INFO:optuna.study.study:Trial 8 finished with value: 43.3186149597168 and parameters: {'lr': 0.0012911590924113163, 'batch_size': 1024, 'num_inducing': 159, 'num_samples': 5, 'kernel_type': 'matern1.5', 'n_gp_layers': 1, 'n_gp_out': 4}. Best is trial 1 with value: 37.58218002319336.
INFO:root:Current Configuration: n_gp_layers:1 - n_gp_out: 1 - num_inducing: 399 - num_samples: 2 - batch_size:512 - num_inducing: 399 - lr: 0.00011272661706555473
INFO:root:0/400 - Loss: 16514.794921875 - Score: 118.56228637695312
INFO:root:0/400 - Loss: 16234.505859375 - Score: 118.53927612304688
INFO:root:10/400 - Loss: 366.7979736328125 - Score: 37.004764556884766
INFO:root:90/400 - Loss: 520.7557983398438 - Score: 47.227108001708984
INFO:optuna.study._optimize:Trial 9 pruned. 
INFO:root:Current Configuration: n_gp_layers:2 - n_gp_out: 1 - num_inducing: 259 - num_samples: 6 - batch_size:2048 - num_inducing: 259 - lr: 0.04347378146278114
INFO:root:0/400 - Loss: 12907.8154296875 - Score: 117.18585205078125
INFO:optuna.study._optimize:Trial 10 pruned. 
INFO:root:Current Configuration: n_gp_layers:1 - n_gp_out: 6 - num_inducing: 82 - num_samples: 7 - batch_size:512 - num_inducing: 82 - lr: 0.01788533951505762
INFO:root:0/400 - Loss: 11376.2861328125 - Score: 116.75786590576172
INFO:optuna.study._optimize:Trial 11 pruned. 
INFO:root:Current Configuration: n_gp_layers:1 - n_gp_out: 4 - num_inducing: 73 - num_samples: 2 - batch_size:512 - num_inducing: 73 - lr: 0.00031587589944159235
INFO:root:0/400 - Loss: 16439.4140625 - Score: 118.55819702148438
INFO:root:100/400 - Loss: 402.7168273925781 - Score: 44.623905181884766
INFO:optuna.study._optimize:Trial 12 pruned. 
INFO:root:Current Configuration: n_gp_layers:2 - n_gp_out: 1 - num_inducing: 58 - num_samples: 12 - batch_size:512 - num_inducing: 58 - lr: 0.011509807913064806
INFO:root:0/400 - Loss: 12865.5966796875 - Score: 117.40738677978516
INFO:root:10/400 - Loss: 2597.62939453125 - Score: 77.70841217041016
INFO:root:110/400 - Loss: 320.2290344238281 - Score: 42.68607711791992
INFO:root:20/400 - Loss: 872.9423217773438 - Score: 54.86582946777344
INFO:root:120/400 - Loss: 268.0802917480469 - Score: 41.486732482910156
INFO:root:30/400 - Loss: 378.3272705078125 - Score: 45.34888458251953
INFO:optuna.study._optimize:Trial 5 pruned. 
INFO:root:Current Configuration: n_gp_layers:4 - n_gp_out: 2 - num_inducing: 90 - num_samples: 14 - batch_size:2048 - num_inducing: 90 - lr: 0.00014210071401296966
INFO:root:10/400 - Loss: 15424.7587890625 - Score: 118.33150482177734
INFO:root:40/400 - Loss: 238.0033416748047 - Score: 41.21868896484375
INFO:root:130/400 - Loss: 225.40647888183594 - Score: 40.49543380737305
INFO:root:0/400 - Loss: 4120.671875 - Score: 83.36383056640625
INFO:root:50/400 - Loss: 190.1916046142578 - Score: 39.48274230957031
INFO:root:60/400 - Loss: 148.22035217285156 - Score: 38.78461837768555
INFO:root:0/400 - Loss: 16544.59765625 - Score: 118.56975555419922
INFO:root:140/400 - Loss: 192.608154296875 - Score: 39.69008255004883
INFO:root:70/400 - Loss: 140.31373596191406 - Score: 38.31772994995117
INFO:root:150/400 - Loss: 178.96849060058594 - Score: 39.43062973022461
INFO:root:80/400 - Loss: 123.6102066040039 - Score: 38.05268478393555
INFO:root:20/400 - Loss: 139.6118927001953 - Score: 37.01579666137695
INFO:root:90/400 - Loss: 124.2392578125 - Score: 38.625694274902344
INFO:root:160/400 - Loss: 163.58946228027344 - Score: 39.15703201293945
INFO:root:Early stopping
INFO:root:After model training
INFO:root:After memory clearing
INFO:optuna.study.study:Trial 13 finished with value: 37.91056442260742 and parameters: {'lr': 0.011509807913064806, 'batch_size': 512, 'num_inducing': 58, 'num_samples': 12, 'kernel_type': 'matern1.5', 'n_gp_layers': 2, 'n_gp_out': 1}. Best is trial 1 with value: 37.58218002319336.
INFO:root:Current Configuration: n_gp_layers:3 - n_gp_out: 3 - num_inducing: 449 - num_samples: 5 - batch_size:1024 - num_inducing: 449 - lr: 0.00013594801509408103
INFO:root:170/400 - Loss: 146.86927795410156 - Score: 38.787715911865234
INFO:root:0/400 - Loss: 16531.541015625 - Score: 118.5644760131836
INFO:root:20/400 - Loss: 14478.27734375 - Score: 117.97496795654297
INFO:root:180/400 - Loss: 136.1113739013672 - Score: 38.38225173950195
INFO:root:Time Budget run out. Pruning Trial
INFO:root:After model training
INFO:root:After memory clearing
INFO:optuna.study.study:Trial 8 finished with value: 38.38225173950195 and parameters: {'lr': 0.005995703439109793, 'batch_size': 1024, 'num_inducing': 176, 'num_samples': 11, 'kernel_type': 'rbf', 'n_gp_layers': 2, 'n_gp_out': 1}. Best is trial 3 with value: 37.44314193725586.
INFO:root:Current Configuration: n_gp_layers:1 - n_gp_out: 1 - num_inducing: 139 - num_samples: 10 - batch_size:512 - num_inducing: 139 - lr: 0.019030110321815612
INFO:root:0/400 - Loss: 11065.6787109375 - Score: 116.25907135009766
INFO:optuna.study._optimize:Trial 9 pruned. 
INFO:root:Current Configuration: n_gp_layers:3 - n_gp_out: 1 - num_inducing: 734 - num_samples: 10 - batch_size:2048 - num_inducing: 734 - lr: 0.00016888307293738678
INFO:root:0/400 - Loss: 16541.47265625 - Score: 118.56683349609375
INFO:optuna.study._optimize:Trial 14 pruned. 
INFO:root:Current Configuration: n_gp_layers:2 - n_gp_out: 1 - num_inducing: 92 - num_samples: 9 - batch_size:512 - num_inducing: 92 - lr: 0.03957630522557885
INFO:root:0/400 - Loss: 7824.1005859375 - Score: 112.89716339111328
INFO:root:Time Budget run out. Pruning Trial
INFO:root:After model training
INFO:root:After memory clearing
INFO:optuna.study.study:Trial 6 finished with value: 36.753379821777344 and parameters: {'lr': 0.03822827340683878, 'batch_size': 1024, 'num_inducing': 464, 'num_samples': 15, 'kernel_type': 'matern1.5', 'n_gp_layers': 1, 'n_gp_out': 5}. Best is trial 6 with value: 36.753379821777344.
INFO:root:Current Configuration: n_gp_layers:4 - n_gp_out: 1 - num_inducing: 97 - num_samples: 10 - batch_size:512 - num_inducing: 97 - lr: 0.030919798258844864
INFO:root:0/400 - Loss: 8740.126953125 - Score: 112.4298324584961
INFO:root:Time Budget run out. Pruning Trial
INFO:root:After model training
INFO:root:After memory clearing
INFO:optuna.study.study:Trial 6 finished with value: 118.50518798828125 and parameters: {'lr': 0.000873188533237095, 'batch_size': 512, 'num_inducing': 776, 'num_samples': 5, 'kernel_type': 'matern1.5', 'n_gp_layers': 2, 'n_gp_out': 4}. Best is trial 1 with value: 37.78729248046875.
INFO:root:Current Configuration: n_gp_layers:2 - n_gp_out: 1 - num_inducing: 86 - num_samples: 12 - batch_size:2048 - num_inducing: 86 - lr: 0.00012059173479237476
INFO:optuna.study._optimize:Trial 7 pruned. 
INFO:root:Current Configuration: n_gp_layers:2 - n_gp_out: 3 - num_inducing: 177 - num_samples: 5 - batch_size:2048 - num_inducing: 177 - lr: 0.00025632776947322986
INFO:root:10/400 - Loss: 331.4270324707031 - Score: 43.45268249511719
INFO:root:0/400 - Loss: 16546.466796875 - Score: 118.56924438476562
INFO:root:0/400 - Loss: 16533.66015625 - Score: 118.56835174560547
INFO:root:20/400 - Loss: 164.22531127929688 - Score: 38.62384033203125
INFO:root:30/400 - Loss: 136.12660217285156 - Score: 38.04743194580078
INFO:root:30/400 - Loss: 13583.443359375 - Score: 117.3107681274414
INFO:root:40/400 - Loss: 139.57827758789062 - Score: 38.14645004272461
INFO:optuna.study._optimize:Trial 7 pruned. 
INFO:root:Current Configuration: n_gp_layers:4 - n_gp_out: 3 - num_inducing: 86 - num_samples: 15 - batch_size:512 - num_inducing: 86 - lr: 0.0012157154599340566
INFO:root:50/400 - Loss: 131.5663299560547 - Score: 38.419246673583984
INFO:root:60/400 - Loss: 110.76590728759766 - Score: 38.27850341796875
INFO:optuna.study._optimize:Trial 10 pruned. 
INFO:root:Current Configuration: n_gp_layers:1 - n_gp_out: 2 - num_inducing: 53 - num_samples: 11 - batch_size:2048 - num_inducing: 53 - lr: 0.007666949631081359
INFO:root:Time Budget run out. Pruning Trial
INFO:root:After model training
INFO:root:After memory clearing
INFO:optuna.study.study:Trial 10 finished with value: 116.99560546875 and parameters: {'lr': 0.0010073639605119244, 'batch_size': 2048, 'num_inducing': 623, 'num_samples': 11, 'kernel_type': 'matern1.5', 'n_gp_layers': 1, 'n_gp_out': 1}. Best is trial 1 with value: 37.39690017700195.
INFO:root:Current Configuration: n_gp_layers:1 - n_gp_out: 2 - num_inducing: 293 - num_samples: 2 - batch_size:1024 - num_inducing: 293 - lr: 0.0075067136919158865
INFO:root:0/400 - Loss: 15841.724609375 - Score: 118.45645141601562
INFO:root:0/400 - Loss: 15209.6533203125 - Score: 118.29737854003906
INFO:root:0/400 - Loss: 16109.400390625 - Score: 118.52458953857422
INFO:root:70/400 - Loss: 113.01716613769531 - Score: 37.59455490112305
INFO:optuna.study._optimize:Trial 11 pruned. 
INFO:root:Current Configuration: n_gp_layers:2 - n_gp_out: 6 - num_inducing: 77 - num_samples: 10 - batch_size:2048 - num_inducing: 77 - lr: 0.00017953395593612882
INFO:root:10/400 - Loss: 5294.79296875 - Score: 87.52481842041016
INFO:root:80/400 - Loss: 100.18521881103516 - Score: 37.831905364990234
INFO:root:Time Budget run out. Pruning Trial
INFO:root:After model training
INFO:root:After memory clearing
INFO:optuna.study.study:Trial 5 finished with value: 42.05530548095703 and parameters: {'lr': 0.04956909084151764, 'batch_size': 512, 'num_inducing': 630, 'num_samples': 15, 'kernel_type': 'matern0.5', 'n_gp_layers': 3, 'n_gp_out': 5}. Best is trial 4 with value: 37.11784744262695.
INFO:root:Current Configuration: n_gp_layers:1 - n_gp_out: 4 - num_inducing: 276 - num_samples: 12 - batch_size:512 - num_inducing: 276 - lr: 0.01543640589813031
INFO:root:0/400 - Loss: 11820.7333984375 - Score: 116.46210479736328
INFO:root:20/400 - Loss: 1566.485107421875 - Score: 55.14099884033203
INFO:root:10/400 - Loss: 16263.271484375 - Score: 118.53958129882812
INFO:root:90/400 - Loss: 94.04537963867188 - Score: 37.70794677734375
INFO:root:Early stopping
INFO:root:After model training
INFO:root:After memory clearing
INFO:optuna.study.study:Trial 15 finished with value: 37.577857971191406 and parameters: {'lr': 0.03957630522557885, 'batch_size': 512, 'num_inducing': 92, 'num_samples': 9, 'kernel_type': 'matern0.5', 'n_gp_layers': 2, 'n_gp_out': 1}. Best is trial 15 with value: 37.577857971191406.
INFO:root:Current Configuration: n_gp_layers:3 - n_gp_out: 2 - num_inducing: 232 - num_samples: 7 - batch_size:512 - num_inducing: 232 - lr: 0.0006319141047525357
INFO:root:30/400 - Loss: 619.1621704101562 - Score: 43.550209045410156
INFO:root:0/400 - Loss: 16541.015625 - Score: 118.56949615478516
INFO:root:0/400 - Loss: 16313.845703125 - Score: 118.5067367553711
INFO:root:40/400 - Loss: 370.47369384765625 - Score: 39.65699005126953
INFO:root:10/400 - Loss: 358.1434326171875 - Score: 39.58043670654297
INFO:root:50/400 - Loss: 283.34307861328125 - Score: 38.458499908447266
INFO:optuna.study._optimize:Trial 16 pruned. 
INFO:root:Current Configuration: n_gp_layers:2 - n_gp_out: 3 - num_inducing: 180 - num_samples: 14 - batch_size:2048 - num_inducing: 180 - lr: 0.021586903333274444
INFO:root:60/400 - Loss: 264.6854248046875 - Score: 37.893306732177734
INFO:optuna.study._optimize:Trial 8 pruned. 
INFO:root:Current Configuration: n_gp_layers:1 - n_gp_out: 2 - num_inducing: 296 - num_samples: 10 - batch_size:2048 - num_inducing: 296 - lr: 0.0012534406512879628
INFO:root:0/400 - Loss: 14577.6162109375 - Score: 117.88085174560547
INFO:root:20/400 - Loss: 300.27899169921875 - Score: 37.439212799072266
INFO:root:0/400 - Loss: 16434.64453125 - Score: 118.54023742675781
INFO:root:70/400 - Loss: 194.58013916015625 - Score: 37.50746536254883
INFO:root:80/400 - Loss: 168.1689453125 - Score: 37.47565841674805
INFO:root:90/400 - Loss: 163.4585723876953 - Score: 37.291175842285156
INFO:root:30/400 - Loss: 233.49310302734375 - Score: 37.738121032714844
INFO:root:20/400 - Loss: 16001.875 - Score: 118.50505065917969
INFO:root:100/400 - Loss: 140.80654907226562 - Score: 37.465293884277344
INFO:root:Early stopping
INFO:root:After model training
INFO:root:After memory clearing
INFO:optuna.study.study:Trial 11 finished with value: 37.291175842285156 and parameters: {'lr': 0.0075067136919158865, 'batch_size': 1024, 'num_inducing': 293, 'num_samples': 2, 'kernel_type': 'rbf', 'n_gp_layers': 1, 'n_gp_out': 2}. Best is trial 11 with value: 37.291175842285156.
INFO:root:Current Configuration: n_gp_layers:2 - n_gp_out: 1 - num_inducing: 770 - num_samples: 8 - batch_size:512 - num_inducing: 770 - lr: 0.0001155824264172615
INFO:root:Early stopping
INFO:root:After model training
INFO:root:After memory clearing
INFO:optuna.study.study:Trial 6 finished with value: 37.17204666137695 and parameters: {'lr': 0.01543640589813031, 'batch_size': 512, 'num_inducing': 276, 'num_samples': 12, 'kernel_type': 'rbf', 'n_gp_layers': 1, 'n_gp_out': 4}. Best is trial 4 with value: 37.11784744262695.
INFO:root:Current Configuration: n_gp_layers:2 - n_gp_out: 4 - num_inducing: 166 - num_samples: 5 - batch_size:1024 - num_inducing: 166 - lr: 0.00010663109589553259
INFO:root:0/400 - Loss: 16537.6484375 - Score: 118.567626953125
INFO:optuna.study._optimize:Trial 9 pruned. 
INFO:root:Current Configuration: n_gp_layers:1 - n_gp_out: 2 - num_inducing: 401 - num_samples: 14 - batch_size:2048 - num_inducing: 401 - lr: 0.08093685049448869
INFO:root:0/400 - Loss: 10582.5625 - Score: 115.53388977050781
INFO:root:0/400 - Loss: 16513.384765625 - Score: 118.56114196777344
INFO:root:10/400 - Loss: 16321.3564453125 - Score: 118.53012084960938
INFO:root:30/400 - Loss: 15747.171875 - Score: 118.45718383789062
INFO:optuna.study._optimize:Trial 10 pruned. 
INFO:root:Current Configuration: n_gp_layers:1 - n_gp_out: 1 - num_inducing: 260 - num_samples: 10 - batch_size:2048 - num_inducing: 260 - lr: 0.035730508305645024
INFO:root:0/400 - Loss: 13510.6748046875 - Score: 117.70684051513672
INFO:root:20/400 - Loss: 16109.90625 - Score: 118.48706817626953
INFO:optuna.study._optimize:Trial 11 pruned. 
INFO:root:Current Configuration: n_gp_layers:1 - n_gp_out: 1 - num_inducing: 416 - num_samples: 8 - batch_size:2048 - num_inducing: 416 - lr: 0.010247135543856357
INFO:root:0/400 - Loss: 15592.080078125 - Score: 118.3567123413086
INFO:optuna.study._optimize:Trial 12 pruned. 
INFO:root:Current Configuration: n_gp_layers:1 - n_gp_out: 2 - num_inducing: 392 - num_samples: 3 - batch_size:1024 - num_inducing: 392 - lr: 0.039338593636438914
INFO:optuna.study._optimize:Trial 12 pruned. 
INFO:root:Current Configuration: n_gp_layers:1 - n_gp_out: 4 - num_inducing: 71 - num_samples: 8 - batch_size:1024 - num_inducing: 71 - lr: 0.004528094259855304
INFO:root:0/400 - Loss: 10795.8974609375 - Score: 116.00566864013672
INFO:root:0/400 - Loss: 15728.7001953125 - Score: 118.4599609375
INFO:root:30/400 - Loss: 15902.177734375 - Score: 118.43663024902344
INFO:root:40/400 - Loss: 15494.0654296875 - Score: 118.3870620727539
INFO:optuna.study._optimize:Trial 13 pruned. 
INFO:root:Current Configuration: n_gp_layers:3 - n_gp_out: 2 - num_inducing: 72 - num_samples: 14 - batch_size:2048 - num_inducing: 72 - lr: 0.00041513530702190374
INFO:optuna.study._optimize:Trial 17 pruned. 
INFO:root:Current Configuration: n_gp_layers:1 - n_gp_out: 2 - num_inducing: 781 - num_samples: 6 - batch_size:512 - num_inducing: 781 - lr: 0.0661742641313344
INFO:root:0/400 - Loss: 16517.658203125 - Score: 118.56297302246094
INFO:root:10/400 - Loss: 349.8543395996094 - Score: 39.05561065673828
INFO:root:0/400 - Loss: 4761.89794921875 - Score: 94.58729553222656
INFO:root:40/400 - Loss: 15697.9501953125 - Score: 118.37838745117188
INFO:root:20/400 - Loss: 298.1360168457031 - Score: 37.771484375
INFO:root:30/400 - Loss: 232.95542907714844 - Score: 37.36870193481445
INFO:optuna.study._optimize:Trial 12 pruned. 
INFO:root:Current Configuration: n_gp_layers:2 - n_gp_out: 1 - num_inducing: 188 - num_samples: 3 - batch_size:512 - num_inducing: 188 - lr: 0.08036885830207145
INFO:root:0/400 - Loss: 4238.68408203125 - Score: 100.16117095947266
INFO:root:50/400 - Loss: 15237.8515625 - Score: 118.28950500488281
INFO:root:50/400 - Loss: 15496.595703125 - Score: 118.30961608886719
INFO:optuna.study._optimize:Trial 13 pruned. 
INFO:root:Current Configuration: n_gp_layers:2 - n_gp_out: 2 - num_inducing: 401 - num_samples: 11 - batch_size:1024 - num_inducing: 401 - lr: 0.0002915949708661932
INFO:root:Early stopping
INFO:root:After model training
INFO:root:After memory clearing
INFO:optuna.study.study:Trial 13 finished with value: 37.22980880737305 and parameters: {'lr': 0.039338593636438914, 'batch_size': 1024, 'num_inducing': 392, 'num_samples': 3, 'kernel_type': 'rbf', 'n_gp_layers': 1, 'n_gp_out': 2}. Best is trial 13 with value: 37.22980880737305.
INFO:root:Current Configuration: n_gp_layers:1 - n_gp_out: 4 - num_inducing: 160 - num_samples: 8 - batch_size:2048 - num_inducing: 160 - lr: 0.002848593399442831
INFO:root:0/400 - Loss: 16283.6533203125 - Score: 118.52477264404297
INFO:optuna.study._optimize:Trial 14 pruned. 
INFO:root:Current Configuration: n_gp_layers:4 - n_gp_out: 3 - num_inducing: 60 - num_samples: 3 - batch_size:1024 - num_inducing: 60 - lr: 0.09493154779610616
INFO:root:0/400 - Loss: 6320.33984375 - Score: 106.32154083251953
INFO:root:0/400 - Loss: 16501.88671875 - Score: 118.55896759033203
INFO:root:Time Budget run out. Pruning Trial
INFO:root:After model training
INFO:root:After memory clearing
INFO:optuna.study.study:Trial 8 finished with value: 118.22862243652344 and parameters: {'lr': 0.00025632776947322986, 'batch_size': 2048, 'num_inducing': 177, 'num_samples': 5, 'kernel_type': 'matern1.5', 'n_gp_layers': 2, 'n_gp_out': 3}. Best is trial 6 with value: 36.753379821777344.
INFO:root:Current Configuration: n_gp_layers:2 - n_gp_out: 6 - num_inducing: 131 - num_samples: 5 - batch_size:1024 - num_inducing: 131 - lr: 0.00011969592007035675
INFO:root:0/400 - Loss: 16535.328125 - Score: 118.5682144165039
INFO:root:60/400 - Loss: 15297.8466796875 - Score: 118.2311782836914
INFO:root:10/400 - Loss: 186.12554931640625 - Score: 40.63766860961914
INFO:optuna.study._optimize:Trial 9 pruned. 
INFO:root:Current Configuration: n_gp_layers:1 - n_gp_out: 1 - num_inducing: 188 - num_samples: 12 - batch_size:512 - num_inducing: 188 - lr: 0.0006451402906792897
INFO:root:0/400 - Loss: 16311.1962890625 - Score: 118.52068328857422
INFO:root:20/400 - Loss: 143.78643798828125 - Score: 43.39331817626953
INFO:root:10/400 - Loss: 14084.4072265625 - Score: 117.741943359375
INFO:root:Early stopping
INFO:root:After model training
INFO:root:After memory clearing
INFO:optuna.study.study:Trial 15 finished with value: 38.891990661621094 and parameters: {'lr': 0.09493154779610616, 'batch_size': 1024, 'num_inducing': 60, 'num_samples': 3, 'kernel_type': 'rbf', 'n_gp_layers': 4, 'n_gp_out': 3}. Best is trial 13 with value: 37.22980880737305.
INFO:root:Current Configuration: n_gp_layers:1 - n_gp_out: 6 - num_inducing: 484 - num_samples: 11 - batch_size:512 - num_inducing: 484 - lr: 0.0008437992889992047
