INFO:optuna.study.study:Trial 2 finished with value: 105.89946746826172 and parameters: {'lr': 0.000771984192477562, 'batch_size': 1024, 'num_inducing': 278, 'num_samples': 3, 'kernel_type': 'matern0.5', 'n_gp_layers': 4, 'n_gp_out': 2}. Best is trial 0 with value: 37.70381546020508.
INFO:root:Current Configuration: n_gp_layers:1 - n_gp_out: 1 - num_inducing: 50 - num_samples: 13 - batch_size:2048 - num_inducing: 50 - lr: 0.013101681052409928
INFO:root:0/400 - Loss: 15360.181640625 - Score: 118.36109161376953
INFO:root:50/400 - Loss: 13213.7900390625 - Score: 117.09346771240234
INFO:root:20/400 - Loss: 192.72291564941406 - Score: 39.981834411621094
INFO:root:10/400 - Loss: 7871.12158203125 - Score: 112.68174743652344
INFO:root:20/400 - Loss: 4724.4755859375 - Score: 97.86917877197266
INFO:root:60/400 - Loss: 12654.7265625 - Score: 116.46199035644531
INFO:root:20/400 - Loss: 13759.0068359375 - Score: 116.53877258300781
INFO:root:Time Budget run out. Pruning Trial
INFO:root:After model training
INFO:root:After memory clearing
INFO:optuna.study.study:Trial 2 finished with value: 118.55390167236328 and parameters: {'lr': 0.0002849533367718103, 'batch_size': 2048, 'num_inducing': 125, 'num_samples': 6, 'kernel_type': 'rbf', 'n_gp_layers': 4, 'n_gp_out': 6}. Best is trial 0 with value: 37.55686569213867.
INFO:root:Current Configuration: n_gp_layers:4 - n_gp_out: 1 - num_inducing: 179 - num_samples: 14 - batch_size:512 - num_inducing: 179 - lr: 0.012139959464094277
INFO:root:30/400 - Loss: 3098.210693359375 - Score: 84.381103515625
INFO:root:0/400 - Loss: 12509.9794921875 - Score: 116.13619995117188
INFO:root:40/400 - Loss: 157.21185302734375 - Score: 38.0660285949707
INFO:root:40/400 - Loss: 2097.142333984375 - Score: 72.9545669555664
INFO:optuna.study._optimize:Trial 5 pruned. 
INFO:root:Current Configuration: n_gp_layers:1 - n_gp_out: 2 - num_inducing: 748 - num_samples: 10 - batch_size:512 - num_inducing: 748 - lr: 0.0072293396260077105
INFO:root:70/400 - Loss: 12100.021484375 - Score: 115.74954986572266
INFO:root:50/400 - Loss: 1430.6297607421875 - Score: 63.33047103881836
INFO:root:Time Budget run out. Pruning Trial
INFO:root:After model training
INFO:root:After memory clearing
INFO:optuna.study.study:Trial 2 finished with value: 37.68682861328125 and parameters: {'lr': 0.02650057776141841, 'batch_size': 1024, 'num_inducing': 108, 'num_samples': 10, 'kernel_type': 'matern1.5', 'n_gp_layers': 3, 'n_gp_out': 2}. Best is trial 2 with value: 37.68682861328125.
INFO:root:Current Configuration: n_gp_layers:3 - n_gp_out: 1 - num_inducing: 125 - num_samples: 10 - batch_size:1024 - num_inducing: 125 - lr: 0.0046461677008078905
INFO:root:60/400 - Loss: 1004.546142578125 - Score: 56.426822662353516
INFO:root:0/400 - Loss: 14038.052734375 - Score: 117.69749450683594
INFO:root:0/400 - Loss: 15690.6845703125 - Score: 118.42681884765625
INFO:root:80/400 - Loss: 11610.0556640625 - Score: 115.13558197021484
INFO:root:70/400 - Loss: 723.7223510742188 - Score: 51.340736389160156
INFO:root:Time Budget run out. Pruning Trial
INFO:root:After model training
INFO:root:After memory clearing
INFO:optuna.study.study:Trial 6 finished with value: 71.98878479003906 and parameters: {'lr': 0.006459051988309766, 'batch_size': 1024, 'num_inducing': 437, 'num_samples': 6, 'kernel_type': 'rbf', 'n_gp_layers': 3, 'n_gp_out': 2}. Best is trial 1 with value: 37.58218002319336.
INFO:root:Current Configuration: n_gp_layers:3 - n_gp_out: 1 - num_inducing: 177 - num_samples: 11 - batch_size:512 - num_inducing: 177 - lr: 0.00035492910494277667
INFO:root:80/400 - Loss: 537.6732177734375 - Score: 47.54750061035156
INFO:optuna.study._optimize:Trial 3 pruned. 
INFO:root:Current Configuration: n_gp_layers:1 - n_gp_out: 4 - num_inducing: 56 - num_samples: 14 - batch_size:512 - num_inducing: 56 - lr: 0.003982627922137281
INFO:root:0/400 - Loss: 16422.91015625 - Score: 118.54618072509766
INFO:root:0/400 - Loss: 15158.5205078125 - Score: 118.40385437011719
INFO:root:90/400 - Loss: 11158.5205078125 - Score: 114.5546875
INFO:root:10/400 - Loss: 2178.24755859375 - Score: 72.78398895263672
INFO:root:90/400 - Loss: 414.3960266113281 - Score: 44.726844787597656
INFO:root:30/400 - Loss: 12445.775390625 - Score: 114.24108123779297
INFO:root:10/400 - Loss: 6067.64599609375 - Score: 95.46356201171875
INFO:root:100/400 - Loss: 334.2208251953125 - Score: 42.994747161865234
INFO:root:100/400 - Loss: 10734.3525390625 - Score: 113.98448944091797
INFO:root:110/400 - Loss: 284.82843017578125 - Score: 41.623836517333984
INFO:root:Time Budget run out. Pruning Trial
INFO:root:After model training
INFO:root:After memory clearing
INFO:optuna.study.study:Trial 3 finished with value: 113.0516128540039 and parameters: {'lr': 0.00036329806217656285, 'batch_size': 512, 'num_inducing': 126, 'num_samples': 9, 'kernel_type': 'rbf', 'n_gp_layers': 2, 'n_gp_out': 3}. Best is trial 1 with value: 37.78729248046875.
INFO:root:Current Configuration: n_gp_layers:2 - n_gp_out: 6 - num_inducing: 167 - num_samples: 13 - batch_size:512 - num_inducing: 167 - lr: 0.022887875102484422
INFO:root:20/400 - Loss: 2833.432373046875 - Score: 72.25293731689453
INFO:optuna.study._optimize:Trial 6 pruned. 
INFO:root:Current Configuration: n_gp_layers:1 - n_gp_out: 1 - num_inducing: 248 - num_samples: 12 - batch_size:512 - num_inducing: 248 - lr: 0.000281552769834617
INFO:root:120/400 - Loss: 234.83428955078125 - Score: 41.10983657836914
INFO:root:0/400 - Loss: 16450.84765625 - Score: 118.54994201660156
INFO:root:110/400 - Loss: 10341.43359375 - Score: 113.43256378173828
INFO:optuna.study._optimize:Trial 7 pruned. 
INFO:root:Current Configuration: n_gp_layers:3 - n_gp_out: 2 - num_inducing: 96 - num_samples: 12 - batch_size:512 - num_inducing: 96 - lr: 0.018889785867090263
INFO:root:130/400 - Loss: 209.07020568847656 - Score: 40.0804443359375
INFO:root:0/400 - Loss: 10176.005859375 - Score: 114.51910400390625
INFO:root:0/400 - Loss: 10757.6806640625 - Score: 113.82151794433594
INFO:optuna.study._optimize:Trial 7 pruned. 
INFO:root:Current Configuration: n_gp_layers:1 - n_gp_out: 4 - num_inducing: 159 - num_samples: 5 - batch_size:1024 - num_inducing: 159 - lr: 0.0012911590924113163
INFO:root:30/400 - Loss: 1495.5784912109375 - Score: 58.339542388916016
INFO:root:0/400 - Loss: 16314.904296875 - Score: 118.53760528564453
INFO:root:140/400 - Loss: 192.29287719726562 - Score: 39.38298034667969
INFO:root:120/400 - Loss: 9973.234375 - Score: 112.89616394042969
INFO:root:150/400 - Loss: 183.51976013183594 - Score: 39.168540954589844
INFO:root:40/400 - Loss: 843.2719116210938 - Score: 49.82335662841797
INFO:root:20/400 - Loss: 614.45556640625 - Score: 48.22916793823242
INFO:root:10/400 - Loss: 13984.3828125 - Score: 117.63001251220703
INFO:root:160/400 - Loss: 187.64248657226562 - Score: 39.17247009277344
INFO:root:130/400 - Loss: 9626.650390625 - Score: 112.36377716064453
INFO:root:170/400 - Loss: 172.4609375 - Score: 38.944969177246094
INFO:root:10/400 - Loss: 500.6288757324219 - Score: 44.97340774536133
INFO:root:50/400 - Loss: 515.7836303710938 - Score: 44.70255661010742
INFO:optuna.study._optimize:Trial 4 pruned. 
INFO:root:Current Configuration: n_gp_layers:3 - n_gp_out: 4 - num_inducing: 88 - num_samples: 6 - batch_size:2048 - num_inducing: 88 - lr: 0.0239800932793171
INFO:root:180/400 - Loss: 159.69451904296875 - Score: 38.65980911254883
INFO:root:20/400 - Loss: 11793.4169921875 - Score: 113.66557312011719
INFO:root:140/400 - Loss: 9298.5419921875 - Score: 111.83805084228516
INFO:root:60/400 - Loss: 349.36724853515625 - Score: 41.687740325927734
INFO:root:190/400 - Loss: 128.24066162109375 - Score: 37.95547103881836
INFO:root:200/400 - Loss: 126.68061828613281 - Score: 37.92510223388672
INFO:root:0/400 - Loss: 14462.6298828125 - Score: 118.33212280273438
INFO:root:30/400 - Loss: 9534.357421875 - Score: 106.2764892578125
INFO:root:70/400 - Loss: 265.94134521484375 - Score: 39.9998664855957
INFO:root:20/400 - Loss: 265.8807067871094 - Score: 40.77724075317383
INFO:root:150/400 - Loss: 8989.2001953125 - Score: 111.31725311279297
INFO:root:210/400 - Loss: 122.17247009277344 - Score: 37.83540725708008
INFO:root:30/400 - Loss: 390.5364074707031 - Score: 43.52883529663086
INFO:root:220/400 - Loss: 116.99152374267578 - Score: 37.827205657958984
INFO:root:80/400 - Loss: 226.9480438232422 - Score: 38.99080276489258
INFO:root:40/400 - Loss: 7841.99755859375 - Score: 99.68309020996094
INFO:root:160/400 - Loss: 8698.361328125 - Score: 110.79309844970703
INFO:root:230/400 - Loss: 114.84591674804688 - Score: 37.78871154785156
INFO:root:240/400 - Loss: 111.17189025878906 - Score: 37.79035568237305
INFO:root:90/400 - Loss: 244.23365783691406 - Score: 38.68558883666992
INFO:root:30/400 - Loss: 191.8235321044922 - Score: 38.431800842285156
INFO:root:170/400 - Loss: 8421.5400390625 - Score: 110.27627563476562
INFO:root:250/400 - Loss: 109.78498840332031 - Score: 37.758602142333984
INFO:root:Early stopping
INFO:root:After model training
INFO:root:After memory clearing
INFO:optuna.study.study:Trial 3 finished with value: 37.737003326416016 and parameters: {'lr': 0.013101681052409928, 'batch_size': 2048, 'num_inducing': 50, 'num_samples': 13, 'kernel_type': 'rbf', 'n_gp_layers': 1, 'n_gp_out': 1}. Best is trial 0 with value: 37.70381546020508.
INFO:root:Current Configuration: n_gp_layers:4 - n_gp_out: 1 - num_inducing: 330 - num_samples: 6 - batch_size:2048 - num_inducing: 330 - lr: 0.026448299678632495
INFO:root:50/400 - Loss: 6545.1767578125 - Score: 93.75855255126953
INFO:optuna.study._optimize:Trial 5 pruned. 
INFO:root:Current Configuration: n_gp_layers:2 - n_gp_out: 4 - num_inducing: 776 - num_samples: 5 - batch_size:512 - num_inducing: 776 - lr: 0.000873188533237095
INFO:root:0/400 - Loss: 14192.1474609375 - Score: 117.83345794677734
INFO:root:100/400 - Loss: 183.7035369873047 - Score: 38.07923126220703
INFO:root:180/400 - Loss: 8155.4853515625 - Score: 109.75654602050781
INFO:root:60/400 - Loss: 5513.89501953125 - Score: 88.05545043945312
INFO:root:10/400 - Loss: 301.85247802734375 - Score: 38.32732391357422
INFO:root:40/400 - Loss: 221.69410705566406 - Score: 40.24517059326172
INFO:root:110/400 - Loss: 163.75906372070312 - Score: 37.84927749633789
INFO:root:40/400 - Loss: 154.97914123535156 - Score: 39.81450653076172
INFO:root:70/400 - Loss: 4683.5498046875 - Score: 82.78406524658203
INFO:root:190/400 - Loss: 7907.083984375 - Score: 109.23839569091797
INFO:root:120/400 - Loss: 149.53762817382812 - Score: 37.755943298339844
INFO:root:80/400 - Loss: 3985.97802734375 - Score: 77.97207641601562
INFO:root:200/400 - Loss: 7668.50830078125 - Score: 108.71797180175781
INFO:root:130/400 - Loss: 138.488037109375 - Score: 37.69511032104492
INFO:root:50/400 - Loss: 142.59886169433594 - Score: 37.79994201660156
INFO:root:90/400 - Loss: 3401.35302734375 - Score: 73.60707092285156
INFO:root:Time Budget run out. Pruning Trial
INFO:root:After model training
INFO:root:After memory clearing
INFO:optuna.study.study:Trial 6 finished with value: 108.34200286865234 and parameters: {'lr': 0.0007103501453459978, 'batch_size': 2048, 'num_inducing': 68, 'num_samples': 8, 'kernel_type': 'matern0.5', 'n_gp_layers': 2, 'n_gp_out': 1}. Best is trial 3 with value: 37.44314193725586.
INFO:root:Current Configuration: n_gp_layers:1 - n_gp_out: 1 - num_inducing: 472 - num_samples: 14 - batch_size:2048 - num_inducing: 472 - lr: 0.0038264654731326032
INFO:root:140/400 - Loss: 128.31884765625 - Score: 37.62627029418945
INFO:root:0/400 - Loss: 16185.0556640625 - Score: 118.48163604736328
INFO:root:50/400 - Loss: 187.1746826171875 - Score: 39.024776458740234
INFO:root:100/400 - Loss: 2905.904296875 - Score: 69.66522216796875
INFO:root:10/400 - Loss: 3784.4716796875 - Score: 89.95394134521484
INFO:root:150/400 - Loss: 118.19654846191406 - Score: 37.58064651489258
INFO:root:60/400 - Loss: 130.9049530029297 - Score: 37.71372985839844
INFO:optuna.study._optimize:Trial 7 pruned. 
INFO:root:Current Configuration: n_gp_layers:2 - n_gp_out: 1 - num_inducing: 176 - num_samples: 11 - batch_size:1024 - num_inducing: 176 - lr: 0.005995703439109793
INFO:root:110/400 - Loss: 2496.400146484375 - Score: 66.092529296875
INFO:root:0/400 - Loss: 15426.6806640625 - Score: 118.21644592285156
INFO:root:160/400 - Loss: 110.95610809326172 - Score: 37.540069580078125
INFO:root:120/400 - Loss: 2143.96728515625 - Score: 62.8255615234375
INFO:root:170/400 - Loss: 103.07662200927734 - Score: 37.55080795288086
INFO:root:10/400 - Loss: 8297.8564453125 - Score: 109.99288177490234
INFO:root:130/400 - Loss: 1843.605224609375 - Score: 59.853416442871094
INFO:root:70/400 - Loss: 101.26740264892578 - Score: 40.12153625488281
INFO:root:60/400 - Loss: 172.3414764404297 - Score: 39.22465515136719
INFO:root:180/400 - Loss: 97.1130599975586 - Score: 37.503623962402344
INFO:root:20/400 - Loss: 5312.52685546875 - Score: 99.78710174560547
INFO:root:Time Budget run out. Pruning Trial
INFO:root:After model training
INFO:root:After memory clearing
INFO:optuna.study.study:Trial 4 finished with value: 37.52021408081055 and parameters: {'lr': 0.06704678381845867, 'batch_size': 1024, 'num_inducing': 596, 'num_samples': 15, 'kernel_type': 'matern1.5', 'n_gp_layers': 1, 'n_gp_out': 5}. Best is trial 4 with value: 37.52021408081055.
INFO:root:Current Configuration: n_gp_layers:1 - n_gp_out: 1 - num_inducing: 56 - num_samples: 11 - batch_size:1024 - num_inducing: 56 - lr: 0.057083238070506304
INFO:root:0/400 - Loss: 9296.0078125 - Score: 115.74030303955078
INFO:root:190/400 - Loss: 91.12138366699219 - Score: 37.47568893432617
INFO:root:140/400 - Loss: 1585.341064453125 - Score: 57.15970230102539
INFO:optuna.study._optimize:Trial 5 pruned. 
INFO:root:Current Configuration: n_gp_layers:1 - n_gp_out: 5 - num_inducing: 464 - num_samples: 15 - batch_size:1024 - num_inducing: 464 - lr: 0.03822827340683878
INFO:root:Early stopping
INFO:root:After model training
INFO:root:After memory clearing
INFO:optuna.study.study:Trial 4 finished with value: 37.46335983276367 and parameters: {'lr': 0.003982627922137281, 'batch_size': 512, 'num_inducing': 56, 'num_samples': 14, 'kernel_type': 'matern1.5', 'n_gp_layers': 1, 'n_gp_out': 4}. Best is trial 4 with value: 37.46335983276367.
INFO:root:Current Configuration: n_gp_layers:2 - n_gp_out: 5 - num_inducing: 161 - num_samples: 8 - batch_size:1024 - num_inducing: 161 - lr: 0.0019104506694399884
INFO:root:Early stopping
INFO:root:After model training
INFO:root:After memory clearing
INFO:optuna.study.study:Trial 3 finished with value: 39.024776458740234 and parameters: {'lr': 0.012139959464094277, 'batch_size': 512, 'num_inducing': 179, 'num_samples': 14, 'kernel_type': 'rbf', 'n_gp_layers': 4, 'n_gp_out': 1}. Best is trial 0 with value: 37.55686569213867.
INFO:root:Current Configuration: n_gp_layers:1 - n_gp_out: 6 - num_inducing: 96 - num_samples: 12 - batch_size:1024 - num_inducing: 96 - lr: 0.03791480521203901
INFO:root:0/400 - Loss: 11041.7841796875 - Score: 116.74943542480469
INFO:root:20/400 - Loss: 1451.3751220703125 - Score: 67.73709869384766
INFO:root:30/400 - Loss: 3633.984130859375 - Score: 88.12698364257812
INFO:root:0/400 - Loss: 10873.3154296875 - Score: 115.41902160644531
INFO:root:150/400 - Loss: 1365.9696044921875 - Score: 54.74717712402344
INFO:root:80/400 - Loss: 108.4317398071289 - Score: 37.56166458129883
WARNING:optuna.study._optimize:Trial 4 failed because of the following error: NotPSDError('Matrix not positive definite after repeatedly adding jitter up to 1.0e-06.',)
Traceback (most recent call last):
  File "/home/linyuhan/my_project/venv_CMAPSS/lib64/python3.6/site-packages/optuna/study/_optimize.py", line 196, in _run_trial
    value_or_values = func(trial)
  File "/home/linyuhan/Dokumente/Masterarbeit/dataset/CMAPSS/code/DGP_Yuhan/HPO_DGP.py", line 400, in <lambda>
    metric=mae),
  File "/home/linyuhan/Dokumente/Masterarbeit/dataset/CMAPSS/code/DGP_Yuhan/HPO_DGP.py", line 263, in objective_train_test
    output = model(X_batch)
  File "/home/linyuhan/my_project/venv_CMAPSS/lib64/python3.6/site-packages/gpytorch/module.py", line 30, in __call__
    outputs = self.forward(*inputs, **kwargs)
  File "/home/linyuhan/Dokumente/Masterarbeit/dataset/CMAPSS/code/DGP_Yuhan/src/deep_gp.py", line 145, in forward
    output = layer(output)
  File "/home/linyuhan/Dokumente/Masterarbeit/dataset/CMAPSS/code/DGP_Yuhan/src/deep_gp.py", line 91, in __call__
    return super().__call__(x, are_samples=bool(len(other_inputs)))
  File "/home/linyuhan/my_project/venv_CMAPSS/lib64/python3.6/site-packages/gpytorch/models/deep_gps/deep_gp.py", line 99, in __call__
    output = ApproximateGP.__call__(self, inputs)
  File "/home/linyuhan/my_project/venv_CMAPSS/lib64/python3.6/site-packages/gpytorch/models/approximate_gp.py", line 81, in __call__
    return self.variational_strategy(inputs, prior=prior, **kwargs)
  File "/home/linyuhan/my_project/venv_CMAPSS/lib64/python3.6/site-packages/gpytorch/variational/variational_strategy.py", line 169, in __call__
    return super().__call__(x, prior=prior, **kwargs)
  File "/home/linyuhan/my_project/venv_CMAPSS/lib64/python3.6/site-packages/gpytorch/variational/_variational_strategy.py", line 129, in __call__
    **kwargs,
  File "/home/linyuhan/my_project/venv_CMAPSS/lib64/python3.6/site-packages/gpytorch/module.py", line 30, in __call__
    outputs = self.forward(*inputs, **kwargs)
  File "/home/linyuhan/my_project/venv_CMAPSS/lib64/python3.6/site-packages/gpytorch/variational/variational_strategy.py", line 103, in forward
    L = self._cholesky_factor(induc_induc_covar)
  File "/home/linyuhan/my_project/venv_CMAPSS/lib64/python3.6/site-packages/gpytorch/utils/memoize.py", line 76, in g
    return _add_to_cache_ignore_args(self, cache_name, method(self, *args, **kwargs))
  File "/home/linyuhan/my_project/venv_CMAPSS/lib64/python3.6/site-packages/gpytorch/variational/variational_strategy.py", line 72, in _cholesky_factor
    L = psd_safe_cholesky(delazify(induc_induc_covar).type(_linalg_dtype_cholesky.value()))
  File "/home/linyuhan/my_project/venv_CMAPSS/lib64/python3.6/site-packages/gpytorch/utils/cholesky.py", line 63, in psd_safe_cholesky
    L = _psd_safe_cholesky(A, out=out, jitter=jitter, max_tries=max_tries)
  File "/home/linyuhan/my_project/venv_CMAPSS/lib64/python3.6/site-packages/gpytorch/utils/cholesky.py", line 45, in _psd_safe_cholesky
    raise NotPSDError(f"Matrix not positive definite after repeatedly adding jitter up to {jitter_new:.1e}.")
gpytorch.utils.errors.NotPSDError: Matrix not positive definite after repeatedly adding jitter up to 1.0e-06.
INFO:root:160/400 - Loss: 1173.8377685546875 - Score: 52.57709503173828
INFO:root:10/400 - Loss: 283.8981628417969 - Score: 40.283199310302734
INFO:root:40/400 - Loss: 2560.660888671875 - Score: 77.94939422607422
INFO:root:0/400 - Loss: 16201.0458984375 - Score: 118.53592681884766
INFO:root:170/400 - Loss: 1015.5784301757812 - Score: 50.617767333984375
INFO:root:90/400 - Loss: 101.20877075195312 - Score: 37.56943130493164
INFO:root:20/400 - Loss: 258.563232421875 - Score: 37.72502899169922
INFO:root:50/400 - Loss: 1828.3668212890625 - Score: 68.78343963623047
INFO:root:180/400 - Loss: 876.9581909179688 - Score: 48.86080551147461
INFO:root:30/400 - Loss: 123.25594329833984 - Score: 37.23435592651367
INFO:root:190/400 - Loss: 759.7184448242188 - Score: 47.31332778930664
INFO:root:Early stopping
INFO:root:After model training
INFO:root:After memory clearing
INFO:optuna.study.study:Trial 8 finished with value: 37.49007034301758 and parameters: {'lr': 0.018889785867090263, 'batch_size': 512, 'num_inducing': 96, 'num_samples': 12, 'kernel_type': 'matern1.5', 'n_gp_layers': 3, 'n_gp_out': 2}. Best is trial 1 with value: 37.39690017700195.
INFO:root:Current Configuration: n_gp_layers:2 - n_gp_out: 1 - num_inducing: 118 - num_samples: 13 - batch_size:512 - num_inducing: 118 - lr: 0.011721091069876455
INFO:root:60/400 - Loss: 1313.4991455078125 - Score: 61.289093017578125
INFO:root:0/400 - Loss: 12775.5693359375 - Score: 117.17183685302734
INFO:root:40/400 - Loss: 123.81436157226562 - Score: 37.30384063720703
INFO:optuna.study._optimize:Trial 9 pruned. 
INFO:root:Current Configuration: n_gp_layers:1 - n_gp_out: 1 - num_inducing: 623 - num_samples: 11 - batch_size:2048 - num_inducing: 623 - lr: 0.0010073639605119244
INFO:root:200/400 - Loss: 662.7296142578125 - Score: 45.928565979003906
INFO:root:Early stopping
INFO:root:After model training
INFO:root:After memory clearing
INFO:optuna.study.study:Trial 4 finished with value: 37.11784744262695 and parameters: {'lr': 0.03791480521203901, 'batch_size': 1024, 'num_inducing': 96, 'num_samples': 12, 'kernel_type': 'matern1.5', 'n_gp_layers': 1, 'n_gp_out': 6}. Best is trial 4 with value: 37.11784744262695.
INFO:root:Current Configuration: n_gp_layers:3 - n_gp_out: 5 - num_inducing: 630 - num_samples: 15 - batch_size:512 - num_inducing: 630 - lr: 0.04956909084151764
INFO:root:0/400 - Loss: 16460.728515625 - Score: 118.55235290527344
INFO:root:70/400 - Loss: 950.0913696289062 - Score: 55.329227447509766
INFO:root:210/400 - Loss: 577.583984375 - Score: 44.69087600708008
INFO:root:220/400 - Loss: 509.46234130859375 - Score: 43.62723159790039
INFO:root:80/400 - Loss: 696.171630859375 - Score: 50.72986602783203
INFO:root:Time Budget run out. Pruning Trial
INFO:root:After model training
INFO:root:After memory clearing
