INFO:optuna.study.study:Trial 0 finished with value: 37.85197830200195 and parameters: {'lr': 0.01, 'batch_size': 1024, 'num_inducing': 128, 'num_samples': 10, 'kernel_type': 'rbf', 'n_gp_layers': 2, 'n_gp_out': 1}. Best is trial 0 with value: 37.85197830200195.
INFO:root:Current Configuration: n_gp_layers:3 - n_gp_out: 3 - num_inducing: 537 - num_samples: 14 - batch_size:2048 - num_inducing: 537 - lr: 0.04479814923865835
INFO:root:Time Budget run out. Pruning Trial
INFO:root:After model training
INFO:root:After memory clearing
INFO:optuna.study.study:Trial 0 finished with value: 37.79494857788086 and parameters: {'lr': 0.01, 'batch_size': 1024, 'num_inducing': 128, 'num_samples': 10, 'kernel_type': 'rbf', 'n_gp_layers': 2, 'n_gp_out': 1}. Best is trial 0 with value: 37.79494857788086.
INFO:root:Current Configuration: n_gp_layers:4 - n_gp_out: 3 - num_inducing: 69 - num_samples: 8 - batch_size:2048 - num_inducing: 69 - lr: 0.00045620258330781037
INFO:root:130/400 - Loss: 128.79937744140625 - Score: 37.61423110961914
INFO:root:Time Budget run out. Pruning Trial
INFO:root:After model training
INFO:root:After memory clearing
INFO:optuna.study.study:Trial 0 finished with value: 37.545196533203125 and parameters: {'lr': 0.01, 'batch_size': 1024, 'num_inducing': 128, 'num_samples': 10, 'kernel_type': 'rbf', 'n_gp_layers': 2, 'n_gp_out': 1}. Best is trial 0 with value: 37.545196533203125.
INFO:root:Current Configuration: n_gp_layers:1 - n_gp_out: 5 - num_inducing: 158 - num_samples: 4 - batch_size:1024 - num_inducing: 158 - lr: 0.01069747257706085
INFO:root:Time Budget run out. Pruning Trial
INFO:root:After model training
INFO:root:After memory clearing
INFO:optuna.study.study:Trial 0 finished with value: 37.55686569213867 and parameters: {'lr': 0.01, 'batch_size': 1024, 'num_inducing': 128, 'num_samples': 10, 'kernel_type': 'rbf', 'n_gp_layers': 2, 'n_gp_out': 1}. Best is trial 0 with value: 37.55686569213867.
INFO:root:Current Configuration: n_gp_layers:2 - n_gp_out: 4 - num_inducing: 75 - num_samples: 13 - batch_size:512 - num_inducing: 75 - lr: 0.009620458665835267
INFO:root:Time Budget run out. Pruning Trial
INFO:root:After model training
INFO:root:After memory clearing
INFO:optuna.study.study:Trial 0 finished with value: 37.82093811035156 and parameters: {'lr': 0.01, 'batch_size': 1024, 'num_inducing': 128, 'num_samples': 10, 'kernel_type': 'rbf', 'n_gp_layers': 2, 'n_gp_out': 1}. Best is trial 0 with value: 37.82093811035156.
INFO:root:Current Configuration: n_gp_layers:3 - n_gp_out: 3 - num_inducing: 312 - num_samples: 9 - batch_size:512 - num_inducing: 312 - lr: 0.0012485835973172722
INFO:root:Time Budget run out. Pruning Trial
INFO:root:After model training
INFO:root:After memory clearing
INFO:optuna.study.study:Trial 0 finished with value: 37.304439544677734 and parameters: {'lr': 0.01, 'batch_size': 1024, 'num_inducing': 128, 'num_samples': 10, 'kernel_type': 'rbf', 'n_gp_layers': 2, 'n_gp_out': 1}. Best is trial 0 with value: 37.304439544677734.
INFO:root:Current Configuration: n_gp_layers:1 - n_gp_out: 2 - num_inducing: 89 - num_samples: 10 - batch_size:2048 - num_inducing: 89 - lr: 0.0660968541540321
INFO:root:Time Budget run out. Pruning Trial
INFO:root:After model training
INFO:root:After memory clearing
INFO:optuna.study.study:Trial 0 finished with value: 38.12601852416992 and parameters: {'lr': 0.01, 'batch_size': 1024, 'num_inducing': 128, 'num_samples': 10, 'kernel_type': 'rbf', 'n_gp_layers': 2, 'n_gp_out': 1}. Best is trial 0 with value: 38.12601852416992.
INFO:root:Current Configuration: n_gp_layers:1 - n_gp_out: 6 - num_inducing: 277 - num_samples: 6 - batch_size:1024 - num_inducing: 277 - lr: 0.03230738965178223
INFO:root:Time Budget run out. Pruning Trial
INFO:root:After model training
INFO:root:After memory clearing
INFO:optuna.study.study:Trial 0 finished with value: 37.804405212402344 and parameters: {'lr': 0.01, 'batch_size': 1024, 'num_inducing': 128, 'num_samples': 10, 'kernel_type': 'rbf', 'n_gp_layers': 2, 'n_gp_out': 1}. Best is trial 0 with value: 37.804405212402344.
INFO:root:Current Configuration: n_gp_layers:1 - n_gp_out: 2 - num_inducing: 262 - num_samples: 12 - batch_size:2048 - num_inducing: 262 - lr: 0.00020866101022175407
INFO:root:Time Budget run out. Pruning Trial
INFO:root:After model training
INFO:root:After memory clearing
INFO:optuna.study.study:Trial 0 finished with value: 37.77363586425781 and parameters: {'lr': 0.01, 'batch_size': 1024, 'num_inducing': 128, 'num_samples': 10, 'kernel_type': 'rbf', 'n_gp_layers': 2, 'n_gp_out': 1}. Best is trial 0 with value: 37.77363586425781.
INFO:root:Current Configuration: n_gp_layers:1 - n_gp_out: 1 - num_inducing: 633 - num_samples: 3 - batch_size:2048 - num_inducing: 633 - lr: 0.0014946769748262624
INFO:root:130/400 - Loss: 154.07435607910156 - Score: 38.699947357177734
INFO:root:Time Budget run out. Pruning Trial
INFO:root:After model training
INFO:root:After memory clearing
INFO:optuna.study.study:Trial 0 finished with value: 38.560447692871094 and parameters: {'lr': 0.01, 'batch_size': 1024, 'num_inducing': 128, 'num_samples': 10, 'kernel_type': 'rbf', 'n_gp_layers': 2, 'n_gp_out': 1}. Best is trial 0 with value: 38.560447692871094.
INFO:root:Current Configuration: n_gp_layers:1 - n_gp_out: 1 - num_inducing: 195 - num_samples: 4 - batch_size:512 - num_inducing: 195 - lr: 0.04729338216636208
INFO:root:130/400 - Loss: 135.03453063964844 - Score: 37.93191909790039
INFO:root:Time Budget run out. Pruning Trial
INFO:root:After model training
INFO:root:After memory clearing
INFO:optuna.study.study:Trial 0 finished with value: 37.92942428588867 and parameters: {'lr': 0.01, 'batch_size': 1024, 'num_inducing': 128, 'num_samples': 10, 'kernel_type': 'rbf', 'n_gp_layers': 2, 'n_gp_out': 1}. Best is trial 0 with value: 37.92942428588867.
INFO:root:Current Configuration: n_gp_layers:2 - n_gp_out: 2 - num_inducing: 50 - num_samples: 14 - batch_size:2048 - num_inducing: 50 - lr: 0.006652497426893072
INFO:root:130/400 - Loss: 130.91500854492188 - Score: 38.1454963684082
INFO:root:Time Budget run out. Pruning Trial
INFO:root:After model training
INFO:root:After memory clearing
INFO:optuna.study.study:Trial 0 finished with value: 38.06056594848633 and parameters: {'lr': 0.01, 'batch_size': 1024, 'num_inducing': 128, 'num_samples': 10, 'kernel_type': 'rbf', 'n_gp_layers': 2, 'n_gp_out': 1}. Best is trial 0 with value: 38.06056594848633.
INFO:root:Current Configuration: n_gp_layers:1 - n_gp_out: 1 - num_inducing: 166 - num_samples: 14 - batch_size:512 - num_inducing: 166 - lr: 0.0555442770834226
INFO:root:0/400 - Loss: 6937.16162109375 - Score: 110.3821029663086
INFO:root:0/400 - Loss: 11470.474609375 - Score: 116.7071533203125
INFO:root:0/400 - Loss: 6148.69873046875 - Score: 108.30158233642578
INFO:root:0/400 - Loss: 15814.5732421875 - Score: 118.49147033691406
INFO:root:0/400 - Loss: 14689.2451171875 - Score: 118.31179809570312
INFO:root:0/400 - Loss: 15139.5400390625 - Score: 118.21782684326172
INFO:root:0/400 - Loss: 11566.8623046875 - Score: 116.19776153564453
INFO:root:0/400 - Loss: 16414.501953125 - Score: 118.54226684570312
INFO:root:0/400 - Loss: 13416.8603515625 - Score: 117.89276123046875
INFO:root:0/400 - Loss: 16537.771484375 - Score: 118.56735229492188
INFO:root:0/400 - Loss: 15937.1416015625 - Score: 118.5037612915039
INFO:root:10/400 - Loss: 243.70700073242188 - Score: 38.942787170410156
INFO:root:0/400 - Loss: 16514.435546875 - Score: 118.5660400390625
INFO:root:10/400 - Loss: 3045.210693359375 - Score: 70.15513610839844
INFO:root:10/400 - Loss: 371.1353454589844 - Score: 43.20956802368164
INFO:root:10/400 - Loss: 198.12648010253906 - Score: 39.25997543334961
INFO:optuna.study._optimize:Trial 1 pruned. 
INFO:root:Current Configuration: n_gp_layers:1 - n_gp_out: 1 - num_inducing: 381 - num_samples: 7 - batch_size:1024 - num_inducing: 381 - lr: 0.0009838037196798991
INFO:root:20/400 - Loss: 376.4603271484375 - Score: 45.31280517578125
INFO:root:0/400 - Loss: 16368.369140625 - Score: 118.53272247314453
INFO:root:10/400 - Loss: 9879.5439453125 - Score: 113.38414764404297
INFO:root:20/400 - Loss: 795.3071899414062 - Score: 46.417747497558594
INFO:root:30/400 - Loss: 142.1138153076172 - Score: 38.066322326660156
INFO:root:20/400 - Loss: 175.44325256347656 - Score: 39.15863037109375
INFO:root:10/400 - Loss: 281.6822814941406 - Score: 38.60236740112305
INFO:root:20/400 - Loss: 188.64918518066406 - Score: 38.90864944458008
INFO:optuna.study._optimize:Trial 2 pruned. 
INFO:root:Current Configuration: n_gp_layers:4 - n_gp_out: 3 - num_inducing: 90 - num_samples: 7 - batch_size:512 - num_inducing: 90 - lr: 0.0011210578610494416
INFO:root:30/400 - Loss: 351.7706298828125 - Score: 40.02610397338867
INFO:root:10/400 - Loss: 4185.22265625 - Score: 77.46383666992188
INFO:root:40/400 - Loss: 147.44068908691406 - Score: 40.314292907714844
INFO:root:20/400 - Loss: 5470.76708984375 - Score: 91.81055450439453
INFO:root:0/400 - Loss: 16138.1318359375 - Score: 118.50331115722656
INFO:root:30/400 - Loss: 118.049072265625 - Score: 37.265811920166016
INFO:root:Early stopping
INFO:root:After model training
INFO:root:After memory clearing
INFO:optuna.study.study:Trial 1 finished with value: 37.58218002319336 and parameters: {'lr': 0.04729338216636208, 'batch_size': 512, 'num_inducing': 195, 'num_samples': 4, 'kernel_type': 'matern1.5', 'n_gp_layers': 1, 'n_gp_out': 1}. Best is trial 1 with value: 37.58218002319336.
INFO:root:Current Configuration: n_gp_layers:2 - n_gp_out: 5 - num_inducing: 74 - num_samples: 3 - batch_size:1024 - num_inducing: 74 - lr: 0.07550793663000266
INFO:root:10/400 - Loss: 1970.6495361328125 - Score: 63.78292465209961
INFO:root:10/400 - Loss: 14921.3857421875 - Score: 118.15892791748047
INFO:root:0/400 - Loss: 7434.88037109375 - Score: 108.7010269165039
INFO:root:40/400 - Loss: 238.66041564941406 - Score: 38.28886413574219
INFO:root:30/400 - Loss: 199.85203552246094 - Score: 38.743980407714844
INFO:optuna.study._optimize:Trial 1 pruned. 
INFO:root:Current Configuration: n_gp_layers:1 - n_gp_out: 1 - num_inducing: 392 - num_samples: 12 - batch_size:1024 - num_inducing: 392 - lr: 0.003710056138013894
INFO:root:0/400 - Loss: 16471.685546875 - Score: 118.5630111694336
INFO:root:30/400 - Loss: 3475.076904296875 - Score: 77.14175415039062
INFO:optuna.study._optimize:Trial 2 pruned. 
INFO:root:Current Configuration: n_gp_layers:2 - n_gp_out: 3 - num_inducing: 57 - num_samples: 13 - batch_size:512 - num_inducing: 57 - lr: 0.0012126114273368056
INFO:optuna.study._optimize:Trial 3 pruned. 
INFO:root:Current Configuration: n_gp_layers:1 - n_gp_out: 4 - num_inducing: 78 - num_samples: 11 - batch_size:1024 - num_inducing: 78 - lr: 0.03220710772728541
INFO:root:0/400 - Loss: 15864.30859375 - Score: 118.439453125
INFO:root:0/400 - Loss: 11669.0302734375 - Score: 116.93399047851562
INFO:root:40/400 - Loss: 108.8411865234375 - Score: 37.363929748535156
INFO:root:0/400 - Loss: 16111.224609375 - Score: 118.52222442626953
INFO:root:10/400 - Loss: 10448.599609375 - Score: 113.41789245605469
INFO:root:50/400 - Loss: 275.0434265136719 - Score: 38.18922424316406
INFO:root:20/400 - Loss: 241.9931182861328 - Score: 39.037471771240234
INFO:root:40/400 - Loss: 162.3809356689453 - Score: 37.88779830932617
INFO:optuna.study._optimize:Trial 2 pruned. 
INFO:root:Current Configuration: n_gp_layers:1 - n_gp_out: 2 - num_inducing: 385 - num_samples: 9 - batch_size:512 - num_inducing: 385 - lr: 0.009351728912121783
INFO:root:Early stopping
INFO:root:After model training
INFO:root:After memory clearing
INFO:optuna.study.study:Trial 1 finished with value: 37.265811920166016 and parameters: {'lr': 0.0660968541540321, 'batch_size': 2048, 'num_inducing': 89, 'num_samples': 10, 'kernel_type': 'rbf', 'n_gp_layers': 1, 'n_gp_out': 2}. Best is trial 1 with value: 37.265811920166016.
INFO:root:Current Configuration: n_gp_layers:2 - n_gp_out: 1 - num_inducing: 522 - num_samples: 8 - batch_size:512 - num_inducing: 522 - lr: 0.004977057554696798
INFO:root:40/400 - Loss: 2296.5751953125 - Score: 66.22076416015625
INFO:root:0/400 - Loss: 16096.267578125 - Score: 118.5203857421875
INFO:root:0/400 - Loss: 13391.908203125 - Score: 117.2795181274414
INFO:root:10/400 - Loss: 457.5072326660156 - Score: 44.12786102294922
INFO:root:60/400 - Loss: 156.59951782226562 - Score: 37.404136657714844
INFO:root:20/400 - Loss: 1042.3486328125 - Score: 48.42905807495117
INFO:root:0/400 - Loss: 14769.919921875 - Score: 118.04621124267578
INFO:root:50/400 - Loss: 138.0565948486328 - Score: 38.31381607055664
INFO:root:50/400 - Loss: 1561.0845947265625 - Score: 58.19588851928711
INFO:root:70/400 - Loss: 145.26034545898438 - Score: 37.45818328857422
INFO:root:20/400 - Loss: 215.24935913085938 - Score: 38.41202163696289
INFO:root:Early stopping
INFO:root:After model training
INFO:root:After memory clearing
INFO:optuna.study.study:Trial 1 finished with value: 37.78729248046875 and parameters: {'lr': 0.0555442770834226, 'batch_size': 512, 'num_inducing': 166, 'num_samples': 14, 'kernel_type': 'matern0.5', 'n_gp_layers': 1, 'n_gp_out': 1}. Best is trial 1 with value: 37.78729248046875.
INFO:root:Current Configuration: n_gp_layers:2 - n_gp_out: 6 - num_inducing: 209 - num_samples: 2 - batch_size:2048 - num_inducing: 209 - lr: 0.0008845636266002723
INFO:root:10/400 - Loss: 11894.8330078125 - Score: 113.50981903076172
INFO:root:20/400 - Loss: 513.8096313476562 - Score: 44.622276306152344
INFO:root:20/400 - Loss: 13613.9091796875 - Score: 117.52589416503906
INFO:root:20/400 - Loss: 7137.75732421875 - Score: 102.98509979248047
INFO:root:30/400 - Loss: 124.54598999023438 - Score: 37.01084899902344
INFO:root:Early stopping
INFO:root:After model training
INFO:root:After memory clearing
INFO:optuna.study.study:Trial 1 finished with value: 37.39690017700195 and parameters: {'lr': 0.01069747257706085, 'batch_size': 1024, 'num_inducing': 158, 'num_samples': 4, 'kernel_type': 'rbf', 'n_gp_layers': 1, 'n_gp_out': 5}. Best is trial 1 with value: 37.39690017700195.
INFO:root:Current Configuration: n_gp_layers:2 - n_gp_out: 5 - num_inducing: 527 - num_samples: 9 - batch_size:1024 - num_inducing: 527 - lr: 0.0053847428520667675
INFO:root:0/400 - Loss: 16473.69921875 - Score: 118.56238555908203
INFO:root:60/400 - Loss: 1088.1075439453125 - Score: 52.287071228027344
INFO:root:10/400 - Loss: 1499.9942626953125 - Score: 56.474327087402344
INFO:root:30/400 - Loss: 174.97425842285156 - Score: 37.70919418334961
INFO:root:20/400 - Loss: 8964.568359375 - Score: 106.51445770263672
INFO:root:30/400 - Loss: 426.6088562011719 - Score: 40.40033721923828
INFO:root:70/400 - Loss: 779.1713256835938 - Score: 48.001346588134766
INFO:optuna.study._optimize:Trial 2 pruned. 
INFO:root:Current Configuration: n_gp_layers:4 - n_gp_out: 1 - num_inducing: 267 - num_samples: 12 - batch_size:1024 - num_inducing: 267 - lr: 0.07219496614262014
INFO:root:40/400 - Loss: 156.32052612304688 - Score: 38.506752014160156
INFO:root:40/400 - Loss: 108.10425567626953 - Score: 37.118186950683594
INFO:root:Early stopping
INFO:root:After model training
INFO:root:After memory clearing
INFO:optuna.study.study:Trial 1 finished with value: 36.760799407958984 and parameters: {'lr': 0.03230738965178223, 'batch_size': 1024, 'num_inducing': 277, 'num_samples': 6, 'kernel_type': 'rbf', 'n_gp_layers': 1, 'n_gp_out': 6}. Best is trial 1 with value: 36.760799407958984.
INFO:root:Current Configuration: n_gp_layers:3 - n_gp_out: 4 - num_inducing: 494 - num_samples: 4 - batch_size:2048 - num_inducing: 494 - lr: 0.009174164242214905
INFO:root:30/400 - Loss: 5221.55224609375 - Score: 94.06096649169922
INFO:root:80/400 - Loss: 578.7413330078125 - Score: 44.93598937988281
INFO:root:20/400 - Loss: 332.0753479003906 - Score: 40.12175750732422
INFO:root:0/400 - Loss: 8095.78369140625 - Score: 113.90644836425781
INFO:root:30/400 - Loss: 7083.361328125 - Score: 100.91692352294922
INFO:root:50/400 - Loss: 111.2129135131836 - Score: 37.303741455078125
INFO:root:30/400 - Loss: 12479.9033203125 - Score: 116.64051055908203
INFO:root:30/400 - Loss: 262.3905029296875 - Score: 39.87832260131836
INFO:root:90/400 - Loss: 446.5007019042969 - Score: 42.76404571533203
INFO:root:Early stopping
INFO:root:After model training
INFO:root:After memory clearing
INFO:optuna.study.study:Trial 4 finished with value: 37.21852111816406 and parameters: {'lr': 0.03220710772728541, 'batch_size': 1024, 'num_inducing': 78, 'num_samples': 11, 'kernel_type': 'matern1.5', 'n_gp_layers': 1, 'n_gp_out': 4}. Best is trial 4 with value: 37.21852111816406.
INFO:root:Current Configuration: n_gp_layers:2 - n_gp_out: 1 - num_inducing: 598 - num_samples: 11 - batch_size:1024 - num_inducing: 598 - lr: 0.04502895027106956
INFO:root:40/400 - Loss: 474.1111145019531 - Score: 40.122314453125
INFO:root:40/400 - Loss: 5708.3837890625 - Score: 95.36473083496094
INFO:root:30/400 - Loss: 235.6407012939453 - Score: 37.94082260131836
INFO:root:100/400 - Loss: 359.0181884765625 - Score: 41.28072738647461
INFO:root:40/400 - Loss: 3934.240966796875 - Score: 85.14472961425781
INFO:root:0/400 - Loss: 10206.337890625 - Score: 115.46440887451172
INFO:root:50/400 - Loss: 4658.4091796875 - Score: 89.29410552978516
INFO:root:110/400 - Loss: 297.51129150390625 - Score: 40.26322555541992
INFO:root:10/400 - Loss: 15577.1103515625 - Score: 118.45500183105469
INFO:root:40/400 - Loss: 11466.8564453125 - Score: 115.46061706542969
INFO:root:40/400 - Loss: 197.8849334716797 - Score: 38.27227783203125
INFO:root:50/400 - Loss: 214.48341369628906 - Score: 37.834495544433594
INFO:root:40/400 - Loss: 213.83111572265625 - Score: 37.61728286743164
INFO:root:120/400 - Loss: 254.9112091064453 - Score: 39.53813171386719
INFO:root:60/400 - Loss: 3836.37890625 - Score: 83.931884765625
INFO:root:10/400 - Loss: 501.7091369628906 - Score: 38.01689529418945
INFO:root:Time Budget run out. Pruning Trial
INFO:root:After model training
INFO:root:After memory clearing
INFO:optuna.study.study:Trial 3 finished with value: 37.44314193725586 and parameters: {'lr': 0.031048572767630418, 'batch_size': 1024, 'num_inducing': 659, 'num_samples': 15, 'kernel_type': 'matern0.5', 'n_gp_layers': 1, 'n_gp_out': 5}. Best is trial 3 with value: 37.44314193725586.
INFO:root:Current Configuration: n_gp_layers:2 - n_gp_out: 1 - num_inducing: 492 - num_samples: 10 - batch_size:1024 - num_inducing: 492 - lr: 0.00017423894766871548
INFO:root:50/400 - Loss: 3021.46142578125 - Score: 77.51117706298828
INFO:root:130/400 - Loss: 224.00018310546875 - Score: 39.03825759887695
INFO:root:0/400 - Loss: 16524.265625 - Score: 118.56368255615234
INFO:root:70/400 - Loss: 3178.02490234375 - Score: 78.94234466552734
INFO:root:50/400 - Loss: 239.25140380859375 - Score: 38.21388244628906
INFO:root:140/400 - Loss: 201.70413208007812 - Score: 38.682411193847656
INFO:root:60/400 - Loss: 184.11627197265625 - Score: 37.78339385986328
INFO:root:Early stopping
INFO:root:After model training
INFO:root:After memory clearing
INFO:optuna.study.study:Trial 3 finished with value: 37.525611877441406 and parameters: {'lr': 0.009351728912121783, 'batch_size': 512, 'num_inducing': 385, 'num_samples': 9, 'kernel_type': 'matern1.5', 'n_gp_layers': 1, 'n_gp_out': 2}. Best is trial 3 with value: 37.525611877441406.
INFO:root:Current Configuration: n_gp_layers:3 - n_gp_out: 1 - num_inducing: 59 - num_samples: 2 - batch_size:2048 - num_inducing: 59 - lr: 0.015704829937141285
INFO:root:0/400 - Loss: 15101.84765625 - Score: 118.22010803222656
INFO:root:50/400 - Loss: 10566.0263671875 - Score: 114.0052261352539
INFO:root:10/400 - Loss: 6816.36328125 - Score: 107.91291809082031
INFO:root:50/400 - Loss: 157.91488647460938 - Score: 38.107601165771484
INFO:root:60/400 - Loss: 2349.083251953125 - Score: 70.7561264038086
INFO:root:20/400 - Loss: 4066.712890625 - Score: 95.17263793945312
INFO:optuna.study._optimize:Trial 3 pruned. 
INFO:root:Current Configuration: n_gp_layers:3 - n_gp_out: 1 - num_inducing: 546 - num_samples: 12 - batch_size:2048 - num_inducing: 546 - lr: 0.00011753168870194569
INFO:root:150/400 - Loss: 183.68807983398438 - Score: 38.42697525024414
INFO:root:30/400 - Loss: 2641.52587890625 - Score: 81.24655151367188
INFO:root:80/400 - Loss: 2640.984619140625 - Score: 74.30868530273438
INFO:root:0/400 - Loss: 15580.5400390625 - Score: 118.4711685180664
INFO:root:40/400 - Loss: 1768.8182373046875 - Score: 69.89246368408203
INFO:root:20/400 - Loss: 14728.451171875 - Score: 118.14785766601562
INFO:root:Time Budget run out. Pruning Trial
INFO:root:After model training
INFO:root:After memory clearing
INFO:optuna.study.study:Trial 1 finished with value: 38.294349670410156 and parameters: {'lr': 0.007987353252504565, 'batch_size': 2048, 'num_inducing': 68, 'num_samples': 8, 'kernel_type': 'rbf', 'n_gp_layers': 1, 'n_gp_out': 6}. Best is trial 0 with value: 37.90920639038086.
INFO:root:Current Configuration: n_gp_layers:1 - n_gp_out: 6 - num_inducing: 106 - num_samples: 11 - batch_size:1024 - num_inducing: 106 - lr: 0.0008586713192096651
INFO:root:50/400 - Loss: 1200.078857421875 - Score: 60.82554626464844
INFO:root:Time Budget run out. Pruning Trial
INFO:root:After model training
INFO:root:After memory clearing
INFO:optuna.study.study:Trial 1 finished with value: 37.736331939697266 and parameters: {'lr': 0.0077083125917856935, 'batch_size': 1024, 'num_inducing': 375, 'num_samples': 4, 'kernel_type': 'matern1.5', 'n_gp_layers': 1, 'n_gp_out': 3}. Best is trial 1 with value: 37.736331939697266.
INFO:root:Current Configuration: n_gp_layers:1 - n_gp_out: 4 - num_inducing: 182 - num_samples: 5 - batch_size:2048 - num_inducing: 182 - lr: 0.007706499296604288
INFO:root:Time Budget run out. Pruning Trial
INFO:root:After model training
INFO:root:0/400 - Loss: 16396.353515625 - Score: 118.55449676513672
INFO:root:After memory clearing
