INFO:optuna.study._optimize:Trial 26 pruned. 
INFO:root:Current Configuration: n_gp_layers:1 - n_gp_out: 1 - num_inducing: 610 - num_samples: 2 - batch_size:512 - num_inducing: 610 - lr: 0.01880717582430647
INFO:root:10/400 - Loss: 482.0475158691406 - Score: 38.14781188964844
INFO:root:0/400 - Loss: 11095.07421875 - Score: 116.19927978515625
WARNING:optuna.study._optimize:Trial 27 failed because of the following error: NotPSDError('Matrix not positive definite after repeatedly adding jitter up to 1.0e-06.',)
Traceback (most recent call last):
  File "/home/linyuhan/my_project/venv_CMAPSS/lib64/python3.6/site-packages/optuna/study/_optimize.py", line 196, in _run_trial
    value_or_values = func(trial)
  File "/home/linyuhan/Dokumente/Masterarbeit/dataset/CMAPSS/code/DGP_Yuhan/HPO_DGP.py", line 400, in <lambda>
    metric=mae),
  File "/home/linyuhan/Dokumente/Masterarbeit/dataset/CMAPSS/code/DGP_Yuhan/HPO_DGP.py", line 263, in objective_train_test
    output = model(X_batch)
  File "/home/linyuhan/my_project/venv_CMAPSS/lib64/python3.6/site-packages/gpytorch/module.py", line 30, in __call__
    outputs = self.forward(*inputs, **kwargs)
  File "/home/linyuhan/Dokumente/Masterarbeit/dataset/CMAPSS/code/DGP_Yuhan/src/deep_gp.py", line 145, in forward
    output = layer(output)
  File "/home/linyuhan/Dokumente/Masterarbeit/dataset/CMAPSS/code/DGP_Yuhan/src/deep_gp.py", line 91, in __call__
    return super().__call__(x, are_samples=bool(len(other_inputs)))
  File "/home/linyuhan/my_project/venv_CMAPSS/lib64/python3.6/site-packages/gpytorch/models/deep_gps/deep_gp.py", line 99, in __call__
    output = ApproximateGP.__call__(self, inputs)
  File "/home/linyuhan/my_project/venv_CMAPSS/lib64/python3.6/site-packages/gpytorch/models/approximate_gp.py", line 81, in __call__
    return self.variational_strategy(inputs, prior=prior, **kwargs)
  File "/home/linyuhan/my_project/venv_CMAPSS/lib64/python3.6/site-packages/gpytorch/variational/variational_strategy.py", line 169, in __call__
    return super().__call__(x, prior=prior, **kwargs)
  File "/home/linyuhan/my_project/venv_CMAPSS/lib64/python3.6/site-packages/gpytorch/variational/_variational_strategy.py", line 129, in __call__
    **kwargs,
  File "/home/linyuhan/my_project/venv_CMAPSS/lib64/python3.6/site-packages/gpytorch/module.py", line 30, in __call__
    outputs = self.forward(*inputs, **kwargs)
  File "/home/linyuhan/my_project/venv_CMAPSS/lib64/python3.6/site-packages/gpytorch/variational/variational_strategy.py", line 103, in forward
    L = self._cholesky_factor(induc_induc_covar)
  File "/home/linyuhan/my_project/venv_CMAPSS/lib64/python3.6/site-packages/gpytorch/utils/memoize.py", line 76, in g
    return _add_to_cache_ignore_args(self, cache_name, method(self, *args, **kwargs))
  File "/home/linyuhan/my_project/venv_CMAPSS/lib64/python3.6/site-packages/gpytorch/variational/variational_strategy.py", line 72, in _cholesky_factor
    L = psd_safe_cholesky(delazify(induc_induc_covar).type(_linalg_dtype_cholesky.value()))
  File "/home/linyuhan/my_project/venv_CMAPSS/lib64/python3.6/site-packages/gpytorch/utils/cholesky.py", line 63, in psd_safe_cholesky
    L = _psd_safe_cholesky(A, out=out, jitter=jitter, max_tries=max_tries)
  File "/home/linyuhan/my_project/venv_CMAPSS/lib64/python3.6/site-packages/gpytorch/utils/cholesky.py", line 45, in _psd_safe_cholesky
    raise NotPSDError(f"Matrix not positive definite after repeatedly adding jitter up to {jitter_new:.1e}.")
gpytorch.utils.errors.NotPSDError: Matrix not positive definite after repeatedly adding jitter up to 1.0e-06.
INFO:root:Time Budget run out. Pruning Trial
INFO:root:After model training
INFO:root:After memory clearing
INFO:optuna.study.study:Trial 18 finished with value: 36.90489959716797 and parameters: {'lr': 0.04046915447575169, 'batch_size': 1024, 'num_inducing': 602, 'num_samples': 12, 'kernel_type': 'matern0.5', 'n_gp_layers': 1, 'n_gp_out': 4}. Best is trial 18 with value: 36.90489959716797.
INFO:root:Current Configuration: n_gp_layers:1 - n_gp_out: 1 - num_inducing: 128 - num_samples: 14 - batch_size:1024 - num_inducing: 128 - lr: 0.022565828939460707
INFO:root:0/400 - Loss: 12964.9931640625 - Score: 117.7354965209961
INFO:optuna.study._optimize:Trial 19 pruned. 
INFO:root:Current Configuration: n_gp_layers:2 - n_gp_out: 2 - num_inducing: 635 - num_samples: 12 - batch_size:512 - num_inducing: 635 - lr: 0.00011843007251446763
INFO:root:0/400 - Loss: 16512.771484375 - Score: 118.56245422363281
INFO:root:Time Budget run out. Pruning Trial
INFO:root:After model training
INFO:root:After memory clearing
INFO:optuna.study.study:Trial 23 finished with value: 41.694679260253906 and parameters: {'lr': 0.08624047729563256, 'batch_size': 512, 'num_inducing': 410, 'num_samples': 14, 'kernel_type': 'matern1.5', 'n_gp_layers': 4, 'n_gp_out': 3}. Best is trial 15 with value: 37.577857971191406.
INFO:root:Current Configuration: n_gp_layers:3 - n_gp_out: 2 - num_inducing: 581 - num_samples: 12 - batch_size:2048 - num_inducing: 581 - lr: 0.0011048815595595027
INFO:optuna.study._optimize:Trial 20 pruned. 
INFO:root:Current Configuration: n_gp_layers:2 - n_gp_out: 1 - num_inducing: 128 - num_samples: 2 - batch_size:1024 - num_inducing: 128 - lr: 0.09314111687601007
INFO:root:0/400 - Loss: 6802.349609375 - Score: 111.28678131103516
INFO:optuna.study._optimize:Trial 21 pruned. 
INFO:root:Current Configuration: n_gp_layers:3 - n_gp_out: 1 - num_inducing: 120 - num_samples: 11 - batch_size:1024 - num_inducing: 120 - lr: 0.0011844318588460595
INFO:root:0/400 - Loss: 16328.4228515625 - Score: 118.5248794555664
INFO:optuna.study._optimize:Trial 22 pruned. 
INFO:root:Current Configuration: n_gp_layers:2 - n_gp_out: 1 - num_inducing: 56 - num_samples: 10 - batch_size:512 - num_inducing: 56 - lr: 0.012136263972245438
INFO:root:0/400 - Loss: 12633.23046875 - Score: 116.92668151855469
INFO:optuna.study._optimize:Trial 23 pruned. 
INFO:root:Current Configuration: n_gp_layers:3 - n_gp_out: 2 - num_inducing: 237 - num_samples: 15 - batch_size:1024 - num_inducing: 237 - lr: 0.0012479502590399803
INFO:root:0/400 - Loss: 16323.6904296875 - Score: 118.5455093383789
INFO:root:0/400 - Loss: 16452.75 - Score: 118.56049346923828
INFO:root:Time Budget run out. Pruning Trial
INFO:root:After model training
INFO:root:After memory clearing
INFO:optuna.study.study:Trial 24 finished with value: 118.56049346923828 and parameters: {'lr': 0.0011048815595595027, 'batch_size': 2048, 'num_inducing': 581, 'num_samples': 12, 'kernel_type': 'matern1.5', 'n_gp_layers': 3, 'n_gp_out': 2}. Best is trial 15 with value: 37.577857971191406.
INFO:root:Current Configuration: n_gp_layers:1 - n_gp_out: 3 - num_inducing: 187 - num_samples: 11 - batch_size:512 - num_inducing: 187 - lr: 0.023452103522694254
INFO:root:0/400 - Loss: 10182.5283203125 - Score: 114.93305206298828
INFO:optuna.study._optimize:Trial 25 pruned. 
INFO:root:Current Configuration: n_gp_layers:1 - n_gp_out: 2 - num_inducing: 135 - num_samples: 9 - batch_size:512 - num_inducing: 135 - lr: 0.010929423235701098
INFO:root:0/400 - Loss: 13007.0009765625 - Score: 117.52189636230469
INFO:optuna.study._optimize:Trial 26 pruned. 
INFO:root:Current Configuration: n_gp_layers:3 - n_gp_out: 1 - num_inducing: 399 - num_samples: 12 - batch_size:2048 - num_inducing: 399 - lr: 0.00036674510906121316
INFO:optuna.study._optimize:Trial 24 pruned. 
INFO:root:Current Configuration: n_gp_layers:2 - n_gp_out: 1 - num_inducing: 123 - num_samples: 12 - batch_size:512 - num_inducing: 123 - lr: 0.0458276342197687
INFO:root:0/400 - Loss: 6792.04248046875 - Score: 107.81092071533203
INFO:root:0/400 - Loss: 16522.123046875 - Score: 118.56267547607422
INFO:optuna.study._optimize:Trial 25 pruned. 
INFO:root:Current Configuration: n_gp_layers:1 - n_gp_out: 3 - num_inducing: 799 - num_samples: 8 - batch_size:1024 - num_inducing: 799 - lr: 0.003125954467676169
INFO:root:0/400 - Loss: 15969.3271484375 - Score: 118.4486083984375
INFO:optuna.study._optimize:Trial 27 pruned. 
INFO:root:Current Configuration: n_gp_layers:1 - n_gp_out: 1 - num_inducing: 105 - num_samples: 15 - batch_size:512 - num_inducing: 105 - lr: 0.00296705139816177
INFO:root:0/400 - Loss: 15473.265625 - Score: 118.35655212402344
INFO:root:10/400 - Loss: 8516.068359375 - Score: 109.88457489013672
INFO:root:20/400 - Loss: 5384.31298828125 - Score: 98.03455352783203
INFO:root:30/400 - Loss: 3736.667724609375 - Score: 87.94389343261719
INFO:root:40/400 - Loss: 2705.213134765625 - Score: 79.190185546875
INFO:root:50/400 - Loss: 2001.549072265625 - Score: 71.54351806640625
INFO:root:60/400 - Loss: 1495.04931640625 - Score: 64.94798278808594
INFO:root:70/400 - Loss: 1123.9586181640625 - Score: 59.379730224609375
INFO:root:80/400 - Loss: 847.6424560546875 - Score: 54.735626220703125
INFO:root:90/400 - Loss: 643.542236328125 - Score: 50.970394134521484
INFO:root:100/400 - Loss: 492.45672607421875 - Score: 47.918418884277344
INFO:root:110/400 - Loss: 383.5777282714844 - Score: 45.51622772216797
INFO:root:120/400 - Loss: 301.68365478515625 - Score: 43.60072326660156
INFO:root:130/400 - Loss: 245.44992065429688 - Score: 42.144710540771484
INFO:optuna.study._optimize:Trial 26 pruned. 
INFO:root:Current Configuration: n_gp_layers:4 - n_gp_out: 2 - num_inducing: 303 - num_samples: 6 - batch_size:1024 - num_inducing: 303 - lr: 0.011089503152622096
INFO:root:140/400 - Loss: 196.66578674316406 - Score: 40.671775817871094
INFO:root:0/400 - Loss: 14530.0615234375 - Score: 117.7879867553711
INFO:root:150/400 - Loss: 169.4424591064453 - Score: 39.89293670654297
INFO:root:160/400 - Loss: 155.44064331054688 - Score: 39.28904342651367
INFO:root:170/400 - Loss: 152.13865661621094 - Score: 38.818511962890625
INFO:optuna.study._optimize:Trial 27 pruned. 
INFO:root:Current Configuration: n_gp_layers:3 - n_gp_out: 1 - num_inducing: 183 - num_samples: 9 - batch_size:1024 - num_inducing: 183 - lr: 0.00022124774437749494
INFO:root:0/400 - Loss: 16515.7578125 - Score: 118.56401062011719
INFO:root:180/400 - Loss: 155.03819274902344 - Score: 38.649322509765625
INFO:optuna.study._optimize:Trial 28 pruned. 
INFO:root:Current Configuration: n_gp_layers:3 - n_gp_out: 2 - num_inducing: 50 - num_samples: 8 - batch_size:2048 - num_inducing: 50 - lr: 0.012921723287923906
INFO:root:190/400 - Loss: 129.0175323486328 - Score: 38.24687957763672
INFO:root:0/400 - Loss: 15366.734375 - Score: 118.37831115722656
INFO:root:200/400 - Loss: 117.79454803466797 - Score: 38.04115295410156
INFO:root:Time Budget run out. Pruning Trial
INFO:root:After model training
INFO:root:After memory clearing
INFO:optuna.study.study:Trial 28 finished with value: 37.96625518798828 and parameters: {'lr': 0.00296705139816177, 'batch_size': 512, 'num_inducing': 105, 'num_samples': 15, 'kernel_type': 'matern1.5', 'n_gp_layers': 1, 'n_gp_out': 1}. Best is trial 15 with value: 37.577857971191406.
INFO:root:Current Configuration: n_gp_layers:2 - n_gp_out: 5 - num_inducing: 348 - num_samples: 15 - batch_size:2048 - num_inducing: 348 - lr: 0.0027708492095716397
INFO:root:10/400 - Loss: 7252.5263671875 - Score: 105.61732482910156
INFO:root:20/400 - Loss: 4121.8701171875 - Score: 89.45254516601562
INFO:root:30/400 - Loss: 2513.40380859375 - Score: 74.21027374267578
INFO:root:0/400 - Loss: 16295.4716796875 - Score: 118.54237365722656
INFO:root:40/400 - Loss: 1574.831298828125 - Score: 62.692230224609375
INFO:root:50/400 - Loss: 1008.9490966796875 - Score: 54.55918884277344
INFO:root:Time Budget run out. Pruning Trial
INFO:root:After model training
INFO:root:After memory clearing
INFO:optuna.study.study:Trial 29 finished with value: 53.22675704956055 and parameters: {'lr': 0.012921723287923906, 'batch_size': 2048, 'num_inducing': 50, 'num_samples': 8, 'kernel_type': 'matern0.5', 'n_gp_layers': 3, 'n_gp_out': 2}. Best is trial 18 with value: 36.90489959716797.
INFO:root:Current Configuration: n_gp_layers:1 - n_gp_out: 1 - num_inducing: 103 - num_samples: 9 - batch_size:512 - num_inducing: 103 - lr: 0.03776051191061001
INFO:root:0/400 - Loss: 8106.56005859375 - Score: 113.88990020751953
INFO:root:10/400 - Loss: 245.23193359375 - Score: 42.045753479003906
INFO:root:20/400 - Loss: 155.72239685058594 - Score: 38.36397933959961
INFO:root:30/400 - Loss: 180.59561157226562 - Score: 38.39607238769531
INFO:root:40/400 - Loss: 118.51455688476562 - Score: 38.076393127441406
INFO:root:Early stopping
INFO:root:After model training
INFO:root:After memory clearing
INFO:optuna.study.study:Trial 30 finished with value: 37.67537307739258 and parameters: {'lr': 0.03776051191061001, 'batch_size': 512, 'num_inducing': 103, 'num_samples': 9, 'kernel_type': 'matern1.5', 'n_gp_layers': 1, 'n_gp_out': 1}. Best is trial 18 with value: 36.90489959716797.
INFO:root:Current Configuration: n_gp_layers:2 - n_gp_out: 3 - num_inducing: 52 - num_samples: 3 - batch_size:512 - num_inducing: 52 - lr: 0.0030328634659360573
INFO:root:0/400 - Loss: 15457.7607421875 - Score: 118.37289428710938
INFO:optuna.study._optimize:Trial 31 pruned. 
INFO:root:Current Configuration: n_gp_layers:4 - n_gp_out: 3 - num_inducing: 59 - num_samples: 2 - batch_size:1024 - num_inducing: 59 - lr: 0.0022012757757184434
INFO:root:0/400 - Loss: 16144.46875 - Score: 118.51789855957031
INFO:optuna.study._optimize:Trial 32 pruned. 
INFO:root:Current Configuration: n_gp_layers:1 - n_gp_out: 1 - num_inducing: 766 - num_samples: 4 - batch_size:2048 - num_inducing: 766 - lr: 0.014719717311642854
INFO:root:0/400 - Loss: 15207.046875 - Score: 118.23086547851562
INFO:root:Time Budget run out. Pruning Trial
INFO:root:After model training
INFO:root:After memory clearing
INFO:optuna.study.study:Trial 29 finished with value: 118.51107025146484 and parameters: {'lr': 0.0027708492095716397, 'batch_size': 2048, 'num_inducing': 348, 'num_samples': 15, 'kernel_type': 'rbf', 'n_gp_layers': 2, 'n_gp_out': 5}. Best is trial 15 with value: 37.577857971191406.
INFO:root:Current Configuration: n_gp_layers:2 - n_gp_out: 3 - num_inducing: 606 - num_samples: 8 - batch_size:512 - num_inducing: 606 - lr: 0.0042451491938729005
INFO:optuna.study._optimize:Trial 33 pruned. 
INFO:root:Current Configuration: n_gp_layers:4 - n_gp_out: 5 - num_inducing: 349 - num_samples: 15 - batch_size:1024 - num_inducing: 349 - lr: 0.09950491896378591
INFO:root:0/400 - Loss: 15040.681640625 - Score: 118.35174560546875
INFO:root:0/400 - Loss: 5638.1259765625 - Score: 99.7242431640625
INFO:optuna.study._optimize:Trial 30 pruned. 
INFO:root:Current Configuration: n_gp_layers:1 - n_gp_out: 5 - num_inducing: 154 - num_samples: 3 - batch_size:1024 - num_inducing: 154 - lr: 0.04226454854439315
INFO:root:0/400 - Loss: 10560.4697265625 - Score: 116.206787109375
INFO:root:10/400 - Loss: 303.2950744628906 - Score: 38.08363723754883
INFO:root:20/400 - Loss: 163.42539978027344 - Score: 37.09345626831055
INFO:root:30/400 - Loss: 122.08289337158203 - Score: 37.089229583740234
INFO:root:Early stopping
INFO:root:After model training
INFO:root:After memory clearing
INFO:optuna.study.study:Trial 31 finished with value: 36.95566177368164 and parameters: {'lr': 0.04226454854439315, 'batch_size': 1024, 'num_inducing': 154, 'num_samples': 3, 'kernel_type': 'matern1.5', 'n_gp_layers': 1, 'n_gp_out': 5}. Best is trial 31 with value: 36.95566177368164.
INFO:root:Current Configuration: n_gp_layers:3 - n_gp_out: 2 - num_inducing: 358 - num_samples: 4 - batch_size:512 - num_inducing: 358 - lr: 0.001989483390134316
INFO:root:0/400 - Loss: 15794.751953125 - Score: 118.31109619140625
INFO:root:Time Budget run out. Pruning Trial
INFO:root:After model training
INFO:root:After memory clearing
INFO:optuna.study.study:Trial 34 finished with value: 47.31935119628906 and parameters: {'lr': 0.09950491896378591, 'batch_size': 1024, 'num_inducing': 349, 'num_samples': 15, 'kernel_type': 'matern0.5', 'n_gp_layers': 4, 'n_gp_out': 5}. Best is trial 18 with value: 36.90489959716797.
INFO:root:Current Configuration: n_gp_layers:1 - n_gp_out: 2 - num_inducing: 102 - num_samples: 13 - batch_size:1024 - num_inducing: 102 - lr: 0.04331950428436437
INFO:root:0/400 - Loss: 10403.5791015625 - Score: 115.7749252319336
INFO:optuna.study._optimize:Trial 35 pruned. 
INFO:root:Current Configuration: n_gp_layers:1 - n_gp_out: 2 - num_inducing: 229 - num_samples: 12 - batch_size:512 - num_inducing: 229 - lr: 0.0950648102487626
INFO:root:0/400 - Loss: 2459.4619140625 - Score: 76.58399200439453
INFO:root:10/400 - Loss: 169.1263885498047 - Score: 38.80662536621094
INFO:root:10/400 - Loss: 9397.1865234375 - Score: 106.35948944091797
INFO:root:20/400 - Loss: 199.1315460205078 - Score: 39.784061431884766
INFO:optuna.study._optimize:Trial 36 pruned. 
INFO:root:Current Configuration: n_gp_layers:4 - n_gp_out: 1 - num_inducing: 149 - num_samples: 11 - batch_size:512 - num_inducing: 149 - lr: 0.008152765742285947
INFO:root:0/400 - Loss: 13770.3759765625 - Score: 117.61458587646484
INFO:optuna.study._optimize:Trial 37 pruned. 
INFO:root:Current Configuration: n_gp_layers:2 - n_gp_out: 1 - num_inducing: 123 - num_samples: 13 - batch_size:512 - num_inducing: 123 - lr: 0.045912780483279195
INFO:root:0/400 - Loss: 7034.349609375 - Score: 111.42864990234375
INFO:root:20/400 - Loss: 5884.2802734375 - Score: 92.91716003417969
INFO:optuna.study._optimize:Trial 38 pruned. 
INFO:root:Current Configuration: n_gp_layers:2 - n_gp_out: 1 - num_inducing: 231 - num_samples: 12 - batch_size:512 - num_inducing: 231 - lr: 0.021187421059643437
INFO:root:0/400 - Loss: 10307.4404296875 - Score: 113.6375732421875
INFO:optuna.study._optimize:Trial 39 pruned. 
INFO:root:Current Configuration: n_gp_layers:1 - n_gp_out: 2 - num_inducing: 113 - num_samples: 9 - batch_size:2048 - num_inducing: 113 - lr: 0.0011919376155619726
INFO:root:0/400 - Loss: 16444.40234375 - Score: 118.55261993408203
INFO:root:10/400 - Loss: 15244.2138671875 - Score: 118.27809143066406
INFO:optuna.study._optimize:Trial 32 pruned. 
INFO:root:Current Configuration: n_gp_layers:4 - n_gp_out: 4 - num_inducing: 116 - num_samples: 2 - batch_size:512 - num_inducing: 116 - lr: 0.09232614343879755
INFO:root:20/400 - Loss: 14139.3408203125 - Score: 117.7948989868164
INFO:root:0/400 - Loss: 2623.170654296875 - Score: 80.40003967285156
INFO:optuna.study._optimize:Trial 40 pruned. 
INFO:root:Current Configuration: n_gp_layers:2 - n_gp_out: 1 - num_inducing: 290 - num_samples: 7 - batch_size:2048 - num_inducing: 290 - lr: 0.006661991008405749
INFO:root:0/400 - Loss: 15921.9775390625 - Score: 118.43333435058594
INFO:optuna.study._optimize:Trial 33 pruned. 
INFO:root:Current Configuration: n_gp_layers:3 - n_gp_out: 1 - num_inducing: 136 - num_samples: 12 - batch_size:1024 - num_inducing: 136 - lr: 0.008994816734279692
INFO:root:0/400 - Loss: 14922.89453125 - Score: 118.1685562133789
INFO:root:10/400 - Loss: 10622.181640625 - Score: 114.12867736816406
INFO:root:10/400 - Loss: 5539.86181640625 - Score: 95.67583465576172
INFO:root:20/400 - Loss: 7032.25390625 - Score: 102.0733871459961
INFO:root:20/400 - Loss: 2651.7626953125 - Score: 73.67337036132812
INFO:optuna.study._optimize:Trial 34 pruned. 
INFO:root:Current Configuration: n_gp_layers:1 - n_gp_out: 2 - num_inducing: 51 - num_samples: 15 - batch_size:2048 - num_inducing: 51 - lr: 0.0330555236370571
INFO:root:0/400 - Loss: 13743.1650390625 - Score: 117.96045684814453
INFO:optuna.study._optimize:Trial 41 pruned. 
INFO:root:Current Configuration: n_gp_layers:3 - n_gp_out: 6 - num_inducing: 74 - num_samples: 14 - batch_size:512 - num_inducing: 74 - lr: 0.057235021652224126
INFO:optuna.study._optimize:Trial 35 pruned. 
INFO:root:Current Configuration: n_gp_layers:2 - n_gp_out: 4 - num_inducing: 296 - num_samples: 9 - batch_size:512 - num_inducing: 296 - lr: 0.01368296709874267
INFO:root:0/400 - Loss: 5069.90625 - Score: 97.17623138427734
INFO:root:0/400 - Loss: 12078.4501953125 - Score: 115.52273559570312
INFO:optuna.study._optimize:Trial 36 pruned. 
INFO:root:Current Configuration: n_gp_layers:1 - n_gp_out: 2 - num_inducing: 772 - num_samples: 5 - batch_size:512 - num_inducing: 772 - lr: 0.05062560502774791
INFO:root:0/400 - Loss: 6088.63671875 - Score: 102.51917266845703
INFO:optuna.study._optimize:Trial 42 pruned. 
INFO:root:Current Configuration: n_gp_layers:3 - n_gp_out: 1 - num_inducing: 131 - num_samples: 3 - batch_size:1024 - num_inducing: 131 - lr: 0.0006944162760014645
INFO:root:0/400 - Loss: 16424.033203125 - Score: 118.54350280761719
INFO:root:10/400 - Loss: 15061.1259765625 - Score: 117.99769592285156
INFO:root:20/400 - Loss: 13797.2646484375 - Score: 116.89374542236328
INFO:root:30/400 - Loss: 12699.7060546875 - Score: 115.73662567138672
INFO:root:40/400 - Loss: 11753.9111328125 - Score: 114.6639633178711
INFO:root:50/400 - Loss: 10924.1650390625 - Score: 113.62014770507812
INFO:root:60/400 - Loss: 10187.35546875 - Score: 112.57109069824219
INFO:root:70/400 - Loss: 9526.1015625 - Score: 111.50572204589844
INFO:root:80/400 - Loss: 8927.6435546875 - Score: 110.42339324951172
INFO:optuna.study._optimize:Trial 37 pruned. 
INFO:root:Current Configuration: n_gp_layers:1 - n_gp_out: 2 - num_inducing: 528 - num_samples: 4 - batch_size:512 - num_inducing: 528 - lr: 0.04831359541890845
INFO:root:0/400 - Loss: 6369.564453125 - Score: 104.45415496826172
INFO:root:90/400 - Loss: 8383.7529296875 - Score: 109.32115936279297
INFO:root:100/400 - Loss: 7886.5703125 - Score: 108.20376586914062
INFO:root:110/400 - Loss: 7430.166015625 - Score: 107.07355499267578
INFO:root:120/400 - Loss: 7007.56884765625 - Score: 105.91455841064453
