INFO:optuna.study.study:Trial 1 finished with value: 67.71727752685547 and parameters: {'lr': 0.006652497426893072, 'batch_size': 2048, 'num_inducing': 50, 'num_samples': 14, 'kernel_type': 'rbf', 'n_gp_layers': 2, 'n_gp_out': 2}. Best is trial 0 with value: 37.92942428588867.
INFO:root:Current Configuration: n_gp_layers:1 - n_gp_out: 5 - num_inducing: 59 - num_samples: 11 - batch_size:1024 - num_inducing: 59 - lr: 0.0014545778886978535
INFO:root:Time Budget run out. Pruning Trial
INFO:root:After model training
INFO:root:After memory clearing
INFO:optuna.study.study:Trial 1 finished with value: 37.933349609375 and parameters: {'lr': 0.009620458665835267, 'batch_size': 512, 'num_inducing': 75, 'num_samples': 13, 'kernel_type': 'matern1.5', 'n_gp_layers': 2, 'n_gp_out': 4}. Best is trial 0 with value: 37.55686569213867.
INFO:root:Current Configuration: n_gp_layers:4 - n_gp_out: 6 - num_inducing: 125 - num_samples: 6 - batch_size:2048 - num_inducing: 125 - lr: 0.0002849533367718103
INFO:root:0/400 - Loss: 16282.837890625 - Score: 118.53646850585938
INFO:root:0/400 - Loss: 15840.5185546875 - Score: 118.46995544433594
INFO:root:Time Budget run out. Pruning Trial
INFO:root:After model training
INFO:root:After memory clearing
INFO:optuna.study.study:Trial 1 finished with value: 113.21566009521484 and parameters: {'lr': 0.0014946769748262624, 'batch_size': 2048, 'num_inducing': 633, 'num_samples': 3, 'kernel_type': 'matern0.5', 'n_gp_layers': 1, 'n_gp_out': 1}. Best is trial 0 with value: 37.77363586425781.
INFO:root:Current Configuration: n_gp_layers:3 - n_gp_out: 3 - num_inducing: 341 - num_samples: 15 - batch_size:2048 - num_inducing: 341 - lr: 0.0017067760794386166
INFO:root:60/400 - Loss: 839.19970703125 - Score: 54.23422622680664
INFO:optuna.study._optimize:Trial 4 pruned. 
INFO:root:Current Configuration: n_gp_layers:2 - n_gp_out: 1 - num_inducing: 155 - num_samples: 3 - batch_size:2048 - num_inducing: 155 - lr: 0.030635374128837965
INFO:optuna.study._optimize:Trial 2 pruned. 
INFO:root:Current Configuration: n_gp_layers:3 - n_gp_out: 6 - num_inducing: 79 - num_samples: 15 - batch_size:2048 - num_inducing: 79 - lr: 0.03115672861376341
INFO:root:0/400 - Loss: 13875.0400390625 - Score: 117.82931518554688
INFO:root:70/400 - Loss: 585.71826171875 - Score: 49.241233825683594
INFO:root:90/400 - Loss: 2198.12548828125 - Score: 69.9207763671875
INFO:root:80/400 - Loss: 428.16046142578125 - Score: 45.799156188964844
INFO:root:10/400 - Loss: 9604.2861328125 - Score: 110.41236114501953
INFO:root:90/400 - Loss: 326.220947265625 - Score: 43.08901596069336
INFO:root:10/400 - Loss: 14827.8818359375 - Score: 118.29711151123047
INFO:root:100/400 - Loss: 269.40594482421875 - Score: 41.72488784790039
INFO:root:Time Budget run out. Pruning Trial
INFO:root:After model training
INFO:root:After memory clearing
INFO:optuna.study.study:Trial 1 finished with value: 118.52850341796875 and parameters: {'lr': 0.00045754546576201393, 'batch_size': 1024, 'num_inducing': 167, 'num_samples': 7, 'kernel_type': 'matern0.5', 'n_gp_layers': 4, 'n_gp_out': 5}. Best is trial 0 with value: 37.70381546020508.
INFO:root:Current Configuration: n_gp_layers:4 - n_gp_out: 2 - num_inducing: 278 - num_samples: 3 - batch_size:1024 - num_inducing: 278 - lr: 0.000771984192477562
INFO:root:10/400 - Loss: 3260.280517578125 - Score: 84.5890121459961
INFO:root:110/400 - Loss: 234.71556091308594 - Score: 41.05886459350586
INFO:root:20/400 - Loss: 5083.4794921875 - Score: 86.85325622558594
INFO:root:100/400 - Loss: 1829.263916015625 - Score: 65.86280059814453
INFO:root:120/400 - Loss: 196.95509338378906 - Score: 40.16946029663086
INFO:root:20/400 - Loss: 13429.1865234375 - Score: 117.50399017333984
INFO:root:130/400 - Loss: 184.9036102294922 - Score: 39.70649719238281
INFO:root:0/400 - Loss: 16412.017578125 - Score: 118.5555191040039
INFO:root:20/400 - Loss: 1335.7996826171875 - Score: 61.326751708984375
INFO:root:140/400 - Loss: 162.5740203857422 - Score: 39.0279426574707
INFO:root:30/400 - Loss: 2804.82568359375 - Score: 68.60098266601562
INFO:root:150/400 - Loss: 140.58509826660156 - Score: 38.71320724487305
INFO:root:0/400 - Loss: 16530.873046875 - Score: 118.56827545166016
INFO:root:110/400 - Loss: 1520.3671875 - Score: 62.182342529296875
INFO:root:Time Budget run out. Pruning Trial
INFO:root:After model training
INFO:root:After memory clearing
INFO:optuna.study.study:Trial 3 finished with value: 61.81217956542969 and parameters: {'lr': 0.0012126114273368056, 'batch_size': 512, 'num_inducing': 57, 'num_samples': 13, 'kernel_type': 'rbf', 'n_gp_layers': 2, 'n_gp_out': 3}. Best is trial 1 with value: 37.58218002319336.
INFO:root:Current Configuration: n_gp_layers:1 - n_gp_out: 4 - num_inducing: 87 - num_samples: 13 - batch_size:512 - num_inducing: 87 - lr: 0.031404351093330576
INFO:root:160/400 - Loss: 168.388671875 - Score: 39.67409896850586
INFO:root:Time Budget run out. Pruning Trial
INFO:root:After model training
INFO:root:After memory clearing
INFO:optuna.study.study:Trial 1 finished with value: 118.09937286376953 and parameters: {'lr': 0.0012485835973172722, 'batch_size': 512, 'num_inducing': 312, 'num_samples': 9, 'kernel_type': 'rbf', 'n_gp_layers': 3, 'n_gp_out': 3}. Best is trial 0 with value: 37.82093811035156.
INFO:root:Current Configuration: n_gp_layers:3 - n_gp_out: 2 - num_inducing: 108 - num_samples: 10 - batch_size:1024 - num_inducing: 108 - lr: 0.02650057776141841
INFO:root:0/400 - Loss: 8728.109375 - Score: 112.63907623291016
INFO:root:30/400 - Loss: 12070.35546875 - Score: 115.24979400634766
INFO:root:30/400 - Loss: 506.2469177246094 - Score: 46.51181411743164
INFO:root:170/400 - Loss: 133.11692810058594 - Score: 38.479469299316406
INFO:root:30/400 - Loss: 13923.80859375 - Score: 117.60868835449219
INFO:optuna.study._optimize:Trial 4 pruned. 
INFO:root:Current Configuration: n_gp_layers:1 - n_gp_out: 1 - num_inducing: 322 - num_samples: 4 - batch_size:1024 - num_inducing: 322 - lr: 0.0013868454448543732
INFO:root:0/400 - Loss: 12203.71484375 - Score: 116.33039855957031
INFO:root:40/400 - Loss: 1594.57470703125 - Score: 56.577579498291016
INFO:root:0/400 - Loss: 16289.8916015625 - Score: 118.50774383544922
INFO:root:180/400 - Loss: 121.711181640625 - Score: 38.11587905883789
INFO:optuna.study._optimize:Trial 5 pruned. 
INFO:root:Current Configuration: n_gp_layers:3 - n_gp_out: 2 - num_inducing: 437 - num_samples: 6 - batch_size:1024 - num_inducing: 437 - lr: 0.006459051988309766
INFO:root:190/400 - Loss: 136.68478393554688 - Score: 38.751007080078125
INFO:root:200/400 - Loss: 112.33995819091797 - Score: 37.82332992553711
INFO:root:50/400 - Loss: 943.2142333984375 - Score: 49.026161193847656
INFO:root:40/400 - Loss: 401.0069274902344 - Score: 44.13679885864258
INFO:root:210/400 - Loss: 116.00108337402344 - Score: 38.07823181152344
INFO:root:Early stopping
INFO:root:After model training
INFO:root:After memory clearing
INFO:optuna.study.study:Trial 4 finished with value: 37.82332992553711 and parameters: {'lr': 0.015704829937141285, 'batch_size': 2048, 'num_inducing': 59, 'num_samples': 2, 'kernel_type': 'rbf', 'n_gp_layers': 3, 'n_gp_out': 1}. Best is trial 3 with value: 37.525611877441406.
INFO:root:Current Configuration: n_gp_layers:1 - n_gp_out: 1 - num_inducing: 760 - num_samples: 2 - batch_size:1024 - num_inducing: 760 - lr: 0.036878794387688874
INFO:root:40/400 - Loss: 10640.4052734375 - Score: 110.91310119628906
INFO:root:0/400 - Loss: 11102.4609375 - Score: 116.55115509033203
INFO:root:Time Budget run out. Pruning Trial
INFO:root:After model training
INFO:root:After memory clearing
INFO:optuna.study.study:Trial 2 finished with value: 117.1639404296875 and parameters: {'lr': 0.0008845636266002723, 'batch_size': 2048, 'num_inducing': 209, 'num_samples': 2, 'kernel_type': 'matern0.5', 'n_gp_layers': 2, 'n_gp_out': 6}. Best is trial 1 with value: 37.78729248046875.
INFO:root:Current Configuration: n_gp_layers:2 - n_gp_out: 3 - num_inducing: 126 - num_samples: 9 - batch_size:512 - num_inducing: 126 - lr: 0.00036329806217656285
INFO:root:60/400 - Loss: 631.533935546875 - Score: 44.53333282470703
INFO:root:50/400 - Loss: 348.8469543457031 - Score: 43.60485076904297
INFO:root:0/400 - Loss: 16419.015625 - Score: 118.54601287841797
INFO:root:50/400 - Loss: 9244.83203125 - Score: 106.15288543701172
INFO:root:70/400 - Loss: 433.56121826171875 - Score: 41.806922912597656
INFO:root:10/400 - Loss: 360.3171081542969 - Score: 42.5200309753418
WARNING:optuna.study._optimize:Trial 5 failed because of the following error: NotPSDError('Matrix not positive definite after repeatedly adding jitter up to 1.0e-06.',)
Traceback (most recent call last):
  File "/home/linyuhan/my_project/venv_CMAPSS/lib64/python3.6/site-packages/optuna/study/_optimize.py", line 196, in _run_trial
    value_or_values = func(trial)
  File "/home/linyuhan/Dokumente/Masterarbeit/dataset/CMAPSS/code/DGP_Yuhan/HPO_DGP.py", line 400, in <lambda>
    metric=mae),
  File "/home/linyuhan/Dokumente/Masterarbeit/dataset/CMAPSS/code/DGP_Yuhan/HPO_DGP.py", line 263, in objective_train_test
    output = model(X_batch)
  File "/home/linyuhan/my_project/venv_CMAPSS/lib64/python3.6/site-packages/gpytorch/module.py", line 30, in __call__
    outputs = self.forward(*inputs, **kwargs)
  File "/home/linyuhan/Dokumente/Masterarbeit/dataset/CMAPSS/code/DGP_Yuhan/src/deep_gp.py", line 145, in forward
    output = layer(output)
  File "/home/linyuhan/Dokumente/Masterarbeit/dataset/CMAPSS/code/DGP_Yuhan/src/deep_gp.py", line 91, in __call__
    return super().__call__(x, are_samples=bool(len(other_inputs)))
  File "/home/linyuhan/my_project/venv_CMAPSS/lib64/python3.6/site-packages/gpytorch/models/deep_gps/deep_gp.py", line 99, in __call__
    output = ApproximateGP.__call__(self, inputs)
  File "/home/linyuhan/my_project/venv_CMAPSS/lib64/python3.6/site-packages/gpytorch/models/approximate_gp.py", line 81, in __call__
    return self.variational_strategy(inputs, prior=prior, **kwargs)
  File "/home/linyuhan/my_project/venv_CMAPSS/lib64/python3.6/site-packages/gpytorch/variational/variational_strategy.py", line 169, in __call__
    return super().__call__(x, prior=prior, **kwargs)
  File "/home/linyuhan/my_project/venv_CMAPSS/lib64/python3.6/site-packages/gpytorch/variational/_variational_strategy.py", line 129, in __call__
    **kwargs,
  File "/home/linyuhan/my_project/venv_CMAPSS/lib64/python3.6/site-packages/gpytorch/module.py", line 30, in __call__
    outputs = self.forward(*inputs, **kwargs)
  File "/home/linyuhan/my_project/venv_CMAPSS/lib64/python3.6/site-packages/gpytorch/variational/variational_strategy.py", line 103, in forward
    L = self._cholesky_factor(induc_induc_covar)
  File "/home/linyuhan/my_project/venv_CMAPSS/lib64/python3.6/site-packages/gpytorch/utils/memoize.py", line 76, in g
    return _add_to_cache_ignore_args(self, cache_name, method(self, *args, **kwargs))
  File "/home/linyuhan/my_project/venv_CMAPSS/lib64/python3.6/site-packages/gpytorch/variational/variational_strategy.py", line 72, in _cholesky_factor
    L = psd_safe_cholesky(delazify(induc_induc_covar).type(_linalg_dtype_cholesky.value()))
  File "/home/linyuhan/my_project/venv_CMAPSS/lib64/python3.6/site-packages/gpytorch/utils/cholesky.py", line 63, in psd_safe_cholesky
    L = _psd_safe_cholesky(A, out=out, jitter=jitter, max_tries=max_tries)
  File "/home/linyuhan/my_project/venv_CMAPSS/lib64/python3.6/site-packages/gpytorch/utils/cholesky.py", line 45, in _psd_safe_cholesky
    raise NotPSDError(f"Matrix not positive definite after repeatedly adding jitter up to {jitter_new:.1e}.")
gpytorch.utils.errors.NotPSDError: Matrix not positive definite after repeatedly adding jitter up to 1.0e-06.
INFO:root:60/400 - Loss: 297.5600280761719 - Score: 42.62505340576172
INFO:root:0/400 - Loss: 15357.921875 - Score: 118.26345825195312
INFO:root:10/400 - Loss: 1233.8206787109375 - Score: 57.97996520996094
INFO:root:80/400 - Loss: 334.36676025390625 - Score: 40.27827835083008
INFO:root:Time Budget run out. Pruning Trial
INFO:root:After model training
INFO:root:After memory clearing
INFO:optuna.study.study:Trial 2 finished with value: 118.33453369140625 and parameters: {'lr': 0.0053847428520667675, 'batch_size': 1024, 'num_inducing': 527, 'num_samples': 9, 'kernel_type': 'rbf', 'n_gp_layers': 2, 'n_gp_out': 5}. Best is trial 1 with value: 37.39690017700195.
INFO:root:Current Configuration: n_gp_layers:1 - n_gp_out: 1 - num_inducing: 205 - num_samples: 8 - batch_size:512 - num_inducing: 205 - lr: 0.002963329123066735
INFO:root:0/400 - Loss: 15489.865234375 - Score: 118.38369750976562
INFO:root:60/400 - Loss: 8168.45458984375 - Score: 102.07451629638672
INFO:root:70/400 - Loss: 181.64068603515625 - Score: 39.833805084228516
INFO:optuna.study._optimize:Trial 3 pruned. 
INFO:root:Current Configuration: n_gp_layers:1 - n_gp_out: 1 - num_inducing: 88 - num_samples: 2 - batch_size:512 - num_inducing: 88 - lr: 0.0007388168409667129
INFO:root:0/400 - Loss: 16280.650390625 - Score: 118.52704620361328
INFO:root:10/400 - Loss: 13807.791015625 - Score: 117.7876205444336
INFO:root:10/400 - Loss: 14939.96484375 - Score: 118.16626739501953
INFO:root:90/400 - Loss: 271.5666809082031 - Score: 39.40462112426758
INFO:root:20/400 - Loss: 11840.5361328125 - Score: 115.9834976196289
INFO:root:30/400 - Loss: 10115.05859375 - Score: 112.73934173583984
INFO:root:40/400 - Loss: 8777.796875 - Score: 109.87186431884766
INFO:root:50/400 - Loss: 7718.35888671875 - Score: 107.28080749511719
INFO:root:60/400 - Loss: 6851.45703125 - Score: 104.82563018798828
INFO:root:70/400 - Loss: 6116.8115234375 - Score: 102.42053985595703
INFO:root:80/400 - Loss: 139.09962463378906 - Score: 38.28111267089844
INFO:root:80/400 - Loss: 5482.724609375 - Score: 100.04637908935547
INFO:root:100/400 - Loss: 236.66812133789062 - Score: 38.89560317993164
INFO:root:90/400 - Loss: 4940.9931640625 - Score: 97.65757751464844
INFO:root:70/400 - Loss: 7277.10107421875 - Score: 98.41020965576172
INFO:root:100/400 - Loss: 4463.375 - Score: 95.26361083984375
INFO:root:110/400 - Loss: 4039.9521484375 - Score: 92.8980941772461
INFO:root:120/400 - Loss: 3663.22705078125 - Score: 90.53881072998047
INFO:root:130/400 - Loss: 3329.36279296875 - Score: 88.1920394897461
INFO:root:Time Budget run out. Pruning Trial
INFO:root:After model training
INFO:root:After memory clearing
INFO:optuna.study.study:Trial 5 finished with value: 39.87487030029297 and parameters: {'lr': 0.04502895027106956, 'batch_size': 1024, 'num_inducing': 598, 'num_samples': 11, 'kernel_type': 'rbf', 'n_gp_layers': 2, 'n_gp_out': 1}. Best is trial 4 with value: 37.21852111816406.
INFO:root:Current Configuration: n_gp_layers:3 - n_gp_out: 4 - num_inducing: 146 - num_samples: 15 - batch_size:2048 - num_inducing: 146 - lr: 0.011292275682458155
INFO:root:140/400 - Loss: 3025.8642578125 - Score: 85.88494873046875
INFO:root:150/400 - Loss: 2753.55810546875 - Score: 83.6059799194336
INFO:root:110/400 - Loss: 210.7423858642578 - Score: 38.5453987121582
INFO:root:90/400 - Loss: 127.59432220458984 - Score: 38.17631149291992
INFO:root:160/400 - Loss: 2503.5361328125 - Score: 81.34500885009766
INFO:root:170/400 - Loss: 2278.41064453125 - Score: 79.1285171508789
INFO:root:180/400 - Loss: 2072.95849609375 - Score: 76.95528411865234
INFO:root:190/400 - Loss: 1884.931884765625 - Score: 74.8170394897461
INFO:root:20/400 - Loss: 13254.25 - Score: 115.2006607055664
INFO:root:200/400 - Loss: 1713.26904296875 - Score: 72.72955322265625
INFO:root:80/400 - Loss: 6514.05419921875 - Score: 95.01419067382812
INFO:root:210/400 - Loss: 1558.021240234375 - Score: 70.70038604736328
INFO:root:120/400 - Loss: 190.23483276367188 - Score: 38.2801513671875
INFO:root:220/400 - Loss: 1412.213623046875 - Score: 68.71324157714844
INFO:root:20/400 - Loss: 307.15216064453125 - Score: 41.48884963989258
INFO:root:230/400 - Loss: 1282.225341796875 - Score: 66.79731750488281
INFO:root:100/400 - Loss: 121.56033325195312 - Score: 38.07097244262695
INFO:root:240/400 - Loss: 1160.783203125 - Score: 64.92752075195312
INFO:root:250/400 - Loss: 1052.19580078125 - Score: 63.10421371459961
INFO:root:0/400 - Loss: 15507.462890625 - Score: 118.38126373291016
INFO:root:260/400 - Loss: 949.3255615234375 - Score: 61.357662200927734
INFO:root:270/400 - Loss: 857.5872192382812 - Score: 59.67455291748047
INFO:root:280/400 - Loss: 774.8521118164062 - Score: 58.07556915283203
INFO:root:130/400 - Loss: 172.81594848632812 - Score: 38.18095779418945
INFO:root:290/400 - Loss: 697.4879150390625 - Score: 56.50987243652344
INFO:root:110/400 - Loss: 114.26436614990234 - Score: 37.91142272949219
INFO:root:300/400 - Loss: 628.74609375 - Score: 55.050804138183594
INFO:root:310/400 - Loss: 565.8209228515625 - Score: 53.64253616333008
INFO:root:90/400 - Loss: 5867.03076171875 - Score: 91.72364807128906
INFO:root:320/400 - Loss: 508.2922668457031 - Score: 52.30632019042969
INFO:root:330/400 - Loss: 456.15704345703125 - Score: 51.02800369262695
INFO:root:120/400 - Loss: 107.81340789794922 - Score: 37.97402572631836
INFO:root:340/400 - Loss: 409.828125 - Score: 49.84482192993164
INFO:root:350/400 - Loss: 367.4381103515625 - Score: 48.681400299072266
INFO:root:140/400 - Loss: 159.03590393066406 - Score: 38.08528518676758
INFO:root:360/400 - Loss: 329.8058776855469 - Score: 47.62876892089844
INFO:root:30/400 - Loss: 11704.140625 - Score: 111.30673217773438
INFO:root:10/400 - Loss: 15062.919921875 - Score: 117.9483642578125
INFO:root:370/400 - Loss: 296.155517578125 - Score: 46.63853454589844
INFO:root:380/400 - Loss: 266.62530517578125 - Score: 45.70460891723633
INFO:root:130/400 - Loss: 115.2079086303711 - Score: 39.97279357910156
INFO:root:390/400 - Loss: 240.0410614013672 - Score: 44.847633361816406
INFO:root:Early stopping
INFO:root:After model training
INFO:root:After memory clearing
INFO:optuna.study.study:Trial 5 finished with value: 37.87373733520508 and parameters: {'lr': 0.030635374128837965, 'batch_size': 2048, 'num_inducing': 155, 'num_samples': 3, 'kernel_type': 'matern1.5', 'n_gp_layers': 2, 'n_gp_out': 1}. Best is trial 3 with value: 37.44314193725586.
INFO:root:Current Configuration: n_gp_layers:2 - n_gp_out: 1 - num_inducing: 68 - num_samples: 8 - batch_size:2048 - num_inducing: 68 - lr: 0.0007103501453459978
INFO:root:After model training
INFO:root:After memory clearing
INFO:optuna.study.study:Trial 4 finished with value: 44.12959671020508 and parameters: {'lr': 0.0007388168409667129, 'batch_size': 512, 'num_inducing': 88, 'num_samples': 2, 'kernel_type': 'matern1.5', 'n_gp_layers': 1, 'n_gp_out': 1}. Best is trial 1 with value: 37.39690017700195.
INFO:root:Current Configuration: n_gp_layers:2 - n_gp_out: 1 - num_inducing: 334 - num_samples: 7 - batch_size:512 - num_inducing: 334 - lr: 0.027241899050823876
INFO:root:0/400 - Loss: 16489.111328125 - Score: 118.55894470214844
INFO:root:0/400 - Loss: 9274.1923828125 - Score: 112.57820892333984
INFO:root:100/400 - Loss: 5302.63623046875 - Score: 88.58185577392578
INFO:root:150/400 - Loss: 150.47976684570312 - Score: 38.02311325073242
INFO:root:10/400 - Loss: 15742.708984375 - Score: 118.42085266113281
INFO:root:160/400 - Loss: 140.80029296875 - Score: 38.00244140625
INFO:root:30/400 - Loss: 199.89163208007812 - Score: 38.875892639160156
INFO:root:20/400 - Loss: 15049.9833984375 - Score: 118.23617553710938
INFO:root:110/400 - Loss: 4801.42138671875 - Score: 85.58118438720703
INFO:root:10/400 - Loss: 6199.37939453125 - Score: 92.93574523925781
INFO:root:40/400 - Loss: 10480.2431640625 - Score: 108.1866455078125
INFO:root:Time Budget run out. Pruning Trial
INFO:root:After model training
INFO:root:After memory clearing
INFO:optuna.study.study:Trial 2 finished with value: 37.91103744506836 and parameters: {'lr': 0.007706499296604288, 'batch_size': 2048, 'num_inducing': 182, 'num_samples': 5, 'kernel_type': 'matern0.5', 'n_gp_layers': 1, 'n_gp_out': 4}. Best is trial 1 with value: 37.736331939697266.
INFO:root:Current Configuration: n_gp_layers:4 - n_gp_out: 4 - num_inducing: 70 - num_samples: 15 - batch_size:2048 - num_inducing: 70 - lr: 0.028420149826047063
INFO:root:Time Budget run out. Pruning Trial
INFO:root:After model training
INFO:root:After memory clearing
INFO:optuna.study.study:Trial 2 finished with value: 84.7150650024414 and parameters: {'lr': 0.0008586713192096651, 'batch_size': 1024, 'num_inducing': 106, 'num_samples': 11, 'kernel_type': 'matern1.5', 'n_gp_layers': 1, 'n_gp_out': 6}. Best is trial 0 with value: 37.90920639038086.
INFO:root:Current Configuration: n_gp_layers:1 - n_gp_out: 1 - num_inducing: 62 - num_samples: 14 - batch_size:1024 - num_inducing: 62 - lr: 0.0003467275099530408
INFO:root:10/400 - Loss: 376.8541564941406 - Score: 43.560272216796875
INFO:root:0/400 - Loss: 16491.64453125 - Score: 118.55894470214844
INFO:optuna.study._optimize:Trial 3 pruned. 
INFO:root:Current Configuration: n_gp_layers:1 - n_gp_out: 5 - num_inducing: 596 - num_samples: 15 - batch_size:1024 - num_inducing: 596 - lr: 0.06704678381845867
INFO:root:30/400 - Loss: 14397.869140625 - Score: 117.97321319580078
INFO:root:40/400 - Loss: 13790.134765625 - Score: 117.60132598876953
INFO:root:0/400 - Loss: 8041.275390625 - Score: 110.87281799316406
INFO:root:Time Budget run out. Pruning Trial
INFO:root:After model training
INFO:root:After memory clearing
