INFO:optuna.study._optimize:Trial 14 pruned. 
INFO:root:Current Configuration: n_gp_layers:4 - n_gp_out: 6 - num_inducing: 756 - num_samples: 15 - batch_size:1024 - num_inducing: 756 - lr: 0.09093543517896557
INFO:root:70/400 - Loss: 15098.3984375 - Score: 118.14177703857422
INFO:root:20/400 - Loss: 12295.671875 - Score: 116.43878936767578
INFO:root:10/400 - Loss: 16070.7216796875 - Score: 118.46085357666016
INFO:root:0/400 - Loss: 16243.4375 - Score: 118.5311508178711
INFO:root:30/400 - Loss: 10754.9794921875 - Score: 114.18810272216797
INFO:root:40/400 - Loss: 9335.5361328125 - Score: 110.77328491210938
INFO:root:80/400 - Loss: 14904.7783203125 - Score: 118.03722381591797
INFO:root:50/400 - Loss: 8194.5126953125 - Score: 107.52940368652344
INFO:root:60/400 - Loss: 7247.13916015625 - Score: 104.55403137207031
INFO:root:90/400 - Loss: 14710.7265625 - Score: 117.91883087158203
INFO:root:10/400 - Loss: 317.4815979003906 - Score: 38.5187873840332
INFO:root:70/400 - Loss: 6459.865234375 - Score: 101.6543960571289
INFO:root:80/400 - Loss: 5768.44287109375 - Score: 98.74535369873047
INFO:root:90/400 - Loss: 5159.54443359375 - Score: 95.8077163696289
INFO:root:100/400 - Loss: 14515.548828125 - Score: 117.78617858886719
INFO:root:100/400 - Loss: 4631.23388671875 - Score: 92.93701934814453
WARNING:optuna.study._optimize:Trial 10 failed because of the following error: NotPSDError('Matrix not positive definite after repeatedly adding jitter up to 1.0e-06.',)
Traceback (most recent call last):
  File "/home/linyuhan/my_project/venv_CMAPSS/lib64/python3.6/site-packages/optuna/study/_optimize.py", line 196, in _run_trial
    value_or_values = func(trial)
  File "/home/linyuhan/Dokumente/Masterarbeit/dataset/CMAPSS/code/DGP_Yuhan/HPO_DGP.py", line 400, in <lambda>
    metric=mae),
  File "/home/linyuhan/Dokumente/Masterarbeit/dataset/CMAPSS/code/DGP_Yuhan/HPO_DGP.py", line 263, in objective_train_test
    output = model(X_batch)
  File "/home/linyuhan/my_project/venv_CMAPSS/lib64/python3.6/site-packages/gpytorch/module.py", line 30, in __call__
    outputs = self.forward(*inputs, **kwargs)
  File "/home/linyuhan/Dokumente/Masterarbeit/dataset/CMAPSS/code/DGP_Yuhan/src/deep_gp.py", line 145, in forward
    output = layer(output)
  File "/home/linyuhan/Dokumente/Masterarbeit/dataset/CMAPSS/code/DGP_Yuhan/src/deep_gp.py", line 91, in __call__
    return super().__call__(x, are_samples=bool(len(other_inputs)))
  File "/home/linyuhan/my_project/venv_CMAPSS/lib64/python3.6/site-packages/gpytorch/models/deep_gps/deep_gp.py", line 99, in __call__
    output = ApproximateGP.__call__(self, inputs)
  File "/home/linyuhan/my_project/venv_CMAPSS/lib64/python3.6/site-packages/gpytorch/models/approximate_gp.py", line 81, in __call__
    return self.variational_strategy(inputs, prior=prior, **kwargs)
  File "/home/linyuhan/my_project/venv_CMAPSS/lib64/python3.6/site-packages/gpytorch/variational/variational_strategy.py", line 169, in __call__
    return super().__call__(x, prior=prior, **kwargs)
  File "/home/linyuhan/my_project/venv_CMAPSS/lib64/python3.6/site-packages/gpytorch/variational/_variational_strategy.py", line 129, in __call__
    **kwargs,
  File "/home/linyuhan/my_project/venv_CMAPSS/lib64/python3.6/site-packages/gpytorch/module.py", line 30, in __call__
    outputs = self.forward(*inputs, **kwargs)
  File "/home/linyuhan/my_project/venv_CMAPSS/lib64/python3.6/site-packages/gpytorch/variational/variational_strategy.py", line 103, in forward
    L = self._cholesky_factor(induc_induc_covar)
  File "/home/linyuhan/my_project/venv_CMAPSS/lib64/python3.6/site-packages/gpytorch/utils/memoize.py", line 76, in g
    return _add_to_cache_ignore_args(self, cache_name, method(self, *args, **kwargs))
  File "/home/linyuhan/my_project/venv_CMAPSS/lib64/python3.6/site-packages/gpytorch/variational/variational_strategy.py", line 72, in _cholesky_factor
    L = psd_safe_cholesky(delazify(induc_induc_covar).type(_linalg_dtype_cholesky.value()))
  File "/home/linyuhan/my_project/venv_CMAPSS/lib64/python3.6/site-packages/gpytorch/utils/cholesky.py", line 63, in psd_safe_cholesky
    L = _psd_safe_cholesky(A, out=out, jitter=jitter, max_tries=max_tries)
  File "/home/linyuhan/my_project/venv_CMAPSS/lib64/python3.6/site-packages/gpytorch/utils/cholesky.py", line 45, in _psd_safe_cholesky
    raise NotPSDError(f"Matrix not positive definite after repeatedly adding jitter up to {jitter_new:.1e}.")
gpytorch.utils.errors.NotPSDError: Matrix not positive definite after repeatedly adding jitter up to 1.0e-06.
INFO:root:20/400 - Loss: 15637.9482421875 - Score: 118.30455017089844
INFO:optuna.study._optimize:Trial 16 pruned. 
INFO:root:Current Configuration: n_gp_layers:4 - n_gp_out: 2 - num_inducing: 101 - num_samples: 3 - batch_size:1024 - num_inducing: 101 - lr: 0.0007974413177825174
INFO:root:0/400 - Loss: 16407.09375 - Score: 118.55494689941406
INFO:root:110/400 - Loss: 14328.166015625 - Score: 117.63900756835938
INFO:optuna.study._optimize:Trial 17 pruned. 
INFO:root:Current Configuration: n_gp_layers:3 - n_gp_out: 3 - num_inducing: 75 - num_samples: 5 - batch_size:1024 - num_inducing: 75 - lr: 0.026238740216636743
INFO:root:0/400 - Loss: 12301.5595703125 - Score: 116.63471221923828
INFO:root:Time Budget run out. Pruning Trial
INFO:root:After model training
INFO:root:After memory clearing
INFO:optuna.study.study:Trial 7 finished with value: 117.49380493164062 and parameters: {'lr': 0.00010663109589553259, 'batch_size': 1024, 'num_inducing': 166, 'num_samples': 5, 'kernel_type': 'matern0.5', 'n_gp_layers': 2, 'n_gp_out': 4}. Best is trial 4 with value: 37.11784744262695.
INFO:root:Current Configuration: n_gp_layers:2 - n_gp_out: 1 - num_inducing: 63 - num_samples: 7 - batch_size:1024 - num_inducing: 63 - lr: 0.00021254874706633808
INFO:root:0/400 - Loss: 16517.544921875 - Score: 118.56513977050781
INFO:root:10/400 - Loss: 16092.6318359375 - Score: 118.49055480957031
INFO:optuna.study._optimize:Trial 18 pruned. 
INFO:root:Current Configuration: n_gp_layers:4 - n_gp_out: 2 - num_inducing: 132 - num_samples: 15 - batch_size:512 - num_inducing: 132 - lr: 0.004101198340681486
INFO:root:20/400 - Loss: 15683.3916015625 - Score: 118.39186096191406
INFO:root:30/400 - Loss: 15289.7802734375 - Score: 118.26764678955078
INFO:root:0/400 - Loss: 15121.162109375 - Score: 118.36348724365234
INFO:root:40/400 - Loss: 14906.8212890625 - Score: 118.11837005615234
INFO:root:50/400 - Loss: 14539.712890625 - Score: 117.94581604003906
INFO:root:60/400 - Loss: 14179.8681640625 - Score: 117.75300598144531
INFO:root:70/400 - Loss: 13841.771484375 - Score: 117.5464096069336
INFO:root:30/400 - Loss: 15201.515625 - Score: 118.0112075805664
INFO:root:80/400 - Loss: 13504.7197265625 - Score: 117.31112670898438
INFO:root:90/400 - Loss: 13178.3486328125 - Score: 117.0530014038086
INFO:root:100/400 - Loss: 12858.8798828125 - Score: 116.7658462524414
INFO:root:110/400 - Loss: 12545.2158203125 - Score: 116.45005798339844
INFO:root:20/400 - Loss: 236.4484100341797 - Score: 38.20918273925781
INFO:root:120/400 - Loss: 12236.1103515625 - Score: 116.10699462890625
INFO:root:130/400 - Loss: 11940.0576171875 - Score: 115.75891876220703
INFO:root:140/400 - Loss: 11657.951171875 - Score: 115.41670227050781
INFO:root:150/400 - Loss: 11384.3955078125 - Score: 115.07683563232422
INFO:root:10/400 - Loss: 5850.98193359375 - Score: 94.44070434570312
INFO:root:160/400 - Loss: 11115.955078125 - Score: 114.75127410888672
INFO:root:Time Budget run out. Pruning Trial
INFO:root:After model training
INFO:root:After memory clearing
INFO:optuna.study.study:Trial 14 finished with value: 117.7249526977539 and parameters: {'lr': 0.00041513530702190374, 'batch_size': 2048, 'num_inducing': 72, 'num_samples': 14, 'kernel_type': 'rbf', 'n_gp_layers': 3, 'n_gp_out': 2}. Best is trial 1 with value: 37.78729248046875.
INFO:root:Current Configuration: n_gp_layers:1 - n_gp_out: 3 - num_inducing: 172 - num_samples: 5 - batch_size:2048 - num_inducing: 172 - lr: 0.004495140201661371
INFO:root:170/400 - Loss: 10867.6171875 - Score: 114.43614959716797
INFO:root:0/400 - Loss: 16131.1904296875 - Score: 118.49557495117188
INFO:root:180/400 - Loss: 10625.0771484375 - Score: 114.12765502929688
INFO:optuna.study._optimize:Trial 15 pruned. 
INFO:root:Current Configuration: n_gp_layers:4 - n_gp_out: 1 - num_inducing: 210 - num_samples: 3 - batch_size:512 - num_inducing: 210 - lr: 0.00021819985766906828
INFO:root:190/400 - Loss: 10383.7294921875 - Score: 113.79621887207031
INFO:root:0/400 - Loss: 16474.365234375 - Score: 118.55427551269531
INFO:root:Time Budget run out. Pruning Trial
INFO:root:After model training
INFO:root:After memory clearing
INFO:optuna.study.study:Trial 18 finished with value: 37.789554595947266 and parameters: {'lr': 0.0661742641313344, 'batch_size': 512, 'num_inducing': 781, 'num_samples': 6, 'kernel_type': 'matern1.5', 'n_gp_layers': 1, 'n_gp_out': 2}. Best is trial 15 with value: 37.577857971191406.
INFO:root:Current Configuration: n_gp_layers:2 - n_gp_out: 1 - num_inducing: 166 - num_samples: 2 - batch_size:2048 - num_inducing: 166 - lr: 0.005831704188776239
INFO:root:200/400 - Loss: 10153.8701171875 - Score: 113.48552703857422
INFO:root:0/400 - Loss: 16007.5986328125 - Score: 118.4684829711914
INFO:root:210/400 - Loss: 9935.7861328125 - Score: 113.18543243408203
INFO:optuna.study._optimize:Trial 19 pruned. 
INFO:root:Current Configuration: n_gp_layers:1 - n_gp_out: 2 - num_inducing: 752 - num_samples: 10 - batch_size:512 - num_inducing: 752 - lr: 0.09962932134654698
INFO:root:220/400 - Loss: 9721.8017578125 - Score: 112.88860321044922
INFO:root:230/400 - Loss: 9515.8720703125 - Score: 112.60060119628906
INFO:root:240/400 - Loss: 9317.298828125 - Score: 112.32360076904297
INFO:root:10/400 - Loss: 15644.5390625 - Score: 118.3036880493164
INFO:root:0/400 - Loss: 3704.38134765625 - Score: 74.82129669189453
INFO:root:250/400 - Loss: 9118.5625 - Score: 112.04019927978516
INFO:root:260/400 - Loss: 8931.251953125 - Score: 111.76231384277344
INFO:root:20/400 - Loss: 2761.918701171875 - Score: 71.97134399414062
INFO:root:270/400 - Loss: 8745.556640625 - Score: 111.48009490966797
INFO:root:280/400 - Loss: 8567.74609375 - Score: 111.19989013671875
INFO:root:290/400 - Loss: 8393.4052734375 - Score: 110.92060089111328
INFO:root:20/400 - Loss: 14782.8916015625 - Score: 117.49308776855469
INFO:root:300/400 - Loss: 8224.5029296875 - Score: 110.6406478881836
INFO:root:310/400 - Loss: 8061.3974609375 - Score: 110.3621597290039
INFO:root:320/400 - Loss: 7900.37060546875 - Score: 110.08281707763672
INFO:root:330/400 - Loss: 7742.94873046875 - Score: 109.79838562011719
INFO:root:340/400 - Loss: 7589.96923828125 - Score: 109.51371765136719
INFO:root:30/400 - Loss: 13986.2861328125 - Score: 116.6059799194336
INFO:root:350/400 - Loss: 7441.05126953125 - Score: 109.23223876953125
INFO:root:360/400 - Loss: 7295.9599609375 - Score: 108.94684600830078
INFO:root:370/400 - Loss: 7153.61865234375 - Score: 108.6594467163086
INFO:root:380/400 - Loss: 7015.08251953125 - Score: 108.3690185546875
INFO:root:30/400 - Loss: 1369.864013671875 - Score: 56.78107452392578
INFO:root:390/400 - Loss: 6880.0380859375 - Score: 108.08402252197266
INFO:root:After model training
INFO:root:After memory clearing
INFO:optuna.study.study:Trial 8 finished with value: 107.82142639160156 and parameters: {'lr': 0.00021254874706633808, 'batch_size': 1024, 'num_inducing': 63, 'num_samples': 7, 'kernel_type': 'rbf', 'n_gp_layers': 2, 'n_gp_out': 1}. Best is trial 4 with value: 37.11784744262695.
INFO:root:Current Configuration: n_gp_layers:2 - n_gp_out: 1 - num_inducing: 375 - num_samples: 8 - batch_size:2048 - num_inducing: 375 - lr: 0.003338993146701226
INFO:root:40/400 - Loss: 13284.7060546875 - Score: 115.91980743408203
INFO:root:0/400 - Loss: 16234.15625 - Score: 118.50991821289062
INFO:root:50/400 - Loss: 12651.6376953125 - Score: 115.30988311767578
INFO:optuna.study._optimize:Trial 9 pruned. 
INFO:root:Current Configuration: n_gp_layers:1 - n_gp_out: 3 - num_inducing: 511 - num_samples: 15 - batch_size:1024 - num_inducing: 511 - lr: 0.0003828111859740216
INFO:root:40/400 - Loss: 712.3873901367188 - Score: 47.80815887451172
INFO:root:60/400 - Loss: 12068.421875 - Score: 114.72831726074219
INFO:root:0/400 - Loss: 16485.3359375 - Score: 118.55939483642578
INFO:root:70/400 - Loss: 11523.4580078125 - Score: 114.15863037109375
INFO:optuna.study._optimize:Trial 10 pruned. 
INFO:root:Current Configuration: n_gp_layers:4 - n_gp_out: 6 - num_inducing: 660 - num_samples: 15 - batch_size:2048 - num_inducing: 660 - lr: 0.00012888383502010866
INFO:root:10/400 - Loss: 185.4634552001953 - Score: 38.10215377807617
INFO:root:80/400 - Loss: 11015.5625 - Score: 113.59129333496094
INFO:root:50/400 - Loss: 422.6778564453125 - Score: 42.879398345947266
INFO:root:90/400 - Loss: 10538.486328125 - Score: 113.02217102050781
INFO:root:Time Budget run out. Pruning Trial
INFO:root:After model training
INFO:root:After memory clearing
INFO:optuna.study.study:Trial 19 finished with value: 41.460391998291016 and parameters: {'lr': 0.004101198340681486, 'batch_size': 512, 'num_inducing': 132, 'num_samples': 15, 'kernel_type': 'matern0.5', 'n_gp_layers': 4, 'n_gp_out': 2}. Best is trial 13 with value: 37.22980880737305.
INFO:root:Current Configuration: n_gp_layers:2 - n_gp_out: 2 - num_inducing: 83 - num_samples: 8 - batch_size:512 - num_inducing: 83 - lr: 0.009183640344838952
INFO:root:0/400 - Loss: 13516.6708984375 - Score: 117.7862548828125
INFO:optuna.study._optimize:Trial 20 pruned. 
INFO:root:Current Configuration: n_gp_layers:3 - n_gp_out: 6 - num_inducing: 144 - num_samples: 15 - batch_size:1024 - num_inducing: 144 - lr: 0.0011788474504491483
INFO:root:100/400 - Loss: 10089.1181640625 - Score: 112.44743347167969
INFO:root:110/400 - Loss: 9664.2138671875 - Score: 111.86434173583984
INFO:root:120/400 - Loss: 9263.359375 - Score: 111.27582550048828
INFO:root:130/400 - Loss: 8881.5849609375 - Score: 110.67769622802734
INFO:root:0/400 - Loss: 16336.259765625 - Score: 118.54965209960938
INFO:root:Time Budget run out. Pruning Trial
INFO:root:After model training
INFO:root:After memory clearing
INFO:optuna.study.study:Trial 16 finished with value: 110.6175765991211 and parameters: {'lr': 0.00021819985766906828, 'batch_size': 512, 'num_inducing': 210, 'num_samples': 3, 'kernel_type': 'matern1.5', 'n_gp_layers': 4, 'n_gp_out': 1}. Best is trial 1 with value: 37.78729248046875.
INFO:root:Current Configuration: n_gp_layers:2 - n_gp_out: 5 - num_inducing: 110 - num_samples: 13 - batch_size:2048 - num_inducing: 110 - lr: 0.00012102223019997164
INFO:root:20/400 - Loss: 190.68728637695312 - Score: 37.82963943481445
INFO:root:Time Budget run out. Pruning Trial
INFO:root:After model training
INFO:root:After memory clearing
INFO:optuna.study.study:Trial 20 finished with value: 37.77137756347656 and parameters: {'lr': 0.09962932134654698, 'batch_size': 512, 'num_inducing': 752, 'num_samples': 10, 'kernel_type': 'matern1.5', 'n_gp_layers': 1, 'n_gp_out': 2}. Best is trial 15 with value: 37.577857971191406.
INFO:root:Current Configuration: n_gp_layers:2 - n_gp_out: 1 - num_inducing: 389 - num_samples: 15 - batch_size:2048 - num_inducing: 389 - lr: 0.06264552332447494
INFO:root:0/400 - Loss: 16546.62109375 - Score: 118.5699691772461
INFO:root:0/400 - Loss: 11625.166015625 - Score: 116.35575103759766
INFO:root:10/400 - Loss: 1822.1856689453125 - Score: 75.36566925048828
INFO:optuna.study._optimize:Trial 21 pruned. 
INFO:root:Current Configuration: n_gp_layers:3 - n_gp_out: 2 - num_inducing: 94 - num_samples: 5 - batch_size:2048 - num_inducing: 94 - lr: 0.024181949944233245
INFO:root:0/400 - Loss: 14390.109375 - Score: 117.95285034179688
INFO:optuna.study._optimize:Trial 22 pruned. 
INFO:root:Current Configuration: n_gp_layers:1 - n_gp_out: 3 - num_inducing: 310 - num_samples: 11 - batch_size:1024 - num_inducing: 310 - lr: 0.0846908461538859
INFO:root:0/400 - Loss: 7025.34716796875 - Score: 109.26473999023438
INFO:root:10/400 - Loss: 377.1677551269531 - Score: 37.803165435791016
INFO:root:20/400 - Loss: 208.19769287109375 - Score: 38.00360870361328
INFO:root:30/400 - Loss: 190.16990661621094 - Score: 37.29485321044922
INFO:root:Time Budget run out. Pruning Trial
INFO:root:After model training
INFO:root:After memory clearing
INFO:optuna.study.study:Trial 21 finished with value: 49.504390716552734 and parameters: {'lr': 0.06264552332447494, 'batch_size': 2048, 'num_inducing': 389, 'num_samples': 15, 'kernel_type': 'matern1.5', 'n_gp_layers': 2, 'n_gp_out': 1}. Best is trial 15 with value: 37.577857971191406.
INFO:root:Current Configuration: n_gp_layers:1 - n_gp_out: 2 - num_inducing: 669 - num_samples: 10 - batch_size:512 - num_inducing: 669 - lr: 0.0029781764083732032
INFO:root:40/400 - Loss: 220.04396057128906 - Score: 37.76364517211914
INFO:root:Time Budget run out. Pruning Trial
INFO:root:After model training
INFO:root:After memory clearing
INFO:optuna.study.study:Trial 17 finished with value: 118.55948638916016 and parameters: {'lr': 0.00012102223019997164, 'batch_size': 2048, 'num_inducing': 110, 'num_samples': 13, 'kernel_type': 'matern1.5', 'n_gp_layers': 2, 'n_gp_out': 5}. Best is trial 1 with value: 37.78729248046875.
INFO:root:Current Configuration: n_gp_layers:1 - n_gp_out: 4 - num_inducing: 602 - num_samples: 12 - batch_size:1024 - num_inducing: 602 - lr: 0.04046915447575169
INFO:root:Early stopping
INFO:root:After model training
INFO:root:After memory clearing
INFO:optuna.study.study:Trial 23 finished with value: 37.10303497314453 and parameters: {'lr': 0.0846908461538859, 'batch_size': 1024, 'num_inducing': 310, 'num_samples': 11, 'kernel_type': 'rbf', 'n_gp_layers': 1, 'n_gp_out': 3}. Best is trial 23 with value: 37.10303497314453.
INFO:root:Current Configuration: n_gp_layers:1 - n_gp_out: 3 - num_inducing: 325 - num_samples: 5 - batch_size:1024 - num_inducing: 325 - lr: 0.08800519297054002
INFO:root:0/400 - Loss: 15472.40625 - Score: 118.30768585205078
INFO:root:0/400 - Loss: 6936.5185546875 - Score: 110.23934173583984
INFO:root:0/400 - Loss: 10457.9931640625 - Score: 113.80074310302734
INFO:root:10/400 - Loss: 316.20184326171875 - Score: 37.6264762878418
INFO:root:20/400 - Loss: 283.6768493652344 - Score: 38.25891876220703
INFO:optuna.study._optimize:Trial 24 pruned. 
INFO:root:Current Configuration: n_gp_layers:1 - n_gp_out: 4 - num_inducing: 380 - num_samples: 2 - batch_size:1024 - num_inducing: 380 - lr: 0.05244317979104497
INFO:root:0/400 - Loss: 9474.978515625 - Score: 114.14794158935547
INFO:optuna.study._optimize:Trial 22 pruned. 
INFO:root:Current Configuration: n_gp_layers:4 - n_gp_out: 3 - num_inducing: 410 - num_samples: 14 - batch_size:512 - num_inducing: 410 - lr: 0.08624047729563256
INFO:root:10/400 - Loss: 338.547119140625 - Score: 37.32309341430664
INFO:root:20/400 - Loss: 282.7290954589844 - Score: 37.31944274902344
INFO:root:30/400 - Loss: 170.05850219726562 - Score: 37.104793548583984
INFO:root:Early stopping
INFO:root:After model training
INFO:root:After memory clearing
INFO:optuna.study.study:Trial 25 finished with value: 36.6922492980957 and parameters: {'lr': 0.05244317979104497, 'batch_size': 1024, 'num_inducing': 380, 'num_samples': 2, 'kernel_type': 'rbf', 'n_gp_layers': 1, 'n_gp_out': 4}. Best is trial 25 with value: 36.6922492980957.
INFO:root:Current Configuration: n_gp_layers:1 - n_gp_out: 4 - num_inducing: 460 - num_samples: 12 - batch_size:2048 - num_inducing: 460 - lr: 0.0497599000884628
INFO:root:0/400 - Loss: 12463.2294921875 - Score: 116.94493865966797
INFO:root:0/400 - Loss: 2236.005126953125 - Score: 74.48797607421875
