INFO:optuna.study._optimize:Trial 38 pruned. 
INFO:root:Current Configuration: n_gp_layers:3 - n_gp_out: 1 - num_inducing: 591 - num_samples: 10 - batch_size:512 - num_inducing: 591 - lr: 0.0031325682981115655
INFO:root:130/400 - Loss: 6617.84228515625 - Score: 104.75525665283203
INFO:root:140/400 - Loss: 6256.16943359375 - Score: 103.59073638916016
INFO:root:0/400 - Loss: 15389.8359375 - Score: 118.19796752929688
INFO:root:150/400 - Loss: 5919.57958984375 - Score: 102.41976928710938
INFO:root:160/400 - Loss: 5605.65869140625 - Score: 101.23566436767578
INFO:root:170/400 - Loss: 5312.130859375 - Score: 99.95486450195312
INFO:root:180/400 - Loss: 5037.48291015625 - Score: 98.57281494140625
INFO:root:190/400 - Loss: 4778.49169921875 - Score: 97.12165832519531
INFO:root:200/400 - Loss: 4534.75390625 - Score: 95.72782897949219
INFO:root:210/400 - Loss: 4305.3310546875 - Score: 94.38766479492188
INFO:root:220/400 - Loss: 4088.906982421875 - Score: 93.08460235595703
INFO:root:230/400 - Loss: 3884.663818359375 - Score: 91.77652740478516
INFO:root:240/400 - Loss: 3691.216796875 - Score: 90.49120330810547
INFO:root:250/400 - Loss: 3508.146728515625 - Score: 89.19741821289062
INFO:root:Time Budget run out. Pruning Trial
INFO:root:After model training
INFO:root:After memory clearing
INFO:optuna.study.study:Trial 43 finished with value: 88.68636322021484 and parameters: {'lr': 0.0006944162760014645, 'batch_size': 1024, 'num_inducing': 131, 'num_samples': 3, 'kernel_type': 'rbf', 'n_gp_layers': 3, 'n_gp_out': 1}. Best is trial 18 with value: 36.90489959716797.
INFO:root:Current Configuration: n_gp_layers:3 - n_gp_out: 1 - num_inducing: 197 - num_samples: 6 - batch_size:512 - num_inducing: 197 - lr: 0.09124390105094086
INFO:root:0/400 - Loss: 3839.8935546875 - Score: 97.364990234375
INFO:root:10/400 - Loss: 165.78729248046875 - Score: 40.58203887939453
INFO:root:20/400 - Loss: 140.03993225097656 - Score: 39.25811004638672
INFO:root:30/400 - Loss: 115.00484466552734 - Score: 39.334007263183594
INFO:root:Early stopping
INFO:root:After model training
INFO:root:After memory clearing
INFO:optuna.study.study:Trial 44 finished with value: 39.06793975830078 and parameters: {'lr': 0.09124390105094086, 'batch_size': 512, 'num_inducing': 197, 'num_samples': 6, 'kernel_type': 'matern0.5', 'n_gp_layers': 3, 'n_gp_out': 1}. Best is trial 18 with value: 36.90489959716797.
INFO:root:Current Configuration: n_gp_layers:2 - n_gp_out: 1 - num_inducing: 146 - num_samples: 11 - batch_size:512 - num_inducing: 146 - lr: 0.019930511011222573
INFO:root:0/400 - Loss: 10831.1953125 - Score: 115.9681625366211
INFO:optuna.study._optimize:Trial 45 pruned. 
INFO:root:Current Configuration: n_gp_layers:2 - n_gp_out: 6 - num_inducing: 492 - num_samples: 7 - batch_size:512 - num_inducing: 492 - lr: 0.01480851245720875
INFO:optuna.study._optimize:Trial 39 pruned. 
INFO:root:Current Configuration: n_gp_layers:3 - n_gp_out: 4 - num_inducing: 395 - num_samples: 2 - batch_size:1024 - num_inducing: 395 - lr: 0.00022863354010200105
INFO:root:0/400 - Loss: 11842.427734375 - Score: 115.69068145751953
INFO:root:0/400 - Loss: 16514.8984375 - Score: 118.56635284423828
INFO:root:10/400 - Loss: 408.64410400390625 - Score: 39.26057815551758
INFO:root:Time Budget run out. Pruning Trial
INFO:root:After model training
INFO:root:After memory clearing
INFO:optuna.study.study:Trial 46 finished with value: 38.796295166015625 and parameters: {'lr': 0.01480851245720875, 'batch_size': 512, 'num_inducing': 492, 'num_samples': 7, 'kernel_type': 'matern1.5', 'n_gp_layers': 2, 'n_gp_out': 6}. Best is trial 18 with value: 36.90489959716797.
INFO:root:Current Configuration: n_gp_layers:3 - n_gp_out: 2 - num_inducing: 149 - num_samples: 11 - batch_size:512 - num_inducing: 149 - lr: 0.008988959455709754
INFO:root:0/400 - Loss: 13397.255859375 - Score: 116.72505187988281
INFO:root:Time Budget run out. Pruning Trial
INFO:root:After model training
INFO:root:After memory clearing
INFO:optuna.study.study:Trial 40 finished with value: 118.52717590332031 and parameters: {'lr': 0.00022863354010200105, 'batch_size': 1024, 'num_inducing': 395, 'num_samples': 2, 'kernel_type': 'matern1.5', 'n_gp_layers': 3, 'n_gp_out': 4}. Best is trial 31 with value: 36.95566177368164.
INFO:root:Current Configuration: n_gp_layers:2 - n_gp_out: 1 - num_inducing: 335 - num_samples: 8 - batch_size:512 - num_inducing: 335 - lr: 0.00023913511800445004
INFO:root:0/400 - Loss: 16465.951171875 - Score: 118.54975128173828
INFO:optuna.study._optimize:Trial 47 pruned. 
INFO:root:Current Configuration: n_gp_layers:2 - n_gp_out: 1 - num_inducing: 108 - num_samples: 9 - batch_size:512 - num_inducing: 108 - lr: 0.09329935346784006
INFO:root:0/400 - Loss: 3577.98046875 - Score: 93.40788269042969
INFO:optuna.study._optimize:Trial 48 pruned. 
INFO:root:Current Configuration: n_gp_layers:3 - n_gp_out: 2 - num_inducing: 323 - num_samples: 12 - batch_size:1024 - num_inducing: 323 - lr: 0.00240598920217297
INFO:optuna.study._optimize:Trial 41 pruned. 
INFO:root:Current Configuration: n_gp_layers:1 - n_gp_out: 2 - num_inducing: 176 - num_samples: 14 - batch_size:1024 - num_inducing: 176 - lr: 0.009196272591328367
INFO:root:0/400 - Loss: 14892.7724609375 - Score: 118.18180847167969
INFO:root:10/400 - Loss: 4562.30322265625 - Score: 84.71823120117188
INFO:root:0/400 - Loss: 16092.5595703125 - Score: 118.4373779296875
INFO:root:20/400 - Loss: 1521.0345458984375 - Score: 56.75259780883789
INFO:root:30/400 - Loss: 575.9015502929688 - Score: 44.18034744262695
INFO:root:40/400 - Loss: 320.59063720703125 - Score: 39.794490814208984
INFO:optuna.study._optimize:Trial 49 pruned. 
INFO:root:Best trials: 
INFO:root:Value: 36.90489959716797
INFO:root:params: 
INFO:root:    lr: 0.04046915447575169
INFO:root:    batch_size: 1024
INFO:root:    num_inducing: 602
INFO:root:    num_samples: 12
INFO:root:    kernel_type: matern0.5
INFO:root:    n_gp_layers: 1
INFO:root:    n_gp_out: 4
INFO:root:After final model training
INFO:root:50/400 - Loss: 290.8806457519531 - Score: 38.3803596496582
INFO:root:60/400 - Loss: 205.813720703125 - Score: 37.88991165161133
INFO:root:70/400 - Loss: 175.98428344726562 - Score: 37.66334533691406
INFO:root:80/400 - Loss: 161.5052490234375 - Score: 37.597251892089844
INFO:root:90/400 - Loss: 151.1004638671875 - Score: 37.55903625488281
INFO:root:100/400 - Loss: 141.45957946777344 - Score: 37.50967025756836
INFO:root:110/400 - Loss: 134.91326904296875 - Score: 37.433441162109375
INFO:root:120/400 - Loss: 125.94355010986328 - Score: 37.468589782714844
INFO:root:130/400 - Loss: 118.72628021240234 - Score: 37.40553283691406
INFO:root:140/400 - Loss: 112.42951202392578 - Score: 37.38096618652344
INFO:root:Early stopping
INFO:root:After model training
INFO:root:After memory clearing
INFO:optuna.study.study:Trial 42 finished with value: 37.343597412109375 and parameters: {'lr': 0.009196272591328367, 'batch_size': 1024, 'num_inducing': 176, 'num_samples': 14, 'kernel_type': 'matern1.5', 'n_gp_layers': 1, 'n_gp_out': 2}. Best is trial 31 with value: 36.95566177368164.
INFO:root:Current Configuration: n_gp_layers:4 - n_gp_out: 6 - num_inducing: 114 - num_samples: 7 - batch_size:1024 - num_inducing: 114 - lr: 0.09200988160039257
INFO:root:0/400 - Loss: 6332.6650390625 - Score: 104.88264465332031
INFO:root:10/400 - Loss: 229.31846618652344 - Score: 40.76942825317383
INFO:root:20/400 - Loss: 176.85841369628906 - Score: 37.56009292602539
INFO:root:Time Budget run out. Pruning Trial
INFO:root:After model training
INFO:root:After memory clearing
INFO:optuna.study.study:Trial 43 finished with value: 37.56009292602539 and parameters: {'lr': 0.09200988160039257, 'batch_size': 1024, 'num_inducing': 114, 'num_samples': 7, 'kernel_type': 'matern0.5', 'n_gp_layers': 4, 'n_gp_out': 6}. Best is trial 31 with value: 36.95566177368164.
INFO:root:Current Configuration: n_gp_layers:4 - n_gp_out: 6 - num_inducing: 106 - num_samples: 6 - batch_size:1024 - num_inducing: 106 - lr: 0.09115798306460197
INFO:root:0/400 - Loss: 6765.41259765625 - Score: 109.15895080566406
INFO:root:10/400 - Loss: 178.0788116455078 - Score: 38.94864273071289
INFO:root:20/400 - Loss: 161.75502014160156 - Score: 38.50606918334961
INFO:root:30/400 - Loss: 121.9419937133789 - Score: 40.261451721191406
INFO:root:Time Budget run out. Pruning Trial
INFO:root:After model training
INFO:root:After memory clearing
INFO:optuna.study.study:Trial 44 finished with value: 37.87307357788086 and parameters: {'lr': 0.09115798306460197, 'batch_size': 1024, 'num_inducing': 106, 'num_samples': 6, 'kernel_type': 'matern0.5', 'n_gp_layers': 4, 'n_gp_out': 6}. Best is trial 31 with value: 36.95566177368164.
INFO:root:Current Configuration: n_gp_layers:4 - n_gp_out: 1 - num_inducing: 284 - num_samples: 8 - batch_size:2048 - num_inducing: 284 - lr: 0.000842257458608892
INFO:root:0/400 - Loss: 16477.369140625 - Score: 118.55856323242188
INFO:root:10/400 - Loss: 15601.4912109375 - Score: 118.36740112304688
INFO:root:20/400 - Loss: 14764.962890625 - Score: 117.96024322509766
INFO:root:30/400 - Loss: 13935.392578125 - Score: 117.0839614868164
INFO:root:40/400 - Loss: 13128.875 - Score: 115.98356628417969
INFO:root:Time Budget run out. Pruning Trial
INFO:root:After model training
INFO:root:After memory clearing
INFO:optuna.study.study:Trial 45 finished with value: 115.78546905517578 and parameters: {'lr': 0.000842257458608892, 'batch_size': 2048, 'num_inducing': 284, 'num_samples': 8, 'kernel_type': 'matern0.5', 'n_gp_layers': 4, 'n_gp_out': 1}. Best is trial 31 with value: 36.95566177368164.
INFO:root:Current Configuration: n_gp_layers:4 - n_gp_out: 2 - num_inducing: 116 - num_samples: 6 - batch_size:1024 - num_inducing: 116 - lr: 0.08594844454359388
INFO:root:0/400 - Loss: 6707.845703125 - Score: 106.5030746459961
INFO:root:10/400 - Loss: 203.4784698486328 - Score: 41.003875732421875
INFO:root:20/400 - Loss: 165.36618041992188 - Score: 38.574832916259766
INFO:optuna.study._optimize:Trial 46 pruned. 
INFO:root:Current Configuration: n_gp_layers:1 - n_gp_out: 3 - num_inducing: 725 - num_samples: 7 - batch_size:512 - num_inducing: 725 - lr: 0.08990759449687416
INFO:root:0/400 - Loss: 1984.110107421875 - Score: 60.33108139038086
INFO:optuna.study._optimize:Trial 47 pruned. 
INFO:root:Current Configuration: n_gp_layers:1 - n_gp_out: 6 - num_inducing: 105 - num_samples: 8 - batch_size:1024 - num_inducing: 105 - lr: 0.026403471850720638
INFO:root:0/400 - Loss: 12458.8662109375 - Score: 117.72501373291016
INFO:optuna.study._optimize:Trial 48 pruned. 
INFO:root:Current Configuration: n_gp_layers:1 - n_gp_out: 1 - num_inducing: 538 - num_samples: 5 - batch_size:512 - num_inducing: 538 - lr: 0.024549980246400684
INFO:root:0/400 - Loss: 10048.0205078125 - Score: 115.83067321777344
