INFO:optuna.storages._in_memory:A new study created in memory with name: DGP 2023-06-12
INFO:optuna.storages._in_memory:A new study created in memory with name: DGP 2023-06-12
INFO:optuna.storages._in_memory:A new study created in memory with name: DGP 2023-06-12
INFO:optuna.storages._in_memory:A new study created in memory with name: DGP 2023-06-12
INFO:optuna.storages._in_memory:A new study created in memory with name: DGP 2023-06-12
INFO:optuna.storages._in_memory:A new study created in memory with name: DGP 2023-06-12
INFO:optuna.storages._in_memory:A new study created in memory with name: DGP 2023-06-12
INFO:optuna.storages._in_memory:A new study created in memory with name: DGP 2023-06-12
INFO:optuna.storages._in_memory:A new study created in memory with name: DGP 2023-06-12
INFO:optuna.storages._in_memory:A new study created in memory with name: DGP 2023-06-12
INFO:optuna.storages._in_memory:A new study created in memory with name: DGP 2023-06-12
INFO:optuna.storages._in_memory:A new study created in memory with name: DGP 2023-06-12
INFO:optuna.storages._in_memory:A new study created in memory with name: DGP 2023-06-12
INFO:optuna.storages._in_memory:A new study created in memory with name: DGP 2023-06-12
INFO:optuna.storages._in_memory:A new study created in memory with name: DGP 2023-06-12
INFO:optuna.storages._in_memory:A new study created in memory with name: DGP 2023-06-12
INFO:root:Current Configuration: n_gp_layers:2 - n_gp_out: 1 - num_inducing: 128 - num_samples: 10 - batch_size:1024 - num_inducing: 128 - lr: 0.01
INFO:root:Current Configuration: n_gp_layers:2 - n_gp_out: 1 - num_inducing: 128 - num_samples: 10 - batch_size:1024 - num_inducing: 128 - lr: 0.01
INFO:root:Current Configuration: n_gp_layers:2 - n_gp_out: 1 - num_inducing: 128 - num_samples: 10 - batch_size:1024 - num_inducing: 128 - lr: 0.01
INFO:root:Current Configuration: n_gp_layers:2 - n_gp_out: 1 - num_inducing: 128 - num_samples: 10 - batch_size:1024 - num_inducing: 128 - lr: 0.01
INFO:root:Current Configuration: n_gp_layers:2 - n_gp_out: 1 - num_inducing: 128 - num_samples: 10 - batch_size:1024 - num_inducing: 128 - lr: 0.01
INFO:root:Current Configuration: n_gp_layers:2 - n_gp_out: 1 - num_inducing: 128 - num_samples: 10 - batch_size:1024 - num_inducing: 128 - lr: 0.01
INFO:root:Current Configuration: n_gp_layers:2 - n_gp_out: 1 - num_inducing: 128 - num_samples: 10 - batch_size:1024 - num_inducing: 128 - lr: 0.01
INFO:root:Current Configuration: n_gp_layers:2 - n_gp_out: 1 - num_inducing: 128 - num_samples: 10 - batch_size:1024 - num_inducing: 128 - lr: 0.01
INFO:root:Current Configuration: n_gp_layers:2 - n_gp_out: 1 - num_inducing: 128 - num_samples: 10 - batch_size:1024 - num_inducing: 128 - lr: 0.01
INFO:root:Current Configuration: n_gp_layers:2 - n_gp_out: 1 - num_inducing: 128 - num_samples: 10 - batch_size:1024 - num_inducing: 128 - lr: 0.01
INFO:root:Current Configuration: n_gp_layers:2 - n_gp_out: 1 - num_inducing: 128 - num_samples: 10 - batch_size:1024 - num_inducing: 128 - lr: 0.01
INFO:root:Current Configuration: n_gp_layers:2 - n_gp_out: 1 - num_inducing: 128 - num_samples: 10 - batch_size:1024 - num_inducing: 128 - lr: 0.01
INFO:root:Current Configuration: n_gp_layers:2 - n_gp_out: 1 - num_inducing: 128 - num_samples: 10 - batch_size:1024 - num_inducing: 128 - lr: 0.01
INFO:root:Current Configuration: n_gp_layers:2 - n_gp_out: 1 - num_inducing: 128 - num_samples: 10 - batch_size:1024 - num_inducing: 128 - lr: 0.01
INFO:root:Current Configuration: n_gp_layers:2 - n_gp_out: 1 - num_inducing: 128 - num_samples: 10 - batch_size:1024 - num_inducing: 128 - lr: 0.01
INFO:root:Current Configuration: n_gp_layers:2 - n_gp_out: 1 - num_inducing: 128 - num_samples: 10 - batch_size:1024 - num_inducing: 128 - lr: 0.01
INFO:root:0/400 - Loss: 14734.9873046875 - Score: 117.9850082397461
INFO:root:0/400 - Loss: 14752.7109375 - Score: 118.0862045288086
INFO:root:0/400 - Loss: 14730.9951171875 - Score: 117.98822021484375
INFO:root:0/400 - Loss: 14763.5654296875 - Score: 118.15752410888672
INFO:root:0/400 - Loss: 14750.5517578125 - Score: 118.05500030517578
INFO:root:0/400 - Loss: 14762.791015625 - Score: 118.10807800292969
INFO:root:0/400 - Loss: 14755.7265625 - Score: 118.13150024414062
INFO:root:0/400 - Loss: 14751.619140625 - Score: 118.08731079101562
INFO:root:0/400 - Loss: 14739.40625 - Score: 118.03807067871094
INFO:root:0/400 - Loss: 14748.0029296875 - Score: 118.13941955566406
INFO:root:0/400 - Loss: 14759.466796875 - Score: 118.12992095947266
INFO:root:0/400 - Loss: 14758.1220703125 - Score: 118.10258483886719
INFO:root:0/400 - Loss: 14739.556640625 - Score: 118.09029388427734
INFO:root:0/400 - Loss: 14780.521484375 - Score: 118.16597747802734
INFO:root:0/400 - Loss: 14781.0185546875 - Score: 118.20943450927734
INFO:root:0/400 - Loss: 14803.6904296875 - Score: 118.2339859008789
INFO:root:10/400 - Loss: 5793.484375 - Score: 101.63090515136719
INFO:root:10/400 - Loss: 5605.56884765625 - Score: 99.59935760498047
INFO:root:10/400 - Loss: 5741.75537109375 - Score: 100.97698211669922
INFO:root:10/400 - Loss: 4498.6943359375 - Score: 86.39704895019531
INFO:root:10/400 - Loss: 5500.5009765625 - Score: 98.13961791992188
INFO:root:10/400 - Loss: 5929.55322265625 - Score: 103.208740234375
INFO:root:10/400 - Loss: 5601.64794921875 - Score: 99.10527038574219
INFO:root:10/400 - Loss: 5583.02587890625 - Score: 98.96728515625
INFO:root:10/400 - Loss: 4897.78564453125 - Score: 91.14958190917969
INFO:root:10/400 - Loss: 5930.10400390625 - Score: 103.2435302734375
INFO:root:10/400 - Loss: 5586.4501953125 - Score: 99.08576202392578
INFO:root:10/400 - Loss: 5129.48193359375 - Score: 94.42935943603516
INFO:root:10/400 - Loss: 5693.3251953125 - Score: 100.46466064453125
INFO:root:10/400 - Loss: 5672.94580078125 - Score: 99.99530792236328
INFO:root:10/400 - Loss: 5195.8876953125 - Score: 94.68354034423828
INFO:root:10/400 - Loss: 5104.01953125 - Score: 93.20054626464844
INFO:root:20/400 - Loss: 2830.75537109375 - Score: 78.71345520019531
INFO:root:20/400 - Loss: 2960.072265625 - Score: 80.93203735351562
INFO:root:20/400 - Loss: 2697.7041015625 - Score: 76.47760009765625
INFO:root:20/400 - Loss: 3035.335205078125 - Score: 82.34410095214844
INFO:root:20/400 - Loss: 2843.199462890625 - Score: 78.97059631347656
INFO:root:20/400 - Loss: 2794.44091796875 - Score: 78.11402130126953
INFO:root:20/400 - Loss: 2936.03759765625 - Score: 80.35253143310547
INFO:root:20/400 - Loss: 3235.20947265625 - Score: 85.52210235595703
INFO:root:20/400 - Loss: 2824.70458984375 - Score: 78.66756439208984
INFO:root:20/400 - Loss: 3197.869140625 - Score: 84.90951538085938
INFO:root:20/400 - Loss: 2934.722412109375 - Score: 80.43704986572266
INFO:root:20/400 - Loss: 2322.10595703125 - Score: 70.44667053222656
INFO:root:20/400 - Loss: 2393.081787109375 - Score: 71.6382064819336
INFO:root:20/400 - Loss: 1763.5390625 - Score: 62.07345962524414
INFO:root:20/400 - Loss: 2108.44970703125 - Score: 67.34635925292969
INFO:root:20/400 - Loss: 2316.39990234375 - Score: 70.43440246582031
INFO:root:30/400 - Loss: 1537.54150390625 - Score: 63.04074478149414
INFO:root:30/400 - Loss: 1414.457275390625 - Score: 60.63058853149414
INFO:root:30/400 - Loss: 1632.894287109375 - Score: 65.19923400878906
INFO:root:30/400 - Loss: 1501.2755126953125 - Score: 62.47653579711914
INFO:root:30/400 - Loss: 1568.296142578125 - Score: 63.665367126464844
INFO:root:30/400 - Loss: 1632.285400390625 - Score: 64.91685485839844
INFO:root:30/400 - Loss: 1902.919921875 - Score: 70.44281768798828
INFO:root:30/400 - Loss: 1198.148681640625 - Score: 56.40852355957031
INFO:root:30/400 - Loss: 1538.2952880859375 - Score: 63.08698654174805
INFO:root:30/400 - Loss: 1721.8001708984375 - Score: 66.94029998779297
INFO:root:30/400 - Loss: 1648.1337890625 - Score: 65.13201141357422
INFO:root:30/400 - Loss: 1855.60546875 - Score: 69.54268646240234
INFO:root:30/400 - Loss: 1151.158935546875 - Score: 55.54952621459961
INFO:root:30/400 - Loss: 1132.5184326171875 - Score: 55.21162414550781
INFO:root:30/400 - Loss: 795.8948364257812 - Score: 49.04269027709961
INFO:root:30/400 - Loss: 1009.4544067382812 - Score: 54.11882019042969
INFO:root:40/400 - Loss: 781.6567993164062 - Score: 50.856117248535156
INFO:root:40/400 - Loss: 873.7694091796875 - Score: 52.86088943481445
INFO:root:40/400 - Loss: 929.6851806640625 - Score: 54.31050109863281
INFO:root:40/400 - Loss: 845.3782958984375 - Score: 52.24714660644531
INFO:root:40/400 - Loss: 936.98046875 - Score: 54.31840133666992
INFO:root:40/400 - Loss: 900.8098754882812 - Score: 53.3737678527832
INFO:root:40/400 - Loss: 647.209228515625 - Score: 48.06755065917969
INFO:root:40/400 - Loss: 1152.860107421875 - Score: 59.17391586303711
INFO:root:40/400 - Loss: 958.51025390625 - Score: 54.65300750732422
INFO:root:40/400 - Loss: 872.7029418945312 - Score: 52.90414810180664
INFO:root:40/400 - Loss: 1108.0511474609375 - Score: 58.17565155029297
INFO:root:40/400 - Loss: 1010.9453125 - Score: 55.95674133300781
INFO:root:40/400 - Loss: 626.6510009765625 - Score: 47.099056243896484
INFO:root:40/400 - Loss: 631.2664794921875 - Score: 47.0122184753418
INFO:root:40/400 - Loss: 490.6944885253906 - Score: 43.84428405761719
INFO:root:40/400 - Loss: 540.128662109375 - Score: 45.59328842163086
INFO:root:50/400 - Loss: 478.193115234375 - Score: 45.01457214355469
INFO:root:50/400 - Loss: 529.9366455078125 - Score: 46.39459228515625
INFO:root:50/400 - Loss: 564.6900634765625 - Score: 47.48271179199219
INFO:root:50/400 - Loss: 508.8232421875 - Score: 46.01645278930664
INFO:root:50/400 - Loss: 571.3945922851562 - Score: 47.74457931518555
INFO:root:50/400 - Loss: 567.44921875 - Score: 47.4106559753418
INFO:root:50/400 - Loss: 490.4278869628906 - Score: 43.344844818115234
INFO:root:50/400 - Loss: 718.4124755859375 - Score: 51.42367172241211
INFO:root:50/400 - Loss: 593.0418090820312 - Score: 48.23418426513672
INFO:root:50/400 - Loss: 619.7918090820312 - Score: 48.989234924316406
INFO:root:50/400 - Loss: 541.1358642578125 - Score: 46.595619201660156
INFO:root:50/400 - Loss: 686.9927978515625 - Score: 50.60844421386719
INFO:root:50/400 - Loss: 410.78741455078125 - Score: 42.77560043334961
INFO:root:50/400 - Loss: 434.64764404296875 - Score: 42.98112487792969
INFO:root:50/400 - Loss: 338.0583190917969 - Score: 40.81193161010742
INFO:root:50/400 - Loss: 403.2648010253906 - Score: 42.26046371459961
INFO:root:60/400 - Loss: 329.9231872558594 - Score: 42.03761672973633
INFO:root:60/400 - Loss: 434.86260986328125 - Score: 44.11176681518555
INFO:root:60/400 - Loss: 393.6404724121094 - Score: 43.55791091918945
INFO:root:60/400 - Loss: 366.9908752441406 - Score: 42.79872131347656
INFO:root:60/400 - Loss: 399.1436462402344 - Score: 43.668113708496094
INFO:root:60/400 - Loss: 381.5763854980469 - Score: 43.19767379760742
INFO:root:60/400 - Loss: 326.9554138183594 - Score: 42.107032775878906
INFO:root:60/400 - Loss: 415.533447265625 - Score: 44.331512451171875
INFO:root:60/400 - Loss: 415.1507263183594 - Score: 43.90256118774414
INFO:root:60/400 - Loss: 488.44183349609375 - Score: 46.46421432495117
INFO:root:60/400 - Loss: 395.9017028808594 - Score: 43.533653259277344
INFO:root:60/400 - Loss: 453.90240478515625 - Score: 45.647613525390625
INFO:root:60/400 - Loss: 313.96051025390625 - Score: 41.40986633300781
INFO:root:60/400 - Loss: 307.8384704589844 - Score: 41.3371696472168
INFO:root:60/400 - Loss: 274.95379638671875 - Score: 39.75374984741211
INFO:root:60/400 - Loss: 308.24365234375 - Score: 41.243404388427734
INFO:root:70/400 - Loss: 262.984619140625 - Score: 40.36675262451172
INFO:root:70/400 - Loss: 291.69110107421875 - Score: 40.85738754272461
INFO:root:70/400 - Loss: 288.4618835449219 - Score: 41.437801361083984
INFO:root:70/400 - Loss: 286.4529724121094 - Score: 41.25209045410156
INFO:root:70/400 - Loss: 280.78424072265625 - Score: 40.903568267822266
INFO:root:70/400 - Loss: 313.8926696777344 - Score: 41.809600830078125
INFO:root:70/400 - Loss: 260.34271240234375 - Score: 40.443641662597656
INFO:root:70/400 - Loss: 382.4726257324219 - Score: 42.36510467529297
INFO:root:70/400 - Loss: 302.75164794921875 - Score: 41.714508056640625
INFO:root:70/400 - Loss: 369.6664123535156 - Score: 43.730106353759766
INFO:root:70/400 - Loss: 273.7502136230469 - Score: 41.17158508300781
INFO:root:70/400 - Loss: 329.7372131347656 - Score: 42.670982360839844
INFO:root:70/400 - Loss: 248.809814453125 - Score: 39.71271514892578
INFO:root:70/400 - Loss: 238.85061645507812 - Score: 39.6151123046875
INFO:root:70/400 - Loss: 246.2554168701172 - Score: 39.5906982421875
INFO:root:70/400 - Loss: 235.48007202148438 - Score: 39.28846740722656
INFO:root:80/400 - Loss: 223.10018920898438 - Score: 39.909950256347656
INFO:root:80/400 - Loss: 216.35556030273438 - Score: 39.558204650878906
INFO:root:80/400 - Loss: 227.96975708007812 - Score: 40.29436111450195
INFO:root:80/400 - Loss: 238.2182159423828 - Score: 40.26370620727539
INFO:root:80/400 - Loss: 221.21109008789062 - Score: 39.97935485839844
INFO:root:80/400 - Loss: 252.22079467773438 - Score: 40.41334533691406
INFO:root:80/400 - Loss: 219.68734741210938 - Score: 39.39104080200195
INFO:root:80/400 - Loss: 283.3452453613281 - Score: 41.23895263671875
INFO:root:80/400 - Loss: 253.8115692138672 - Score: 40.55302047729492
INFO:root:80/400 - Loss: 269.2300109863281 - Score: 41.23390197753906
INFO:root:80/400 - Loss: 240.23190307617188 - Score: 40.150394439697266
INFO:root:80/400 - Loss: 275.6100769042969 - Score: 41.47648239135742
INFO:root:80/400 - Loss: 205.696533203125 - Score: 39.512184143066406
INFO:root:80/400 - Loss: 186.9099578857422 - Score: 38.76051712036133
INFO:root:80/400 - Loss: 243.08303833007812 - Score: 39.658111572265625
INFO:root:80/400 - Loss: 204.9718017578125 - Score: 38.358882904052734
INFO:root:90/400 - Loss: 189.18109130859375 - Score: 39.3105354309082
INFO:root:90/400 - Loss: 208.45590209960938 - Score: 39.62835693359375
INFO:root:90/400 - Loss: 196.8838348388672 - Score: 39.423118591308594
INFO:root:90/400 - Loss: 188.8480682373047 - Score: 39.217796325683594
INFO:root:90/400 - Loss: 209.26052856445312 - Score: 39.36893081665039
INFO:root:90/400 - Loss: 202.30947875976562 - Score: 39.39796829223633
INFO:root:90/400 - Loss: 203.37420654296875 - Score: 39.19893264770508
INFO:root:90/400 - Loss: 233.0261688232422 - Score: 40.09185791015625
INFO:root:90/400 - Loss: 202.92098999023438 - Score: 39.44938278198242
INFO:root:90/400 - Loss: 229.671630859375 - Score: 40.29176330566406
INFO:root:90/400 - Loss: 203.58656311035156 - Score: 39.31946563720703
INFO:root:90/400 - Loss: 205.5044708251953 - Score: 39.67677688598633
INFO:root:90/400 - Loss: 178.85096740722656 - Score: 38.331974029541016
INFO:root:90/400 - Loss: 176.28878784179688 - Score: 38.19904327392578
INFO:root:Early stopping
INFO:root:After model training
INFO:root:After memory clearing
INFO:optuna.study.study:Trial 0 finished with value: 38.17227554321289 and parameters: {'lr': 0.01, 'batch_size': 1024, 'num_inducing': 128, 'num_samples': 10, 'kernel_type': 'rbf', 'n_gp_layers': 2, 'n_gp_out': 1}. Best is trial 0 with value: 38.17227554321289.
INFO:root:Current Configuration: n_gp_layers:1 - n_gp_out: 1 - num_inducing: 60 - num_samples: 9 - batch_size:2048 - num_inducing: 60 - lr: 0.000530124464457663
INFO:root:0/400 - Loss: 16507.154296875 - Score: 118.56241607666016
INFO:root:90/400 - Loss: 172.490478515625 - Score: 37.90057373046875
INFO:optuna.study._optimize:Trial 1 pruned. 
INFO:root:Current Configuration: n_gp_layers:1 - n_gp_out: 2 - num_inducing: 329 - num_samples: 2 - batch_size:1024 - num_inducing: 329 - lr: 0.001986934153527166
INFO:root:0/400 - Loss: 16178.537109375 - Score: 118.48697662353516
INFO:root:100/400 - Loss: 167.74710083007812 - Score: 38.76168441772461
INFO:root:100/400 - Loss: 167.03472900390625 - Score: 38.72991180419922
INFO:root:100/400 - Loss: 173.16012573242188 - Score: 38.48117446899414
INFO:root:100/400 - Loss: 161.62612915039062 - Score: 38.648406982421875
INFO:root:100/400 - Loss: 170.42300415039062 - Score: 38.77501678466797
INFO:root:100/400 - Loss: 175.3655548095703 - Score: 38.711551666259766
INFO:root:100/400 - Loss: 164.0131378173828 - Score: 38.006996154785156
INFO:root:100/400 - Loss: 205.44534301757812 - Score: 39.78584289550781
INFO:root:100/400 - Loss: 170.4227752685547 - Score: 38.84995651245117
INFO:optuna.study._optimize:Trial 2 pruned. 
INFO:root:Current Configuration: n_gp_layers:1 - n_gp_out: 5 - num_inducing: 659 - num_samples: 15 - batch_size:1024 - num_inducing: 659 - lr: 0.031048572767630418
INFO:root:100/400 - Loss: 194.21153259277344 - Score: 39.714622497558594
INFO:root:100/400 - Loss: 166.8433380126953 - Score: 38.288604736328125
INFO:root:100/400 - Loss: 175.0736846923828 - Score: 38.85353088378906
INFO:root:100/400 - Loss: 181.07737731933594 - Score: 39.229984283447266
INFO:root:100/400 - Loss: 168.5883026123047 - Score: 38.022342681884766
INFO:root:100/400 - Loss: 158.06802368164062 - Score: 37.55342102050781
INFO:root:110/400 - Loss: 147.6352996826172 - Score: 38.20804977416992
INFO:root:110/400 - Loss: 154.45472717285156 - Score: 38.62531280517578
INFO:root:110/400 - Loss: 151.7377471923828 - Score: 38.172542572021484
INFO:root:110/400 - Loss: 150.02806091308594 - Score: 38.29671859741211
INFO:root:110/400 - Loss: 158.1146240234375 - Score: 38.393863677978516
INFO:root:110/400 - Loss: 153.81454467773438 - Score: 38.390235900878906
INFO:root:110/400 - Loss: 151.72109985351562 - Score: 38.001251220703125
INFO:root:110/400 - Loss: 168.24252319335938 - Score: 38.723934173583984
INFO:root:110/400 - Loss: 159.3905487060547 - Score: 38.50023651123047
INFO:root:110/400 - Loss: 151.71128845214844 - Score: 37.801597595214844
INFO:root:110/400 - Loss: 175.27694702148438 - Score: 39.0444221496582
INFO:root:110/400 - Loss: 154.42544555664062 - Score: 38.301334381103516
INFO:root:110/400 - Loss: 180.36849975585938 - Score: 39.329627990722656
INFO:root:110/400 - Loss: 156.83627319335938 - Score: 37.90044403076172
INFO:root:0/400 - Loss: 11900.853515625 - Score: 116.80323791503906
INFO:root:110/400 - Loss: 150.27163696289062 - Score: 37.34178924560547
INFO:root:120/400 - Loss: 149.80825805664062 - Score: 38.50832748413086
INFO:root:120/400 - Loss: 144.19659423828125 - Score: 38.42976379394531
INFO:root:120/400 - Loss: 143.75601196289062 - Score: 38.01523971557617
INFO:root:120/400 - Loss: 144.20419311523438 - Score: 38.21498107910156
INFO:root:120/400 - Loss: 146.6033172607422 - Score: 38.008705139160156
INFO:root:120/400 - Loss: 152.7524871826172 - Score: 38.414703369140625
INFO:root:120/400 - Loss: 145.22604370117188 - Score: 37.72156524658203
INFO:root:120/400 - Loss: 140.9547119140625 - Score: 37.89565658569336
INFO:root:120/400 - Loss: 149.8555450439453 - Score: 38.38864517211914
INFO:root:120/400 - Loss: 136.78213500976562 - Score: 37.64033126831055
INFO:root:120/400 - Loss: 145.27011108398438 - Score: 38.17081069946289
INFO:root:120/400 - Loss: 166.03871154785156 - Score: 39.02592086791992
INFO:root:120/400 - Loss: 139.40866088867188 - Score: 38.26071548461914
INFO:root:120/400 - Loss: 145.32150268554688 - Score: 37.898643493652344
INFO:root:120/400 - Loss: 144.42849731445312 - Score: 37.478694915771484
INFO:root:130/400 - Loss: 135.1513671875 - Score: 38.28968811035156
INFO:root:130/400 - Loss: 129.705322265625 - Score: 37.90888595581055
INFO:root:130/400 - Loss: 132.07876586914062 - Score: 37.79640197753906
INFO:root:130/400 - Loss: 129.7274169921875 - Score: 37.90920639038086
INFO:root:130/400 - Loss: 136.2208709716797 - Score: 37.82093811035156
INFO:root:130/400 - Loss: 140.94284057617188 - Score: 37.85714340209961
INFO:root:130/400 - Loss: 149.86329650878906 - Score: 38.04178237915039
INFO:root:130/400 - Loss: 134.089111328125 - Score: 37.81462860107422
INFO:root:130/400 - Loss: 137.8520050048828 - Score: 38.17348861694336
INFO:root:Time Budget run out. Pruning Trial
INFO:root:After model training
INFO:root:After memory clearing
INFO:optuna.study.study:Trial 0 finished with value: 37.90920639038086 and parameters: {'lr': 0.01, 'batch_size': 1024, 'num_inducing': 128, 'num_samples': 10, 'kernel_type': 'rbf', 'n_gp_layers': 2, 'n_gp_out': 1}. Best is trial 0 with value: 37.90920639038086.
INFO:root:Current Configuration: n_gp_layers:1 - n_gp_out: 6 - num_inducing: 68 - num_samples: 8 - batch_size:2048 - num_inducing: 68 - lr: 0.007987353252504565
INFO:root:Time Budget run out. Pruning Trial
INFO:root:After model training
INFO:root:After memory clearing
INFO:optuna.study.study:Trial 0 finished with value: 37.98957824707031 and parameters: {'lr': 0.01, 'batch_size': 1024, 'num_inducing': 128, 'num_samples': 10, 'kernel_type': 'rbf', 'n_gp_layers': 2, 'n_gp_out': 1}. Best is trial 0 with value: 37.98957824707031.
INFO:root:Current Configuration: n_gp_layers:1 - n_gp_out: 3 - num_inducing: 375 - num_samples: 4 - batch_size:1024 - num_inducing: 375 - lr: 0.0077083125917856935
INFO:root:Time Budget run out. Pruning Trial
INFO:root:After model training
INFO:root:After memory clearing
INFO:optuna.study.study:Trial 0 finished with value: 37.70381546020508 and parameters: {'lr': 0.01, 'batch_size': 1024, 'num_inducing': 128, 'num_samples': 10, 'kernel_type': 'rbf', 'n_gp_layers': 2, 'n_gp_out': 1}. Best is trial 0 with value: 37.70381546020508.
INFO:root:Current Configuration: n_gp_layers:4 - n_gp_out: 5 - num_inducing: 167 - num_samples: 7 - batch_size:1024 - num_inducing: 167 - lr: 0.00045754546576201393
INFO:root:Time Budget run out. Pruning Trial
INFO:root:After model training
INFO:root:After memory clearing
