[32m[I 2023-06-12 20:58:22,610][0m Trial 4 pruned. [0m
Current Configuration: n_gp_layers:2 - n_gp_out: 1 - num_inducing: 128 - num_samples: 10 - batch_size:1024 - num_inducing: 128 - lr: 0.01
0/400 - Loss: 14758.1220703125 - Score: 118.10258483886719
10/400 - Loss: 5129.48193359375 - Score: 94.42935943603516
20/400 - Loss: 2322.10595703125 - Score: 70.44667053222656
30/400 - Loss: 1151.158935546875 - Score: 55.54952621459961
40/400 - Loss: 626.6510009765625 - Score: 47.099056243896484
50/400 - Loss: 410.78741455078125 - Score: 42.77560043334961
EarlyStopping counter: 1 out of 15
EarlyStopping counter: 1 out of 15
60/400 - Loss: 313.96051025390625 - Score: 41.40986633300781
EarlyStopping counter: 2 out of 15
EarlyStopping counter: 1 out of 15
EarlyStopping counter: 1 out of 15
EarlyStopping counter: 2 out of 15
70/400 - Loss: 238.85061645507812 - Score: 39.6151123046875
EarlyStopping counter: 1 out of 15
EarlyStopping counter: 1 out of 15
EarlyStopping counter: 2 out of 15
EarlyStopping counter: 3 out of 15
EarlyStopping counter: 1 out of 15
EarlyStopping counter: 2 out of 15
EarlyStopping counter: 3 out of 15
80/400 - Loss: 186.9099578857422 - Score: 38.76051712036133
EarlyStopping counter: 1 out of 15
EarlyStopping counter: 2 out of 15
EarlyStopping counter: 3 out of 15
EarlyStopping counter: 4 out of 15
EarlyStopping counter: 5 out of 15
EarlyStopping counter: 6 out of 15
EarlyStopping counter: 7 out of 15
90/400 - Loss: 176.28878784179688 - Score: 38.19904327392578
EarlyStopping counter: 1 out of 15
EarlyStopping counter: 2 out of 15
EarlyStopping counter: 3 out of 15
EarlyStopping counter: 4 out of 15
EarlyStopping counter: 5 out of 15
EarlyStopping counter: 1 out of 15
100/400 - Loss: 168.5883026123047 - Score: 38.022342681884766
EarlyStopping counter: 1 out of 15
EarlyStopping counter: 2 out of 15
EarlyStopping counter: 3 out of 15
EarlyStopping counter: 1 out of 15
EarlyStopping counter: 2 out of 15
EarlyStopping counter: 3 out of 15
EarlyStopping counter: 4 out of 15
EarlyStopping counter: 5 out of 15
110/400 - Loss: 156.83627319335938 - Score: 37.90044403076172
EarlyStopping counter: 1 out of 15
EarlyStopping counter: 2 out of 15
EarlyStopping counter: 3 out of 15
EarlyStopping counter: 4 out of 15
EarlyStopping counter: 5 out of 15
EarlyStopping counter: 6 out of 15
EarlyStopping counter: 7 out of 15
EarlyStopping counter: 8 out of 15
120/400 - Loss: 145.32150268554688 - Score: 37.898643493652344
EarlyStopping counter: 9 out of 15
EarlyStopping counter: 10 out of 15
EarlyStopping counter: 11 out of 15
EarlyStopping counter: 1 out of 15
EarlyStopping counter: 2 out of 15
EarlyStopping counter: 3 out of 15
EarlyStopping counter: 4 out of 15
EarlyStopping counter: 5 out of 15
Time Budget run out. Pruning Trial
Current Configuration: n_gp_layers:4 - n_gp_out: 5 - num_inducing: 167 - num_samples: 7 - batch_size:1024 - num_inducing: 167 - lr: 0.00045754546576201393
0/400 - Loss: 16471.685546875 - Score: 118.5630111694336
Time Budget run out. Pruning Trial
Current Configuration: n_gp_layers:4 - n_gp_out: 2 - num_inducing: 278 - num_samples: 3 - batch_size:1024 - num_inducing: 278 - lr: 0.000771984192477562
0/400 - Loss: 16412.017578125 - Score: 118.5555191040039
10/400 - Loss: 14939.96484375 - Score: 118.16626739501953
20/400 - Loss: 13254.25 - Score: 115.2006607055664
30/400 - Loss: 11704.140625 - Score: 111.30673217773438
40/400 - Loss: 10480.2431640625 - Score: 108.1866455078125
Time Budget run out. Pruning Trial
Current Configuration: n_gp_layers:1 - n_gp_out: 1 - num_inducing: 50 - num_samples: 13 - batch_size:2048 - num_inducing: 50 - lr: 0.013101681052409928
0/400 - Loss: 15360.181640625 - Score: 118.36109161376953
10/400 - Loss: 7871.12158203125 - Score: 112.68174743652344
20/400 - Loss: 4724.4755859375 - Score: 97.86917877197266
30/400 - Loss: 3098.210693359375 - Score: 84.381103515625
40/400 - Loss: 2097.142333984375 - Score: 72.9545669555664
50/400 - Loss: 1430.6297607421875 - Score: 63.33047103881836
60/400 - Loss: 1004.546142578125 - Score: 56.426822662353516
70/400 - Loss: 723.7223510742188 - Score: 51.340736389160156
80/400 - Loss: 537.6732177734375 - Score: 47.54750061035156
90/400 - Loss: 414.3960266113281 - Score: 44.726844787597656
EarlyStopping counter: 1 out of 15
EarlyStopping counter: 2 out of 15
EarlyStopping counter: 1 out of 15
100/400 - Loss: 334.2208251953125 - Score: 42.994747161865234
EarlyStopping counter: 1 out of 15
EarlyStopping counter: 2 out of 15
EarlyStopping counter: 3 out of 15
110/400 - Loss: 284.82843017578125 - Score: 41.623836517333984
EarlyStopping counter: 1 out of 15
EarlyStopping counter: 2 out of 15
EarlyStopping counter: 3 out of 15
EarlyStopping counter: 4 out of 15
EarlyStopping counter: 5 out of 15
EarlyStopping counter: 1 out of 15
120/400 - Loss: 234.83428955078125 - Score: 41.10983657836914
EarlyStopping counter: 1 out of 15
EarlyStopping counter: 2 out of 15
EarlyStopping counter: 3 out of 15
130/400 - Loss: 209.07020568847656 - Score: 40.0804443359375
EarlyStopping counter: 1 out of 15
EarlyStopping counter: 2 out of 15
EarlyStopping counter: 3 out of 15
EarlyStopping counter: 4 out of 15
EarlyStopping counter: 5 out of 15
EarlyStopping counter: 6 out of 15
140/400 - Loss: 192.29287719726562 - Score: 39.38298034667969
EarlyStopping counter: 1 out of 15
EarlyStopping counter: 2 out of 15
EarlyStopping counter: 3 out of 15
EarlyStopping counter: 4 out of 15
EarlyStopping counter: 1 out of 15
EarlyStopping counter: 1 out of 15
EarlyStopping counter: 2 out of 15
150/400 - Loss: 183.51976013183594 - Score: 39.168540954589844
EarlyStopping counter: 1 out of 15
EarlyStopping counter: 2 out of 15
EarlyStopping counter: 3 out of 15
EarlyStopping counter: 4 out of 15
EarlyStopping counter: 5 out of 15
EarlyStopping counter: 6 out of 15
EarlyStopping counter: 1 out of 15
EarlyStopping counter: 2 out of 15
160/400 - Loss: 187.64248657226562 - Score: 39.17247009277344
EarlyStopping counter: 3 out of 15
EarlyStopping counter: 4 out of 15
EarlyStopping counter: 1 out of 15
EarlyStopping counter: 2 out of 15
EarlyStopping counter: 3 out of 15
EarlyStopping counter: 4 out of 15
EarlyStopping counter: 5 out of 15
EarlyStopping counter: 6 out of 15
170/400 - Loss: 172.4609375 - Score: 38.944969177246094
EarlyStopping counter: 7 out of 15
EarlyStopping counter: 8 out of 15
EarlyStopping counter: 9 out of 15
EarlyStopping counter: 10 out of 15
EarlyStopping counter: 1 out of 15
EarlyStopping counter: 1 out of 15
EarlyStopping counter: 2 out of 15
EarlyStopping counter: 3 out of 15
180/400 - Loss: 159.69451904296875 - Score: 38.65980911254883
EarlyStopping counter: 1 out of 15
EarlyStopping counter: 2 out of 15
EarlyStopping counter: 3 out of 15
EarlyStopping counter: 4 out of 15
EarlyStopping counter: 1 out of 15
EarlyStopping counter: 1 out of 15
190/400 - Loss: 128.24066162109375 - Score: 37.95547103881836
EarlyStopping counter: 1 out of 15
EarlyStopping counter: 2 out of 15
EarlyStopping counter: 3 out of 15
EarlyStopping counter: 4 out of 15
EarlyStopping counter: 5 out of 15
EarlyStopping counter: 6 out of 15
EarlyStopping counter: 7 out of 15
EarlyStopping counter: 8 out of 15
EarlyStopping counter: 9 out of 15
200/400 - Loss: 126.68061828613281 - Score: 37.92510223388672
EarlyStopping counter: 1 out of 15
EarlyStopping counter: 1 out of 15
EarlyStopping counter: 2 out of 15
EarlyStopping counter: 3 out of 15
EarlyStopping counter: 4 out of 15
EarlyStopping counter: 5 out of 15
EarlyStopping counter: 6 out of 15
EarlyStopping counter: 7 out of 15
210/400 - Loss: 122.17247009277344 - Score: 37.83540725708008
EarlyStopping counter: 1 out of 15
EarlyStopping counter: 2 out of 15
EarlyStopping counter: 3 out of 15
EarlyStopping counter: 4 out of 15
EarlyStopping counter: 5 out of 15
EarlyStopping counter: 1 out of 15
EarlyStopping counter: 1 out of 15
EarlyStopping counter: 2 out of 15
220/400 - Loss: 116.99152374267578 - Score: 37.827205657958984
EarlyStopping counter: 3 out of 15
EarlyStopping counter: 4 out of 15
EarlyStopping counter: 5 out of 15
EarlyStopping counter: 1 out of 15
EarlyStopping counter: 1 out of 15
EarlyStopping counter: 2 out of 15
EarlyStopping counter: 3 out of 15
EarlyStopping counter: 4 out of 15
[32m[I 2023-06-12 21:08:30,115][0m Trial 3 finished with value: 37.737003326416016 and parameters: {'lr': 0.013101681052409928, 'batch_size': 2048, 'num_inducing': 50, 'num_samples': 13, 'kernel_type': 'rbf', 'n_gp_layers': 1, 'n_gp_out': 1}. Best is trial 0 with value: 37.70381546020508.[0m
[32m[I 2023-06-12 21:08:41,800][0m Trial 5 pruned. [0m
[32m[I 2023-06-12 21:19:04,082][0m Trial 6 finished with value: 108.34200286865234 and parameters: {'lr': 0.0007103501453459978, 'batch_size': 2048, 'num_inducing': 68, 'num_samples': 8, 'kernel_type': 'matern0.5', 'n_gp_layers': 2, 'n_gp_out': 1}. Best is trial 3 with value: 37.44314193725586.[0m
[32m[I 2023-06-12 21:24:02,942][0m Trial 7 pruned. [0m
[32m[I 2023-06-12 21:31:13,066][0m Trial 4 finished with value: 37.52021408081055 and parameters: {'lr': 0.06704678381845867, 'batch_size': 1024, 'num_inducing': 596, 'num_samples': 15, 'kernel_type': 'matern1.5', 'n_gp_layers': 1, 'n_gp_out': 5}. Best is trial 4 with value: 37.52021408081055.[0m
[32m[I 2023-06-12 21:31:55,137][0m Trial 5 pruned. [0m
[32m[I 2023-06-12 21:33:29,440][0m Trial 4 finished with value: 37.46335983276367 and parameters: {'lr': 0.003982627922137281, 'batch_size': 512, 'num_inducing': 56, 'num_samples': 14, 'kernel_type': 'matern1.5', 'n_gp_layers': 1, 'n_gp_out': 4}. Best is trial 4 with value: 37.46335983276367.[0m
