[32m[I 2023-06-12 21:33:45,787][0m Trial 3 finished with value: 39.024776458740234 and parameters: {'lr': 0.012139959464094277, 'batch_size': 512, 'num_inducing': 179, 'num_samples': 14, 'kernel_type': 'rbf', 'n_gp_layers': 4, 'n_gp_out': 1}. Best is trial 0 with value: 37.55686569213867.[0m
/home/linyuhan/my_project/venv_CMAPSS/lib64/python3.6/site-packages/gpytorch/utils/cholesky.py:40: NumericalWarning: A not p.d., added jitter of 1.0e-08 to the diagonal
  NumericalWarning,
/home/linyuhan/my_project/venv_CMAPSS/lib64/python3.6/site-packages/gpytorch/utils/cholesky.py:40: NumericalWarning: A not p.d., added jitter of 1.0e-07 to the diagonal
  NumericalWarning,
/home/linyuhan/my_project/venv_CMAPSS/lib64/python3.6/site-packages/gpytorch/utils/cholesky.py:40: NumericalWarning: A not p.d., added jitter of 1.0e-06 to the diagonal
  NumericalWarning,
[33m[W 2023-06-12 21:35:08,746][0m Trial 4 failed because of the following error: NotPSDError('Matrix not positive definite after repeatedly adding jitter up to 1.0e-06.',)[0m
Traceback (most recent call last):
  File "/home/linyuhan/my_project/venv_CMAPSS/lib64/python3.6/site-packages/optuna/study/_optimize.py", line 196, in _run_trial
    value_or_values = func(trial)
  File "/home/linyuhan/Dokumente/Masterarbeit/dataset/CMAPSS/code/DGP_Yuhan/HPO_DGP.py", line 400, in <lambda>
    metric=mae),
  File "/home/linyuhan/Dokumente/Masterarbeit/dataset/CMAPSS/code/DGP_Yuhan/HPO_DGP.py", line 263, in objective_train_test
    output = model(X_batch)
  File "/home/linyuhan/my_project/venv_CMAPSS/lib64/python3.6/site-packages/gpytorch/module.py", line 30, in __call__
    outputs = self.forward(*inputs, **kwargs)
  File "/home/linyuhan/Dokumente/Masterarbeit/dataset/CMAPSS/code/DGP_Yuhan/src/deep_gp.py", line 145, in forward
    output = layer(output)
  File "/home/linyuhan/Dokumente/Masterarbeit/dataset/CMAPSS/code/DGP_Yuhan/src/deep_gp.py", line 91, in __call__
    return super().__call__(x, are_samples=bool(len(other_inputs)))
  File "/home/linyuhan/my_project/venv_CMAPSS/lib64/python3.6/site-packages/gpytorch/models/deep_gps/deep_gp.py", line 99, in __call__
    output = ApproximateGP.__call__(self, inputs)
  File "/home/linyuhan/my_project/venv_CMAPSS/lib64/python3.6/site-packages/gpytorch/models/approximate_gp.py", line 81, in __call__
    return self.variational_strategy(inputs, prior=prior, **kwargs)
  File "/home/linyuhan/my_project/venv_CMAPSS/lib64/python3.6/site-packages/gpytorch/variational/variational_strategy.py", line 169, in __call__
    return super().__call__(x, prior=prior, **kwargs)
  File "/home/linyuhan/my_project/venv_CMAPSS/lib64/python3.6/site-packages/gpytorch/variational/_variational_strategy.py", line 129, in __call__
    **kwargs,
  File "/home/linyuhan/my_project/venv_CMAPSS/lib64/python3.6/site-packages/gpytorch/module.py", line 30, in __call__
    outputs = self.forward(*inputs, **kwargs)
  File "/home/linyuhan/my_project/venv_CMAPSS/lib64/python3.6/site-packages/gpytorch/variational/variational_strategy.py", line 103, in forward
    L = self._cholesky_factor(induc_induc_covar)
  File "/home/linyuhan/my_project/venv_CMAPSS/lib64/python3.6/site-packages/gpytorch/utils/memoize.py", line 76, in g
    return _add_to_cache_ignore_args(self, cache_name, method(self, *args, **kwargs))
  File "/home/linyuhan/my_project/venv_CMAPSS/lib64/python3.6/site-packages/gpytorch/variational/variational_strategy.py", line 72, in _cholesky_factor
    L = psd_safe_cholesky(delazify(induc_induc_covar).type(_linalg_dtype_cholesky.value()))
  File "/home/linyuhan/my_project/venv_CMAPSS/lib64/python3.6/site-packages/gpytorch/utils/cholesky.py", line 63, in psd_safe_cholesky
    L = _psd_safe_cholesky(A, out=out, jitter=jitter, max_tries=max_tries)
  File "/home/linyuhan/my_project/venv_CMAPSS/lib64/python3.6/site-packages/gpytorch/utils/cholesky.py", line 45, in _psd_safe_cholesky
    raise NotPSDError(f"Matrix not positive definite after repeatedly adding jitter up to {jitter_new:.1e}.")
gpytorch.utils.errors.NotPSDError: Matrix not positive definite after repeatedly adding jitter up to 1.0e-06.
230/400 - Loss: 114.84591674804688 - Score: 37.78871154785156
EarlyStopping counter: 5 out of 15
EarlyStopping counter: 6 out of 15
EarlyStopping counter: 7 out of 15
EarlyStopping counter: 8 out of 15
EarlyStopping counter: 9 out of 15
EarlyStopping counter: 1 out of 15
EarlyStopping counter: 2 out of 15
EarlyStopping counter: 3 out of 15
EarlyStopping counter: 4 out of 15
240/400 - Loss: 111.17189025878906 - Score: 37.79035568237305
EarlyStopping counter: 5 out of 15
EarlyStopping counter: 6 out of 15
EarlyStopping counter: 7 out of 15
EarlyStopping counter: 8 out of 15
EarlyStopping counter: 9 out of 15
EarlyStopping counter: 10 out of 15
EarlyStopping counter: 11 out of 15
EarlyStopping counter: 12 out of 15
EarlyStopping counter: 13 out of 15
EarlyStopping counter: 14 out of 15
250/400 - Loss: 109.78498840332031 - Score: 37.758602142333984
EarlyStopping counter: 15 out of 15
Early stopping
Current Configuration: n_gp_layers:4 - n_gp_out: 1 - num_inducing: 330 - num_samples: 6 - batch_size:2048 - num_inducing: 330 - lr: 0.026448299678632495
0/400 - Loss: 14192.1474609375 - Score: 117.83345794677734
10/400 - Loss: 3784.4716796875 - Score: 89.95394134521484
20/400 - Loss: 1451.3751220703125 - Score: 67.73709869384766
Traceback (most recent call last):
  File "/home/linyuhan/Dokumente/Masterarbeit/dataset/CMAPSS/code/DGP_Yuhan/experiment.py", line 30, in <module>
    time_tolerance=time_tolerance)
  File "/home/linyuhan/Dokumente/Masterarbeit/dataset/CMAPSS/code/DGP_Yuhan/HPO_DGP.py", line 401, in HPO_DGP
    n_trials=n_trials)  # n_trials=N_TRIALS
  File "/home/linyuhan/my_project/venv_CMAPSS/lib64/python3.6/site-packages/optuna/study/study.py", line 428, in optimize
    show_progress_bar=show_progress_bar,
  File "/home/linyuhan/my_project/venv_CMAPSS/lib64/python3.6/site-packages/optuna/study/_optimize.py", line 76, in _optimize
    progress_bar=progress_bar,
  File "/home/linyuhan/my_project/venv_CMAPSS/lib64/python3.6/site-packages/optuna/study/_optimize.py", line 160, in _optimize_sequential
    frozen_trial = _run_trial(study, func, catch)
  File "/home/linyuhan/my_project/venv_CMAPSS/lib64/python3.6/site-packages/optuna/study/_optimize.py", line 234, in _run_trial
    raise func_err
  File "/home/linyuhan/my_project/venv_CMAPSS/lib64/python3.6/site-packages/optuna/study/_optimize.py", line 196, in _run_trial
    value_or_values = func(trial)
  File "/home/linyuhan/Dokumente/Masterarbeit/dataset/CMAPSS/code/DGP_Yuhan/HPO_DGP.py", line 400, in <lambda>
    metric=mae),
  File "/home/linyuhan/Dokumente/Masterarbeit/dataset/CMAPSS/code/DGP_Yuhan/HPO_DGP.py", line 263, in objective_train_test
    output = model(X_batch)
  File "/home/linyuhan/my_project/venv_CMAPSS/lib64/python3.6/site-packages/gpytorch/module.py", line 30, in __call__
    outputs = self.forward(*inputs, **kwargs)
  File "/home/linyuhan/Dokumente/Masterarbeit/dataset/CMAPSS/code/DGP_Yuhan/src/deep_gp.py", line 145, in forward
    output = layer(output)
  File "/home/linyuhan/Dokumente/Masterarbeit/dataset/CMAPSS/code/DGP_Yuhan/src/deep_gp.py", line 91, in __call__
    return super().__call__(x, are_samples=bool(len(other_inputs)))
  File "/home/linyuhan/my_project/venv_CMAPSS/lib64/python3.6/site-packages/gpytorch/models/deep_gps/deep_gp.py", line 99, in __call__
    output = ApproximateGP.__call__(self, inputs)
  File "/home/linyuhan/my_project/venv_CMAPSS/lib64/python3.6/site-packages/gpytorch/models/approximate_gp.py", line 81, in __call__
    return self.variational_strategy(inputs, prior=prior, **kwargs)
  File "/home/linyuhan/my_project/venv_CMAPSS/lib64/python3.6/site-packages/gpytorch/variational/variational_strategy.py", line 169, in __call__
    return super().__call__(x, prior=prior, **kwargs)
  File "/home/linyuhan/my_project/venv_CMAPSS/lib64/python3.6/site-packages/gpytorch/variational/_variational_strategy.py", line 129, in __call__
    **kwargs,
  File "/home/linyuhan/my_project/venv_CMAPSS/lib64/python3.6/site-packages/gpytorch/module.py", line 30, in __call__
    outputs = self.forward(*inputs, **kwargs)
  File "/home/linyuhan/my_project/venv_CMAPSS/lib64/python3.6/site-packages/gpytorch/variational/variational_strategy.py", line 103, in forward
    L = self._cholesky_factor(induc_induc_covar)
  File "/home/linyuhan/my_project/venv_CMAPSS/lib64/python3.6/site-packages/gpytorch/utils/memoize.py", line 76, in g
    return _add_to_cache_ignore_args(self, cache_name, method(self, *args, **kwargs))
  File "/home/linyuhan/my_project/venv_CMAPSS/lib64/python3.6/site-packages/gpytorch/variational/variational_strategy.py", line 72, in _cholesky_factor
    L = psd_safe_cholesky(delazify(induc_induc_covar).type(_linalg_dtype_cholesky.value()))
  File "/home/linyuhan/my_project/venv_CMAPSS/lib64/python3.6/site-packages/gpytorch/utils/cholesky.py", line 63, in psd_safe_cholesky
    L = _psd_safe_cholesky(A, out=out, jitter=jitter, max_tries=max_tries)
  File "/home/linyuhan/my_project/venv_CMAPSS/lib64/python3.6/site-packages/gpytorch/utils/cholesky.py", line 45, in _psd_safe_cholesky
    raise NotPSDError(f"Matrix not positive definite after repeatedly adding jitter up to {jitter_new:.1e}.")
gpytorch.utils.errors.NotPSDError: Matrix not positive definite after repeatedly adding jitter up to 1.0e-06.
Current Configuration: n_gp_layers:2 - n_gp_out: 1 - num_inducing: 128 - num_samples: 10 - batch_size:1024 - num_inducing: 128 - lr: 0.01
0/400 - Loss: 14750.5517578125 - Score: 118.05500030517578
10/400 - Loss: 4498.6943359375 - Score: 86.39704895019531
20/400 - Loss: 1763.5390625 - Score: 62.07345962524414
30/400 - Loss: 795.8948364257812 - Score: 49.04269027709961
EarlyStopping counter: 1 out of 15
EarlyStopping counter: 2 out of 15
40/400 - Loss: 490.6944885253906 - Score: 43.84428405761719
EarlyStopping counter: 1 out of 15
50/400 - Loss: 338.0583190917969 - Score: 40.81193161010742
EarlyStopping counter: 1 out of 15
EarlyStopping counter: 1 out of 15
EarlyStopping counter: 2 out of 15
EarlyStopping counter: 3 out of 15
EarlyStopping counter: 1 out of 15
60/400 - Loss: 274.95379638671875 - Score: 39.75374984741211
EarlyStopping counter: 1 out of 15
EarlyStopping counter: 2 out of 15
EarlyStopping counter: 3 out of 15
EarlyStopping counter: 4 out of 15
EarlyStopping counter: 5 out of 15
EarlyStopping counter: 6 out of 15
EarlyStopping counter: 7 out of 15
EarlyStopping counter: 1 out of 15
70/400 - Loss: 246.2554168701172 - Score: 39.5906982421875
EarlyStopping counter: 2 out of 15
EarlyStopping counter: 3 out of 15
EarlyStopping counter: 1 out of 15
EarlyStopping counter: 2 out of 15
EarlyStopping counter: 3 out of 15
EarlyStopping counter: 4 out of 15
EarlyStopping counter: 5 out of 15
80/400 - Loss: 243.08303833007812 - Score: 39.658111572265625
EarlyStopping counter: 6 out of 15
EarlyStopping counter: 7 out of 15
EarlyStopping counter: 8 out of 15
EarlyStopping counter: 9 out of 15
EarlyStopping counter: 10 out of 15
EarlyStopping counter: 11 out of 15
EarlyStopping counter: 12 out of 15
EarlyStopping counter: 13 out of 15
EarlyStopping counter: 14 out of 15
EarlyStopping counter: 15 out of 15
Early stopping
Current Configuration: n_gp_layers:1 - n_gp_out: 1 - num_inducing: 60 - num_samples: 9 - batch_size:2048 - num_inducing: 60 - lr: 0.000530124464457663
0/400 - Loss: 16507.154296875 - Score: 118.56241607666016
Current Configuration: n_gp_layers:1 - n_gp_out: 2 - num_inducing: 329 - num_samples: 2 - batch_size:1024 - num_inducing: 329 - lr: 0.001986934153527166
0/400 - Loss: 16178.537109375 - Score: 118.48697662353516
Current Configuration: n_gp_layers:1 - n_gp_out: 5 - num_inducing: 659 - num_samples: 15 - batch_size:1024 - num_inducing: 659 - lr: 0.031048572767630418
0/400 - Loss: 11900.853515625 - Score: 116.80323791503906
EarlyStopping counter: 1 out of 15
10/400 - Loss: 501.7091369628906 - Score: 38.01689529418945
Time Budget run out. Pruning Trial
Current Configuration: n_gp_layers:2 - n_gp_out: 1 - num_inducing: 492 - num_samples: 10 - batch_size:1024 - num_inducing: 492 - lr: 0.00017423894766871548
0/400 - Loss: 16524.265625 - Score: 118.56368255615234
Current Configuration: n_gp_layers:2 - n_gp_out: 1 - num_inducing: 155 - num_samples: 3 - batch_size:2048 - num_inducing: 155 - lr: 0.030635374128837965
0/400 - Loss: 13875.0400390625 - Score: 117.82931518554688
10/400 - Loss: 3260.280517578125 - Score: 84.5890121459961
EarlyStopping counter: 1 out of 15
20/400 - Loss: 1335.7996826171875 - Score: 61.326751708984375
30/400 - Loss: 506.2469177246094 - Score: 46.51181411743164
EarlyStopping counter: 1 out of 15
EarlyStopping counter: 2 out of 15
EarlyStopping counter: 3 out of 15
EarlyStopping counter: 4 out of 15
40/400 - Loss: 401.0069274902344 - Score: 44.13679885864258
EarlyStopping counter: 1 out of 15
EarlyStopping counter: 2 out of 15
EarlyStopping counter: 3 out of 15
EarlyStopping counter: 4 out of 15
EarlyStopping counter: 5 out of 15
EarlyStopping counter: 6 out of 15
50/400 - Loss: 348.8469543457031 - Score: 43.60485076904297
EarlyStopping counter: 7 out of 15
EarlyStopping counter: 8 out of 15
EarlyStopping counter: 9 out of 15
EarlyStopping counter: 10 out of 15
EarlyStopping counter: 1 out of 15
EarlyStopping counter: 2 out of 15
EarlyStopping counter: 3 out of 15
60/400 - Loss: 297.5600280761719 - Score: 42.62505340576172
EarlyStopping counter: 4 out of 15
EarlyStopping counter: 5 out of 15
EarlyStopping counter: 6 out of 15
EarlyStopping counter: 7 out of 15
EarlyStopping counter: 1 out of 15
EarlyStopping counter: 2 out of 15
EarlyStopping counter: 3 out of 15
EarlyStopping counter: 1 out of 15
70/400 - Loss: 181.64068603515625 - Score: 39.833805084228516
EarlyStopping counter: 1 out of 15
EarlyStopping counter: 1 out of 15
80/400 - Loss: 139.09962463378906 - Score: 38.28111267089844
EarlyStopping counter: 1 out of 15
EarlyStopping counter: 2 out of 15
EarlyStopping counter: 1 out of 15
EarlyStopping counter: 2 out of 15
EarlyStopping counter: 3 out of 15
EarlyStopping counter: 1 out of 15
EarlyStopping counter: 2 out of 15
90/400 - Loss: 127.59432220458984 - Score: 38.17631149291992
EarlyStopping counter: 1 out of 15
EarlyStopping counter: 2 out of 15
EarlyStopping counter: 1 out of 15
EarlyStopping counter: 1 out of 15
EarlyStopping counter: 2 out of 15
100/400 - Loss: 121.56033325195312 - Score: 38.07097244262695
EarlyStopping counter: 3 out of 15
EarlyStopping counter: 1 out of 15
EarlyStopping counter: 2 out of 15
EarlyStopping counter: 3 out of 15
EarlyStopping counter: 4 out of 15
EarlyStopping counter: 5 out of 15
EarlyStopping counter: 1 out of 15
110/400 - Loss: 114.26436614990234 - Score: 37.91142272949219
EarlyStopping counter: 1 out of 15
EarlyStopping counter: 2 out of 15
EarlyStopping counter: 3 out of 15
EarlyStopping counter: 1 out of 15
EarlyStopping counter: 1 out of 15
EarlyStopping counter: 2 out of 15
EarlyStopping counter: 3 out of 15
120/400 - Loss: 107.81340789794922 - Score: 37.97402572631836
EarlyStopping counter: 4 out of 15
EarlyStopping counter: 5 out of 15
EarlyStopping counter: 6 out of 15
EarlyStopping counter: 7 out of 15
EarlyStopping counter: 8 out of 15
EarlyStopping counter: 9 out of 15
EarlyStopping counter: 10 out of 15
EarlyStopping counter: 11 out of 15
EarlyStopping counter: 12 out of 15
EarlyStopping counter: 13 out of 15
130/400 - Loss: 115.2079086303711 - Score: 39.97279357910156
EarlyStopping counter: 14 out of 15
EarlyStopping counter: 15 out of 15
Early stopping
Current Configuration: n_gp_layers:2 - n_gp_out: 1 - num_inducing: 68 - num_samples: 8 - batch_size:2048 - num_inducing: 68 - lr: 0.0007103501453459978
0/400 - Loss: 16489.111328125 - Score: 118.55894470214844
10/400 - Loss: 15742.708984375 - Score: 118.42085266113281
20/400 - Loss: 15049.9833984375 - Score: 118.23617553710938
30/400 - Loss: 14397.869140625 - Score: 117.97321319580078
40/400 - Loss: 13790.134765625 - Score: 117.60132598876953
50/400 - Loss: 13213.7900390625 - Score: 117.09346771240234
60/400 - Loss: 12654.7265625 - Score: 116.46199035644531
70/400 - Loss: 12100.021484375 - Score: 115.74954986572266
80/400 - Loss: 11610.0556640625 - Score: 115.13558197021484
90/400 - Loss: 11158.5205078125 - Score: 114.5546875
100/400 - Loss: 10734.3525390625 - Score: 113.98448944091797
110/400 - Loss: 10341.43359375 - Score: 113.43256378173828
120/400 - Loss: 9973.234375 - Score: 112.89616394042969
130/400 - Loss: 9626.650390625 - Score: 112.36377716064453
140/400 - Loss: 9298.5419921875 - Score: 111.83805084228516
150/400 - Loss: 8989.2001953125 - Score: 111.31725311279297
160/400 - Loss: 8698.361328125 - Score: 110.79309844970703
170/400 - Loss: 8421.5400390625 - Score: 110.27627563476562
180/400 - Loss: 8155.4853515625 - Score: 109.75654602050781
190/400 - Loss: 7907.083984375 - Score: 109.23839569091797
200/400 - Loss: 7668.50830078125 - Score: 108.71797180175781
Time Budget run out. Pruning Trial
Current Configuration: n_gp_layers:1 - n_gp_out: 1 - num_inducing: 472 - num_samples: 14 - batch_size:2048 - num_inducing: 472 - lr: 0.0038264654731326032
0/400 - Loss: 16185.0556640625 - Score: 118.48163604736328
Current Configuration: n_gp_layers:2 - n_gp_out: 1 - num_inducing: 176 - num_samples: 11 - batch_size:1024 - num_inducing: 176 - lr: 0.005995703439109793
0/400 - Loss: 15426.6806640625 - Score: 118.21644592285156
10/400 - Loss: 8297.8564453125 - Score: 109.99288177490234
20/400 - Loss: 5312.52685546875 - Score: 99.78710174560547
30/400 - Loss: 3633.984130859375 - Score: 88.12698364257812
[32m[I 2023-06-12 21:44:42,117][0m Trial 8 finished with value: 37.49007034301758 and parameters: {'lr': 0.018889785867090263, 'batch_size': 512, 'num_inducing': 96, 'num_samples': 12, 'kernel_type': 'matern1.5', 'n_gp_layers': 3, 'n_gp_out': 2}. Best is trial 1 with value: 37.39690017700195.[0m
[32m[I 2023-06-12 21:45:49,865][0m Trial 9 pruned. [0m
[32m[I 2023-06-12 21:46:37,219][0m Trial 4 finished with value: 37.11784744262695 and parameters: {'lr': 0.03791480521203901, 'batch_size': 1024, 'num_inducing': 96, 'num_samples': 12, 'kernel_type': 'matern1.5', 'n_gp_layers': 1, 'n_gp_out': 6}. Best is trial 4 with value: 37.11784744262695.[0m
[32m[I 2023-06-12 21:51:56,541][0m Trial 8 finished with value: 43.3186149597168 and parameters: {'lr': 0.0012911590924113163, 'batch_size': 1024, 'num_inducing': 159, 'num_samples': 5, 'kernel_type': 'matern1.5', 'n_gp_layers': 1, 'n_gp_out': 4}. Best is trial 1 with value: 37.58218002319336.[0m
[32m[I 2023-06-12 21:54:44,299][0m Trial 9 pruned. [0m
[32m[I 2023-06-12 21:56:53,531][0m Trial 10 pruned. [0m
[32m[I 2023-06-12 21:57:25,548][0m Trial 11 pruned. [0m
