[32m[I 2023-06-13 03:11:11,780][0m Trial 26 pruned. [0m
/home/linyuhan/my_project/venv_CMAPSS/lib64/python3.6/site-packages/gpytorch/utils/cholesky.py:40: NumericalWarning: A not p.d., added jitter of 1.0e-08 to the diagonal
  NumericalWarning,
/home/linyuhan/my_project/venv_CMAPSS/lib64/python3.6/site-packages/gpytorch/utils/cholesky.py:40: NumericalWarning: A not p.d., added jitter of 1.0e-07 to the diagonal
  NumericalWarning,
/home/linyuhan/my_project/venv_CMAPSS/lib64/python3.6/site-packages/gpytorch/utils/cholesky.py:40: NumericalWarning: A not p.d., added jitter of 1.0e-06 to the diagonal
  NumericalWarning,
[33m[W 2023-06-13 03:12:57,385][0m Trial 27 failed because of the following error: NotPSDError('Matrix not positive definite after repeatedly adding jitter up to 1.0e-06.',)[0m
Traceback (most recent call last):
  File "/home/linyuhan/my_project/venv_CMAPSS/lib64/python3.6/site-packages/optuna/study/_optimize.py", line 196, in _run_trial
    value_or_values = func(trial)
  File "/home/linyuhan/Dokumente/Masterarbeit/dataset/CMAPSS/code/DGP_Yuhan/HPO_DGP.py", line 400, in <lambda>
    metric=mae),
  File "/home/linyuhan/Dokumente/Masterarbeit/dataset/CMAPSS/code/DGP_Yuhan/HPO_DGP.py", line 263, in objective_train_test
    output = model(X_batch)
  File "/home/linyuhan/my_project/venv_CMAPSS/lib64/python3.6/site-packages/gpytorch/module.py", line 30, in __call__
    outputs = self.forward(*inputs, **kwargs)
  File "/home/linyuhan/Dokumente/Masterarbeit/dataset/CMAPSS/code/DGP_Yuhan/src/deep_gp.py", line 145, in forward
    output = layer(output)
  File "/home/linyuhan/Dokumente/Masterarbeit/dataset/CMAPSS/code/DGP_Yuhan/src/deep_gp.py", line 91, in __call__
    return super().__call__(x, are_samples=bool(len(other_inputs)))
  File "/home/linyuhan/my_project/venv_CMAPSS/lib64/python3.6/site-packages/gpytorch/models/deep_gps/deep_gp.py", line 99, in __call__
    output = ApproximateGP.__call__(self, inputs)
  File "/home/linyuhan/my_project/venv_CMAPSS/lib64/python3.6/site-packages/gpytorch/models/approximate_gp.py", line 81, in __call__
    return self.variational_strategy(inputs, prior=prior, **kwargs)
  File "/home/linyuhan/my_project/venv_CMAPSS/lib64/python3.6/site-packages/gpytorch/variational/variational_strategy.py", line 169, in __call__
    return super().__call__(x, prior=prior, **kwargs)
  File "/home/linyuhan/my_project/venv_CMAPSS/lib64/python3.6/site-packages/gpytorch/variational/_variational_strategy.py", line 129, in __call__
    **kwargs,
  File "/home/linyuhan/my_project/venv_CMAPSS/lib64/python3.6/site-packages/gpytorch/module.py", line 30, in __call__
    outputs = self.forward(*inputs, **kwargs)
  File "/home/linyuhan/my_project/venv_CMAPSS/lib64/python3.6/site-packages/gpytorch/variational/variational_strategy.py", line 103, in forward
    L = self._cholesky_factor(induc_induc_covar)
  File "/home/linyuhan/my_project/venv_CMAPSS/lib64/python3.6/site-packages/gpytorch/utils/memoize.py", line 76, in g
    return _add_to_cache_ignore_args(self, cache_name, method(self, *args, **kwargs))
  File "/home/linyuhan/my_project/venv_CMAPSS/lib64/python3.6/site-packages/gpytorch/variational/variational_strategy.py", line 72, in _cholesky_factor
    L = psd_safe_cholesky(delazify(induc_induc_covar).type(_linalg_dtype_cholesky.value()))
  File "/home/linyuhan/my_project/venv_CMAPSS/lib64/python3.6/site-packages/gpytorch/utils/cholesky.py", line 63, in psd_safe_cholesky
    L = _psd_safe_cholesky(A, out=out, jitter=jitter, max_tries=max_tries)
  File "/home/linyuhan/my_project/venv_CMAPSS/lib64/python3.6/site-packages/gpytorch/utils/cholesky.py", line 45, in _psd_safe_cholesky
    raise NotPSDError(f"Matrix not positive definite after repeatedly adding jitter up to {jitter_new:.1e}.")
gpytorch.utils.errors.NotPSDError: Matrix not positive definite after repeatedly adding jitter up to 1.0e-06.
10/400 - Loss: 186.12554931640625 - Score: 40.63766860961914
EarlyStopping counter: 2 out of 15
EarlyStopping counter: 3 out of 15
EarlyStopping counter: 4 out of 15
EarlyStopping counter: 5 out of 15
EarlyStopping counter: 6 out of 15
EarlyStopping counter: 7 out of 15
EarlyStopping counter: 8 out of 15
EarlyStopping counter: 9 out of 15
EarlyStopping counter: 10 out of 15
EarlyStopping counter: 11 out of 15
20/400 - Loss: 143.78643798828125 - Score: 43.39331817626953
EarlyStopping counter: 12 out of 15
EarlyStopping counter: 13 out of 15
EarlyStopping counter: 14 out of 15
EarlyStopping counter: 15 out of 15
Early stopping
Current Configuration: n_gp_layers:1 - n_gp_out: 6 - num_inducing: 484 - num_samples: 11 - batch_size:512 - num_inducing: 484 - lr: 0.0008437992889992047
0/400 - Loss: 16243.4375 - Score: 118.5311508178711
Current Configuration: n_gp_layers:4 - n_gp_out: 2 - num_inducing: 101 - num_samples: 3 - batch_size:1024 - num_inducing: 101 - lr: 0.0007974413177825174
0/400 - Loss: 16407.09375 - Score: 118.55494689941406
Current Configuration: n_gp_layers:3 - n_gp_out: 3 - num_inducing: 75 - num_samples: 5 - batch_size:1024 - num_inducing: 75 - lr: 0.026238740216636743
0/400 - Loss: 12301.5595703125 - Score: 116.63471221923828
Current Configuration: n_gp_layers:4 - n_gp_out: 2 - num_inducing: 132 - num_samples: 15 - batch_size:512 - num_inducing: 132 - lr: 0.004101198340681486
0/400 - Loss: 15121.162109375 - Score: 118.36348724365234
10/400 - Loss: 5850.98193359375 - Score: 94.44070434570312
20/400 - Loss: 2761.918701171875 - Score: 71.97134399414062
30/400 - Loss: 1369.864013671875 - Score: 56.78107452392578
40/400 - Loss: 712.3873901367188 - Score: 47.80815887451172
50/400 - Loss: 422.6778564453125 - Score: 42.879398345947266
Time Budget run out. Pruning Trial
Current Configuration: n_gp_layers:2 - n_gp_out: 2 - num_inducing: 83 - num_samples: 8 - batch_size:512 - num_inducing: 83 - lr: 0.009183640344838952
0/400 - Loss: 13516.6708984375 - Score: 117.7862548828125
Current Configuration: n_gp_layers:3 - n_gp_out: 6 - num_inducing: 144 - num_samples: 15 - batch_size:1024 - num_inducing: 144 - lr: 0.0011788474504491483
0/400 - Loss: 16336.259765625 - Score: 118.54965209960938
Current Configuration: n_gp_layers:3 - n_gp_out: 2 - num_inducing: 94 - num_samples: 5 - batch_size:2048 - num_inducing: 94 - lr: 0.024181949944233245
0/400 - Loss: 14390.109375 - Score: 117.95285034179688
Current Configuration: n_gp_layers:1 - n_gp_out: 3 - num_inducing: 310 - num_samples: 11 - batch_size:1024 - num_inducing: 310 - lr: 0.0846908461538859
0/400 - Loss: 7025.34716796875 - Score: 109.26473999023438
EarlyStopping counter: 1 out of 15
EarlyStopping counter: 1 out of 15
EarlyStopping counter: 2 out of 15
10/400 - Loss: 377.1677551269531 - Score: 37.803165435791016
EarlyStopping counter: 3 out of 15
EarlyStopping counter: 4 out of 15
EarlyStopping counter: 5 out of 15
EarlyStopping counter: 6 out of 15
EarlyStopping counter: 7 out of 15
EarlyStopping counter: 1 out of 15
EarlyStopping counter: 2 out of 15
EarlyStopping counter: 3 out of 15
EarlyStopping counter: 4 out of 15
20/400 - Loss: 208.19769287109375 - Score: 38.00360870361328
EarlyStopping counter: 5 out of 15
EarlyStopping counter: 6 out of 15
EarlyStopping counter: 7 out of 15
EarlyStopping counter: 8 out of 15
EarlyStopping counter: 9 out of 15
EarlyStopping counter: 1 out of 15
30/400 - Loss: 190.16990661621094 - Score: 37.29485321044922
EarlyStopping counter: 2 out of 15
EarlyStopping counter: 3 out of 15
EarlyStopping counter: 4 out of 15
EarlyStopping counter: 5 out of 15
EarlyStopping counter: 6 out of 15
EarlyStopping counter: 7 out of 15
EarlyStopping counter: 8 out of 15
EarlyStopping counter: 9 out of 15
EarlyStopping counter: 10 out of 15
EarlyStopping counter: 11 out of 15
40/400 - Loss: 220.04396057128906 - Score: 37.76364517211914
EarlyStopping counter: 12 out of 15
EarlyStopping counter: 13 out of 15
EarlyStopping counter: 14 out of 15
EarlyStopping counter: 15 out of 15
Early stopping
Current Configuration: n_gp_layers:1 - n_gp_out: 3 - num_inducing: 325 - num_samples: 5 - batch_size:1024 - num_inducing: 325 - lr: 0.08800519297054002
0/400 - Loss: 6936.5185546875 - Score: 110.23934173583984
EarlyStopping counter: 1 out of 15
EarlyStopping counter: 1 out of 15
EarlyStopping counter: 1 out of 15
10/400 - Loss: 316.20184326171875 - Score: 37.6264762878418
EarlyStopping counter: 2 out of 15
EarlyStopping counter: 3 out of 15
EarlyStopping counter: 4 out of 15
EarlyStopping counter: 5 out of 15
EarlyStopping counter: 6 out of 15
EarlyStopping counter: 7 out of 15
EarlyStopping counter: 8 out of 15
EarlyStopping counter: 9 out of 15
EarlyStopping counter: 10 out of 15
EarlyStopping counter: 11 out of 15
20/400 - Loss: 283.6768493652344 - Score: 38.25891876220703
EarlyStopping counter: 1 out of 15
EarlyStopping counter: 2 out of 15
EarlyStopping counter: 3 out of 15
EarlyStopping counter: 4 out of 15
EarlyStopping counter: 5 out of 15
EarlyStopping counter: 6 out of 15
Current Configuration: n_gp_layers:1 - n_gp_out: 4 - num_inducing: 380 - num_samples: 2 - batch_size:1024 - num_inducing: 380 - lr: 0.05244317979104497
0/400 - Loss: 9474.978515625 - Score: 114.14794158935547
10/400 - Loss: 338.547119140625 - Score: 37.32309341430664
EarlyStopping counter: 1 out of 15
EarlyStopping counter: 2 out of 15
EarlyStopping counter: 3 out of 15
EarlyStopping counter: 4 out of 15
EarlyStopping counter: 5 out of 15
EarlyStopping counter: 6 out of 15
EarlyStopping counter: 7 out of 15
EarlyStopping counter: 8 out of 15
EarlyStopping counter: 1 out of 15
20/400 - Loss: 282.7290954589844 - Score: 37.31944274902344
EarlyStopping counter: 2 out of 15
EarlyStopping counter: 3 out of 15
EarlyStopping counter: 4 out of 15
EarlyStopping counter: 5 out of 15
EarlyStopping counter: 6 out of 15
EarlyStopping counter: 7 out of 15
EarlyStopping counter: 8 out of 15
EarlyStopping counter: 9 out of 15
EarlyStopping counter: 10 out of 15
EarlyStopping counter: 11 out of 15
30/400 - Loss: 170.05850219726562 - Score: 37.104793548583984
EarlyStopping counter: 12 out of 15
EarlyStopping counter: 13 out of 15
EarlyStopping counter: 14 out of 15
EarlyStopping counter: 15 out of 15
Early stopping
Current Configuration: n_gp_layers:1 - n_gp_out: 4 - num_inducing: 460 - num_samples: 12 - batch_size:2048 - num_inducing: 460 - lr: 0.0497599000884628
0/400 - Loss: 12463.2294921875 - Score: 116.94493865966797
EarlyStopping counter: 1 out of 15
Current Configuration: n_gp_layers:1 - n_gp_out: 1 - num_inducing: 610 - num_samples: 2 - batch_size:512 - num_inducing: 610 - lr: 0.01880717582430647
0/400 - Loss: 11095.07421875 - Score: 116.19927978515625
Traceback (most recent call last):
  File "/home/linyuhan/Dokumente/Masterarbeit/dataset/CMAPSS/code/DGP_Yuhan/experiment.py", line 30, in <module>
    time_tolerance=time_tolerance)
  File "/home/linyuhan/Dokumente/Masterarbeit/dataset/CMAPSS/code/DGP_Yuhan/HPO_DGP.py", line 401, in HPO_DGP
    n_trials=n_trials)  # n_trials=N_TRIALS
  File "/home/linyuhan/my_project/venv_CMAPSS/lib64/python3.6/site-packages/optuna/study/study.py", line 428, in optimize
    show_progress_bar=show_progress_bar,
  File "/home/linyuhan/my_project/venv_CMAPSS/lib64/python3.6/site-packages/optuna/study/_optimize.py", line 76, in _optimize
    progress_bar=progress_bar,
  File "/home/linyuhan/my_project/venv_CMAPSS/lib64/python3.6/site-packages/optuna/study/_optimize.py", line 160, in _optimize_sequential
    frozen_trial = _run_trial(study, func, catch)
  File "/home/linyuhan/my_project/venv_CMAPSS/lib64/python3.6/site-packages/optuna/study/_optimize.py", line 234, in _run_trial
    raise func_err
  File "/home/linyuhan/my_project/venv_CMAPSS/lib64/python3.6/site-packages/optuna/study/_optimize.py", line 196, in _run_trial
    value_or_values = func(trial)
  File "/home/linyuhan/Dokumente/Masterarbeit/dataset/CMAPSS/code/DGP_Yuhan/HPO_DGP.py", line 400, in <lambda>
    metric=mae),
  File "/home/linyuhan/Dokumente/Masterarbeit/dataset/CMAPSS/code/DGP_Yuhan/HPO_DGP.py", line 263, in objective_train_test
    output = model(X_batch)
  File "/home/linyuhan/my_project/venv_CMAPSS/lib64/python3.6/site-packages/gpytorch/module.py", line 30, in __call__
    outputs = self.forward(*inputs, **kwargs)
  File "/home/linyuhan/Dokumente/Masterarbeit/dataset/CMAPSS/code/DGP_Yuhan/src/deep_gp.py", line 145, in forward
    output = layer(output)
  File "/home/linyuhan/Dokumente/Masterarbeit/dataset/CMAPSS/code/DGP_Yuhan/src/deep_gp.py", line 91, in __call__
    return super().__call__(x, are_samples=bool(len(other_inputs)))
  File "/home/linyuhan/my_project/venv_CMAPSS/lib64/python3.6/site-packages/gpytorch/models/deep_gps/deep_gp.py", line 99, in __call__
    output = ApproximateGP.__call__(self, inputs)
  File "/home/linyuhan/my_project/venv_CMAPSS/lib64/python3.6/site-packages/gpytorch/models/approximate_gp.py", line 81, in __call__
    return self.variational_strategy(inputs, prior=prior, **kwargs)
  File "/home/linyuhan/my_project/venv_CMAPSS/lib64/python3.6/site-packages/gpytorch/variational/variational_strategy.py", line 169, in __call__
    return super().__call__(x, prior=prior, **kwargs)
  File "/home/linyuhan/my_project/venv_CMAPSS/lib64/python3.6/site-packages/gpytorch/variational/_variational_strategy.py", line 129, in __call__
    **kwargs,
  File "/home/linyuhan/my_project/venv_CMAPSS/lib64/python3.6/site-packages/gpytorch/module.py", line 30, in __call__
    outputs = self.forward(*inputs, **kwargs)
  File "/home/linyuhan/my_project/venv_CMAPSS/lib64/python3.6/site-packages/gpytorch/variational/variational_strategy.py", line 103, in forward
    L = self._cholesky_factor(induc_induc_covar)
  File "/home/linyuhan/my_project/venv_CMAPSS/lib64/python3.6/site-packages/gpytorch/utils/memoize.py", line 76, in g
    return _add_to_cache_ignore_args(self, cache_name, method(self, *args, **kwargs))
  File "/home/linyuhan/my_project/venv_CMAPSS/lib64/python3.6/site-packages/gpytorch/variational/variational_strategy.py", line 72, in _cholesky_factor
    L = psd_safe_cholesky(delazify(induc_induc_covar).type(_linalg_dtype_cholesky.value()))
  File "/home/linyuhan/my_project/venv_CMAPSS/lib64/python3.6/site-packages/gpytorch/utils/cholesky.py", line 63, in psd_safe_cholesky
    L = _psd_safe_cholesky(A, out=out, jitter=jitter, max_tries=max_tries)
  File "/home/linyuhan/my_project/venv_CMAPSS/lib64/python3.6/site-packages/gpytorch/utils/cholesky.py", line 45, in _psd_safe_cholesky
    raise NotPSDError(f"Matrix not positive definite after repeatedly adding jitter up to {jitter_new:.1e}.")
gpytorch.utils.errors.NotPSDError: Matrix not positive definite after repeatedly adding jitter up to 1.0e-06.
[32m[I 2023-06-13 03:33:25,074][0m Trial 18 finished with value: 36.90489959716797 and parameters: {'lr': 0.04046915447575169, 'batch_size': 1024, 'num_inducing': 602, 'num_samples': 12, 'kernel_type': 'matern0.5', 'n_gp_layers': 1, 'n_gp_out': 4}. Best is trial 18 with value: 36.90489959716797.[0m
[32m[I 2023-06-13 03:36:59,652][0m Trial 19 pruned. [0m
[32m[I 2023-06-13 03:48:56,491][0m Trial 23 finished with value: 41.694679260253906 and parameters: {'lr': 0.08624047729563256, 'batch_size': 512, 'num_inducing': 410, 'num_samples': 14, 'kernel_type': 'matern1.5', 'n_gp_layers': 4, 'n_gp_out': 3}. Best is trial 15 with value: 37.577857971191406.[0m
[32m[I 2023-06-13 04:12:08,459][0m Trial 20 pruned. [0m
[32m[I 2023-06-13 04:13:17,254][0m Trial 21 pruned. [0m
[32m[I 2023-06-13 04:15:39,157][0m Trial 22 pruned. [0m
[32m[I 2023-06-13 04:16:17,414][0m Trial 23 pruned. [0m
[32m[I 2023-06-13 04:57:43,942][0m Trial 24 finished with value: 118.56049346923828 and parameters: {'lr': 0.0011048815595595027, 'batch_size': 2048, 'num_inducing': 581, 'num_samples': 12, 'kernel_type': 'matern1.5', 'n_gp_layers': 3, 'n_gp_out': 2}. Best is trial 15 with value: 37.577857971191406.[0m
[32m[I 2023-06-13 04:59:25,623][0m Trial 25 pruned. [0m
[32m[I 2023-06-13 05:00:23,117][0m Trial 26 pruned. [0m
[32m[I 2023-06-13 05:03:00,566][0m Trial 24 pruned. [0m
[32m[I 2023-06-13 05:07:09,504][0m Trial 25 pruned. [0m
[32m[I 2023-06-13 05:16:31,567][0m Trial 27 pruned. [0m
[32m[I 2023-06-13 05:55:07,383][0m Trial 26 pruned. [0m
[32m[I 2023-06-13 06:06:31,432][0m Trial 27 pruned. [0m
[32m[I 2023-06-13 06:09:58,646][0m Trial 28 pruned. [0m
[32m[I 2023-06-13 06:16:41,529][0m Trial 28 finished with value: 37.96625518798828 and parameters: {'lr': 0.00296705139816177, 'batch_size': 512, 'num_inducing': 105, 'num_samples': 15, 'kernel_type': 'matern1.5', 'n_gp_layers': 1, 'n_gp_out': 1}. Best is trial 15 with value: 37.577857971191406.[0m
[32m[I 2023-06-13 07:10:22,084][0m Trial 29 finished with value: 53.22675704956055 and parameters: {'lr': 0.012921723287923906, 'batch_size': 2048, 'num_inducing': 50, 'num_samples': 8, 'kernel_type': 'matern0.5', 'n_gp_layers': 3, 'n_gp_out': 2}. Best is trial 18 with value: 36.90489959716797.[0m
[32m[I 2023-06-13 07:18:09,842][0m Trial 30 finished with value: 37.67537307739258 and parameters: {'lr': 0.03776051191061001, 'batch_size': 512, 'num_inducing': 103, 'num_samples': 9, 'kernel_type': 'matern1.5', 'n_gp_layers': 1, 'n_gp_out': 1}. Best is trial 18 with value: 36.90489959716797.[0m
[32m[I 2023-06-13 07:18:53,168][0m Trial 31 pruned. [0m
[32m[I 2023-06-13 07:26:01,084][0m Trial 32 pruned. [0m
[32m[I 2023-06-13 07:37:20,582][0m Trial 29 finished with value: 118.51107025146484 and parameters: {'lr': 0.0027708492095716397, 'batch_size': 2048, 'num_inducing': 348, 'num_samples': 15, 'kernel_type': 'rbf', 'n_gp_layers': 2, 'n_gp_out': 5}. Best is trial 15 with value: 37.577857971191406.[0m
[32m[I 2023-06-13 07:39:12,100][0m Trial 33 pruned. [0m
[32m[I 2023-06-13 08:31:01,572][0m Trial 30 pruned. [0m
[32m[I 2023-06-13 08:43:04,474][0m Trial 31 finished with value: 36.95566177368164 and parameters: {'lr': 0.04226454854439315, 'batch_size': 1024, 'num_inducing': 154, 'num_samples': 3, 'kernel_type': 'matern1.5', 'n_gp_layers': 1, 'n_gp_out': 5}. Best is trial 31 with value: 36.95566177368164.[0m
[32m[I 2023-06-13 08:55:30,380][0m Trial 34 finished with value: 47.31935119628906 and parameters: {'lr': 0.09950491896378591, 'batch_size': 1024, 'num_inducing': 349, 'num_samples': 15, 'kernel_type': 'matern0.5', 'n_gp_layers': 4, 'n_gp_out': 5}. Best is trial 18 with value: 36.90489959716797.[0m
[32m[I 2023-06-13 08:59:06,759][0m Trial 35 pruned. [0m
[32m[I 2023-06-13 09:16:10,822][0m Trial 36 pruned. [0m
[32m[I 2023-06-13 09:19:37,147][0m Trial 37 pruned. [0m
[32m[I 2023-06-13 09:23:17,851][0m Trial 38 pruned. [0m
[32m[I 2023-06-13 09:26:43,371][0m Trial 39 pruned. [0m
[32m[I 2023-06-13 09:33:16,957][0m Trial 32 pruned. [0m
[32m[I 2023-06-13 09:35:13,469][0m Trial 40 pruned. [0m
