The job has begun
[32m[I 2023-06-12 17:26:14,474][0m A new study created in memory with name: DGP 2023-06-12[0m
[32m[I 2023-06-12 17:26:14,474][0m A new study created in memory with name: DGP 2023-06-12[0m
[32m[I 2023-06-12 17:26:14,474][0m A new study created in memory with name: DGP 2023-06-12[0m
[32m[I 2023-06-12 17:26:14,475][0m A new study created in memory with name: DGP 2023-06-12[0m
[32m[I 2023-06-12 17:26:14,475][0m A new study created in memory with name: DGP 2023-06-12[0m
[32m[I 2023-06-12 17:26:14,475][0m A new study created in memory with name: DGP 2023-06-12[0m
[32m[I 2023-06-12 17:26:14,475][0m A new study created in memory with name: DGP 2023-06-12[0m
[32m[I 2023-06-12 17:26:14,475][0m A new study created in memory with name: DGP 2023-06-12[0m
[32m[I 2023-06-12 17:26:14,475][0m A new study created in memory with name: DGP 2023-06-12[0m
[32m[I 2023-06-12 17:26:14,475][0m A new study created in memory with name: DGP 2023-06-12[0m
[32m[I 2023-06-12 17:26:14,475][0m A new study created in memory with name: DGP 2023-06-12[0m
[32m[I 2023-06-12 17:26:14,475][0m A new study created in memory with name: DGP 2023-06-12[0m
[32m[I 2023-06-12 17:26:14,476][0m A new study created in memory with name: DGP 2023-06-12[0m
[32m[I 2023-06-12 17:26:14,476][0m A new study created in memory with name: DGP 2023-06-12[0m
[32m[I 2023-06-12 17:26:14,476][0m A new study created in memory with name: DGP 2023-06-12[0m
[32m[I 2023-06-12 17:26:14,476][0m A new study created in memory with name: DGP 2023-06-12[0m
[32m[I 2023-06-12 18:08:58,170][0m Trial 0 finished with value: 38.17227554321289 and parameters: {'lr': 0.01, 'batch_size': 1024, 'num_inducing': 128, 'num_samples': 10, 'kernel_type': 'rbf', 'n_gp_layers': 2, 'n_gp_out': 1}. Best is trial 0 with value: 38.17227554321289.[0m
[32m[I 2023-06-12 18:10:45,116][0m Trial 1 pruned. [0m
[32m[I 2023-06-12 18:12:28,144][0m Trial 2 pruned. [0m
[32m[I 2023-06-12 18:26:18,092][0m Trial 0 finished with value: 37.90920639038086 and parameters: {'lr': 0.01, 'batch_size': 1024, 'num_inducing': 128, 'num_samples': 10, 'kernel_type': 'rbf', 'n_gp_layers': 2, 'n_gp_out': 1}. Best is trial 0 with value: 37.90920639038086.[0m
[32m[I 2023-06-12 18:26:18,606][0m Trial 0 finished with value: 37.98957824707031 and parameters: {'lr': 0.01, 'batch_size': 1024, 'num_inducing': 128, 'num_samples': 10, 'kernel_type': 'rbf', 'n_gp_layers': 2, 'n_gp_out': 1}. Best is trial 0 with value: 37.98957824707031.[0m
[32m[I 2023-06-12 18:26:20,815][0m Trial 0 finished with value: 37.70381546020508 and parameters: {'lr': 0.01, 'batch_size': 1024, 'num_inducing': 128, 'num_samples': 10, 'kernel_type': 'rbf', 'n_gp_layers': 2, 'n_gp_out': 1}. Best is trial 0 with value: 37.70381546020508.[0m
[32m[I 2023-06-12 18:26:22,345][0m Trial 0 finished with value: 37.85197830200195 and parameters: {'lr': 0.01, 'batch_size': 1024, 'num_inducing': 128, 'num_samples': 10, 'kernel_type': 'rbf', 'n_gp_layers': 2, 'n_gp_out': 1}. Best is trial 0 with value: 37.85197830200195.[0m
[32m[I 2023-06-12 18:26:23,243][0m Trial 0 finished with value: 37.79494857788086 and parameters: {'lr': 0.01, 'batch_size': 1024, 'num_inducing': 128, 'num_samples': 10, 'kernel_type': 'rbf', 'n_gp_layers': 2, 'n_gp_out': 1}. Best is trial 0 with value: 37.79494857788086.[0m
[32m[I 2023-06-12 18:26:27,349][0m Trial 0 finished with value: 37.545196533203125 and parameters: {'lr': 0.01, 'batch_size': 1024, 'num_inducing': 128, 'num_samples': 10, 'kernel_type': 'rbf', 'n_gp_layers': 2, 'n_gp_out': 1}. Best is trial 0 with value: 37.545196533203125.[0m
[32m[I 2023-06-12 18:26:29,026][0m Trial 0 finished with value: 37.55686569213867 and parameters: {'lr': 0.01, 'batch_size': 1024, 'num_inducing': 128, 'num_samples': 10, 'kernel_type': 'rbf', 'n_gp_layers': 2, 'n_gp_out': 1}. Best is trial 0 with value: 37.55686569213867.[0m
[32m[I 2023-06-12 18:26:29,679][0m Trial 0 finished with value: 37.82093811035156 and parameters: {'lr': 0.01, 'batch_size': 1024, 'num_inducing': 128, 'num_samples': 10, 'kernel_type': 'rbf', 'n_gp_layers': 2, 'n_gp_out': 1}. Best is trial 0 with value: 37.82093811035156.[0m
[32m[I 2023-06-12 18:26:30,736][0m Trial 0 finished with value: 37.304439544677734 and parameters: {'lr': 0.01, 'batch_size': 1024, 'num_inducing': 128, 'num_samples': 10, 'kernel_type': 'rbf', 'n_gp_layers': 2, 'n_gp_out': 1}. Best is trial 0 with value: 37.304439544677734.[0m
[32m[I 2023-06-12 18:26:31,889][0m Trial 0 finished with value: 38.12601852416992 and parameters: {'lr': 0.01, 'batch_size': 1024, 'num_inducing': 128, 'num_samples': 10, 'kernel_type': 'rbf', 'n_gp_layers': 2, 'n_gp_out': 1}. Best is trial 0 with value: 38.12601852416992.[0m
[32m[I 2023-06-12 18:26:34,174][0m Trial 0 finished with value: 37.804405212402344 and parameters: {'lr': 0.01, 'batch_size': 1024, 'num_inducing': 128, 'num_samples': 10, 'kernel_type': 'rbf', 'n_gp_layers': 2, 'n_gp_out': 1}. Best is trial 0 with value: 37.804405212402344.[0m
[32m[I 2023-06-12 18:26:35,568][0m Trial 0 finished with value: 37.77363586425781 and parameters: {'lr': 0.01, 'batch_size': 1024, 'num_inducing': 128, 'num_samples': 10, 'kernel_type': 'rbf', 'n_gp_layers': 2, 'n_gp_out': 1}. Best is trial 0 with value: 37.77363586425781.[0m
[32m[I 2023-06-12 18:26:36,538][0m Trial 0 finished with value: 38.560447692871094 and parameters: {'lr': 0.01, 'batch_size': 1024, 'num_inducing': 128, 'num_samples': 10, 'kernel_type': 'rbf', 'n_gp_layers': 2, 'n_gp_out': 1}. Best is trial 0 with value: 38.560447692871094.[0m
[32m[I 2023-06-12 18:26:37,442][0m Trial 0 finished with value: 37.92942428588867 and parameters: {'lr': 0.01, 'batch_size': 1024, 'num_inducing': 128, 'num_samples': 10, 'kernel_type': 'rbf', 'n_gp_layers': 2, 'n_gp_out': 1}. Best is trial 0 with value: 37.92942428588867.[0m
slurmstepd: error: Detected 1 oom-kill event(s) in StepId=1083028.0 cgroup. Some of your processes may have been killed by the cgroup out-of-memory handler.
srun: error: paris1: task 10: Out Of Memory
[32m[I 2023-06-12 18:26:41,783][0m Trial 0 finished with value: 38.06056594848633 and parameters: {'lr': 0.01, 'batch_size': 1024, 'num_inducing': 128, 'num_samples': 10, 'kernel_type': 'rbf', 'n_gp_layers': 2, 'n_gp_out': 1}. Best is trial 0 with value: 38.06056594848633.[0m
[32m[I 2023-06-12 18:31:16,834][0m Trial 1 pruned. [0m
[32m[I 2023-06-12 18:35:13,276][0m Trial 2 pruned. [0m
[32m[I 2023-06-12 18:38:13,824][0m Trial 1 finished with value: 37.58218002319336 and parameters: {'lr': 0.04729338216636208, 'batch_size': 512, 'num_inducing': 195, 'num_samples': 4, 'kernel_type': 'matern1.5', 'n_gp_layers': 1, 'n_gp_out': 1}. Best is trial 1 with value: 37.58218002319336.[0m
[32m[I 2023-06-12 18:39:37,768][0m Trial 1 pruned. [0m
[32m[I 2023-06-12 18:40:07,983][0m Trial 2 pruned. [0m
[32m[I 2023-06-12 18:40:16,947][0m Trial 3 pruned. [0m
[32m[I 2023-06-12 18:43:16,191][0m Trial 2 pruned. [0m
[32m[I 2023-06-12 18:43:23,198][0m Trial 1 finished with value: 37.265811920166016 and parameters: {'lr': 0.0660968541540321, 'batch_size': 2048, 'num_inducing': 89, 'num_samples': 10, 'kernel_type': 'rbf', 'n_gp_layers': 1, 'n_gp_out': 2}. Best is trial 1 with value: 37.265811920166016.[0m
[32m[I 2023-06-12 18:48:32,077][0m Trial 1 finished with value: 37.78729248046875 and parameters: {'lr': 0.0555442770834226, 'batch_size': 512, 'num_inducing': 166, 'num_samples': 14, 'kernel_type': 'matern0.5', 'n_gp_layers': 1, 'n_gp_out': 1}. Best is trial 1 with value: 37.78729248046875.[0m
[32m[I 2023-06-12 18:50:45,089][0m Trial 1 finished with value: 37.39690017700195 and parameters: {'lr': 0.01069747257706085, 'batch_size': 1024, 'num_inducing': 158, 'num_samples': 4, 'kernel_type': 'rbf', 'n_gp_layers': 1, 'n_gp_out': 5}. Best is trial 1 with value: 37.39690017700195.[0m
[32m[I 2023-06-12 18:55:38,719][0m Trial 2 pruned. [0m
[32m[I 2023-06-12 18:57:45,160][0m Trial 1 finished with value: 36.760799407958984 and parameters: {'lr': 0.03230738965178223, 'batch_size': 1024, 'num_inducing': 277, 'num_samples': 6, 'kernel_type': 'rbf', 'n_gp_layers': 1, 'n_gp_out': 6}. Best is trial 1 with value: 36.760799407958984.[0m
[32m[I 2023-06-12 19:02:31,032][0m Trial 4 finished with value: 37.21852111816406 and parameters: {'lr': 0.03220710772728541, 'batch_size': 1024, 'num_inducing': 78, 'num_samples': 11, 'kernel_type': 'matern1.5', 'n_gp_layers': 1, 'n_gp_out': 4}. Best is trial 4 with value: 37.21852111816406.[0m
[32m[I 2023-06-12 19:14:39,216][0m Trial 3 finished with value: 37.44314193725586 and parameters: {'lr': 0.031048572767630418, 'batch_size': 1024, 'num_inducing': 659, 'num_samples': 15, 'kernel_type': 'matern0.5', 'n_gp_layers': 1, 'n_gp_out': 5}. Best is trial 3 with value: 37.44314193725586.[0m
[32m[I 2023-06-12 19:20:53,009][0m Trial 3 finished with value: 37.525611877441406 and parameters: {'lr': 0.009351728912121783, 'batch_size': 512, 'num_inducing': 385, 'num_samples': 9, 'kernel_type': 'matern1.5', 'n_gp_layers': 1, 'n_gp_out': 2}. Best is trial 3 with value: 37.525611877441406.[0m
[32m[I 2023-06-12 19:23:35,129][0m Trial 3 pruned. [0m
[32m[I 2023-06-12 19:26:30,932][0m Trial 1 finished with value: 38.294349670410156 and parameters: {'lr': 0.007987353252504565, 'batch_size': 2048, 'num_inducing': 68, 'num_samples': 8, 'kernel_type': 'rbf', 'n_gp_layers': 1, 'n_gp_out': 6}. Best is trial 0 with value: 37.90920639038086.[0m
[32m[I 2023-06-12 19:26:50,356][0m Trial 1 finished with value: 37.736331939697266 and parameters: {'lr': 0.0077083125917856935, 'batch_size': 1024, 'num_inducing': 375, 'num_samples': 4, 'kernel_type': 'matern1.5', 'n_gp_layers': 1, 'n_gp_out': 3}. Best is trial 1 with value: 37.736331939697266.[0m
[32m[I 2023-06-12 19:27:01,674][0m Trial 1 finished with value: 67.71727752685547 and parameters: {'lr': 0.006652497426893072, 'batch_size': 2048, 'num_inducing': 50, 'num_samples': 14, 'kernel_type': 'rbf', 'n_gp_layers': 2, 'n_gp_out': 2}. Best is trial 0 with value: 37.92942428588867.[0m
[32m[I 2023-06-12 19:27:12,829][0m Trial 1 finished with value: 37.933349609375 and parameters: {'lr': 0.009620458665835267, 'batch_size': 512, 'num_inducing': 75, 'num_samples': 13, 'kernel_type': 'matern1.5', 'n_gp_layers': 2, 'n_gp_out': 4}. Best is trial 0 with value: 37.55686569213867.[0m
[32m[I 2023-06-12 19:27:39,563][0m Trial 1 finished with value: 113.21566009521484 and parameters: {'lr': 0.0014946769748262624, 'batch_size': 2048, 'num_inducing': 633, 'num_samples': 3, 'kernel_type': 'matern0.5', 'n_gp_layers': 1, 'n_gp_out': 1}. Best is trial 0 with value: 37.77363586425781.[0m
[32m[I 2023-06-12 19:28:04,112][0m Trial 4 pruned. [0m
[32m[I 2023-06-12 19:28:23,842][0m Trial 2 pruned. [0m
[32m[I 2023-06-12 19:32:42,785][0m Trial 1 finished with value: 118.52850341796875 and parameters: {'lr': 0.00045754546576201393, 'batch_size': 1024, 'num_inducing': 167, 'num_samples': 7, 'kernel_type': 'matern0.5', 'n_gp_layers': 4, 'n_gp_out': 5}. Best is trial 0 with value: 37.70381546020508.[0m
[32m[I 2023-06-12 19:40:15,989][0m Trial 3 finished with value: 61.81217956542969 and parameters: {'lr': 0.0012126114273368056, 'batch_size': 512, 'num_inducing': 57, 'num_samples': 13, 'kernel_type': 'rbf', 'n_gp_layers': 2, 'n_gp_out': 3}. Best is trial 1 with value: 37.58218002319336.[0m
[32m[I 2023-06-12 19:40:19,697][0m Trial 1 finished with value: 118.09937286376953 and parameters: {'lr': 0.0012485835973172722, 'batch_size': 512, 'num_inducing': 312, 'num_samples': 9, 'kernel_type': 'rbf', 'n_gp_layers': 3, 'n_gp_out': 3}. Best is trial 0 with value: 37.82093811035156.[0m
[32m[I 2023-06-12 19:41:39,008][0m Trial 4 pruned. [0m
[32m[I 2023-06-12 19:43:31,828][0m Trial 5 pruned. [0m
Current Configuration: n_gp_layers:2 - n_gp_out: 1 - num_inducing: 128 - num_samples: 10 - batch_size:1024 - num_inducing: 128 - lr: 0.01
0/400 - Loss: 14739.40625 - Score: 118.03807067871094
10/400 - Loss: 5500.5009765625 - Score: 98.13961791992188
20/400 - Loss: 2697.7041015625 - Score: 76.47760009765625
30/400 - Loss: 1414.457275390625 - Score: 60.63058853149414
40/400 - Loss: 781.6567993164062 - Score: 50.856117248535156
50/400 - Loss: 478.193115234375 - Score: 45.01457214355469
EarlyStopping counter: 1 out of 15
60/400 - Loss: 329.9231872558594 - Score: 42.03761672973633
EarlyStopping counter: 1 out of 15
EarlyStopping counter: 2 out of 15
EarlyStopping counter: 1 out of 15
EarlyStopping counter: 1 out of 15
EarlyStopping counter: 1 out of 15
70/400 - Loss: 262.984619140625 - Score: 40.36675262451172
EarlyStopping counter: 1 out of 15
EarlyStopping counter: 1 out of 15
EarlyStopping counter: 2 out of 15
EarlyStopping counter: 1 out of 15
EarlyStopping counter: 2 out of 15
EarlyStopping counter: 3 out of 15
80/400 - Loss: 223.10018920898438 - Score: 39.909950256347656
EarlyStopping counter: 1 out of 15
EarlyStopping counter: 2 out of 15
EarlyStopping counter: 1 out of 15
EarlyStopping counter: 2 out of 15
EarlyStopping counter: 3 out of 15
EarlyStopping counter: 4 out of 15
EarlyStopping counter: 5 out of 15
90/400 - Loss: 189.18109130859375 - Score: 39.3105354309082
EarlyStopping counter: 6 out of 15
EarlyStopping counter: 1 out of 15
EarlyStopping counter: 1 out of 15
EarlyStopping counter: 2 out of 15
EarlyStopping counter: 3 out of 15
EarlyStopping counter: 4 out of 15
EarlyStopping counter: 1 out of 15
100/400 - Loss: 167.74710083007812 - Score: 38.76168441772461
EarlyStopping counter: 1 out of 15
EarlyStopping counter: 2 out of 15
EarlyStopping counter: 1 out of 15
EarlyStopping counter: 1 out of 15
EarlyStopping counter: 2 out of 15
EarlyStopping counter: 3 out of 15
EarlyStopping counter: 4 out of 15
110/400 - Loss: 147.6352996826172 - Score: 38.20804977416992
EarlyStopping counter: 1 out of 15
EarlyStopping counter: 2 out of 15
EarlyStopping counter: 3 out of 15
EarlyStopping counter: 1 out of 15
EarlyStopping counter: 2 out of 15
EarlyStopping counter: 3 out of 15
EarlyStopping counter: 4 out of 15
EarlyStopping counter: 5 out of 15
120/400 - Loss: 149.80825805664062 - Score: 38.50832748413086
EarlyStopping counter: 6 out of 15
EarlyStopping counter: 7 out of 15
EarlyStopping counter: 8 out of 15
EarlyStopping counter: 9 out of 15
EarlyStopping counter: 1 out of 15
EarlyStopping counter: 2 out of 15
EarlyStopping counter: 3 out of 15
EarlyStopping counter: 4 out of 15
130/400 - Loss: 129.705322265625 - Score: 37.90888595581055
EarlyStopping counter: 5 out of 15
EarlyStopping counter: 6 out of 15
EarlyStopping counter: 7 out of 15
Time Budget run out. Pruning Trial
Current Configuration: n_gp_layers:4 - n_gp_out: 3 - num_inducing: 69 - num_samples: 8 - batch_size:2048 - num_inducing: 69 - lr: 0.00045620258330781037
0/400 - Loss: 16514.435546875 - Score: 118.5660400390625
Current Configuration: n_gp_layers:1 - n_gp_out: 1 - num_inducing: 392 - num_samples: 12 - batch_size:1024 - num_inducing: 392 - lr: 0.003710056138013894
0/400 - Loss: 15864.30859375 - Score: 118.439453125
Current Configuration: n_gp_layers:1 - n_gp_out: 2 - num_inducing: 385 - num_samples: 9 - batch_size:512 - num_inducing: 385 - lr: 0.009351728912121783
0/400 - Loss: 13391.908203125 - Score: 117.2795181274414
10/400 - Loss: 1499.9942626953125 - Score: 56.474327087402344
20/400 - Loss: 332.0753479003906 - Score: 40.12175750732422
30/400 - Loss: 235.6407012939453 - Score: 37.94082260131836
EarlyStopping counter: 1 out of 15
EarlyStopping counter: 1 out of 15
EarlyStopping counter: 2 out of 15
EarlyStopping counter: 1 out of 15
EarlyStopping counter: 2 out of 15
EarlyStopping counter: 3 out of 15
40/400 - Loss: 213.83111572265625 - Score: 37.61728286743164
EarlyStopping counter: 4 out of 15
EarlyStopping counter: 5 out of 15
EarlyStopping counter: 6 out of 15
EarlyStopping counter: 7 out of 15
EarlyStopping counter: 8 out of 15
EarlyStopping counter: 9 out of 15
EarlyStopping counter: 10 out of 15
EarlyStopping counter: 11 out of 15
EarlyStopping counter: 12 out of 15
EarlyStopping counter: 13 out of 15
50/400 - Loss: 239.25140380859375 - Score: 38.21388244628906
EarlyStopping counter: 14 out of 15
EarlyStopping counter: 15 out of 15
Early stopping
Current Configuration: n_gp_layers:3 - n_gp_out: 1 - num_inducing: 59 - num_samples: 2 - batch_size:2048 - num_inducing: 59 - lr: 0.015704829937141285
0/400 - Loss: 15101.84765625 - Score: 118.22010803222656
10/400 - Loss: 6816.36328125 - Score: 107.91291809082031
20/400 - Loss: 4066.712890625 - Score: 95.17263793945312
30/400 - Loss: 2641.52587890625 - Score: 81.24655151367188
40/400 - Loss: 1768.8182373046875 - Score: 69.89246368408203
50/400 - Loss: 1200.078857421875 - Score: 60.82554626464844
60/400 - Loss: 839.19970703125 - Score: 54.23422622680664
70/400 - Loss: 585.71826171875 - Score: 49.241233825683594
80/400 - Loss: 428.16046142578125 - Score: 45.799156188964844
EarlyStopping counter: 1 out of 15
90/400 - Loss: 326.220947265625 - Score: 43.08901596069336
100/400 - Loss: 269.40594482421875 - Score: 41.72488784790039
EarlyStopping counter: 1 out of 15
EarlyStopping counter: 2 out of 15
EarlyStopping counter: 1 out of 15
EarlyStopping counter: 2 out of 15
EarlyStopping counter: 1 out of 15
110/400 - Loss: 234.71556091308594 - Score: 41.05886459350586
EarlyStopping counter: 1 out of 15
EarlyStopping counter: 2 out of 15
EarlyStopping counter: 3 out of 15
EarlyStopping counter: 4 out of 15
EarlyStopping counter: 5 out of 15
EarlyStopping counter: 6 out of 15
EarlyStopping counter: 1 out of 15
120/400 - Loss: 196.95509338378906 - Score: 40.16946029663086
EarlyStopping counter: 2 out of 15
EarlyStopping counter: 3 out of 15
EarlyStopping counter: 4 out of 15
EarlyStopping counter: 1 out of 15
EarlyStopping counter: 2 out of 15
EarlyStopping counter: 3 out of 15
EarlyStopping counter: 4 out of 15
EarlyStopping counter: 5 out of 15
130/400 - Loss: 184.9036102294922 - Score: 39.70649719238281
EarlyStopping counter: 6 out of 15
EarlyStopping counter: 1 out of 15
EarlyStopping counter: 2 out of 15
EarlyStopping counter: 3 out of 15
EarlyStopping counter: 1 out of 15
EarlyStopping counter: 2 out of 15
140/400 - Loss: 162.5740203857422 - Score: 39.0279426574707
EarlyStopping counter: 1 out of 15
EarlyStopping counter: 1 out of 15
EarlyStopping counter: 1 out of 15
EarlyStopping counter: 2 out of 15
EarlyStopping counter: 3 out of 15
EarlyStopping counter: 1 out of 15
150/400 - Loss: 140.58509826660156 - Score: 38.71320724487305
EarlyStopping counter: 2 out of 15
EarlyStopping counter: 3 out of 15
EarlyStopping counter: 4 out of 15
EarlyStopping counter: 5 out of 15
EarlyStopping counter: 6 out of 15
EarlyStopping counter: 7 out of 15
EarlyStopping counter: 8 out of 15
EarlyStopping counter: 9 out of 15
EarlyStopping counter: 10 out of 15
EarlyStopping counter: 11 out of 15
160/400 - Loss: 168.388671875 - Score: 39.67409896850586
EarlyStopping counter: 12 out of 15
EarlyStopping counter: 1 out of 15
EarlyStopping counter: 2 out of 15
EarlyStopping counter: 3 out of 15
EarlyStopping counter: 1 out of 15
EarlyStopping counter: 2 out of 15
EarlyStopping counter: 3 out of 15
EarlyStopping counter: 4 out of 15
170/400 - Loss: 133.11692810058594 - Score: 38.479469299316406
EarlyStopping counter: 5 out of 15
EarlyStopping counter: 6 out of 15
EarlyStopping counter: 7 out of 15
EarlyStopping counter: 8 out of 15
EarlyStopping counter: 9 out of 15
EarlyStopping counter: 10 out of 15
EarlyStopping counter: 11 out of 15
EarlyStopping counter: 1 out of 15
EarlyStopping counter: 2 out of 15
180/400 - Loss: 121.711181640625 - Score: 38.11587905883789
EarlyStopping counter: 3 out of 15
EarlyStopping counter: 4 out of 15
EarlyStopping counter: 5 out of 15
EarlyStopping counter: 1 out of 15
EarlyStopping counter: 2 out of 15
EarlyStopping counter: 1 out of 15
EarlyStopping counter: 2 out of 15
EarlyStopping counter: 3 out of 15
190/400 - Loss: 136.68478393554688 - Score: 38.751007080078125
EarlyStopping counter: 1 out of 15
[32m[I 2023-06-12 19:46:29,207][0m Trial 4 finished with value: 37.82332992553711 and parameters: {'lr': 0.015704829937141285, 'batch_size': 2048, 'num_inducing': 59, 'num_samples': 2, 'kernel_type': 'rbf', 'n_gp_layers': 3, 'n_gp_out': 1}. Best is trial 3 with value: 37.525611877441406.[0m
