[32m[I 2023-06-13 13:10:36,881][0m Trial 49 pruned. [0m
10/400 - Loss: 10622.181640625 - Score: 114.12867736816406
20/400 - Loss: 7032.25390625 - Score: 102.0733871459961
Current Configuration: n_gp_layers:3 - n_gp_out: 6 - num_inducing: 74 - num_samples: 14 - batch_size:512 - num_inducing: 74 - lr: 0.057235021652224126
0/400 - Loss: 5069.90625 - Score: 97.17623138427734
EarlyStopping counter: 1 out of 15
EarlyStopping counter: 2 out of 15
Current Configuration: n_gp_layers:3 - n_gp_out: 1 - num_inducing: 131 - num_samples: 3 - batch_size:1024 - num_inducing: 131 - lr: 0.0006944162760014645
0/400 - Loss: 16424.033203125 - Score: 118.54350280761719
10/400 - Loss: 15061.1259765625 - Score: 117.99769592285156
20/400 - Loss: 13797.2646484375 - Score: 116.89374542236328
30/400 - Loss: 12699.7060546875 - Score: 115.73662567138672
40/400 - Loss: 11753.9111328125 - Score: 114.6639633178711
50/400 - Loss: 10924.1650390625 - Score: 113.62014770507812
60/400 - Loss: 10187.35546875 - Score: 112.57109069824219
70/400 - Loss: 9526.1015625 - Score: 111.50572204589844
80/400 - Loss: 8927.6435546875 - Score: 110.42339324951172
90/400 - Loss: 8383.7529296875 - Score: 109.32115936279297
100/400 - Loss: 7886.5703125 - Score: 108.20376586914062
110/400 - Loss: 7430.166015625 - Score: 107.07355499267578
120/400 - Loss: 7007.56884765625 - Score: 105.91455841064453
130/400 - Loss: 6617.84228515625 - Score: 104.75525665283203
140/400 - Loss: 6256.16943359375 - Score: 103.59073638916016
150/400 - Loss: 5919.57958984375 - Score: 102.41976928710938
160/400 - Loss: 5605.65869140625 - Score: 101.23566436767578
170/400 - Loss: 5312.130859375 - Score: 99.95486450195312
180/400 - Loss: 5037.48291015625 - Score: 98.57281494140625
190/400 - Loss: 4778.49169921875 - Score: 97.12165832519531
200/400 - Loss: 4534.75390625 - Score: 95.72782897949219
210/400 - Loss: 4305.3310546875 - Score: 94.38766479492188
220/400 - Loss: 4088.906982421875 - Score: 93.08460235595703
230/400 - Loss: 3884.663818359375 - Score: 91.77652740478516
240/400 - Loss: 3691.216796875 - Score: 90.49120330810547
250/400 - Loss: 3508.146728515625 - Score: 89.19741821289062
Time Budget run out. Pruning Trial
Current Configuration: n_gp_layers:3 - n_gp_out: 1 - num_inducing: 197 - num_samples: 6 - batch_size:512 - num_inducing: 197 - lr: 0.09124390105094086
0/400 - Loss: 3839.8935546875 - Score: 97.364990234375
10/400 - Loss: 165.78729248046875 - Score: 40.58203887939453
EarlyStopping counter: 1 out of 15
EarlyStopping counter: 2 out of 15
EarlyStopping counter: 1 out of 15
EarlyStopping counter: 1 out of 15
EarlyStopping counter: 2 out of 15
EarlyStopping counter: 3 out of 15
EarlyStopping counter: 4 out of 15
20/400 - Loss: 140.03993225097656 - Score: 39.25811004638672
EarlyStopping counter: 5 out of 15
EarlyStopping counter: 6 out of 15
EarlyStopping counter: 7 out of 15
EarlyStopping counter: 8 out of 15
EarlyStopping counter: 9 out of 15
EarlyStopping counter: 10 out of 15
EarlyStopping counter: 11 out of 15
EarlyStopping counter: 12 out of 15
EarlyStopping counter: 13 out of 15
EarlyStopping counter: 14 out of 15
30/400 - Loss: 115.00484466552734 - Score: 39.334007263183594
EarlyStopping counter: 15 out of 15
Early stopping
Current Configuration: n_gp_layers:2 - n_gp_out: 1 - num_inducing: 146 - num_samples: 11 - batch_size:512 - num_inducing: 146 - lr: 0.019930511011222573
0/400 - Loss: 10831.1953125 - Score: 115.9681625366211
Current Configuration: n_gp_layers:2 - n_gp_out: 6 - num_inducing: 492 - num_samples: 7 - batch_size:512 - num_inducing: 492 - lr: 0.01480851245720875
0/400 - Loss: 11842.427734375 - Score: 115.69068145751953
10/400 - Loss: 408.64410400390625 - Score: 39.26057815551758
Time Budget run out. Pruning Trial
Current Configuration: n_gp_layers:3 - n_gp_out: 2 - num_inducing: 149 - num_samples: 11 - batch_size:512 - num_inducing: 149 - lr: 0.008988959455709754
0/400 - Loss: 13397.255859375 - Score: 116.72505187988281
Current Configuration: n_gp_layers:2 - n_gp_out: 1 - num_inducing: 108 - num_samples: 9 - batch_size:512 - num_inducing: 108 - lr: 0.09329935346784006
0/400 - Loss: 3577.98046875 - Score: 93.40788269042969
EarlyStopping counter: 1 out of 15
EarlyStopping counter: 2 out of 15
EarlyStopping counter: 3 out of 15
Current Configuration: n_gp_layers:3 - n_gp_out: 2 - num_inducing: 323 - num_samples: 12 - batch_size:1024 - num_inducing: 323 - lr: 0.00240598920217297
0/400 - Loss: 16092.5595703125 - Score: 118.4373779296875
Traceback (most recent call last):
  File "/home/linyuhan/Dokumente/Masterarbeit/dataset/CMAPSS/code/DGP_Yuhan/experiment.py", line 30, in <module>
    time_tolerance=time_tolerance)
  File "/home/linyuhan/Dokumente/Masterarbeit/dataset/CMAPSS/code/DGP_Yuhan/HPO_DGP.py", line 439, in HPO_DGP
    X_train_outer.detach()
UnboundLocalError: local variable 'X_train_outer' referenced before assignment
[32m[I 2023-06-13 13:40:11,980][0m Trial 42 finished with value: 37.343597412109375 and parameters: {'lr': 0.009196272591328367, 'batch_size': 1024, 'num_inducing': 176, 'num_samples': 14, 'kernel_type': 'matern1.5', 'n_gp_layers': 1, 'n_gp_out': 2}. Best is trial 31 with value: 36.95566177368164.[0m
[32m[I 2023-06-13 14:42:00,315][0m Trial 43 finished with value: 37.56009292602539 and parameters: {'lr': 0.09200988160039257, 'batch_size': 1024, 'num_inducing': 114, 'num_samples': 7, 'kernel_type': 'matern0.5', 'n_gp_layers': 4, 'n_gp_out': 6}. Best is trial 31 with value: 36.95566177368164.[0m
[32m[I 2023-06-13 15:43:17,705][0m Trial 44 finished with value: 37.87307357788086 and parameters: {'lr': 0.09115798306460197, 'batch_size': 1024, 'num_inducing': 106, 'num_samples': 6, 'kernel_type': 'matern0.5', 'n_gp_layers': 4, 'n_gp_out': 6}. Best is trial 31 with value: 36.95566177368164.[0m
[32m[I 2023-06-13 16:43:52,613][0m Trial 45 finished with value: 115.78546905517578 and parameters: {'lr': 0.000842257458608892, 'batch_size': 2048, 'num_inducing': 284, 'num_samples': 8, 'kernel_type': 'matern0.5', 'n_gp_layers': 4, 'n_gp_out': 1}. Best is trial 31 with value: 36.95566177368164.[0m
[32m[I 2023-06-13 16:59:42,800][0m Trial 46 pruned. [0m
[32m[I 2023-06-13 17:22:05,223][0m Trial 47 pruned. [0m
[32m[I 2023-06-13 17:24:05,749][0m Trial 48 pruned. [0m
srun: Job step aborted: Waiting up to 62 seconds for job step to finish.
slurmstepd: error: *** JOB 1083028 ON paris1 CANCELLED AT 2023-06-13T17:26:24 DUE TO TIME LIMIT ***
slurmstepd: error: *** STEP 1083028.0 ON paris1 CANCELLED AT 2023-06-13T17:26:24 DUE TO TIME LIMIT ***
40/400 - Loss: 320.59063720703125 - Score: 39.794490814208984slurmstepd: error: Detected 10 oom-kill event(s) in StepId=1083028.batch cgroup. Some of your processes may have been killed by the cgroup out-of-memory handler.
