[32m[I 2023-06-12 23:35:08,659][0m Trial 8 finished with value: 118.22862243652344 and parameters: {'lr': 0.00025632776947322986, 'batch_size': 2048, 'num_inducing': 177, 'num_samples': 5, 'kernel_type': 'matern1.5', 'n_gp_layers': 2, 'n_gp_out': 3}. Best is trial 6 with value: 36.753379821777344.[0m
0/400 - Loss: 14038.052734375 - Score: 117.69749450683594
Current Configuration: n_gp_layers:1 - n_gp_out: 1 - num_inducing: 248 - num_samples: 12 - batch_size:512 - num_inducing: 248 - lr: 0.000281552769834617
0/400 - Loss: 16450.84765625 - Score: 118.54994201660156
Current Configuration: n_gp_layers:3 - n_gp_out: 2 - num_inducing: 96 - num_samples: 12 - batch_size:512 - num_inducing: 96 - lr: 0.018889785867090263
0/400 - Loss: 10757.6806640625 - Score: 113.82151794433594
10/400 - Loss: 500.6288757324219 - Score: 44.97340774536133
EarlyStopping counter: 1 out of 15
EarlyStopping counter: 1 out of 15
EarlyStopping counter: 2 out of 15
EarlyStopping counter: 3 out of 15
20/400 - Loss: 265.8807067871094 - Score: 40.77724075317383
EarlyStopping counter: 1 out of 15
EarlyStopping counter: 2 out of 15
EarlyStopping counter: 3 out of 15
EarlyStopping counter: 1 out of 15
EarlyStopping counter: 2 out of 15
EarlyStopping counter: 3 out of 15
30/400 - Loss: 191.8235321044922 - Score: 38.431800842285156
EarlyStopping counter: 4 out of 15
EarlyStopping counter: 5 out of 15
EarlyStopping counter: 6 out of 15
EarlyStopping counter: 1 out of 15
EarlyStopping counter: 2 out of 15
EarlyStopping counter: 3 out of 15
EarlyStopping counter: 1 out of 15
EarlyStopping counter: 2 out of 15
40/400 - Loss: 154.97914123535156 - Score: 39.81450653076172
EarlyStopping counter: 3 out of 15
EarlyStopping counter: 4 out of 15
EarlyStopping counter: 5 out of 15
EarlyStopping counter: 1 out of 15
EarlyStopping counter: 2 out of 15
EarlyStopping counter: 3 out of 15
EarlyStopping counter: 4 out of 15
50/400 - Loss: 142.59886169433594 - Score: 37.79994201660156
EarlyStopping counter: 1 out of 15
EarlyStopping counter: 1 out of 15
EarlyStopping counter: 2 out of 15
EarlyStopping counter: 3 out of 15
EarlyStopping counter: 4 out of 15
EarlyStopping counter: 5 out of 15
EarlyStopping counter: 1 out of 15
60/400 - Loss: 130.9049530029297 - Score: 37.71372985839844
EarlyStopping counter: 2 out of 15
EarlyStopping counter: 3 out of 15
EarlyStopping counter: 1 out of 15
EarlyStopping counter: 2 out of 15
EarlyStopping counter: 1 out of 15
EarlyStopping counter: 2 out of 15
EarlyStopping counter: 3 out of 15
EarlyStopping counter: 4 out of 15
70/400 - Loss: 101.26740264892578 - Score: 40.12153625488281
EarlyStopping counter: 5 out of 15
EarlyStopping counter: 6 out of 15
EarlyStopping counter: 7 out of 15
EarlyStopping counter: 8 out of 15
EarlyStopping counter: 9 out of 15
EarlyStopping counter: 10 out of 15
EarlyStopping counter: 11 out of 15
EarlyStopping counter: 12 out of 15
80/400 - Loss: 108.4317398071289 - Score: 37.56166458129883
EarlyStopping counter: 1 out of 15
EarlyStopping counter: 2 out of 15
EarlyStopping counter: 3 out of 15
EarlyStopping counter: 1 out of 15
EarlyStopping counter: 2 out of 15
EarlyStopping counter: 3 out of 15
EarlyStopping counter: 4 out of 15
EarlyStopping counter: 5 out of 15
EarlyStopping counter: 6 out of 15
90/400 - Loss: 101.20877075195312 - Score: 37.56943130493164
EarlyStopping counter: 7 out of 15
EarlyStopping counter: 8 out of 15
EarlyStopping counter: 9 out of 15
EarlyStopping counter: 10 out of 15
EarlyStopping counter: 11 out of 15
EarlyStopping counter: 12 out of 15
EarlyStopping counter: 13 out of 15
EarlyStopping counter: 14 out of 15
EarlyStopping counter: 15 out of 15
Early stopping
Current Configuration: n_gp_layers:2 - n_gp_out: 1 - num_inducing: 118 - num_samples: 13 - batch_size:512 - num_inducing: 118 - lr: 0.011721091069876455
0/400 - Loss: 12775.5693359375 - Score: 117.17183685302734
Current Configuration: n_gp_layers:1 - n_gp_out: 1 - num_inducing: 623 - num_samples: 11 - batch_size:2048 - num_inducing: 623 - lr: 0.0010073639605119244
0/400 - Loss: 16460.728515625 - Score: 118.55235290527344
10/400 - Loss: 15424.7587890625 - Score: 118.33150482177734
20/400 - Loss: 14478.27734375 - Score: 117.97496795654297
30/400 - Loss: 13583.443359375 - Score: 117.3107681274414
Time Budget run out. Pruning Trial
Current Configuration: n_gp_layers:1 - n_gp_out: 2 - num_inducing: 293 - num_samples: 2 - batch_size:1024 - num_inducing: 293 - lr: 0.0075067136919158865
0/400 - Loss: 15209.6533203125 - Score: 118.29737854003906
10/400 - Loss: 5294.79296875 - Score: 87.52481842041016
20/400 - Loss: 1566.485107421875 - Score: 55.14099884033203
30/400 - Loss: 619.1621704101562 - Score: 43.550209045410156
EarlyStopping counter: 1 out of 15
EarlyStopping counter: 2 out of 15
40/400 - Loss: 370.47369384765625 - Score: 39.65699005126953
EarlyStopping counter: 1 out of 15
50/400 - Loss: 283.34307861328125 - Score: 38.458499908447266
EarlyStopping counter: 1 out of 15
EarlyStopping counter: 1 out of 15
EarlyStopping counter: 2 out of 15
EarlyStopping counter: 3 out of 15
60/400 - Loss: 264.6854248046875 - Score: 37.893306732177734
EarlyStopping counter: 1 out of 15
EarlyStopping counter: 2 out of 15
EarlyStopping counter: 3 out of 15
EarlyStopping counter: 4 out of 15
EarlyStopping counter: 5 out of 15
70/400 - Loss: 194.58013916015625 - Score: 37.50746536254883
EarlyStopping counter: 1 out of 15
EarlyStopping counter: 1 out of 15
EarlyStopping counter: 2 out of 15
EarlyStopping counter: 3 out of 15
EarlyStopping counter: 1 out of 15
EarlyStopping counter: 2 out of 15
EarlyStopping counter: 3 out of 15
80/400 - Loss: 168.1689453125 - Score: 37.47565841674805
EarlyStopping counter: 4 out of 15
EarlyStopping counter: 5 out of 15
EarlyStopping counter: 6 out of 15
EarlyStopping counter: 7 out of 15
EarlyStopping counter: 8 out of 15
EarlyStopping counter: 9 out of 15
EarlyStopping counter: 10 out of 15
EarlyStopping counter: 11 out of 15
EarlyStopping counter: 12 out of 15
90/400 - Loss: 163.4585723876953 - Score: 37.291175842285156
EarlyStopping counter: 1 out of 15
EarlyStopping counter: 2 out of 15
EarlyStopping counter: 3 out of 15
EarlyStopping counter: 4 out of 15
EarlyStopping counter: 5 out of 15
EarlyStopping counter: 6 out of 15
EarlyStopping counter: 7 out of 15
EarlyStopping counter: 8 out of 15
EarlyStopping counter: 9 out of 15
EarlyStopping counter: 10 out of 15
100/400 - Loss: 140.80654907226562 - Score: 37.465293884277344
EarlyStopping counter: 11 out of 15
EarlyStopping counter: 12 out of 15
EarlyStopping counter: 13 out of 15
EarlyStopping counter: 14 out of 15
EarlyStopping counter: 15 out of 15
Early stopping
Current Configuration: n_gp_layers:2 - n_gp_out: 1 - num_inducing: 770 - num_samples: 8 - batch_size:512 - num_inducing: 770 - lr: 0.0001155824264172615
0/400 - Loss: 16513.384765625 - Score: 118.56114196777344
Current Configuration: n_gp_layers:1 - n_gp_out: 2 - num_inducing: 392 - num_samples: 3 - batch_size:1024 - num_inducing: 392 - lr: 0.039338593636438914
0/400 - Loss: 10795.8974609375 - Score: 116.00566864013672
EarlyStopping counter: 1 out of 15
10/400 - Loss: 349.8543395996094 - Score: 39.05561065673828
EarlyStopping counter: 1 out of 15
EarlyStopping counter: 1 out of 15
EarlyStopping counter: 2 out of 15
EarlyStopping counter: 1 out of 15
EarlyStopping counter: 2 out of 15
EarlyStopping counter: 1 out of 15
20/400 - Loss: 298.1360168457031 - Score: 37.771484375
EarlyStopping counter: 1 out of 15
EarlyStopping counter: 2 out of 15
EarlyStopping counter: 3 out of 15
EarlyStopping counter: 4 out of 15
EarlyStopping counter: 5 out of 15
EarlyStopping counter: 6 out of 15
EarlyStopping counter: 7 out of 15
EarlyStopping counter: 8 out of 15
EarlyStopping counter: 9 out of 15
30/400 - Loss: 232.95542907714844 - Score: 37.36870193481445
EarlyStopping counter: 10 out of 15
EarlyStopping counter: 11 out of 15
EarlyStopping counter: 12 out of 15
EarlyStopping counter: 13 out of 15
EarlyStopping counter: 14 out of 15
EarlyStopping counter: 15 out of 15
Early stopping
Current Configuration: n_gp_layers:1 - n_gp_out: 4 - num_inducing: 160 - num_samples: 8 - batch_size:2048 - num_inducing: 160 - lr: 0.002848593399442831
0/400 - Loss: 16283.6533203125 - Score: 118.52477264404297
Current Configuration: n_gp_layers:4 - n_gp_out: 3 - num_inducing: 60 - num_samples: 3 - batch_size:1024 - num_inducing: 60 - lr: 0.09493154779610616
0/400 - Loss: 6320.33984375 - Score: 106.32154083251953
EarlyStopping counter: 1 out of 15
EarlyStopping counter: 1 out of 15
[32m[I 2023-06-12 23:38:20,339][0m Trial 9 pruned. [0m
[32m[I 2023-06-12 23:40:27,978][0m Trial 15 finished with value: 38.891990661621094 and parameters: {'lr': 0.09493154779610616, 'batch_size': 1024, 'num_inducing': 60, 'num_samples': 3, 'kernel_type': 'rbf', 'n_gp_layers': 4, 'n_gp_out': 3}. Best is trial 13 with value: 37.22980880737305.[0m
