[32m[I 2023-06-13 09:40:24,948][0m Trial 33 pruned. [0m
120/400 - Loss: 9263.359375 - Score: 111.27582550048828
130/400 - Loss: 8881.5849609375 - Score: 110.67769622802734
Time Budget run out. Pruning Trial
Current Configuration: n_gp_layers:2 - n_gp_out: 5 - num_inducing: 110 - num_samples: 13 - batch_size:2048 - num_inducing: 110 - lr: 0.00012102223019997164
0/400 - Loss: 16546.62109375 - Score: 118.5699691772461
Time Budget run out. Pruning Trial
Current Configuration: n_gp_layers:1 - n_gp_out: 4 - num_inducing: 602 - num_samples: 12 - batch_size:1024 - num_inducing: 602 - lr: 0.04046915447575169
0/400 - Loss: 10457.9931640625 - Score: 113.80074310302734
EarlyStopping counter: 1 out of 15
EarlyStopping counter: 2 out of 15
10/400 - Loss: 482.0475158691406 - Score: 38.14781188964844
EarlyStopping counter: 3 out of 15
EarlyStopping counter: 4 out of 15
Time Budget run out. Pruning Trial
Current Configuration: n_gp_layers:1 - n_gp_out: 1 - num_inducing: 128 - num_samples: 14 - batch_size:1024 - num_inducing: 128 - lr: 0.022565828939460707
0/400 - Loss: 12964.9931640625 - Score: 117.7354965209961
Current Configuration: n_gp_layers:2 - n_gp_out: 2 - num_inducing: 635 - num_samples: 12 - batch_size:512 - num_inducing: 635 - lr: 0.00011843007251446763
0/400 - Loss: 16512.771484375 - Score: 118.56245422363281
Current Configuration: n_gp_layers:2 - n_gp_out: 1 - num_inducing: 128 - num_samples: 2 - batch_size:1024 - num_inducing: 128 - lr: 0.09314111687601007
0/400 - Loss: 6802.349609375 - Score: 111.28678131103516
EarlyStopping counter: 1 out of 15
EarlyStopping counter: 2 out of 15
EarlyStopping counter: 3 out of 15
Current Configuration: n_gp_layers:3 - n_gp_out: 1 - num_inducing: 120 - num_samples: 11 - batch_size:1024 - num_inducing: 120 - lr: 0.0011844318588460595
0/400 - Loss: 16328.4228515625 - Score: 118.5248794555664
Current Configuration: n_gp_layers:2 - n_gp_out: 1 - num_inducing: 56 - num_samples: 10 - batch_size:512 - num_inducing: 56 - lr: 0.012136263972245438
0/400 - Loss: 12633.23046875 - Score: 116.92668151855469
Current Configuration: n_gp_layers:3 - n_gp_out: 2 - num_inducing: 237 - num_samples: 15 - batch_size:1024 - num_inducing: 237 - lr: 0.0012479502590399803
0/400 - Loss: 16323.6904296875 - Score: 118.5455093383789
Current Configuration: n_gp_layers:2 - n_gp_out: 1 - num_inducing: 123 - num_samples: 12 - batch_size:512 - num_inducing: 123 - lr: 0.0458276342197687
0/400 - Loss: 6792.04248046875 - Score: 107.81092071533203
EarlyStopping counter: 1 out of 15
Current Configuration: n_gp_layers:1 - n_gp_out: 3 - num_inducing: 799 - num_samples: 8 - batch_size:1024 - num_inducing: 799 - lr: 0.003125954467676169
0/400 - Loss: 15969.3271484375 - Score: 118.4486083984375
Current Configuration: n_gp_layers:4 - n_gp_out: 2 - num_inducing: 303 - num_samples: 6 - batch_size:1024 - num_inducing: 303 - lr: 0.011089503152622096
0/400 - Loss: 14530.0615234375 - Score: 117.7879867553711
Current Configuration: n_gp_layers:3 - n_gp_out: 1 - num_inducing: 183 - num_samples: 9 - batch_size:1024 - num_inducing: 183 - lr: 0.00022124774437749494
0/400 - Loss: 16515.7578125 - Score: 118.56401062011719
Current Configuration: n_gp_layers:3 - n_gp_out: 2 - num_inducing: 50 - num_samples: 8 - batch_size:2048 - num_inducing: 50 - lr: 0.012921723287923906
0/400 - Loss: 15366.734375 - Score: 118.37831115722656
10/400 - Loss: 7252.5263671875 - Score: 105.61732482910156
20/400 - Loss: 4121.8701171875 - Score: 89.45254516601562
30/400 - Loss: 2513.40380859375 - Score: 74.21027374267578
40/400 - Loss: 1574.831298828125 - Score: 62.692230224609375
50/400 - Loss: 1008.9490966796875 - Score: 54.55918884277344
Time Budget run out. Pruning Trial
Current Configuration: n_gp_layers:1 - n_gp_out: 1 - num_inducing: 103 - num_samples: 9 - batch_size:512 - num_inducing: 103 - lr: 0.03776051191061001
0/400 - Loss: 8106.56005859375 - Score: 113.88990020751953
10/400 - Loss: 245.23193359375 - Score: 42.045753479003906
EarlyStopping counter: 1 out of 15
EarlyStopping counter: 1 out of 15
20/400 - Loss: 155.72239685058594 - Score: 38.36397933959961
EarlyStopping counter: 1 out of 15
EarlyStopping counter: 2 out of 15
EarlyStopping counter: 3 out of 15
EarlyStopping counter: 4 out of 15
EarlyStopping counter: 5 out of 15
EarlyStopping counter: 6 out of 15
EarlyStopping counter: 1 out of 15
EarlyStopping counter: 2 out of 15
30/400 - Loss: 180.59561157226562 - Score: 38.39607238769531
EarlyStopping counter: 3 out of 15
EarlyStopping counter: 4 out of 15
EarlyStopping counter: 1 out of 15
EarlyStopping counter: 2 out of 15
EarlyStopping counter: 3 out of 15
EarlyStopping counter: 4 out of 15
EarlyStopping counter: 5 out of 15
EarlyStopping counter: 6 out of 15
EarlyStopping counter: 7 out of 15
40/400 - Loss: 118.51455688476562 - Score: 38.076393127441406
EarlyStopping counter: 8 out of 15
EarlyStopping counter: 9 out of 15
EarlyStopping counter: 10 out of 15
EarlyStopping counter: 11 out of 15
EarlyStopping counter: 12 out of 15
EarlyStopping counter: 13 out of 15
EarlyStopping counter: 14 out of 15
EarlyStopping counter: 15 out of 15
Early stopping
Current Configuration: n_gp_layers:2 - n_gp_out: 3 - num_inducing: 52 - num_samples: 3 - batch_size:512 - num_inducing: 52 - lr: 0.0030328634659360573
0/400 - Loss: 15457.7607421875 - Score: 118.37289428710938
Current Configuration: n_gp_layers:4 - n_gp_out: 3 - num_inducing: 59 - num_samples: 2 - batch_size:1024 - num_inducing: 59 - lr: 0.0022012757757184434
0/400 - Loss: 16144.46875 - Score: 118.51789855957031
Current Configuration: n_gp_layers:1 - n_gp_out: 1 - num_inducing: 766 - num_samples: 4 - batch_size:2048 - num_inducing: 766 - lr: 0.014719717311642854
0/400 - Loss: 15207.046875 - Score: 118.23086547851562
Current Configuration: n_gp_layers:4 - n_gp_out: 5 - num_inducing: 349 - num_samples: 15 - batch_size:1024 - num_inducing: 349 - lr: 0.09950491896378591
0/400 - Loss: 5638.1259765625 - Score: 99.7242431640625
Time Budget run out. Pruning Trial
Current Configuration: n_gp_layers:1 - n_gp_out: 2 - num_inducing: 102 - num_samples: 13 - batch_size:1024 - num_inducing: 102 - lr: 0.04331950428436437
0/400 - Loss: 10403.5791015625 - Score: 115.7749252319336
Current Configuration: n_gp_layers:1 - n_gp_out: 2 - num_inducing: 229 - num_samples: 12 - batch_size:512 - num_inducing: 229 - lr: 0.0950648102487626
0/400 - Loss: 2459.4619140625 - Score: 76.58399200439453
EarlyStopping counter: 1 out of 15
EarlyStopping counter: 2 out of 15
10/400 - Loss: 169.1263885498047 - Score: 38.80662536621094
EarlyStopping counter: 1 out of 15
EarlyStopping counter: 2 out of 15
EarlyStopping counter: 3 out of 15
EarlyStopping counter: 1 out of 15
EarlyStopping counter: 2 out of 15
EarlyStopping counter: 3 out of 15
EarlyStopping counter: 4 out of 15
EarlyStopping counter: 1 out of 15
20/400 - Loss: 199.1315460205078 - Score: 39.784061431884766
EarlyStopping counter: 2 out of 15
EarlyStopping counter: 3 out of 15
EarlyStopping counter: 4 out of 15
EarlyStopping counter: 5 out of 15
EarlyStopping counter: 6 out of 15
EarlyStopping counter: 1 out of 15
Current Configuration: n_gp_layers:4 - n_gp_out: 1 - num_inducing: 149 - num_samples: 11 - batch_size:512 - num_inducing: 149 - lr: 0.008152765742285947
0/400 - Loss: 13770.3759765625 - Score: 117.61458587646484
Current Configuration: n_gp_layers:2 - n_gp_out: 1 - num_inducing: 123 - num_samples: 13 - batch_size:512 - num_inducing: 123 - lr: 0.045912780483279195
0/400 - Loss: 7034.349609375 - Score: 111.42864990234375
EarlyStopping counter: 1 out of 15
Current Configuration: n_gp_layers:2 - n_gp_out: 1 - num_inducing: 231 - num_samples: 12 - batch_size:512 - num_inducing: 231 - lr: 0.021187421059643437
0/400 - Loss: 10307.4404296875 - Score: 113.6375732421875
Current Configuration: n_gp_layers:1 - n_gp_out: 2 - num_inducing: 113 - num_samples: 9 - batch_size:2048 - num_inducing: 113 - lr: 0.0011919376155619726
0/400 - Loss: 16444.40234375 - Score: 118.55261993408203
10/400 - Loss: 15244.2138671875 - Score: 118.27809143066406
20/400 - Loss: 14139.3408203125 - Score: 117.7948989868164
Current Configuration: n_gp_layers:2 - n_gp_out: 1 - num_inducing: 290 - num_samples: 7 - batch_size:2048 - num_inducing: 290 - lr: 0.006661991008405749
0/400 - Loss: 15921.9775390625 - Score: 118.43333435058594
[32m[I 2023-06-13 09:57:42,108][0m Trial 34 pruned. [0m
[32m[I 2023-06-13 09:59:01,657][0m Trial 41 pruned. [0m
[32m[I 2023-06-13 09:59:28,754][0m Trial 35 pruned. [0m
[32m[I 2023-06-13 10:09:32,569][0m Trial 36 pruned. [0m
[32m[I 2023-06-13 10:14:24,987][0m Trial 42 pruned. [0m
[32m[I 2023-06-13 10:33:26,780][0m Trial 37 pruned. [0m
[32m[I 2023-06-13 10:42:55,921][0m Trial 38 pruned. [0m
[32m[I 2023-06-13 11:14:25,560][0m Trial 43 finished with value: 88.68636322021484 and parameters: {'lr': 0.0006944162760014645, 'batch_size': 1024, 'num_inducing': 131, 'num_samples': 3, 'kernel_type': 'rbf', 'n_gp_layers': 3, 'n_gp_out': 1}. Best is trial 18 with value: 36.90489959716797.[0m
[32m[I 2023-06-13 11:35:03,651][0m Trial 44 finished with value: 39.06793975830078 and parameters: {'lr': 0.09124390105094086, 'batch_size': 512, 'num_inducing': 197, 'num_samples': 6, 'kernel_type': 'matern0.5', 'n_gp_layers': 3, 'n_gp_out': 1}. Best is trial 18 with value: 36.90489959716797.[0m
[32m[I 2023-06-13 11:36:43,088][0m Trial 45 pruned. [0m
[32m[I 2023-06-13 11:41:15,741][0m Trial 39 pruned. [0m
[32m[I 2023-06-13 12:39:21,743][0m Trial 46 finished with value: 38.796295166015625 and parameters: {'lr': 0.01480851245720875, 'batch_size': 512, 'num_inducing': 492, 'num_samples': 7, 'kernel_type': 'matern1.5', 'n_gp_layers': 2, 'n_gp_out': 6}. Best is trial 18 with value: 36.90489959716797.[0m
[32m[I 2023-06-13 12:44:29,983][0m Trial 40 finished with value: 118.52717590332031 and parameters: {'lr': 0.00022863354010200105, 'batch_size': 1024, 'num_inducing': 395, 'num_samples': 2, 'kernel_type': 'matern1.5', 'n_gp_layers': 3, 'n_gp_out': 4}. Best is trial 31 with value: 36.95566177368164.[0m
[32m[I 2023-06-13 12:47:39,531][0m Trial 47 pruned. [0m
[32m[I 2023-06-13 12:49:28,824][0m Trial 48 pruned. [0m
[32m[I 2023-06-13 12:52:19,545][0m Trial 41 pruned. [0m
Current Configuration: n_gp_layers:1 - n_gp_out: 2 - num_inducing: 669 - num_samples: 10 - batch_size:512 - num_inducing: 669 - lr: 0.0029781764083732032
0/400 - Loss: 15472.40625 - Score: 118.30768585205078
Current Configuration: n_gp_layers:4 - n_gp_out: 3 - num_inducing: 410 - num_samples: 14 - batch_size:512 - num_inducing: 410 - lr: 0.08624047729563256
0/400 - Loss: 2236.005126953125 - Score: 74.48797607421875
EarlyStopping counter: 1 out of 15
Time Budget run out. Pruning Trial
Current Configuration: n_gp_layers:3 - n_gp_out: 2 - num_inducing: 581 - num_samples: 12 - batch_size:2048 - num_inducing: 581 - lr: 0.0011048815595595027
0/400 - Loss: 16452.75 - Score: 118.56049346923828
Time Budget run out. Pruning Trial
Current Configuration: n_gp_layers:1 - n_gp_out: 3 - num_inducing: 187 - num_samples: 11 - batch_size:512 - num_inducing: 187 - lr: 0.023452103522694254
0/400 - Loss: 10182.5283203125 - Score: 114.93305206298828
Current Configuration: n_gp_layers:1 - n_gp_out: 2 - num_inducing: 135 - num_samples: 9 - batch_size:512 - num_inducing: 135 - lr: 0.010929423235701098
0/400 - Loss: 13007.0009765625 - Score: 117.52189636230469
Current Configuration: n_gp_layers:3 - n_gp_out: 1 - num_inducing: 399 - num_samples: 12 - batch_size:2048 - num_inducing: 399 - lr: 0.00036674510906121316
0/400 - Loss: 16522.123046875 - Score: 118.56267547607422
Current Configuration: n_gp_layers:1 - n_gp_out: 1 - num_inducing: 105 - num_samples: 15 - batch_size:512 - num_inducing: 105 - lr: 0.00296705139816177
0/400 - Loss: 15473.265625 - Score: 118.35655212402344
10/400 - Loss: 8516.068359375 - Score: 109.88457489013672
20/400 - Loss: 5384.31298828125 - Score: 98.03455352783203
30/400 - Loss: 3736.667724609375 - Score: 87.94389343261719
40/400 - Loss: 2705.213134765625 - Score: 79.190185546875
50/400 - Loss: 2001.549072265625 - Score: 71.54351806640625
60/400 - Loss: 1495.04931640625 - Score: 64.94798278808594
70/400 - Loss: 1123.9586181640625 - Score: 59.379730224609375
80/400 - Loss: 847.6424560546875 - Score: 54.735626220703125
90/400 - Loss: 643.542236328125 - Score: 50.970394134521484
100/400 - Loss: 492.45672607421875 - Score: 47.918418884277344
110/400 - Loss: 383.5777282714844 - Score: 45.51622772216797
120/400 - Loss: 301.68365478515625 - Score: 43.60072326660156
EarlyStopping counter: 1 out of 15
130/400 - Loss: 245.44992065429688 - Score: 42.144710540771484
EarlyStopping counter: 1 out of 15
140/400 - Loss: 196.66578674316406 - Score: 40.671775817871094
EarlyStopping counter: 1 out of 15
150/400 - Loss: 169.4424591064453 - Score: 39.89293670654297
EarlyStopping counter: 1 out of 15
EarlyStopping counter: 1 out of 15
EarlyStopping counter: 2 out of 15
160/400 - Loss: 155.44064331054688 - Score: 39.28904342651367
EarlyStopping counter: 1 out of 15
EarlyStopping counter: 2 out of 15
EarlyStopping counter: 1 out of 15
170/400 - Loss: 152.13865661621094 - Score: 38.818511962890625
EarlyStopping counter: 1 out of 15
EarlyStopping counter: 2 out of 15
EarlyStopping counter: 3 out of 15
EarlyStopping counter: 1 out of 15
180/400 - Loss: 155.03819274902344 - Score: 38.649322509765625
EarlyStopping counter: 1 out of 15
190/400 - Loss: 129.0175323486328 - Score: 38.24687957763672
EarlyStopping counter: 1 out of 15
EarlyStopping counter: 2 out of 15
EarlyStopping counter: 3 out of 15
EarlyStopping counter: 1 out of 15
200/400 - Loss: 117.79454803466797 - Score: 38.04115295410156
EarlyStopping counter: 1 out of 15
EarlyStopping counter: 2 out of 15
EarlyStopping counter: 1 out of 15
EarlyStopping counter: 1 out of 15
EarlyStopping counter: 1 out of 15
Time Budget run out. Pruning Trial
Current Configuration: n_gp_layers:2 - n_gp_out: 5 - num_inducing: 348 - num_samples: 15 - batch_size:2048 - num_inducing: 348 - lr: 0.0027708492095716397
0/400 - Loss: 16295.4716796875 - Score: 118.54237365722656
Time Budget run out. Pruning Trial
Current Configuration: n_gp_layers:2 - n_gp_out: 3 - num_inducing: 606 - num_samples: 8 - batch_size:512 - num_inducing: 606 - lr: 0.0042451491938729005
0/400 - Loss: 15040.681640625 - Score: 118.35174560546875
Current Configuration: n_gp_layers:1 - n_gp_out: 5 - num_inducing: 154 - num_samples: 3 - batch_size:1024 - num_inducing: 154 - lr: 0.04226454854439315
0/400 - Loss: 10560.4697265625 - Score: 116.206787109375
10/400 - Loss: 303.2950744628906 - Score: 38.08363723754883
EarlyStopping counter: 1 out of 15
EarlyStopping counter: 2 out of 15
EarlyStopping counter: 3 out of 15
EarlyStopping counter: 4 out of 15
EarlyStopping counter: 5 out of 15
EarlyStopping counter: 6 out of 15
20/400 - Loss: 163.42539978027344 - Score: 37.09345626831055
EarlyStopping counter: 1 out of 15
EarlyStopping counter: 2 out of 15
EarlyStopping counter: 3 out of 15
EarlyStopping counter: 4 out of 15
EarlyStopping counter: 5 out of 15
EarlyStopping counter: 6 out of 15
EarlyStopping counter: 7 out of 15
EarlyStopping counter: 8 out of 15
30/400 - Loss: 122.08289337158203 - Score: 37.089229583740234
EarlyStopping counter: 9 out of 15
EarlyStopping counter: 10 out of 15
EarlyStopping counter: 11 out of 15
EarlyStopping counter: 12 out of 15
EarlyStopping counter: 13 out of 15
EarlyStopping counter: 14 out of 15
EarlyStopping counter: 15 out of 15
Early stopping
Current Configuration: n_gp_layers:3 - n_gp_out: 2 - num_inducing: 358 - num_samples: 4 - batch_size:512 - num_inducing: 358 - lr: 0.001989483390134316
0/400 - Loss: 15794.751953125 - Score: 118.31109619140625
10/400 - Loss: 9397.1865234375 - Score: 106.35948944091797
20/400 - Loss: 5884.2802734375 - Score: 92.91716003417969
Current Configuration: n_gp_layers:4 - n_gp_out: 4 - num_inducing: 116 - num_samples: 2 - batch_size:512 - num_inducing: 116 - lr: 0.09232614343879755
0/400 - Loss: 2623.170654296875 - Score: 80.40003967285156
EarlyStopping counter: 1 out of 15
EarlyStopping counter: 2 out of 15
EarlyStopping counter: 1 out of 15
EarlyStopping counter: 1 out of 15
EarlyStopping counter: 2 out of 15
Current Configuration: n_gp_layers:3 - n_gp_out: 1 - num_inducing: 136 - num_samples: 12 - batch_size:1024 - num_inducing: 136 - lr: 0.008994816734279692
0/400 - Loss: 14922.89453125 - Score: 118.1685562133789
10/400 - Loss: 5539.86181640625 - Score: 95.67583465576172
20/400 - Loss: 2651.7626953125 - Score: 73.67337036132812
Current Configuration: n_gp_layers:1 - n_gp_out: 2 - num_inducing: 51 - num_samples: 15 - batch_size:2048 - num_inducing: 51 - lr: 0.0330555236370571
0/400 - Loss: 13743.1650390625 - Score: 117.96045684814453
Current Configuration: n_gp_layers:2 - n_gp_out: 4 - num_inducing: 296 - num_samples: 9 - batch_size:512 - num_inducing: 296 - lr: 0.01368296709874267
0/400 - Loss: 12078.4501953125 - Score: 115.52273559570312
Current Configuration: n_gp_layers:1 - n_gp_out: 2 - num_inducing: 772 - num_samples: 5 - batch_size:512 - num_inducing: 772 - lr: 0.05062560502774791
0/400 - Loss: 6088.63671875 - Score: 102.51917266845703
EarlyStopping counter: 1 out of 15
EarlyStopping counter: 1 out of 15
Current Configuration: n_gp_layers:1 - n_gp_out: 2 - num_inducing: 528 - num_samples: 4 - batch_size:512 - num_inducing: 528 - lr: 0.04831359541890845
0/400 - Loss: 6369.564453125 - Score: 104.45415496826172
EarlyStopping counter: 1 out of 15
EarlyStopping counter: 1 out of 15
Current Configuration: n_gp_layers:3 - n_gp_out: 1 - num_inducing: 591 - num_samples: 10 - batch_size:512 - num_inducing: 591 - lr: 0.0031325682981115655
0/400 - Loss: 15389.8359375 - Score: 118.19796752929688
Current Configuration: n_gp_layers:3 - n_gp_out: 4 - num_inducing: 395 - num_samples: 2 - batch_size:1024 - num_inducing: 395 - lr: 0.00022863354010200105
0/400 - Loss: 16514.8984375 - Score: 118.56635284423828
Time Budget run out. Pruning Trial
Current Configuration: n_gp_layers:2 - n_gp_out: 1 - num_inducing: 335 - num_samples: 8 - batch_size:512 - num_inducing: 335 - lr: 0.00023913511800445004
0/400 - Loss: 16465.951171875 - Score: 118.54975128173828
Current Configuration: n_gp_layers:1 - n_gp_out: 2 - num_inducing: 176 - num_samples: 14 - batch_size:1024 - num_inducing: 176 - lr: 0.009196272591328367
0/400 - Loss: 14892.7724609375 - Score: 118.18180847167969
10/400 - Loss: 4562.30322265625 - Score: 84.71823120117188
20/400 - Loss: 1521.0345458984375 - Score: 56.75259780883789
30/400 - Loss: 575.9015502929688 - Score: 44.18034744262695
