[32m[I 2023-06-12 19:48:38,671][0m Trial 2 finished with value: 117.1639404296875 and parameters: {'lr': 0.0008845636266002723, 'batch_size': 2048, 'num_inducing': 209, 'num_samples': 2, 'kernel_type': 'matern0.5', 'n_gp_layers': 2, 'n_gp_out': 6}. Best is trial 1 with value: 37.78729248046875.[0m
/home/linyuhan/my_project/venv_CMAPSS/lib64/python3.6/site-packages/gpytorch/utils/cholesky.py:40: NumericalWarning: A not p.d., added jitter of 1.0e-08 to the diagonal
  NumericalWarning,
/home/linyuhan/my_project/venv_CMAPSS/lib64/python3.6/site-packages/gpytorch/utils/cholesky.py:40: NumericalWarning: A not p.d., added jitter of 1.0e-07 to the diagonal
  NumericalWarning,
/home/linyuhan/my_project/venv_CMAPSS/lib64/python3.6/site-packages/gpytorch/utils/cholesky.py:40: NumericalWarning: A not p.d., added jitter of 1.0e-06 to the diagonal
  NumericalWarning,
[33m[W 2023-06-12 19:52:53,416][0m Trial 5 failed because of the following error: NotPSDError('Matrix not positive definite after repeatedly adding jitter up to 1.0e-06.',)[0m
Traceback (most recent call last):
  File "/home/linyuhan/my_project/venv_CMAPSS/lib64/python3.6/site-packages/optuna/study/_optimize.py", line 196, in _run_trial
    value_or_values = func(trial)
  File "/home/linyuhan/Dokumente/Masterarbeit/dataset/CMAPSS/code/DGP_Yuhan/HPO_DGP.py", line 400, in <lambda>
    metric=mae),
  File "/home/linyuhan/Dokumente/Masterarbeit/dataset/CMAPSS/code/DGP_Yuhan/HPO_DGP.py", line 263, in objective_train_test
    output = model(X_batch)
  File "/home/linyuhan/my_project/venv_CMAPSS/lib64/python3.6/site-packages/gpytorch/module.py", line 30, in __call__
    outputs = self.forward(*inputs, **kwargs)
  File "/home/linyuhan/Dokumente/Masterarbeit/dataset/CMAPSS/code/DGP_Yuhan/src/deep_gp.py", line 145, in forward
    output = layer(output)
  File "/home/linyuhan/Dokumente/Masterarbeit/dataset/CMAPSS/code/DGP_Yuhan/src/deep_gp.py", line 91, in __call__
    return super().__call__(x, are_samples=bool(len(other_inputs)))
  File "/home/linyuhan/my_project/venv_CMAPSS/lib64/python3.6/site-packages/gpytorch/models/deep_gps/deep_gp.py", line 99, in __call__
    output = ApproximateGP.__call__(self, inputs)
  File "/home/linyuhan/my_project/venv_CMAPSS/lib64/python3.6/site-packages/gpytorch/models/approximate_gp.py", line 81, in __call__
    return self.variational_strategy(inputs, prior=prior, **kwargs)
  File "/home/linyuhan/my_project/venv_CMAPSS/lib64/python3.6/site-packages/gpytorch/variational/variational_strategy.py", line 169, in __call__
    return super().__call__(x, prior=prior, **kwargs)
  File "/home/linyuhan/my_project/venv_CMAPSS/lib64/python3.6/site-packages/gpytorch/variational/_variational_strategy.py", line 129, in __call__
    **kwargs,
  File "/home/linyuhan/my_project/venv_CMAPSS/lib64/python3.6/site-packages/gpytorch/module.py", line 30, in __call__
    outputs = self.forward(*inputs, **kwargs)
  File "/home/linyuhan/my_project/venv_CMAPSS/lib64/python3.6/site-packages/gpytorch/variational/variational_strategy.py", line 103, in forward
    L = self._cholesky_factor(induc_induc_covar)
  File "/home/linyuhan/my_project/venv_CMAPSS/lib64/python3.6/site-packages/gpytorch/utils/memoize.py", line 76, in g
    return _add_to_cache_ignore_args(self, cache_name, method(self, *args, **kwargs))
  File "/home/linyuhan/my_project/venv_CMAPSS/lib64/python3.6/site-packages/gpytorch/variational/variational_strategy.py", line 72, in _cholesky_factor
    L = psd_safe_cholesky(delazify(induc_induc_covar).type(_linalg_dtype_cholesky.value()))
  File "/home/linyuhan/my_project/venv_CMAPSS/lib64/python3.6/site-packages/gpytorch/utils/cholesky.py", line 63, in psd_safe_cholesky
    L = _psd_safe_cholesky(A, out=out, jitter=jitter, max_tries=max_tries)
  File "/home/linyuhan/my_project/venv_CMAPSS/lib64/python3.6/site-packages/gpytorch/utils/cholesky.py", line 45, in _psd_safe_cholesky
    raise NotPSDError(f"Matrix not positive definite after repeatedly adding jitter up to {jitter_new:.1e}.")
gpytorch.utils.errors.NotPSDError: Matrix not positive definite after repeatedly adding jitter up to 1.0e-06.
EarlyStopping counter: 2 out of 15
EarlyStopping counter: 1 out of 15
EarlyStopping counter: 2 out of 15
EarlyStopping counter: 3 out of 15
200/400 - Loss: 112.33995819091797 - Score: 37.82332992553711
EarlyStopping counter: 1 out of 15
EarlyStopping counter: 2 out of 15
EarlyStopping counter: 3 out of 15
EarlyStopping counter: 4 out of 15
EarlyStopping counter: 5 out of 15
EarlyStopping counter: 6 out of 15
EarlyStopping counter: 7 out of 15
EarlyStopping counter: 8 out of 15
EarlyStopping counter: 9 out of 15
EarlyStopping counter: 10 out of 15
210/400 - Loss: 116.00108337402344 - Score: 38.07823181152344
EarlyStopping counter: 11 out of 15
EarlyStopping counter: 12 out of 15
EarlyStopping counter: 13 out of 15
EarlyStopping counter: 14 out of 15
EarlyStopping counter: 15 out of 15
Early stopping
Current Configuration: n_gp_layers:1 - n_gp_out: 1 - num_inducing: 760 - num_samples: 2 - batch_size:1024 - num_inducing: 760 - lr: 0.036878794387688874
0/400 - Loss: 11102.4609375 - Score: 116.55115509033203
Traceback (most recent call last):
  File "/home/linyuhan/Dokumente/Masterarbeit/dataset/CMAPSS/code/DGP_Yuhan/experiment.py", line 30, in <module>
    time_tolerance=time_tolerance)
  File "/home/linyuhan/Dokumente/Masterarbeit/dataset/CMAPSS/code/DGP_Yuhan/HPO_DGP.py", line 401, in HPO_DGP
    n_trials=n_trials)  # n_trials=N_TRIALS
  File "/home/linyuhan/my_project/venv_CMAPSS/lib64/python3.6/site-packages/optuna/study/study.py", line 428, in optimize
    show_progress_bar=show_progress_bar,
  File "/home/linyuhan/my_project/venv_CMAPSS/lib64/python3.6/site-packages/optuna/study/_optimize.py", line 76, in _optimize
    progress_bar=progress_bar,
  File "/home/linyuhan/my_project/venv_CMAPSS/lib64/python3.6/site-packages/optuna/study/_optimize.py", line 160, in _optimize_sequential
    frozen_trial = _run_trial(study, func, catch)
  File "/home/linyuhan/my_project/venv_CMAPSS/lib64/python3.6/site-packages/optuna/study/_optimize.py", line 234, in _run_trial
    raise func_err
  File "/home/linyuhan/my_project/venv_CMAPSS/lib64/python3.6/site-packages/optuna/study/_optimize.py", line 196, in _run_trial
    value_or_values = func(trial)
  File "/home/linyuhan/Dokumente/Masterarbeit/dataset/CMAPSS/code/DGP_Yuhan/HPO_DGP.py", line 400, in <lambda>
    metric=mae),
  File "/home/linyuhan/Dokumente/Masterarbeit/dataset/CMAPSS/code/DGP_Yuhan/HPO_DGP.py", line 263, in objective_train_test
    output = model(X_batch)
  File "/home/linyuhan/my_project/venv_CMAPSS/lib64/python3.6/site-packages/gpytorch/module.py", line 30, in __call__
    outputs = self.forward(*inputs, **kwargs)
  File "/home/linyuhan/Dokumente/Masterarbeit/dataset/CMAPSS/code/DGP_Yuhan/src/deep_gp.py", line 145, in forward
    output = layer(output)
  File "/home/linyuhan/Dokumente/Masterarbeit/dataset/CMAPSS/code/DGP_Yuhan/src/deep_gp.py", line 91, in __call__
    return super().__call__(x, are_samples=bool(len(other_inputs)))
  File "/home/linyuhan/my_project/venv_CMAPSS/lib64/python3.6/site-packages/gpytorch/models/deep_gps/deep_gp.py", line 99, in __call__
    output = ApproximateGP.__call__(self, inputs)
  File "/home/linyuhan/my_project/venv_CMAPSS/lib64/python3.6/site-packages/gpytorch/models/approximate_gp.py", line 81, in __call__
    return self.variational_strategy(inputs, prior=prior, **kwargs)
  File "/home/linyuhan/my_project/venv_CMAPSS/lib64/python3.6/site-packages/gpytorch/variational/variational_strategy.py", line 169, in __call__
    return super().__call__(x, prior=prior, **kwargs)
  File "/home/linyuhan/my_project/venv_CMAPSS/lib64/python3.6/site-packages/gpytorch/variational/_variational_strategy.py", line 129, in __call__
    **kwargs,
  File "/home/linyuhan/my_project/venv_CMAPSS/lib64/python3.6/site-packages/gpytorch/module.py", line 30, in __call__
    outputs = self.forward(*inputs, **kwargs)
  File "/home/linyuhan/my_project/venv_CMAPSS/lib64/python3.6/site-packages/gpytorch/variational/variational_strategy.py", line 103, in forward
    L = self._cholesky_factor(induc_induc_covar)
  File "/home/linyuhan/my_project/venv_CMAPSS/lib64/python3.6/site-packages/gpytorch/utils/memoize.py", line 76, in g
    return _add_to_cache_ignore_args(self, cache_name, method(self, *args, **kwargs))
  File "/home/linyuhan/my_project/venv_CMAPSS/lib64/python3.6/site-packages/gpytorch/variational/variational_strategy.py", line 72, in _cholesky_factor
    L = psd_safe_cholesky(delazify(induc_induc_covar).type(_linalg_dtype_cholesky.value()))
  File "/home/linyuhan/my_project/venv_CMAPSS/lib64/python3.6/site-packages/gpytorch/utils/cholesky.py", line 63, in psd_safe_cholesky
    L = _psd_safe_cholesky(A, out=out, jitter=jitter, max_tries=max_tries)
  File "/home/linyuhan/my_project/venv_CMAPSS/lib64/python3.6/site-packages/gpytorch/utils/cholesky.py", line 45, in _psd_safe_cholesky
    raise NotPSDError(f"Matrix not positive definite after repeatedly adding jitter up to {jitter_new:.1e}.")
gpytorch.utils.errors.NotPSDError: Matrix not positive definite after repeatedly adding jitter up to 1.0e-06.
[32m[I 2023-06-12 19:57:31,655][0m Trial 2 finished with value: 118.33453369140625 and parameters: {'lr': 0.0053847428520667675, 'batch_size': 1024, 'num_inducing': 527, 'num_samples': 9, 'kernel_type': 'rbf', 'n_gp_layers': 2, 'n_gp_out': 5}. Best is trial 1 with value: 37.39690017700195.[0m
[32m[I 2023-06-12 19:58:26,666][0m Trial 3 pruned. [0m
[32m[I 2023-06-12 20:05:18,409][0m Trial 5 finished with value: 39.87487030029297 and parameters: {'lr': 0.04502895027106956, 'batch_size': 1024, 'num_inducing': 598, 'num_samples': 11, 'kernel_type': 'rbf', 'n_gp_layers': 2, 'n_gp_out': 1}. Best is trial 4 with value: 37.21852111816406.[0m
[32m[I 2023-06-12 20:18:53,574][0m Trial 5 finished with value: 37.87373733520508 and parameters: {'lr': 0.030635374128837965, 'batch_size': 2048, 'num_inducing': 155, 'num_samples': 3, 'kernel_type': 'matern1.5', 'n_gp_layers': 2, 'n_gp_out': 1}. Best is trial 3 with value: 37.44314193725586.[0m
[32m[I 2023-06-12 20:19:07,614][0m Trial 4 finished with value: 44.12959671020508 and parameters: {'lr': 0.0007388168409667129, 'batch_size': 512, 'num_inducing': 88, 'num_samples': 2, 'kernel_type': 'matern1.5', 'n_gp_layers': 1, 'n_gp_out': 1}. Best is trial 1 with value: 37.39690017700195.[0m
[32m[I 2023-06-12 20:26:50,805][0m Trial 2 finished with value: 37.91103744506836 and parameters: {'lr': 0.007706499296604288, 'batch_size': 2048, 'num_inducing': 182, 'num_samples': 5, 'kernel_type': 'matern0.5', 'n_gp_layers': 1, 'n_gp_out': 4}. Best is trial 1 with value: 37.736331939697266.[0m
[32m[I 2023-06-12 20:26:52,246][0m Trial 2 finished with value: 84.7150650024414 and parameters: {'lr': 0.0008586713192096651, 'batch_size': 1024, 'num_inducing': 106, 'num_samples': 11, 'kernel_type': 'matern1.5', 'n_gp_layers': 1, 'n_gp_out': 6}. Best is trial 0 with value: 37.90920639038086.[0m
[32m[I 2023-06-12 20:27:49,384][0m Trial 3 pruned. [0m
[32m[I 2023-06-12 20:32:57,462][0m Trial 2 finished with value: 105.89946746826172 and parameters: {'lr': 0.000771984192477562, 'batch_size': 1024, 'num_inducing': 278, 'num_samples': 3, 'kernel_type': 'matern0.5', 'n_gp_layers': 4, 'n_gp_out': 2}. Best is trial 0 with value: 37.70381546020508.[0m
[32m[I 2023-06-12 20:37:07,645][0m Trial 2 finished with value: 118.55390167236328 and parameters: {'lr': 0.0002849533367718103, 'batch_size': 2048, 'num_inducing': 125, 'num_samples': 6, 'kernel_type': 'rbf', 'n_gp_layers': 4, 'n_gp_out': 6}. Best is trial 0 with value: 37.55686569213867.[0m
[32m[I 2023-06-12 20:39:01,485][0m Trial 5 pruned. [0m
[32m[I 2023-06-12 20:40:42,680][0m Trial 2 finished with value: 37.68682861328125 and parameters: {'lr': 0.02650057776141841, 'batch_size': 1024, 'num_inducing': 108, 'num_samples': 10, 'kernel_type': 'matern1.5', 'n_gp_layers': 3, 'n_gp_out': 2}. Best is trial 2 with value: 37.68682861328125.[0m
Current Configuration: n_gp_layers:2 - n_gp_out: 1 - num_inducing: 128 - num_samples: 10 - batch_size:1024 - num_inducing: 128 - lr: 0.01
0/400 - Loss: 14803.6904296875 - Score: 118.2339859008789
10/400 - Loss: 5104.01953125 - Score: 93.20054626464844
20/400 - Loss: 2316.39990234375 - Score: 70.43440246582031
30/400 - Loss: 1132.5184326171875 - Score: 55.21162414550781
40/400 - Loss: 631.2664794921875 - Score: 47.0122184753418
EarlyStopping counter: 1 out of 15
50/400 - Loss: 434.64764404296875 - Score: 42.98112487792969
EarlyStopping counter: 1 out of 15
EarlyStopping counter: 1 out of 15
EarlyStopping counter: 1 out of 15
EarlyStopping counter: 1 out of 15
60/400 - Loss: 307.8384704589844 - Score: 41.3371696472168
EarlyStopping counter: 1 out of 15
70/400 - Loss: 248.809814453125 - Score: 39.71271514892578
EarlyStopping counter: 1 out of 15
EarlyStopping counter: 2 out of 15
EarlyStopping counter: 1 out of 15
EarlyStopping counter: 2 out of 15
80/400 - Loss: 205.696533203125 - Score: 39.512184143066406
EarlyStopping counter: 1 out of 15
EarlyStopping counter: 2 out of 15
EarlyStopping counter: 1 out of 15
EarlyStopping counter: 2 out of 15
EarlyStopping counter: 3 out of 15
EarlyStopping counter: 4 out of 15
EarlyStopping counter: 5 out of 15
EarlyStopping counter: 6 out of 15
90/400 - Loss: 178.85096740722656 - Score: 38.331974029541016
EarlyStopping counter: 7 out of 15
EarlyStopping counter: 8 out of 15
EarlyStopping counter: 9 out of 15
EarlyStopping counter: 10 out of 15
EarlyStopping counter: 1 out of 15
EarlyStopping counter: 2 out of 15
100/400 - Loss: 166.8433380126953 - Score: 38.288604736328125
EarlyStopping counter: 3 out of 15
EarlyStopping counter: 1 out of 15
EarlyStopping counter: 2 out of 15
EarlyStopping counter: 3 out of 15
EarlyStopping counter: 4 out of 15
EarlyStopping counter: 5 out of 15
110/400 - Loss: 151.71128845214844 - Score: 37.801597595214844
EarlyStopping counter: 1 out of 15
EarlyStopping counter: 2 out of 15
EarlyStopping counter: 3 out of 15
EarlyStopping counter: 4 out of 15
EarlyStopping counter: 5 out of 15
EarlyStopping counter: 6 out of 15
EarlyStopping counter: 7 out of 15
120/400 - Loss: 136.78213500976562 - Score: 37.64033126831055
EarlyStopping counter: 1 out of 15
EarlyStopping counter: 2 out of 15
EarlyStopping counter: 3 out of 15
EarlyStopping counter: 1 out of 15
EarlyStopping counter: 2 out of 15
EarlyStopping counter: 1 out of 15
EarlyStopping counter: 2 out of 15
EarlyStopping counter: 3 out of 15
130/400 - Loss: 128.79937744140625 - Score: 37.61423110961914
Time Budget run out. Pruning Trial
Current Configuration: n_gp_layers:1 - n_gp_out: 5 - num_inducing: 158 - num_samples: 4 - batch_size:1024 - num_inducing: 158 - lr: 0.01069747257706085
0/400 - Loss: 14689.2451171875 - Score: 118.31179809570312
10/400 - Loss: 3045.210693359375 - Score: 70.15513610839844
20/400 - Loss: 795.3071899414062 - Score: 46.417747497558594
30/400 - Loss: 351.7706298828125 - Score: 40.02610397338867
40/400 - Loss: 238.66041564941406 - Score: 38.28886413574219
EarlyStopping counter: 1 out of 15
EarlyStopping counter: 1 out of 15
EarlyStopping counter: 2 out of 15
EarlyStopping counter: 3 out of 15
EarlyStopping counter: 4 out of 15
50/400 - Loss: 275.0434265136719 - Score: 38.18922424316406
EarlyStopping counter: 5 out of 15
EarlyStopping counter: 6 out of 15
EarlyStopping counter: 7 out of 15
EarlyStopping counter: 8 out of 15
EarlyStopping counter: 1 out of 15
60/400 - Loss: 156.59951782226562 - Score: 37.404136657714844
EarlyStopping counter: 1 out of 15
EarlyStopping counter: 2 out of 15
EarlyStopping counter: 3 out of 15
EarlyStopping counter: 1 out of 15
EarlyStopping counter: 2 out of 15
EarlyStopping counter: 3 out of 15
EarlyStopping counter: 4 out of 15
EarlyStopping counter: 5 out of 15
70/400 - Loss: 145.26034545898438 - Score: 37.45818328857422
EarlyStopping counter: 6 out of 15
EarlyStopping counter: 7 out of 15
EarlyStopping counter: 8 out of 15
EarlyStopping counter: 9 out of 15
EarlyStopping counter: 10 out of 15
EarlyStopping counter: 11 out of 15
EarlyStopping counter: 12 out of 15
EarlyStopping counter: 13 out of 15
EarlyStopping counter: 14 out of 15
EarlyStopping counter: 15 out of 15
Early stopping
Current Configuration: n_gp_layers:2 - n_gp_out: 5 - num_inducing: 527 - num_samples: 9 - batch_size:1024 - num_inducing: 527 - lr: 0.0053847428520667675
0/400 - Loss: 15580.5400390625 - Score: 118.4711685180664
Time Budget run out. Pruning Trial
Current Configuration: n_gp_layers:1 - n_gp_out: 1 - num_inducing: 205 - num_samples: 8 - batch_size:512 - num_inducing: 205 - lr: 0.002963329123066735
0/400 - Loss: 15489.865234375 - Score: 118.38369750976562
Current Configuration: n_gp_layers:1 - n_gp_out: 1 - num_inducing: 88 - num_samples: 2 - batch_size:512 - num_inducing: 88 - lr: 0.0007388168409667129
0/400 - Loss: 16280.650390625 - Score: 118.52704620361328
10/400 - Loss: 13807.791015625 - Score: 117.7876205444336
20/400 - Loss: 11840.5361328125 - Score: 115.9834976196289
30/400 - Loss: 10115.05859375 - Score: 112.73934173583984
40/400 - Loss: 8777.796875 - Score: 109.87186431884766
50/400 - Loss: 7718.35888671875 - Score: 107.28080749511719
60/400 - Loss: 6851.45703125 - Score: 104.82563018798828
70/400 - Loss: 6116.8115234375 - Score: 102.42053985595703
80/400 - Loss: 5482.724609375 - Score: 100.04637908935547
90/400 - Loss: 4940.9931640625 - Score: 97.65757751464844
100/400 - Loss: 4463.375 - Score: 95.26361083984375
110/400 - Loss: 4039.9521484375 - Score: 92.8980941772461
120/400 - Loss: 3663.22705078125 - Score: 90.53881072998047
130/400 - Loss: 3329.36279296875 - Score: 88.1920394897461
140/400 - Loss: 3025.8642578125 - Score: 85.88494873046875
150/400 - Loss: 2753.55810546875 - Score: 83.6059799194336
160/400 - Loss: 2503.5361328125 - Score: 81.34500885009766
170/400 - Loss: 2278.41064453125 - Score: 79.1285171508789
180/400 - Loss: 2072.95849609375 - Score: 76.95528411865234
190/400 - Loss: 1884.931884765625 - Score: 74.8170394897461
200/400 - Loss: 1713.26904296875 - Score: 72.72955322265625
210/400 - Loss: 1558.021240234375 - Score: 70.70038604736328
220/400 - Loss: 1412.213623046875 - Score: 68.71324157714844
230/400 - Loss: 1282.225341796875 - Score: 66.79731750488281
240/400 - Loss: 1160.783203125 - Score: 64.92752075195312
250/400 - Loss: 1052.19580078125 - Score: 63.10421371459961
260/400 - Loss: 949.3255615234375 - Score: 61.357662200927734
270/400 - Loss: 857.5872192382812 - Score: 59.67455291748047
280/400 - Loss: 774.8521118164062 - Score: 58.07556915283203
290/400 - Loss: 697.4879150390625 - Score: 56.50987243652344
300/400 - Loss: 628.74609375 - Score: 55.050804138183594
310/400 - Loss: 565.8209228515625 - Score: 53.64253616333008
320/400 - Loss: 508.2922668457031 - Score: 52.30632019042969
330/400 - Loss: 456.15704345703125 - Score: 51.02800369262695
340/400 - Loss: 409.828125 - Score: 49.84482192993164
350/400 - Loss: 367.4381103515625 - Score: 48.681400299072266
360/400 - Loss: 329.8058776855469 - Score: 47.62876892089844
370/400 - Loss: 296.155517578125 - Score: 46.63853454589844
380/400 - Loss: 266.62530517578125 - Score: 45.70460891723633
390/400 - Loss: 240.0410614013672 - Score: 44.847633361816406
Current Configuration: n_gp_layers:2 - n_gp_out: 1 - num_inducing: 334 - num_samples: 7 - batch_size:512 - num_inducing: 334 - lr: 0.027241899050823876
0/400 - Loss: 9274.1923828125 - Score: 112.57820892333984
EarlyStopping counter: 1 out of 15
EarlyStopping counter: 2 out of 15
10/400 - Loss: 376.8541564941406 - Score: 43.560272216796875
EarlyStopping counter: 1 out of 15
EarlyStopping counter: 2 out of 15
EarlyStopping counter: 1 out of 15
EarlyStopping counter: 1 out of 15
EarlyStopping counter: 2 out of 15
20/400 - Loss: 192.72291564941406 - Score: 39.981834411621094
EarlyStopping counter: 3 out of 15
EarlyStopping counter: 4 out of 15
EarlyStopping counter: 5 out of 15
EarlyStopping counter: 6 out of 15
EarlyStopping counter: 1 out of 15
EarlyStopping counter: 2 out of 15
Current Configuration: n_gp_layers:1 - n_gp_out: 2 - num_inducing: 748 - num_samples: 10 - batch_size:512 - num_inducing: 748 - lr: 0.0072293396260077105
[32m[I 2023-06-12 20:43:51,463][0m Trial 6 finished with value: 71.98878479003906 and parameters: {'lr': 0.006459051988309766, 'batch_size': 1024, 'num_inducing': 437, 'num_samples': 6, 'kernel_type': 'rbf', 'n_gp_layers': 3, 'n_gp_out': 2}. Best is trial 1 with value: 37.58218002319336.[0m
[32m[I 2023-06-12 20:44:28,506][0m Trial 3 pruned. [0m
[32m[I 2023-06-12 20:49:17,053][0m Trial 3 finished with value: 113.0516128540039 and parameters: {'lr': 0.00036329806217656285, 'batch_size': 512, 'num_inducing': 126, 'num_samples': 9, 'kernel_type': 'rbf', 'n_gp_layers': 2, 'n_gp_out': 3}. Best is trial 1 with value: 37.78729248046875.[0m
[32m[I 2023-06-12 20:49:48,315][0m Trial 6 pruned. [0m
[32m[I 2023-06-12 20:51:10,656][0m Trial 7 pruned. [0m
[32m[I 2023-06-12 20:51:55,474][0m Trial 7 pruned. [0m
