[32m[I 2023-06-12 21:58:11,316][0m Trial 12 pruned. [0m
Current Configuration: n_gp_layers:2 - n_gp_out: 1 - num_inducing: 128 - num_samples: 10 - batch_size:1024 - num_inducing: 128 - lr: 0.01
0/400 - Loss: 14762.791015625 - Score: 118.10807800292969
10/400 - Loss: 5929.55322265625 - Score: 103.208740234375
20/400 - Loss: 3235.20947265625 - Score: 85.52210235595703
30/400 - Loss: 1902.919921875 - Score: 70.44281768798828
40/400 - Loss: 1152.860107421875 - Score: 59.17391586303711
50/400 - Loss: 718.4124755859375 - Score: 51.42367172241211
60/400 - Loss: 488.44183349609375 - Score: 46.46421432495117
EarlyStopping counter: 1 out of 15
EarlyStopping counter: 1 out of 15
70/400 - Loss: 369.6664123535156 - Score: 43.730106353759766
EarlyStopping counter: 1 out of 15
80/400 - Loss: 269.2300109863281 - Score: 41.23390197753906
EarlyStopping counter: 1 out of 15
EarlyStopping counter: 1 out of 15
EarlyStopping counter: 1 out of 15
EarlyStopping counter: 2 out of 15
90/400 - Loss: 229.671630859375 - Score: 40.29176330566406
EarlyStopping counter: 1 out of 15
EarlyStopping counter: 1 out of 15
EarlyStopping counter: 2 out of 15
EarlyStopping counter: 1 out of 15
EarlyStopping counter: 1 out of 15
100/400 - Loss: 194.21153259277344 - Score: 39.714622497558594
EarlyStopping counter: 1 out of 15
EarlyStopping counter: 2 out of 15
EarlyStopping counter: 3 out of 15
EarlyStopping counter: 1 out of 15
EarlyStopping counter: 1 out of 15
110/400 - Loss: 175.27694702148438 - Score: 39.0444221496582
EarlyStopping counter: 2 out of 15
EarlyStopping counter: 3 out of 15
EarlyStopping counter: 4 out of 15
EarlyStopping counter: 5 out of 15
EarlyStopping counter: 6 out of 15
EarlyStopping counter: 7 out of 15
EarlyStopping counter: 1 out of 15
EarlyStopping counter: 2 out of 15
EarlyStopping counter: 3 out of 15
120/400 - Loss: 166.03871154785156 - Score: 39.02592086791992
EarlyStopping counter: 4 out of 15
EarlyStopping counter: 5 out of 15
EarlyStopping counter: 6 out of 15
EarlyStopping counter: 1 out of 15
EarlyStopping counter: 1 out of 15
EarlyStopping counter: 2 out of 15
EarlyStopping counter: 1 out of 15
130/400 - Loss: 154.07435607910156 - Score: 38.699947357177734
Time Budget run out. Pruning Trial
Current Configuration: n_gp_layers:1 - n_gp_out: 1 - num_inducing: 195 - num_samples: 4 - batch_size:512 - num_inducing: 195 - lr: 0.04729338216636208
0/400 - Loss: 6937.16162109375 - Score: 110.3821029663086
10/400 - Loss: 243.70700073242188 - Score: 38.942787170410156
EarlyStopping counter: 1 out of 15
EarlyStopping counter: 2 out of 15
EarlyStopping counter: 1 out of 15
EarlyStopping counter: 2 out of 15
EarlyStopping counter: 3 out of 15
EarlyStopping counter: 4 out of 15
EarlyStopping counter: 5 out of 15
EarlyStopping counter: 6 out of 15
20/400 - Loss: 376.4603271484375 - Score: 45.31280517578125
EarlyStopping counter: 7 out of 15
EarlyStopping counter: 8 out of 15
EarlyStopping counter: 9 out of 15
EarlyStopping counter: 1 out of 15
EarlyStopping counter: 2 out of 15
EarlyStopping counter: 3 out of 15
EarlyStopping counter: 4 out of 15
30/400 - Loss: 142.1138153076172 - Score: 38.066322326660156
EarlyStopping counter: 5 out of 15
EarlyStopping counter: 6 out of 15
EarlyStopping counter: 1 out of 15
EarlyStopping counter: 2 out of 15
EarlyStopping counter: 3 out of 15
EarlyStopping counter: 4 out of 15
EarlyStopping counter: 5 out of 15
EarlyStopping counter: 6 out of 15
EarlyStopping counter: 7 out of 15
40/400 - Loss: 147.44068908691406 - Score: 40.314292907714844
EarlyStopping counter: 8 out of 15
EarlyStopping counter: 9 out of 15
EarlyStopping counter: 10 out of 15
EarlyStopping counter: 11 out of 15
EarlyStopping counter: 12 out of 15
EarlyStopping counter: 13 out of 15
EarlyStopping counter: 14 out of 15
EarlyStopping counter: 15 out of 15
Early stopping
Current Configuration: n_gp_layers:2 - n_gp_out: 5 - num_inducing: 74 - num_samples: 3 - batch_size:1024 - num_inducing: 74 - lr: 0.07550793663000266
0/400 - Loss: 7434.88037109375 - Score: 108.7010269165039
Current Configuration: n_gp_layers:2 - n_gp_out: 3 - num_inducing: 57 - num_samples: 13 - batch_size:512 - num_inducing: 57 - lr: 0.0012126114273368056
0/400 - Loss: 16111.224609375 - Score: 118.52222442626953
10/400 - Loss: 11894.8330078125 - Score: 113.50981903076172
20/400 - Loss: 8964.568359375 - Score: 106.51445770263672
30/400 - Loss: 7083.361328125 - Score: 100.91692352294922
40/400 - Loss: 5708.3837890625 - Score: 95.36473083496094
50/400 - Loss: 4658.4091796875 - Score: 89.29410552978516
60/400 - Loss: 3836.37890625 - Score: 83.931884765625
70/400 - Loss: 3178.02490234375 - Score: 78.94234466552734
80/400 - Loss: 2640.984619140625 - Score: 74.30868530273438
90/400 - Loss: 2198.12548828125 - Score: 69.9207763671875
100/400 - Loss: 1829.263916015625 - Score: 65.86280059814453
110/400 - Loss: 1520.3671875 - Score: 62.182342529296875
Time Budget run out. Pruning Trial
Current Configuration: n_gp_layers:1 - n_gp_out: 4 - num_inducing: 87 - num_samples: 13 - batch_size:512 - num_inducing: 87 - lr: 0.031404351093330576
0/400 - Loss: 8728.109375 - Score: 112.63907623291016
Current Configuration: n_gp_layers:1 - n_gp_out: 1 - num_inducing: 322 - num_samples: 4 - batch_size:1024 - num_inducing: 322 - lr: 0.0013868454448543732
0/400 - Loss: 16289.8916015625 - Score: 118.50774383544922
Current Configuration: n_gp_layers:3 - n_gp_out: 2 - num_inducing: 437 - num_samples: 6 - batch_size:1024 - num_inducing: 437 - lr: 0.006459051988309766
0/400 - Loss: 15357.921875 - Score: 118.26345825195312
10/400 - Loss: 6199.37939453125 - Score: 92.93574523925781
Time Budget run out. Pruning Trial
Current Configuration: n_gp_layers:3 - n_gp_out: 1 - num_inducing: 177 - num_samples: 11 - batch_size:512 - num_inducing: 177 - lr: 0.00035492910494277667
0/400 - Loss: 16422.91015625 - Score: 118.54618072509766
Current Configuration: n_gp_layers:1 - n_gp_out: 4 - num_inducing: 159 - num_samples: 5 - batch_size:1024 - num_inducing: 159 - lr: 0.0012911590924113163
0/400 - Loss: 16314.904296875 - Score: 118.53760528564453
10/400 - Loss: 13984.3828125 - Score: 117.63001251220703
20/400 - Loss: 11793.4169921875 - Score: 113.66557312011719
30/400 - Loss: 9534.357421875 - Score: 106.2764892578125
40/400 - Loss: 7841.99755859375 - Score: 99.68309020996094
50/400 - Loss: 6545.1767578125 - Score: 93.75855255126953
60/400 - Loss: 5513.89501953125 - Score: 88.05545043945312
70/400 - Loss: 4683.5498046875 - Score: 82.78406524658203
80/400 - Loss: 3985.97802734375 - Score: 77.97207641601562
90/400 - Loss: 3401.35302734375 - Score: 73.60707092285156
100/400 - Loss: 2905.904296875 - Score: 69.66522216796875
110/400 - Loss: 2496.400146484375 - Score: 66.092529296875
120/400 - Loss: 2143.96728515625 - Score: 62.8255615234375
130/400 - Loss: 1843.605224609375 - Score: 59.853416442871094
140/400 - Loss: 1585.341064453125 - Score: 57.15970230102539
150/400 - Loss: 1365.9696044921875 - Score: 54.74717712402344
160/400 - Loss: 1173.8377685546875 - Score: 52.57709503173828
170/400 - Loss: 1015.5784301757812 - Score: 50.617767333984375
180/400 - Loss: 876.9581909179688 - Score: 48.86080551147461
190/400 - Loss: 759.7184448242188 - Score: 47.31332778930664
200/400 - Loss: 662.7296142578125 - Score: 45.928565979003906
210/400 - Loss: 577.583984375 - Score: 44.69087600708008
220/400 - Loss: 509.46234130859375 - Score: 43.62723159790039
Time Budget run out. Pruning Trial
Current Configuration: n_gp_layers:1 - n_gp_out: 1 - num_inducing: 399 - num_samples: 2 - batch_size:512 - num_inducing: 399 - lr: 0.00011272661706555473
0/400 - Loss: 16514.794921875 - Score: 118.56228637695312
Current Configuration: n_gp_layers:2 - n_gp_out: 1 - num_inducing: 259 - num_samples: 6 - batch_size:2048 - num_inducing: 259 - lr: 0.04347378146278114
0/400 - Loss: 12907.8154296875 - Score: 117.18585205078125
Current Configuration: n_gp_layers:1 - n_gp_out: 6 - num_inducing: 82 - num_samples: 7 - batch_size:512 - num_inducing: 82 - lr: 0.01788533951505762
0/400 - Loss: 11376.2861328125 - Score: 116.75786590576172
Current Configuration: n_gp_layers:1 - n_gp_out: 4 - num_inducing: 73 - num_samples: 2 - batch_size:512 - num_inducing: 73 - lr: 0.00031587589944159235
0/400 - Loss: 16439.4140625 - Score: 118.55819702148438
[32m[I 2023-06-12 22:05:05,922][0m Trial 5 pruned. [0m
[32m[I 2023-06-12 22:17:38,929][0m Trial 13 finished with value: 37.91056442260742 and parameters: {'lr': 0.011509807913064806, 'batch_size': 512, 'num_inducing': 58, 'num_samples': 12, 'kernel_type': 'matern1.5', 'n_gp_layers': 2, 'n_gp_out': 1}. Best is trial 1 with value: 37.58218002319336.[0m
[32m[I 2023-06-12 22:24:11,904][0m Trial 8 finished with value: 38.38225173950195 and parameters: {'lr': 0.005995703439109793, 'batch_size': 1024, 'num_inducing': 176, 'num_samples': 11, 'kernel_type': 'rbf', 'n_gp_layers': 2, 'n_gp_out': 1}. Best is trial 3 with value: 37.44314193725586.[0m
[32m[I 2023-06-12 22:25:34,567][0m Trial 9 pruned. [0m
[32m[I 2023-06-12 22:32:49,529][0m Trial 14 pruned. [0m
[32m[I 2023-06-12 22:33:31,869][0m Trial 6 finished with value: 36.753379821777344 and parameters: {'lr': 0.03822827340683878, 'batch_size': 1024, 'num_inducing': 464, 'num_samples': 15, 'kernel_type': 'matern1.5', 'n_gp_layers': 1, 'n_gp_out': 5}. Best is trial 6 with value: 36.753379821777344.[0m
[32m[I 2023-06-12 22:34:44,125][0m Trial 6 finished with value: 118.50518798828125 and parameters: {'lr': 0.000873188533237095, 'batch_size': 512, 'num_inducing': 776, 'num_samples': 5, 'kernel_type': 'matern1.5', 'n_gp_layers': 2, 'n_gp_out': 4}. Best is trial 1 with value: 37.78729248046875.[0m
[32m[I 2023-06-12 22:35:02,846][0m Trial 7 pruned. [0m
[32m[I 2023-06-12 22:43:16,079][0m Trial 7 pruned. [0m
[32m[I 2023-06-12 22:46:11,749][0m Trial 10 pruned. [0m
[32m[I 2023-06-12 22:46:18,456][0m Trial 10 finished with value: 116.99560546875 and parameters: {'lr': 0.0010073639605119244, 'batch_size': 2048, 'num_inducing': 623, 'num_samples': 11, 'kernel_type': 'matern1.5', 'n_gp_layers': 1, 'n_gp_out': 1}. Best is trial 1 with value: 37.39690017700195.[0m
[32m[I 2023-06-12 22:48:01,521][0m Trial 11 pruned. [0m
[32m[I 2023-06-12 22:49:33,536][0m Trial 5 finished with value: 42.05530548095703 and parameters: {'lr': 0.04956909084151764, 'batch_size': 512, 'num_inducing': 630, 'num_samples': 15, 'kernel_type': 'matern0.5', 'n_gp_layers': 3, 'n_gp_out': 5}. Best is trial 4 with value: 37.11784744262695.[0m
/home/linyuhan/my_project/venv_CMAPSS/lib64/python3.6/site-packages/gpytorch/distributions/multivariate_normal.py:263: NumericalWarning: Negative variance values detected. This is likely due to numerical instabilities. Rounding negative variances up to 1e-06.
  NumericalWarning,
[32m[I 2023-06-12 22:51:44,633][0m Trial 15 finished with value: 37.577857971191406 and parameters: {'lr': 0.03957630522557885, 'batch_size': 512, 'num_inducing': 92, 'num_samples': 9, 'kernel_type': 'matern0.5', 'n_gp_layers': 2, 'n_gp_out': 1}. Best is trial 15 with value: 37.577857971191406.[0m
[32m[I 2023-06-12 22:55:22,578][0m Trial 16 pruned. [0m
[32m[I 2023-06-12 22:57:20,428][0m Trial 8 pruned. [0m
Current Configuration: n_gp_layers:2 - n_gp_out: 1 - num_inducing: 128 - num_samples: 10 - batch_size:1024 - num_inducing: 128 - lr: 0.01
0/400 - Loss: 14781.0185546875 - Score: 118.20943450927734
10/400 - Loss: 5195.8876953125 - Score: 94.68354034423828
20/400 - Loss: 2393.081787109375 - Score: 71.6382064819336
30/400 - Loss: 1198.148681640625 - Score: 56.40852355957031
40/400 - Loss: 647.209228515625 - Score: 48.06755065917969
50/400 - Loss: 490.4278869628906 - Score: 43.344844818115234
EarlyStopping counter: 1 out of 15
EarlyStopping counter: 1 out of 15
EarlyStopping counter: 1 out of 15
EarlyStopping counter: 2 out of 15
EarlyStopping counter: 3 out of 15
60/400 - Loss: 326.9554138183594 - Score: 42.107032775878906
EarlyStopping counter: 1 out of 15
EarlyStopping counter: 1 out of 15
EarlyStopping counter: 1 out of 15
EarlyStopping counter: 1 out of 15
EarlyStopping counter: 2 out of 15
70/400 - Loss: 260.34271240234375 - Score: 40.443641662597656
EarlyStopping counter: 3 out of 15
EarlyStopping counter: 1 out of 15
EarlyStopping counter: 1 out of 15
EarlyStopping counter: 2 out of 15
EarlyStopping counter: 3 out of 15
EarlyStopping counter: 4 out of 15
EarlyStopping counter: 5 out of 15
EarlyStopping counter: 6 out of 15
80/400 - Loss: 219.68734741210938 - Score: 39.39104080200195
EarlyStopping counter: 1 out of 15
EarlyStopping counter: 2 out of 15
EarlyStopping counter: 1 out of 15
EarlyStopping counter: 1 out of 15
EarlyStopping counter: 1 out of 15
EarlyStopping counter: 2 out of 15
90/400 - Loss: 203.37420654296875 - Score: 39.19893264770508
EarlyStopping counter: 3 out of 15
EarlyStopping counter: 1 out of 15
EarlyStopping counter: 2 out of 15
EarlyStopping counter: 3 out of 15
EarlyStopping counter: 1 out of 15
EarlyStopping counter: 2 out of 15
EarlyStopping counter: 3 out of 15
100/400 - Loss: 164.0131378173828 - Score: 38.006996154785156
EarlyStopping counter: 1 out of 15
EarlyStopping counter: 1 out of 15
EarlyStopping counter: 2 out of 15
EarlyStopping counter: 3 out of 15
EarlyStopping counter: 4 out of 15
EarlyStopping counter: 5 out of 15
EarlyStopping counter: 6 out of 15
EarlyStopping counter: 7 out of 15
EarlyStopping counter: 8 out of 15
110/400 - Loss: 151.72109985351562 - Score: 38.001251220703125
EarlyStopping counter: 9 out of 15
EarlyStopping counter: 10 out of 15
EarlyStopping counter: 1 out of 15
EarlyStopping counter: 2 out of 15
EarlyStopping counter: 3 out of 15
EarlyStopping counter: 4 out of 15
EarlyStopping counter: 5 out of 15
120/400 - Loss: 145.22604370117188 - Score: 37.72156524658203
EarlyStopping counter: 1 out of 15
EarlyStopping counter: 2 out of 15
EarlyStopping counter: 3 out of 15
EarlyStopping counter: 1 out of 15
EarlyStopping counter: 2 out of 15
EarlyStopping counter: 3 out of 15
EarlyStopping counter: 4 out of 15
EarlyStopping counter: 1 out of 15
130/400 - Loss: 149.86329650878906 - Score: 38.04178237915039
EarlyStopping counter: 2 out of 15
EarlyStopping counter: 3 out of 15
Time Budget run out. Pruning Trial
Current Configuration: n_gp_layers:2 - n_gp_out: 4 - num_inducing: 75 - num_samples: 13 - batch_size:512 - num_inducing: 75 - lr: 0.009620458665835267
0/400 - Loss: 13416.8603515625 - Score: 117.89276123046875
10/400 - Loss: 1970.6495361328125 - Score: 63.78292465209961
20/400 - Loss: 513.8096313476562 - Score: 44.622276306152344
30/400 - Loss: 262.3905029296875 - Score: 39.87832260131836
EarlyStopping counter: 1 out of 15
40/400 - Loss: 197.8849334716797 - Score: 38.27227783203125
EarlyStopping counter: 1 out of 15
EarlyStopping counter: 2 out of 15
EarlyStopping counter: 1 out of 15
EarlyStopping counter: 2 out of 15
EarlyStopping counter: 1 out of 15
EarlyStopping counter: 2 out of 15
EarlyStopping counter: 3 out of 15
50/400 - Loss: 157.91488647460938 - Score: 38.107601165771484
EarlyStopping counter: 4 out of 15
EarlyStopping counter: 5 out of 15
EarlyStopping counter: 1 out of 15
Time Budget run out. Pruning Trial
Current Configuration: n_gp_layers:4 - n_gp_out: 6 - num_inducing: 125 - num_samples: 6 - batch_size:2048 - num_inducing: 125 - lr: 0.0002849533367718103
0/400 - Loss: 16530.873046875 - Score: 118.56827545166016
Time Budget run out. Pruning Trial
Current Configuration: n_gp_layers:4 - n_gp_out: 1 - num_inducing: 179 - num_samples: 14 - batch_size:512 - num_inducing: 179 - lr: 0.012139959464094277
0/400 - Loss: 12509.9794921875 - Score: 116.13619995117188
10/400 - Loss: 2178.24755859375 - Score: 72.78398895263672
20/400 - Loss: 614.45556640625 - Score: 48.22916793823242
EarlyStopping counter: 1 out of 15
EarlyStopping counter: 1 out of 15
EarlyStopping counter: 2 out of 15
EarlyStopping counter: 3 out of 15
30/400 - Loss: 390.5364074707031 - Score: 43.52883529663086
EarlyStopping counter: 4 out of 15
EarlyStopping counter: 5 out of 15
EarlyStopping counter: 6 out of 15
EarlyStopping counter: 1 out of 15
EarlyStopping counter: 2 out of 15
EarlyStopping counter: 3 out of 15
40/400 - Loss: 221.69410705566406 - Score: 40.24517059326172
EarlyStopping counter: 4 out of 15
EarlyStopping counter: 1 out of 15
EarlyStopping counter: 1 out of 15
EarlyStopping counter: 2 out of 15
EarlyStopping counter: 3 out of 15
EarlyStopping counter: 4 out of 15
EarlyStopping counter: 5 out of 15
50/400 - Loss: 187.1746826171875 - Score: 39.024776458740234
EarlyStopping counter: 1 out of 15
EarlyStopping counter: 2 out of 15
EarlyStopping counter: 3 out of 15
EarlyStopping counter: 4 out of 15
EarlyStopping counter: 5 out of 15
EarlyStopping counter: 6 out of 15
EarlyStopping counter: 7 out of 15
EarlyStopping counter: 8 out of 15
EarlyStopping counter: 9 out of 15
EarlyStopping counter: 10 out of 15
60/400 - Loss: 172.3414764404297 - Score: 39.22465515136719
EarlyStopping counter: 11 out of 15
EarlyStopping counter: 12 out of 15
EarlyStopping counter: 13 out of 15
EarlyStopping counter: 14 out of 15
EarlyStopping counter: 15 out of 15
Early stopping
Current Configuration: n_gp_layers:1 - n_gp_out: 6 - num_inducing: 96 - num_samples: 12 - batch_size:1024 - num_inducing: 96 - lr: 0.03791480521203901
0/400 - Loss: 11041.7841796875 - Score: 116.74943542480469
10/400 - Loss: 283.8981628417969 - Score: 40.283199310302734
EarlyStopping counter: 1 out of 15
EarlyStopping counter: 1 out of 15
EarlyStopping counter: 2 out of 15
20/400 - Loss: 258.563232421875 - Score: 37.72502899169922
EarlyStopping counter: 3 out of 15
EarlyStopping counter: 4 out of 15
EarlyStopping counter: 5 out of 15
EarlyStopping counter: 6 out of 15
EarlyStopping counter: 7 out of 15
EarlyStopping counter: 1 out of 15
EarlyStopping counter: 2 out of 15
30/400 - Loss: 123.25594329833984 - Score: 37.23435592651367
EarlyStopping counter: 3 out of 15
EarlyStopping counter: 4 out of 15
EarlyStopping counter: 5 out of 15
EarlyStopping counter: 6 out of 15
EarlyStopping counter: 7 out of 15
EarlyStopping counter: 8 out of 15
EarlyStopping counter: 9 out of 15
EarlyStopping counter: 10 out of 15
EarlyStopping counter: 11 out of 15
EarlyStopping counter: 12 out of 15
40/400 - Loss: 123.81436157226562 - Score: 37.30384063720703
EarlyStopping counter: 13 out of 15
EarlyStopping counter: 14 out of 15
EarlyStopping counter: 15 out of 15
Early stopping
Current Configuration: n_gp_layers:3 - n_gp_out: 5 - num_inducing: 630 - num_samples: 15 - batch_size:512 - num_inducing: 630 - lr: 0.04956909084151764
0/400 - Loss: 4120.671875 - Score: 83.36383056640625
Time Budget run out. Pruning Trial
Current Configuration: n_gp_layers:1 - n_gp_out: 4 - num_inducing: 276 - num_samples: 12 - batch_size:512 - num_inducing: 276 - lr: 0.01543640589813031
0/400 - Loss: 11820.7333984375 - Score: 116.46210479736328
10/400 - Loss: 358.1434326171875 - Score: 39.58043670654297
EarlyStopping counter: 1 out of 15
EarlyStopping counter: 1 out of 15
EarlyStopping counter: 2 out of 15
20/400 - Loss: 300.27899169921875 - Score: 37.439212799072266
EarlyStopping counter: 1 out of 15
EarlyStopping counter: 1 out of 15
EarlyStopping counter: 2 out of 15
EarlyStopping counter: 3 out of 15
EarlyStopping counter: 4 out of 15
EarlyStopping counter: 5 out of 15
EarlyStopping counter: 6 out of 15
EarlyStopping counter: 7 out of 15
[32m[I 2023-06-12 23:04:32,943][0m Trial 11 finished with value: 37.291175842285156 and parameters: {'lr': 0.0075067136919158865, 'batch_size': 1024, 'num_inducing': 293, 'num_samples': 2, 'kernel_type': 'rbf', 'n_gp_layers': 1, 'n_gp_out': 2}. Best is trial 11 with value: 37.291175842285156.[0m
[32m[I 2023-06-12 23:05:22,698][0m Trial 6 finished with value: 37.17204666137695 and parameters: {'lr': 0.01543640589813031, 'batch_size': 512, 'num_inducing': 276, 'num_samples': 12, 'kernel_type': 'rbf', 'n_gp_layers': 1, 'n_gp_out': 4}. Best is trial 4 with value: 37.11784744262695.[0m
[32m[I 2023-06-12 23:06:25,468][0m Trial 9 pruned. [0m
[32m[I 2023-06-12 23:13:42,450][0m Trial 10 pruned. [0m
[32m[I 2023-06-12 23:16:34,373][0m Trial 11 pruned. [0m
[32m[I 2023-06-12 23:20:35,933][0m Trial 12 pruned. [0m
[32m[I 2023-06-12 23:20:45,006][0m Trial 12 pruned. [0m
[32m[I 2023-06-12 23:21:49,450][0m Trial 13 pruned. [0m
[32m[I 2023-06-12 23:23:09,642][0m Trial 17 pruned. [0m
[32m[I 2023-06-12 23:30:18,208][0m Trial 12 pruned. [0m
[32m[I 2023-06-12 23:31:54,248][0m Trial 13 pruned. [0m
[32m[I 2023-06-12 23:32:03,555][0m Trial 13 finished with value: 37.22980880737305 and parameters: {'lr': 0.039338593636438914, 'batch_size': 1024, 'num_inducing': 392, 'num_samples': 3, 'kernel_type': 'rbf', 'n_gp_layers': 1, 'n_gp_out': 2}. Best is trial 13 with value: 37.22980880737305.[0m
[32m[I 2023-06-12 23:33:37,706][0m Trial 14 pruned. [0m
