[32m[I 2023-06-12 23:40:55,232][0m Trial 14 pruned. [0m
/home/linyuhan/my_project/venv_CMAPSS/lib64/python3.6/site-packages/gpytorch/utils/cholesky.py:40: NumericalWarning: A not p.d., added jitter of 1.0e-08 to the diagonal
  NumericalWarning,
/home/linyuhan/my_project/venv_CMAPSS/lib64/python3.6/site-packages/gpytorch/utils/cholesky.py:40: NumericalWarning: A not p.d., added jitter of 1.0e-07 to the diagonal
  NumericalWarning,
/home/linyuhan/my_project/venv_CMAPSS/lib64/python3.6/site-packages/gpytorch/utils/cholesky.py:40: NumericalWarning: A not p.d., added jitter of 1.0e-06 to the diagonal
  NumericalWarning,
[33m[W 2023-06-12 23:58:17,358][0m Trial 10 failed because of the following error: NotPSDError('Matrix not positive definite after repeatedly adding jitter up to 1.0e-06.',)[0m
Traceback (most recent call last):
  File "/home/linyuhan/my_project/venv_CMAPSS/lib64/python3.6/site-packages/optuna/study/_optimize.py", line 196, in _run_trial
    value_or_values = func(trial)
  File "/home/linyuhan/Dokumente/Masterarbeit/dataset/CMAPSS/code/DGP_Yuhan/HPO_DGP.py", line 400, in <lambda>
    metric=mae),
  File "/home/linyuhan/Dokumente/Masterarbeit/dataset/CMAPSS/code/DGP_Yuhan/HPO_DGP.py", line 263, in objective_train_test
    output = model(X_batch)
  File "/home/linyuhan/my_project/venv_CMAPSS/lib64/python3.6/site-packages/gpytorch/module.py", line 30, in __call__
    outputs = self.forward(*inputs, **kwargs)
  File "/home/linyuhan/Dokumente/Masterarbeit/dataset/CMAPSS/code/DGP_Yuhan/src/deep_gp.py", line 145, in forward
    output = layer(output)
  File "/home/linyuhan/Dokumente/Masterarbeit/dataset/CMAPSS/code/DGP_Yuhan/src/deep_gp.py", line 91, in __call__
    return super().__call__(x, are_samples=bool(len(other_inputs)))
  File "/home/linyuhan/my_project/venv_CMAPSS/lib64/python3.6/site-packages/gpytorch/models/deep_gps/deep_gp.py", line 99, in __call__
    output = ApproximateGP.__call__(self, inputs)
  File "/home/linyuhan/my_project/venv_CMAPSS/lib64/python3.6/site-packages/gpytorch/models/approximate_gp.py", line 81, in __call__
    return self.variational_strategy(inputs, prior=prior, **kwargs)
  File "/home/linyuhan/my_project/venv_CMAPSS/lib64/python3.6/site-packages/gpytorch/variational/variational_strategy.py", line 169, in __call__
    return super().__call__(x, prior=prior, **kwargs)
  File "/home/linyuhan/my_project/venv_CMAPSS/lib64/python3.6/site-packages/gpytorch/variational/_variational_strategy.py", line 129, in __call__
    **kwargs,
  File "/home/linyuhan/my_project/venv_CMAPSS/lib64/python3.6/site-packages/gpytorch/module.py", line 30, in __call__
    outputs = self.forward(*inputs, **kwargs)
  File "/home/linyuhan/my_project/venv_CMAPSS/lib64/python3.6/site-packages/gpytorch/variational/variational_strategy.py", line 103, in forward
    L = self._cholesky_factor(induc_induc_covar)
  File "/home/linyuhan/my_project/venv_CMAPSS/lib64/python3.6/site-packages/gpytorch/utils/memoize.py", line 76, in g
    return _add_to_cache_ignore_args(self, cache_name, method(self, *args, **kwargs))
  File "/home/linyuhan/my_project/venv_CMAPSS/lib64/python3.6/site-packages/gpytorch/variational/variational_strategy.py", line 72, in _cholesky_factor
    L = psd_safe_cholesky(delazify(induc_induc_covar).type(_linalg_dtype_cholesky.value()))
  File "/home/linyuhan/my_project/venv_CMAPSS/lib64/python3.6/site-packages/gpytorch/utils/cholesky.py", line 63, in psd_safe_cholesky
    L = _psd_safe_cholesky(A, out=out, jitter=jitter, max_tries=max_tries)
  File "/home/linyuhan/my_project/venv_CMAPSS/lib64/python3.6/site-packages/gpytorch/utils/cholesky.py", line 45, in _psd_safe_cholesky
    raise NotPSDError(f"Matrix not positive definite after repeatedly adding jitter up to {jitter_new:.1e}.")
gpytorch.utils.errors.NotPSDError: Matrix not positive definite after repeatedly adding jitter up to 1.0e-06.
Current Configuration: n_gp_layers:2 - n_gp_out: 1 - num_inducing: 128 - num_samples: 10 - batch_size:1024 - num_inducing: 128 - lr: 0.01
0/400 - Loss: 14730.9951171875 - Score: 117.98822021484375
10/400 - Loss: 5741.75537109375 - Score: 100.97698211669922
20/400 - Loss: 2960.072265625 - Score: 80.93203735351562
30/400 - Loss: 1632.894287109375 - Score: 65.19923400878906
40/400 - Loss: 929.6851806640625 - Score: 54.31050109863281
50/400 - Loss: 564.6900634765625 - Score: 47.48271179199219
60/400 - Loss: 393.6404724121094 - Score: 43.55791091918945
EarlyStopping counter: 1 out of 15
EarlyStopping counter: 1 out of 15
EarlyStopping counter: 1 out of 15
EarlyStopping counter: 1 out of 15
70/400 - Loss: 288.4618835449219 - Score: 41.437801361083984
EarlyStopping counter: 1 out of 15
EarlyStopping counter: 2 out of 15
80/400 - Loss: 221.21109008789062 - Score: 39.97935485839844
EarlyStopping counter: 1 out of 15
90/400 - Loss: 188.8480682373047 - Score: 39.217796325683594
EarlyStopping counter: 2 out of 15
EarlyStopping counter: 1 out of 15
EarlyStopping counter: 2 out of 15
EarlyStopping counter: 3 out of 15
EarlyStopping counter: 1 out of 15
100/400 - Loss: 161.62612915039062 - Score: 38.648406982421875
EarlyStopping counter: 2 out of 15
EarlyStopping counter: 3 out of 15
EarlyStopping counter: 1 out of 15
EarlyStopping counter: 2 out of 15
EarlyStopping counter: 3 out of 15
EarlyStopping counter: 1 out of 15
EarlyStopping counter: 1 out of 15
110/400 - Loss: 150.02806091308594 - Score: 38.29671859741211
EarlyStopping counter: 2 out of 15
EarlyStopping counter: 3 out of 15
EarlyStopping counter: 4 out of 15
EarlyStopping counter: 5 out of 15
EarlyStopping counter: 1 out of 15
EarlyStopping counter: 2 out of 15
120/400 - Loss: 144.20419311523438 - Score: 38.21498107910156
EarlyStopping counter: 1 out of 15
EarlyStopping counter: 2 out of 15
EarlyStopping counter: 3 out of 15
EarlyStopping counter: 1 out of 15
130/400 - Loss: 129.7274169921875 - Score: 37.90920639038086
EarlyStopping counter: 1 out of 15
EarlyStopping counter: 2 out of 15
EarlyStopping counter: 3 out of 15
Time Budget run out. Pruning Trial
Current Configuration: n_gp_layers:1 - n_gp_out: 6 - num_inducing: 68 - num_samples: 8 - batch_size:2048 - num_inducing: 68 - lr: 0.007987353252504565
0/400 - Loss: 15814.5732421875 - Score: 118.49147033691406
10/400 - Loss: 9879.5439453125 - Score: 113.38414764404297
20/400 - Loss: 5470.76708984375 - Score: 91.81055450439453
30/400 - Loss: 3475.076904296875 - Score: 77.14175415039062
40/400 - Loss: 2296.5751953125 - Score: 66.22076416015625
50/400 - Loss: 1561.0845947265625 - Score: 58.19588851928711
60/400 - Loss: 1088.1075439453125 - Score: 52.287071228027344
70/400 - Loss: 779.1713256835938 - Score: 48.001346588134766
80/400 - Loss: 578.7413330078125 - Score: 44.93598937988281
90/400 - Loss: 446.5007019042969 - Score: 42.76404571533203
100/400 - Loss: 359.0181884765625 - Score: 41.28072738647461
110/400 - Loss: 297.51129150390625 - Score: 40.26322555541992
120/400 - Loss: 254.9112091064453 - Score: 39.53813171386719
130/400 - Loss: 224.00018310546875 - Score: 39.03825759887695
140/400 - Loss: 201.70413208007812 - Score: 38.682411193847656
150/400 - Loss: 183.68807983398438 - Score: 38.42697525024414
EarlyStopping counter: 1 out of 15
Time Budget run out. Pruning Trial
Current Configuration: n_gp_layers:1 - n_gp_out: 6 - num_inducing: 106 - num_samples: 11 - batch_size:1024 - num_inducing: 106 - lr: 0.0008586713192096651
0/400 - Loss: 16396.353515625 - Score: 118.55449676513672
10/400 - Loss: 14827.8818359375 - Score: 118.29711151123047
20/400 - Loss: 13429.1865234375 - Score: 117.50399017333984
30/400 - Loss: 12070.35546875 - Score: 115.24979400634766
40/400 - Loss: 10640.4052734375 - Score: 110.91310119628906
50/400 - Loss: 9244.83203125 - Score: 106.15288543701172
60/400 - Loss: 8168.45458984375 - Score: 102.07451629638672
70/400 - Loss: 7277.10107421875 - Score: 98.41020965576172
80/400 - Loss: 6514.05419921875 - Score: 95.01419067382812
90/400 - Loss: 5867.03076171875 - Score: 91.72364807128906
100/400 - Loss: 5302.63623046875 - Score: 88.58185577392578
110/400 - Loss: 4801.42138671875 - Score: 85.58118438720703
Time Budget run out. Pruning Trial
Current Configuration: n_gp_layers:1 - n_gp_out: 1 - num_inducing: 62 - num_samples: 14 - batch_size:1024 - num_inducing: 62 - lr: 0.0003467275099530408
0/400 - Loss: 16491.64453125 - Score: 118.55894470214844
Current Configuration: n_gp_layers:1 - n_gp_out: 5 - num_inducing: 596 - num_samples: 15 - batch_size:1024 - num_inducing: 596 - lr: 0.06704678381845867
0/400 - Loss: 8041.275390625 - Score: 110.87281799316406
EarlyStopping counter: 1 out of 15
EarlyStopping counter: 1 out of 15
EarlyStopping counter: 2 out of 15
EarlyStopping counter: 3 out of 15
EarlyStopping counter: 4 out of 15
10/400 - Loss: 301.85247802734375 - Score: 38.32732391357422
EarlyStopping counter: 5 out of 15
EarlyStopping counter: 6 out of 15
EarlyStopping counter: 1 out of 15
EarlyStopping counter: 2 out of 15
Time Budget run out. Pruning Trial
Current Configuration: n_gp_layers:1 - n_gp_out: 1 - num_inducing: 56 - num_samples: 11 - batch_size:1024 - num_inducing: 56 - lr: 0.057083238070506304
0/400 - Loss: 9296.0078125 - Score: 115.74030303955078
Current Configuration: n_gp_layers:1 - n_gp_out: 5 - num_inducing: 464 - num_samples: 15 - batch_size:1024 - num_inducing: 464 - lr: 0.03822827340683878
0/400 - Loss: 10873.3154296875 - Score: 115.41902160644531
10/400 - Loss: 366.7979736328125 - Score: 37.004764556884766
EarlyStopping counter: 1 out of 15
EarlyStopping counter: 2 out of 15
EarlyStopping counter: 3 out of 15
EarlyStopping counter: 4 out of 15
EarlyStopping counter: 1 out of 15
EarlyStopping counter: 2 out of 15
EarlyStopping counter: 3 out of 15
20/400 - Loss: 139.6118927001953 - Score: 37.01579666137695
EarlyStopping counter: 4 out of 15
EarlyStopping counter: 5 out of 15
EarlyStopping counter: 6 out of 15
EarlyStopping counter: 7 out of 15
EarlyStopping counter: 8 out of 15
EarlyStopping counter: 9 out of 15
EarlyStopping counter: 10 out of 15
EarlyStopping counter: 11 out of 15
EarlyStopping counter: 12 out of 15
Time Budget run out. Pruning Trial
Current Configuration: n_gp_layers:4 - n_gp_out: 1 - num_inducing: 97 - num_samples: 10 - batch_size:512 - num_inducing: 97 - lr: 0.030919798258844864
0/400 - Loss: 8740.126953125 - Score: 112.4298324584961
Current Configuration: n_gp_layers:2 - n_gp_out: 3 - num_inducing: 177 - num_samples: 5 - batch_size:2048 - num_inducing: 177 - lr: 0.00025632776947322986
0/400 - Loss: 16533.66015625 - Score: 118.56835174560547
10/400 - Loss: 16263.271484375 - Score: 118.53958129882812
20/400 - Loss: 16001.875 - Score: 118.50505065917969
30/400 - Loss: 15747.171875 - Score: 118.45718383789062
40/400 - Loss: 15494.0654296875 - Score: 118.3870620727539
50/400 - Loss: 15237.8515625 - Score: 118.28950500488281
Time Budget run out. Pruning Trial
Current Configuration: n_gp_layers:2 - n_gp_out: 6 - num_inducing: 131 - num_samples: 5 - batch_size:1024 - num_inducing: 131 - lr: 0.00011969592007035675
0/400 - Loss: 16535.328125 - Score: 118.5682144165039
Current Configuration: n_gp_layers:1 - n_gp_out: 1 - num_inducing: 188 - num_samples: 12 - batch_size:512 - num_inducing: 188 - lr: 0.0006451402906792897
0/400 - Loss: 16311.1962890625 - Score: 118.52068328857422
10/400 - Loss: 14084.4072265625 - Score: 117.741943359375
20/400 - Loss: 12295.671875 - Score: 116.43878936767578
30/400 - Loss: 10754.9794921875 - Score: 114.18810272216797
40/400 - Loss: 9335.5361328125 - Score: 110.77328491210938
50/400 - Loss: 8194.5126953125 - Score: 107.52940368652344
60/400 - Loss: 7247.13916015625 - Score: 104.55403137207031
70/400 - Loss: 6459.865234375 - Score: 101.6543960571289
80/400 - Loss: 5768.44287109375 - Score: 98.74535369873047
90/400 - Loss: 5159.54443359375 - Score: 95.8077163696289
100/400 - Loss: 4631.23388671875 - Score: 92.93701934814453
Traceback (most recent call last):
  File "/home/linyuhan/Dokumente/Masterarbeit/dataset/CMAPSS/code/DGP_Yuhan/experiment.py", line 30, in <module>
    time_tolerance=time_tolerance)
  File "/home/linyuhan/Dokumente/Masterarbeit/dataset/CMAPSS/code/DGP_Yuhan/HPO_DGP.py", line 401, in HPO_DGP
    n_trials=n_trials)  # n_trials=N_TRIALS
  File "/home/linyuhan/my_project/venv_CMAPSS/lib64/python3.6/site-packages/optuna/study/study.py", line 428, in optimize
    show_progress_bar=show_progress_bar,
  File "/home/linyuhan/my_project/venv_CMAPSS/lib64/python3.6/site-packages/optuna/study/_optimize.py", line 76, in _optimize
    progress_bar=progress_bar,
  File "/home/linyuhan/my_project/venv_CMAPSS/lib64/python3.6/site-packages/optuna/study/_optimize.py", line 160, in _optimize_sequential
    frozen_trial = _run_trial(study, func, catch)
  File "/home/linyuhan/my_project/venv_CMAPSS/lib64/python3.6/site-packages/optuna/study/_optimize.py", line 234, in _run_trial
    raise func_err
  File "/home/linyuhan/my_project/venv_CMAPSS/lib64/python3.6/site-packages/optuna/study/_optimize.py", line 196, in _run_trial
    value_or_values = func(trial)
  File "/home/linyuhan/Dokumente/Masterarbeit/dataset/CMAPSS/code/DGP_Yuhan/HPO_DGP.py", line 400, in <lambda>
    metric=mae),
  File "/home/linyuhan/Dokumente/Masterarbeit/dataset/CMAPSS/code/DGP_Yuhan/HPO_DGP.py", line 263, in objective_train_test
    output = model(X_batch)
  File "/home/linyuhan/my_project/venv_CMAPSS/lib64/python3.6/site-packages/gpytorch/module.py", line 30, in __call__
    outputs = self.forward(*inputs, **kwargs)
  File "/home/linyuhan/Dokumente/Masterarbeit/dataset/CMAPSS/code/DGP_Yuhan/src/deep_gp.py", line 145, in forward
    output = layer(output)
  File "/home/linyuhan/Dokumente/Masterarbeit/dataset/CMAPSS/code/DGP_Yuhan/src/deep_gp.py", line 91, in __call__
    return super().__call__(x, are_samples=bool(len(other_inputs)))
  File "/home/linyuhan/my_project/venv_CMAPSS/lib64/python3.6/site-packages/gpytorch/models/deep_gps/deep_gp.py", line 99, in __call__
    output = ApproximateGP.__call__(self, inputs)
  File "/home/linyuhan/my_project/venv_CMAPSS/lib64/python3.6/site-packages/gpytorch/models/approximate_gp.py", line 81, in __call__
    return self.variational_strategy(inputs, prior=prior, **kwargs)
  File "/home/linyuhan/my_project/venv_CMAPSS/lib64/python3.6/site-packages/gpytorch/variational/variational_strategy.py", line 169, in __call__
    return super().__call__(x, prior=prior, **kwargs)
  File "/home/linyuhan/my_project/venv_CMAPSS/lib64/python3.6/site-packages/gpytorch/variational/_variational_strategy.py", line 129, in __call__
    **kwargs,
  File "/home/linyuhan/my_project/venv_CMAPSS/lib64/python3.6/site-packages/gpytorch/module.py", line 30, in __call__
    outputs = self.forward(*inputs, **kwargs)
  File "/home/linyuhan/my_project/venv_CMAPSS/lib64/python3.6/site-packages/gpytorch/variational/variational_strategy.py", line 103, in forward
    L = self._cholesky_factor(induc_induc_covar)
  File "/home/linyuhan/my_project/venv_CMAPSS/lib64/python3.6/site-packages/gpytorch/utils/memoize.py", line 76, in g
    return _add_to_cache_ignore_args(self, cache_name, method(self, *args, **kwargs))
  File "/home/linyuhan/my_project/venv_CMAPSS/lib64/python3.6/site-packages/gpytorch/variational/variational_strategy.py", line 72, in _cholesky_factor
    L = psd_safe_cholesky(delazify(induc_induc_covar).type(_linalg_dtype_cholesky.value()))
  File "/home/linyuhan/my_project/venv_CMAPSS/lib64/python3.6/site-packages/gpytorch/utils/cholesky.py", line 63, in psd_safe_cholesky
    L = _psd_safe_cholesky(A, out=out, jitter=jitter, max_tries=max_tries)
  File "/home/linyuhan/my_project/venv_CMAPSS/lib64/python3.6/site-packages/gpytorch/utils/cholesky.py", line 45, in _psd_safe_cholesky
    raise NotPSDError(f"Matrix not positive definite after repeatedly adding jitter up to {jitter_new:.1e}.")
gpytorch.utils.errors.NotPSDError: Matrix not positive definite after repeatedly adding jitter up to 1.0e-06.
[32m[I 2023-06-13 00:00:12,360][0m Trial 16 pruned. [0m
[32m[I 2023-06-13 00:04:17,480][0m Trial 17 pruned. [0m
[32m[I 2023-06-13 00:05:43,851][0m Trial 7 finished with value: 117.49380493164062 and parameters: {'lr': 0.00010663109589553259, 'batch_size': 1024, 'num_inducing': 166, 'num_samples': 5, 'kernel_type': 'matern0.5', 'n_gp_layers': 2, 'n_gp_out': 4}. Best is trial 4 with value: 37.11784744262695.[0m
[32m[I 2023-06-13 00:08:04,521][0m Trial 18 pruned. [0m
[32m[I 2023-06-13 00:22:27,694][0m Trial 14 finished with value: 117.7249526977539 and parameters: {'lr': 0.00041513530702190374, 'batch_size': 2048, 'num_inducing': 72, 'num_samples': 14, 'kernel_type': 'rbf', 'n_gp_layers': 3, 'n_gp_out': 2}. Best is trial 1 with value: 37.78729248046875.[0m
[32m[I 2023-06-13 00:24:04,266][0m Trial 15 pruned. [0m
[32m[I 2023-06-13 00:25:17,587][0m Trial 18 finished with value: 37.789554595947266 and parameters: {'lr': 0.0661742641313344, 'batch_size': 512, 'num_inducing': 781, 'num_samples': 6, 'kernel_type': 'matern1.5', 'n_gp_layers': 1, 'n_gp_out': 2}. Best is trial 15 with value: 37.577857971191406.[0m
[32m[I 2023-06-13 00:26:18,716][0m Trial 19 pruned. [0m
[32m[I 2023-06-13 00:43:09,531][0m Trial 8 finished with value: 107.82142639160156 and parameters: {'lr': 0.00021254874706633808, 'batch_size': 1024, 'num_inducing': 63, 'num_samples': 7, 'kernel_type': 'rbf', 'n_gp_layers': 2, 'n_gp_out': 1}. Best is trial 4 with value: 37.11784744262695.[0m
[32m[I 2023-06-13 00:51:48,080][0m Trial 9 pruned. [0m
[32m[I 2023-06-13 00:57:44,625][0m Trial 10 pruned. [0m
30/400 - Loss: 233.49310302734375 - Score: 37.738121032714844[32m[I 2023-06-13 01:08:30,614][0m Trial 19 finished with value: 41.460391998291016 and parameters: {'lr': 0.004101198340681486, 'batch_size': 512, 'num_inducing': 132, 'num_samples': 15, 'kernel_type': 'matern0.5', 'n_gp_layers': 4, 'n_gp_out': 2}. Best is trial 13 with value: 37.22980880737305.[0m
