[32m[I 2023-06-13 01:10:22,315][0m Trial 20 pruned. [0m
Current Configuration: n_gp_layers:2 - n_gp_out: 1 - num_inducing: 128 - num_samples: 10 - batch_size:1024 - num_inducing: 128 - lr: 0.01
0/400 - Loss: 14751.619140625 - Score: 118.08731079101562
10/400 - Loss: 5930.10400390625 - Score: 103.2435302734375
20/400 - Loss: 3197.869140625 - Score: 84.90951538085938
30/400 - Loss: 1855.60546875 - Score: 69.54268646240234
40/400 - Loss: 1108.0511474609375 - Score: 58.17565155029297
50/400 - Loss: 686.9927978515625 - Score: 50.60844421386719
60/400 - Loss: 453.90240478515625 - Score: 45.647613525390625
70/400 - Loss: 329.7372131347656 - Score: 42.670982360839844
EarlyStopping counter: 1 out of 15
EarlyStopping counter: 2 out of 15
80/400 - Loss: 275.6100769042969 - Score: 41.47648239135742
EarlyStopping counter: 1 out of 15
EarlyStopping counter: 2 out of 15
90/400 - Loss: 205.5044708251953 - Score: 39.67677688598633
EarlyStopping counter: 1 out of 15
EarlyStopping counter: 2 out of 15
100/400 - Loss: 181.07737731933594 - Score: 39.229984283447266
EarlyStopping counter: 1 out of 15
EarlyStopping counter: 2 out of 15
EarlyStopping counter: 3 out of 15
EarlyStopping counter: 4 out of 15
EarlyStopping counter: 5 out of 15
110/400 - Loss: 180.36849975585938 - Score: 39.329627990722656
EarlyStopping counter: 6 out of 15
EarlyStopping counter: 7 out of 15
EarlyStopping counter: 8 out of 15
EarlyStopping counter: 9 out of 15
EarlyStopping counter: 10 out of 15
EarlyStopping counter: 1 out of 15
120/400 - Loss: 139.40866088867188 - Score: 38.26071548461914
EarlyStopping counter: 1 out of 15
EarlyStopping counter: 1 out of 15
EarlyStopping counter: 2 out of 15
EarlyStopping counter: 3 out of 15
EarlyStopping counter: 4 out of 15
EarlyStopping counter: 5 out of 15
EarlyStopping counter: 6 out of 15
130/400 - Loss: 130.91500854492188 - Score: 38.1454963684082
Time Budget run out. Pruning Trial
Current Configuration: n_gp_layers:1 - n_gp_out: 1 - num_inducing: 166 - num_samples: 14 - batch_size:512 - num_inducing: 166 - lr: 0.0555442770834226
0/400 - Loss: 6148.69873046875 - Score: 108.30158233642578
EarlyStopping counter: 1 out of 15
EarlyStopping counter: 2 out of 15
10/400 - Loss: 198.12648010253906 - Score: 39.25997543334961
EarlyStopping counter: 1 out of 15
EarlyStopping counter: 2 out of 15
EarlyStopping counter: 3 out of 15
EarlyStopping counter: 1 out of 15
EarlyStopping counter: 1 out of 15
EarlyStopping counter: 1 out of 15
20/400 - Loss: 188.64918518066406 - Score: 38.90864944458008
EarlyStopping counter: 2 out of 15
EarlyStopping counter: 3 out of 15
EarlyStopping counter: 4 out of 15
EarlyStopping counter: 5 out of 15
EarlyStopping counter: 1 out of 15
EarlyStopping counter: 2 out of 15
EarlyStopping counter: 3 out of 15
EarlyStopping counter: 1 out of 15
30/400 - Loss: 199.85203552246094 - Score: 38.743980407714844
EarlyStopping counter: 2 out of 15
EarlyStopping counter: 1 out of 15
EarlyStopping counter: 2 out of 15
EarlyStopping counter: 3 out of 15
EarlyStopping counter: 4 out of 15
EarlyStopping counter: 5 out of 15
EarlyStopping counter: 1 out of 15
40/400 - Loss: 162.3809356689453 - Score: 37.88779830932617
EarlyStopping counter: 2 out of 15
EarlyStopping counter: 3 out of 15
EarlyStopping counter: 4 out of 15
EarlyStopping counter: 5 out of 15
EarlyStopping counter: 6 out of 15
EarlyStopping counter: 7 out of 15
EarlyStopping counter: 8 out of 15
EarlyStopping counter: 9 out of 15
EarlyStopping counter: 10 out of 15
EarlyStopping counter: 11 out of 15
50/400 - Loss: 138.0565948486328 - Score: 38.31381607055664
EarlyStopping counter: 12 out of 15
EarlyStopping counter: 13 out of 15
EarlyStopping counter: 14 out of 15
EarlyStopping counter: 15 out of 15
Early stopping
Current Configuration: n_gp_layers:2 - n_gp_out: 6 - num_inducing: 209 - num_samples: 2 - batch_size:2048 - num_inducing: 209 - lr: 0.0008845636266002723
0/400 - Loss: 16473.69921875 - Score: 118.56238555908203
10/400 - Loss: 15577.1103515625 - Score: 118.45500183105469
20/400 - Loss: 14728.451171875 - Score: 118.14785766601562
30/400 - Loss: 13923.80859375 - Score: 117.60868835449219
Time Budget run out. Pruning Trial
Current Configuration: n_gp_layers:2 - n_gp_out: 3 - num_inducing: 126 - num_samples: 9 - batch_size:512 - num_inducing: 126 - lr: 0.00036329806217656285
0/400 - Loss: 16419.015625 - Score: 118.54601287841797
10/400 - Loss: 15062.919921875 - Score: 117.9483642578125
20/400 - Loss: 13759.0068359375 - Score: 116.53877258300781
30/400 - Loss: 12445.775390625 - Score: 114.24108123779297
Time Budget run out. Pruning Trial
Current Configuration: n_gp_layers:2 - n_gp_out: 6 - num_inducing: 167 - num_samples: 13 - batch_size:512 - num_inducing: 167 - lr: 0.022887875102484422
0/400 - Loss: 10176.005859375 - Score: 114.51910400390625
Current Configuration: n_gp_layers:3 - n_gp_out: 4 - num_inducing: 88 - num_samples: 6 - batch_size:2048 - num_inducing: 88 - lr: 0.0239800932793171
0/400 - Loss: 14462.6298828125 - Score: 118.33212280273438
Current Configuration: n_gp_layers:2 - n_gp_out: 4 - num_inducing: 776 - num_samples: 5 - batch_size:512 - num_inducing: 776 - lr: 0.000873188533237095
0/400 - Loss: 16234.505859375 - Score: 118.53927612304688
Time Budget run out. Pruning Trial
Current Configuration: n_gp_layers:2 - n_gp_out: 1 - num_inducing: 86 - num_samples: 12 - batch_size:2048 - num_inducing: 86 - lr: 0.00012059173479237476
0/400 - Loss: 16546.466796875 - Score: 118.56924438476562
Current Configuration: n_gp_layers:4 - n_gp_out: 3 - num_inducing: 86 - num_samples: 15 - batch_size:512 - num_inducing: 86 - lr: 0.0012157154599340566
0/400 - Loss: 16109.400390625 - Score: 118.52458953857422
Current Configuration: n_gp_layers:1 - n_gp_out: 2 - num_inducing: 296 - num_samples: 10 - batch_size:2048 - num_inducing: 296 - lr: 0.0012534406512879628
0/400 - Loss: 16434.64453125 - Score: 118.54023742675781
Current Configuration: n_gp_layers:1 - n_gp_out: 2 - num_inducing: 401 - num_samples: 14 - batch_size:2048 - num_inducing: 401 - lr: 0.08093685049448869
0/400 - Loss: 10582.5625 - Score: 115.53388977050781
Current Configuration: n_gp_layers:1 - n_gp_out: 1 - num_inducing: 260 - num_samples: 10 - batch_size:2048 - num_inducing: 260 - lr: 0.035730508305645024
0/400 - Loss: 13510.6748046875 - Score: 117.70684051513672
Current Configuration: n_gp_layers:1 - n_gp_out: 1 - num_inducing: 416 - num_samples: 8 - batch_size:2048 - num_inducing: 416 - lr: 0.010247135543856357
0/400 - Loss: 15592.080078125 - Score: 118.3567123413086
Current Configuration: n_gp_layers:1 - n_gp_out: 4 - num_inducing: 71 - num_samples: 8 - batch_size:1024 - num_inducing: 71 - lr: 0.004528094259855304
0/400 - Loss: 15728.7001953125 - Score: 118.4599609375
Current Configuration: n_gp_layers:3 - n_gp_out: 2 - num_inducing: 72 - num_samples: 14 - batch_size:2048 - num_inducing: 72 - lr: 0.00041513530702190374
0/400 - Loss: 16517.658203125 - Score: 118.56297302246094
10/400 - Loss: 16070.7216796875 - Score: 118.46085357666016
20/400 - Loss: 15637.9482421875 - Score: 118.30455017089844
30/400 - Loss: 15201.515625 - Score: 118.0112075805664
Time Budget run out. Pruning Trial
Current Configuration: n_gp_layers:1 - n_gp_out: 3 - num_inducing: 172 - num_samples: 5 - batch_size:2048 - num_inducing: 172 - lr: 0.004495140201661371
0/400 - Loss: 16131.1904296875 - Score: 118.49557495117188
Current Configuration: n_gp_layers:4 - n_gp_out: 1 - num_inducing: 210 - num_samples: 3 - batch_size:512 - num_inducing: 210 - lr: 0.00021819985766906828
0/400 - Loss: 16474.365234375 - Score: 118.55427551269531
10/400 - Loss: 15644.5390625 - Score: 118.3036880493164
20/400 - Loss: 14782.8916015625 - Score: 117.49308776855469
30/400 - Loss: 13986.2861328125 - Score: 116.6059799194336
40/400 - Loss: 13284.7060546875 - Score: 115.91980743408203
50/400 - Loss: 12651.6376953125 - Score: 115.30988311767578
60/400 - Loss: 12068.421875 - Score: 114.72831726074219
70/400 - Loss: 11523.4580078125 - Score: 114.15863037109375
80/400 - Loss: 11015.5625 - Score: 113.59129333496094
90/400 - Loss: 10538.486328125 - Score: 113.02217102050781
100/400 - Loss: 10089.1181640625 - Score: 112.44743347167969
110/400 - Loss: 9664.2138671875 - Score: 111.86434173583984
[32m[I 2023-06-13 01:24:11,856][0m Trial 16 finished with value: 110.6175765991211 and parameters: {'lr': 0.00021819985766906828, 'batch_size': 512, 'num_inducing': 210, 'num_samples': 3, 'kernel_type': 'matern1.5', 'n_gp_layers': 4, 'n_gp_out': 1}. Best is trial 1 with value: 37.78729248046875.[0m
[32m[I 2023-06-13 01:28:35,671][0m Trial 20 finished with value: 37.77137756347656 and parameters: {'lr': 0.09962932134654698, 'batch_size': 512, 'num_inducing': 752, 'num_samples': 10, 'kernel_type': 'matern1.5', 'n_gp_layers': 1, 'n_gp_out': 2}. Best is trial 15 with value: 37.577857971191406.[0m
40/400 - Loss: 2560.660888671875 - Score: 77.94939422607422[32m[I 2023-06-13 02:06:04,126][0m Trial 21 pruned. [0m
[32m[I 2023-06-13 02:08:13,960][0m Trial 22 pruned. [0m
[32m[I 2023-06-13 02:29:28,963][0m Trial 21 finished with value: 49.504390716552734 and parameters: {'lr': 0.06264552332447494, 'batch_size': 2048, 'num_inducing': 389, 'num_samples': 15, 'kernel_type': 'matern1.5', 'n_gp_layers': 2, 'n_gp_out': 1}. Best is trial 15 with value: 37.577857971191406.[0m
Current Configuration: n_gp_layers:2 - n_gp_out: 1 - num_inducing: 58 - num_samples: 12 - batch_size:512 - num_inducing: 58 - lr: 0.011509807913064806
0/400 - Loss: 12865.5966796875 - Score: 117.40738677978516
10/400 - Loss: 2597.62939453125 - Score: 77.70841217041016
20/400 - Loss: 872.9423217773438 - Score: 54.86582946777344
30/400 - Loss: 378.3272705078125 - Score: 45.34888458251953
EarlyStopping counter: 1 out of 15
40/400 - Loss: 238.0033416748047 - Score: 41.21868896484375
EarlyStopping counter: 1 out of 15
EarlyStopping counter: 1 out of 15
50/400 - Loss: 190.1916046142578 - Score: 39.48274230957031
EarlyStopping counter: 1 out of 15
EarlyStopping counter: 2 out of 15
EarlyStopping counter: 3 out of 15
EarlyStopping counter: 1 out of 15
EarlyStopping counter: 2 out of 15
EarlyStopping counter: 3 out of 15
60/400 - Loss: 148.22035217285156 - Score: 38.78461837768555
EarlyStopping counter: 1 out of 15
EarlyStopping counter: 2 out of 15
EarlyStopping counter: 3 out of 15
EarlyStopping counter: 4 out of 15
70/400 - Loss: 140.31373596191406 - Score: 38.31772994995117
EarlyStopping counter: 1 out of 15
EarlyStopping counter: 2 out of 15
EarlyStopping counter: 3 out of 15
EarlyStopping counter: 1 out of 15
EarlyStopping counter: 1 out of 15
80/400 - Loss: 123.6102066040039 - Score: 38.05268478393555
EarlyStopping counter: 1 out of 15
EarlyStopping counter: 2 out of 15
EarlyStopping counter: 3 out of 15
EarlyStopping counter: 4 out of 15
EarlyStopping counter: 5 out of 15
EarlyStopping counter: 6 out of 15
EarlyStopping counter: 7 out of 15
EarlyStopping counter: 8 out of 15
90/400 - Loss: 124.2392578125 - Score: 38.625694274902344
EarlyStopping counter: 9 out of 15
EarlyStopping counter: 10 out of 15
EarlyStopping counter: 11 out of 15
EarlyStopping counter: 12 out of 15
EarlyStopping counter: 13 out of 15
EarlyStopping counter: 14 out of 15
EarlyStopping counter: 15 out of 15
Early stopping
Current Configuration: n_gp_layers:3 - n_gp_out: 3 - num_inducing: 449 - num_samples: 5 - batch_size:1024 - num_inducing: 449 - lr: 0.00013594801509408103
0/400 - Loss: 16531.541015625 - Score: 118.5644760131836
Current Configuration: n_gp_layers:2 - n_gp_out: 1 - num_inducing: 92 - num_samples: 9 - batch_size:512 - num_inducing: 92 - lr: 0.03957630522557885
0/400 - Loss: 7824.1005859375 - Score: 112.89716339111328
EarlyStopping counter: 1 out of 15
EarlyStopping counter: 2 out of 15
10/400 - Loss: 331.4270324707031 - Score: 43.45268249511719
EarlyStopping counter: 1 out of 15
EarlyStopping counter: 1 out of 15
EarlyStopping counter: 1 out of 15
EarlyStopping counter: 2 out of 15
EarlyStopping counter: 3 out of 15
20/400 - Loss: 164.22531127929688 - Score: 38.62384033203125
EarlyStopping counter: 1 out of 15
EarlyStopping counter: 1 out of 15
EarlyStopping counter: 2 out of 15
EarlyStopping counter: 3 out of 15
EarlyStopping counter: 4 out of 15
EarlyStopping counter: 5 out of 15
EarlyStopping counter: 6 out of 15
EarlyStopping counter: 7 out of 15
30/400 - Loss: 136.12660217285156 - Score: 38.04743194580078
EarlyStopping counter: 1 out of 15
EarlyStopping counter: 2 out of 15
EarlyStopping counter: 1 out of 15
EarlyStopping counter: 2 out of 15
EarlyStopping counter: 3 out of 15
EarlyStopping counter: 4 out of 15
EarlyStopping counter: 5 out of 15
EarlyStopping counter: 6 out of 15
EarlyStopping counter: 7 out of 15
40/400 - Loss: 139.57827758789062 - Score: 38.14645004272461
EarlyStopping counter: 1 out of 15
EarlyStopping counter: 2 out of 15
EarlyStopping counter: 3 out of 15
EarlyStopping counter: 4 out of 15
EarlyStopping counter: 5 out of 15
EarlyStopping counter: 6 out of 15
EarlyStopping counter: 7 out of 15
EarlyStopping counter: 8 out of 15
EarlyStopping counter: 9 out of 15
50/400 - Loss: 131.5663299560547 - Score: 38.419246673583984
EarlyStopping counter: 1 out of 15
EarlyStopping counter: 1 out of 15
EarlyStopping counter: 2 out of 15
EarlyStopping counter: 1 out of 15
EarlyStopping counter: 2 out of 15
EarlyStopping counter: 3 out of 15
EarlyStopping counter: 4 out of 15
60/400 - Loss: 110.76590728759766 - Score: 38.27850341796875
EarlyStopping counter: 5 out of 15
EarlyStopping counter: 6 out of 15
EarlyStopping counter: 7 out of 15
EarlyStopping counter: 8 out of 15
EarlyStopping counter: 9 out of 15
EarlyStopping counter: 10 out of 15
EarlyStopping counter: 1 out of 15
EarlyStopping counter: 2 out of 15
70/400 - Loss: 113.01716613769531 - Score: 37.59455490112305
EarlyStopping counter: 1 out of 15
EarlyStopping counter: 2 out of 15
EarlyStopping counter: 3 out of 15
EarlyStopping counter: 4 out of 15
EarlyStopping counter: 5 out of 15
EarlyStopping counter: 6 out of 15
EarlyStopping counter: 7 out of 15
EarlyStopping counter: 8 out of 15
EarlyStopping counter: 9 out of 15
EarlyStopping counter: 10 out of 15
80/400 - Loss: 100.18521881103516 - Score: 37.831905364990234
EarlyStopping counter: 1 out of 15
EarlyStopping counter: 2 out of 15
EarlyStopping counter: 3 out of 15
EarlyStopping counter: 4 out of 15
EarlyStopping counter: 5 out of 15
EarlyStopping counter: 6 out of 15
EarlyStopping counter: 7 out of 15
EarlyStopping counter: 8 out of 15
EarlyStopping counter: 9 out of 15
90/400 - Loss: 94.04537963867188 - Score: 37.70794677734375
EarlyStopping counter: 10 out of 15
EarlyStopping counter: 11 out of 15
EarlyStopping counter: 12 out of 15
EarlyStopping counter: 13 out of 15
EarlyStopping counter: 14 out of 15
EarlyStopping counter: 15 out of 15
Early stopping
Current Configuration: n_gp_layers:3 - n_gp_out: 2 - num_inducing: 232 - num_samples: 7 - batch_size:512 - num_inducing: 232 - lr: 0.0006319141047525357
0/400 - Loss: 16313.845703125 - Score: 118.5067367553711
Current Configuration: n_gp_layers:2 - n_gp_out: 3 - num_inducing: 180 - num_samples: 14 - batch_size:2048 - num_inducing: 180 - lr: 0.021586903333274444
0/400 - Loss: 14577.6162109375 - Score: 117.88085174560547
Current Configuration: n_gp_layers:1 - n_gp_out: 2 - num_inducing: 781 - num_samples: 6 - batch_size:512 - num_inducing: 781 - lr: 0.0661742641313344
0/400 - Loss: 4761.89794921875 - Score: 94.58729553222656
EarlyStopping counter: 1 out of 15
EarlyStopping counter: 1 out of 15
10/400 - Loss: 317.4815979003906 - Score: 38.5187873840332
EarlyStopping counter: 1 out of 15
EarlyStopping counter: 2 out of 15
EarlyStopping counter: 3 out of 15
EarlyStopping counter: 4 out of 15
EarlyStopping counter: 5 out of 15
EarlyStopping counter: 6 out of 15
EarlyStopping counter: 7 out of 15
EarlyStopping counter: 8 out of 15
EarlyStopping counter: 9 out of 15
20/400 - Loss: 236.4484100341797 - Score: 38.20918273925781
EarlyStopping counter: 10 out of 15
EarlyStopping counter: 11 out of 15
EarlyStopping counter: 12 out of 15
Time Budget run out. Pruning Trial
Current Configuration: n_gp_layers:2 - n_gp_out: 1 - num_inducing: 166 - num_samples: 2 - batch_size:2048 - num_inducing: 166 - lr: 0.005831704188776239
0/400 - Loss: 16007.5986328125 - Score: 118.4684829711914
Current Configuration: n_gp_layers:1 - n_gp_out: 2 - num_inducing: 752 - num_samples: 10 - batch_size:512 - num_inducing: 752 - lr: 0.09962932134654698
0/400 - Loss: 3704.38134765625 - Score: 74.82129669189453
EarlyStopping counter: 1 out of 15
EarlyStopping counter: 2 out of 15
EarlyStopping counter: 3 out of 15
EarlyStopping counter: 4 out of 15
EarlyStopping counter: 1 out of 15
10/400 - Loss: 185.4634552001953 - Score: 38.10215377807617
EarlyStopping counter: 2 out of 15
EarlyStopping counter: 3 out of 15
EarlyStopping counter: 4 out of 15
EarlyStopping counter: 5 out of 15
EarlyStopping counter: 6 out of 15
EarlyStopping counter: 7 out of 15
EarlyStopping counter: 8 out of 15
EarlyStopping counter: 9 out of 15
EarlyStopping counter: 10 out of 15
EarlyStopping counter: 11 out of 15
20/400 - Loss: 190.68728637695312 - Score: 37.82963943481445
EarlyStopping counter: 12 out of 15
Time Budget run out. Pruning Trial
Current Configuration: n_gp_layers:2 - n_gp_out: 1 - num_inducing: 389 - num_samples: 15 - batch_size:2048 - num_inducing: 389 - lr: 0.06264552332447494
0/400 - Loss: 11625.166015625 - Score: 116.35575103759766
EarlyStopping counter: 1 out of 15
EarlyStopping counter: 2 out of 15
10/400 - Loss: 1822.1856689453125 - Score: 75.36566925048828
Time Budget run out. Pruning Trial
[32m[I 2023-06-13 02:31:06,338][0m Trial 17 finished with value: 118.55948638916016 and parameters: {'lr': 0.00012102223019997164, 'batch_size': 2048, 'num_inducing': 110, 'num_samples': 13, 'kernel_type': 'matern1.5', 'n_gp_layers': 2, 'n_gp_out': 5}. Best is trial 1 with value: 37.78729248046875.[0m
[32m[I 2023-06-13 02:33:04,885][0m Trial 23 finished with value: 37.10303497314453 and parameters: {'lr': 0.0846908461538859, 'batch_size': 1024, 'num_inducing': 310, 'num_samples': 11, 'kernel_type': 'rbf', 'n_gp_layers': 1, 'n_gp_out': 3}. Best is trial 23 with value: 37.10303497314453.[0m
[32m[I 2023-06-13 02:43:23,670][0m Trial 24 pruned. [0m
[32m[I 2023-06-13 02:45:13,340][0m Trial 22 pruned. [0m
[32m[I 2023-06-13 02:56:04,377][0m Trial 25 finished with value: 36.6922492980957 and parameters: {'lr': 0.05244317979104497, 'batch_size': 1024, 'num_inducing': 380, 'num_samples': 2, 'kernel_type': 'rbf', 'n_gp_layers': 1, 'n_gp_out': 4}. Best is trial 25 with value: 36.6922492980957.[0m
